en_text,jp_text,google_translated,score,semantic_score
"It's a high school festival, so people from outside this school will be present.",そうですね　高校のお祭りですし 学外の方も　おみえになりますので,"Yes, it is a high school festival, so it will be a good idea",0.45,0.7701894
I'd appreciate it if you'll avoid going for something too daring.,あまり大胆な格好は遠慮して いただきたいところですけど,I would like to have a very bold dress,0.045454545454545456,0.31533736
We did it!  That's what we need!,Ｏｋｉｅ－ｄｏｋｉｅ！ やったわ　そうこなくっちゃ,Okie-dokie!I did it so much,0.25,0.34604335
"However, please keep it reasonable.",ただし　あくまで 常識の範囲内でお願いします,"However, please be within the scope of common sense",0.21428571428571427,0.5238205
I have absolutely no idea what they'll be used for...,何に使うのか まったく予想がつかないな,I can not expect anything to use,0.05555555555555555,0.50041765
"What happened? n-nothing, really.",何があったの？ 別に何もないわよ,What happened?There is nothing separately,0.2727272727272727,0.5315972
Did you hurt your foot?,もしかして　足にケガとかしたの？ 見せて,Did you get injured on your feet?Show me,0.3333333333333333,0.8352603
Why is your foot wet?,何で足がぬれてるの？,What is your feet wet?,0.5,0.8408211
He urinated on me.,えッ？ オシッコを　ひっかけられたのよ,Eh?She was scolded by She,0.0,0.22664434
I saw this expensive-looking dog on the school grounds.,校内で高そうな犬を見かけたから,Because I saw a high dog in the school,0.35714285714285715,0.6779619
"I thought that I could probably use him for something, so I tried to catch him.",何か使い道があるんじゃないかと 思って　捕まえようとしたの,I was trying to catch it thinking that there is something wrong,0.2272727272727273,0.3885668
And then he really warmed up to me...,そしたら　妙に懐かれて,Then I nostalgically,0.09090909090909093,0.2754625
"Ah, dogs urinate when they're happy.",ああ～　犬ってうれしいと オシッコしちゃったりするから,Oh ~ Because I'm happy and I'm happy,0.06666666666666668,0.3137919
This is quite the disaster!,あはははッ　それは災難だったね,"Oh, it was a disaster",0.09090909090909093,0.5883074
This isn't funny. s-sorry.,笑い事じゃないんですけど ごめん,"I'm not laughing, but sorry",0.0,0.55408514
"I mean, not like we can do anything about this here.",だって　そのままじゃ どうしようもないでしょう,"Even if it is it, it will not be",0.10526315789473684,0.11360111
"We'll need to wash your shoes and stuff, so I'll carry you to the taps.",靴下とか洗わなきゃいけないし 水道まで　おぶっていくよ,I have to wash my socks or welves and I will wake up to water,0.15384615384615385,0.5222326
What'll people say if they see us like this?!,こんなとこ誰かに見られたら　何を 言われるか　わからないじゃない,I do not know what to say if I saw something like this,0.2631578947368421,0.46521628
It doesn't matter what people'll say.,何を言われても別にいいよ 事情が事情だし,Another good thing is good if it is said,0.06666666666666668,0.3736218
I'm not fine with this!,私がよくないの わかった　ごめん,I'm sorry I'm not good,0.3333333333333333,0.4250557
"Just stay still, or you'll fall!",だから暴れないで　落ちちゃうよ,So I will fall without getting rid,0.06666666666666668,0.5896253
"Actually, please give me a break.",やっぱり　勘弁してください ダメ,After all please forgive me,0.18181818181818185,0.36794174
Nope! but someone might see us if you make too much noise.,でも　あんまり騒ぐと　誰かに 見られちゃうかもしれないよ,"But if you make a noise, you may be seen by someone",0.3,0.67831445
Tachibana-kun's a real mystery.,橘君　本当に不思議な人,Tachibana-kun really strange person,0.1111111111111111,0.81712675
Maybe it's because he has different values than I do?,〈私とは違う価値観を 持ってるのかな〉,<Will I have a different value from me>,0.1,0.38406938
I'm a little curious.,〈ちょっと気になるかも〉,<Maybe I'm a little concerned>,0.4,0.39083582
"Huh?  Thinking about it, isn't this the first time I've ever been curious about someone?",〈あれ　そういえば 私が誰かを気にするなんて〉,"<For example, how do I care about someone>",0.16,0.29715985
"How strange. hey there tsukasa, don't tell me you're interested in him?",〈変なの もしかして　詞　お気に入り？〉,<Most of the words ority?>,0.04166666666666666,0.05245845
"Geez, what the heck am I thinking?!",あッ　もう何考えてんだろう　私,I think I'm thinking about me,0.14285714285714285,0.3841843
"Ahh, it's Tachibana-kun's fault that I'm losing my studying time!",ああ～　橘君のせいで 勉強する時間が減ってるじゃない,Oh ~ The time to study because of Tachibana-kun's time,0.14285714285714285,0.8370017
I'm really going to toy with you next time!,今度から もっといじめてやるんだから,I'm going to fly more than this time,0.3333333333333333,0.3472912
Math II,覚悟してなさいよ,Please be prepared,0.0,0.10441106
Question Book,覚悟してなさいよ,Please be prepared,0.0,0.095134936
Step Up,覚悟してなさいよ,Please be prepared,0.0,0.26482645
For Dummies,覚悟してなさいよ,Please be prepared,0.0,0.24229327
Prepare yourself!,覚悟してなさいよ,Please be prepared,0.0,0.6075873
The blue illumination adorns the sidewalk,歩道を飾る　青いイルミネーション,Blue illumination to decorate the sidewalk,0.5714285714285714,0.94553816
And I stand alone in the swarming crowd,にぎわう人込みにひとりたたずむ,Take alone to the crowded people,0.16666666666666666,0.4902742
Smiles peeking through,こぼれそうな笑顔,Smiling smile,0.0,0.7310444
That I cannot bear to look,まぶしくて見れないの,I can not see it,0.3333333333333333,0.37993482
Will anyone love me?,誰かに愛されるでしょうか,Will someone loved,0.14285714285714285,0.6724818
I'm hiding underneath a facade,強がりの奥に隠れた,Hidden in the back of the strength,0.0,0.42081857
Please realize that,「わたし」に気付いてよ,"Be aware of ""I""",0.0,0.31907278
Can I really become free?,本当に自由になれるでしょうか,Do you really be free?,0.3333333333333333,0.80411917
Please tell me,どうか教えて,Please tell me,1.0,1.0000005
The lonely angel sighs,さみしげな　天使が嘆く,Samurai angel lament,0.16666666666666666,0.48787683
