en_text,jp_text,google_translated,score
it's problematic that you desire chaste girls when that desire is based on unfounded fantasies.,"そのような
薄っぺらい女性幻想に基づいて","like that
Based on a thin female fantasy",0.15
Even girls are interested in talking about dirty stuff.,"女の子だって
エッチな話に興味があるのだ","It is a girl
I'm interested in naughty stories",0.1111111111111111
Animation Number 236,"ブリーフ派か
トランクス派か","Brief
Trunks",0.0
I never said anything about that.,そんな話は していなかったぞ！,I did not talk like that!,0.16666666666666666
Were we talking about whether or not I'm wearing panties under my spats?,"あれ？
私がスパッツの下に","that?
I am under the spats",0.2222222222222222
Aren't you wearing them?! Kanbaru-san!,はいてないんですか 神原さん？,Aren't you?,0.5
So under the spats coming out from the bottom of your skirt is...,"じゃ じゃあ そのスカートから
はみ出しているスパッツの下は…","Well then from that skirt
Under the spats that is protruding ...",0.4117647058823529
"Even if that was the case, there's no need to be surprised, is there?","たとえ そうだったとしても
驚くほどのことでは ないだろう","Even if it was so
I will not be surprisingly",0.18181818181818182
"Spats were originally intended to be lingerie, you know.","スパッツというのは
もともと","Spats
originally",0.18181818181818182
Meaning. \N\NTight pants.,常にパンツ 見せびらかしながら,Always show pants while showing,0.125
That's all the more of a reason!,まあ その辺りは さしずめ,Well that's the area,0.2727272727272727
"Hmm, if you put it that way, I suppose it's true.","（神原）
ふむ　そう言われれば
そのとおりなのだが","If you say so
That's right",0.25
we'll just say it was a stylish present from this sports-loving girl.,"スポーツ少女からの
小粋な贈り物といったところだな","Sport girl from girl
It is a place called a small gift",0.2
"Oh yeah, now I remember!",（神原）ああ そうだ 思い出した,"Oh, I remembered that",0.3333333333333333
We were talking about whether I could be Senjougahara-senpai's replacement.,"私が戦場ヶ原先輩の代わりに
なれるかどうかと","I instead of the Senior of Battlefield
Whether it can",0.10526315789473684
Hold it!,"（阿良々木）
違う 露出狂の変態行為だ！",It is a transformation act of a different exposure crazy!,0.18181818181818182
Don't change subjects before stating it clearly!,話を戻そうとするな！,Don't try to talk!,0.25
"Are you wearing them, or aren't you?!","本当は はいているのか
それとも本当に はいていないのか","Is it true?
Or isn't he not really?",0.2
Like hell it is!,ささいなことだ,It is a small thing,0.25
It's the difference between my underclassman being a sports girl or an exhibitionist!,"僕の後輩がスポーツ少女か
露出狂かの分水嶺(ぶんすいれい)だ！","My junior is a sport girl
It is a waters of the exposure crazy!",0.2727272727272727
Let's see...,"（神原）
そうだな",Yes,0.0
What if you think of if this way:,では こう考えたら どうだろう,So what if you think,0.4444444444444444
She's both a sports girl and an exhibitionist.,"スポーツ少女でもあり
また露出狂でもある","It is also a sport girl
She is also an exposure crazy",0.25
"For someone who believes she's a sports girl, she is a sports girl,","スポーツ少女だと
思う者には","Sports girl
For those who think",0.3076923076923077
Don't play with words!,"（阿良々木）
言葉で遊ぶな！",Don't play with words!,1.0
It's both A and B.,"〝〇〇(まるまる)でもあり
××(ばつばつ)でもある〞","It is also ""〇 
It is also a ××  """,0.16666666666666666
"For someone who believes it's A, it's A,","〝××だと思う者には
××だ〞","""For those who think that it is ××
× × """,0.2
Cool,"っていうセリフが
かっこいいのは","A line called
Cool",0.25
Until middle school,中学生までだ,It is up to junior high school students,0.1
Are you my little sister or something?!,お前は僕の妹か！,You are my sister!,0.5555555555555556
"But seriously, Kanbaru, no matter how hard you try,","真面目な話
どんなに頑張ったところで","Serious story
No matter how hard you worked",0.38461538461538464
You're not Senjougahara.,お前は戦場ヶ原じゃないしな,You are not a battlefield,0.25
It's impossible for someone to replace someone else.,"じゃあ ムダ口たたいてないで
もう行こうぜ","Well then I do not want to be muddy
Let's go anymore",0.1
It's just as you said.,"そうだな
阿良々木先輩の言うとおりだ","Yes
It is as I say that Atsugi senior",0.14285714285714285
what was with that girl?,"（神原）
な… なあ 阿良々木先輩
何だ？ あの子","Na ... Niao Atsuki Senior
What?That girl",0.36363636363636365
She was super cute!,めちゃくちゃ かわいかったな！,It was pretty cute!,0.42857142857142855
Why does that give you the biggest smile you've had all day?,"ん… 今日いちばんの笑顔で
何を言ってるんだ お前は！","... with the best smile today
What are you saying!",0.14285714285714285
"No, I want her to hug me!",抱きしめたい… いや 抱かれたい！,I want to hug ... I want to be hugged!,0.4166666666666667
"But anyway, you're better off not getting involved with that.",あれには関わらないほうが いいよ,It is better not to involve that,0.17647058823529413
"What's this, Araragi-kun?",全く ご同慶の至りだよ,It's all about Sekuhiki at all,0.09090909090909091
You bring a different girl every time I see you.,"君は会うたんびに
違う女の子を連れているなあ","You meet again
I have a different girl",0.38461538461538464
I'm happy for you.,"待ちくたびれて
もう少しで寝ちまうところだった","I'm waiting for you
It was a place to go to bed a little more",0.25
Shut up.,"（阿良々木）
うるせえ
同じセリフを何度も言うな","shut up
Don't say the same line many times",0.18181818181818182
"Oh yeah, I saw Shinobu on the stairway.",そうだ 忍(しのぶ)を階段で見かけたぜ,Yes I saw Shinobu  on the stairs,0.4166666666666667
"Oh, she sulked off when I ate one of the donuts from Mister Donut.","ああ おやつのミスタードーナツを
僕が１個 多く食べたら","Oh a snack Mister Donut
If I eat one lot",0.23809523809523808
She's been like that since yesterday.,"昨日から ずっと
あんな調子なんだよ","From yesterday
It's such a tone",0.15384615384615385
What kind of vampire is she?,どんな吸血鬼だよ…,What vampire is ...,0.375
Kanbaru is written with the characters god and field.,"“かんばる”は神様の“神”に
原っぱの“原”","""Kanbaru"" is to God's ""God""
""Hara"" of the original",0.23529411764705882
Field,"“原”って書いて
“ばる”って読むんだ","Write ""Hara""
Read ""Burut""",0.0
"As for Suruga, um...",駿河は… えっと,Suruga is ... well,0.25
It's Suruga from Japanese bondage torture.,“駿河問(するがど)い”の駿河だ,"It is the Suruga of ""Suga Kawayu""",0.13333333333333333
"Nice to meet you, too.","初めまして
忍野メメです お嬢さん","Nice to meet you
It is Oto Meme",0.36363636363636365
"Oshino, anyway, I'll start off by giving this to you.","（阿良々木）
忍野 とりあえず まずは
これ 渡しとくよ","Oshino First for the time being
I will pass this",0.15
"It's from that tsundere girl, Senjougahara.","そのツンデレちゃん
戦場ヶ原からだ","That Tsundere
It is from the battlefield",0.3333333333333333
"Oh right, money.",ん？ ああ お金ね　お金お金,Yeah?Oh money money money,0.2857142857142857
"Money, money...",へえ…,Hook ...,0.25
It was just about to start affecting my lifestyle.,よかった よかった,It was good,0.18181818181818182
"Oh, it's those bandages, isn't it?",ああ その包帯かな？,"Oh, is it its dressing?",0.45454545454545453
"Oshino, I'm...",忍野さん 私は…,Mr. Oshino I ...,0.5
It doesn't really seem to be an enjoyable story.,あんまり楽しい話じゃなさそうだ,It seems not to be a fun story,0.26666666666666666
"It's especially true in my case, and all the more if it's the left arm.","ましてや それが左手ともなると
もう なおさらさ","And if it becomes a left hand
Another too much",0.18181818181818182
"Could you take off the bandages and let me see it, miss?","（忍野）
包帯ほどいて見せてくれるかな？
お嬢ちゃん","Do you want to show it as a bandage?
Grandmother",0.13636363636363635
Is this good enough?,これでいいのか,Is this right,0.3333333333333333
"I see, just as I thought.","（忍野）
うん いいよ　そっか やっぱりね",Yeah I'm sorry I'm sorry,0.1
"Araragi-kun, and you too, miss... let me clear something up for you:",（神原）あっ うん…,Yes ...,0.06666666666666667
Your left hand-that's not a monkey's paw.,"お嬢ちゃんの左手
それはね 猿の手じゃないよ","Left hand of your mother
It's not the hand of the monkey",0.35714285714285715
Huh?,"（阿良々木）は？
（神原）は…","What is Atsugi?
 ...",0.16666666666666666
is something that I've never heard of.,僕は寡聞にして聞いたことがない,I have never heard of it,0.36363636363636365
"Miss, your hand was originally mummified, right?","お嬢ちゃん その手は
もともとはミイラだったんだっけ？","Ohsta-chan its hand
Originally it was Mummy?",0.3076923076923077
"If that has gained life by assimilating with you,","それが
お嬢ちゃんと同化することによって","that is
By assimiting with your mother",0.21428571428571427
Rainy?,“レイニー”？,"""Rainy""?",0.5
"If you narrow that group down to ones that have a monkey's arms and wear a raincoat,","その中でも猿の腕を持つ
雨がっぱの悪魔となれば","Among them, they have monkey arms
If the rain is a devil",0.25
the number necessarily decreases quite a bit.,必然 数は限られてくる,The number is limited,0.2
The only one that assimilates with the owner is the Rainy Devil.,"持ち主と 一体化するってのは
レイニー･デビルだ","What is integrated with the owner
It is Rainy Devil",0.42857142857142855
It's not a monkey's paw-it's a demon's hand.,猿の手じゃない 悪魔の手だ,It is the hand of the devil who is not the person of the monkey,0.26666666666666666
"Of course, it will grant you anything you wish for...",そりゃあ 何でも かなえてくれるさ,"Well, I can see anything",0.13333333333333333
In exchange for taking your soul it grants you three wishes.,"（忍野）
魂と引き換えに",In exchange for the soul,0.3076923076923077
It's only natural.,"３つの願いを
かなえてやろう","Three wishes
Let's do it",0.2222222222222222
I'm Karen!,"（月火）
うん 月火ちゃんって茶道部だよ！",I'm a tea ceremony club!,0.375
"Tsukihi-chan, you're in the tea club, right?","（火憐）
月火ちゃんって茶道部だよな？",Moon fire is a tea ceremony club?,0.2
"Well then, do you know what type of tea they use in Uji city in Kyoto?","（火憐）
じゃあ 京都の宇治市が",Well then Uji City in Kyoto,0.35294117647058826
"I know, I know!","（月火）
知ってる知ってる！","I know, I know!",1.0
Really?,"（月火）
本当に？",Really?,1.0
"By the way, a tap and a jacuzzi resemble each other in the position of their names, eh?","（火憐）
ところで 蛇口とジャグジーって
名前もポジションも似てるよな","By the way, the faucet and Jacuzzi
The name and position are similar",0.3181818181818182
Quiz!,"（火憐）予告編クイズ！
（月火）クイズ！","trailer quiz!
 quiz!",0.6666666666666666
Izu?,"（火憐）予告編 伊豆
（月火）伊豆？","trailer Izu
 Izu?",0.6666666666666666
Izu is a riddle?,"（火憐）伊豆は謎だぜ
（月火）伊豆は謎なの？","Izu is a mystery
 Izu is a mystery?",0.6666666666666666
"Next time, ""Suruga Monkey"", Part Three!","（火憐･月火）
次回「するがモンキー
其ノ参(そのさん)」","Next time ""I'm Monkey
参  """,0.3076923076923077
Izu is a quiz!,"（火憐）
伊豆 is クイズ",Izu IS quiz,0.6
Enigmatic!,"（月火）
謎めいた！",Mysterious!,0.3333333333333333
