en_text,jp_text,google_translated,score
For you to so easily forget something I've given you...,"なぶってあげようと
思って","In case
I thought to",0.14285714285714285
"I'm not going to forgive you, even if you apologize.",（戦場ヶ原）謝っても許さないわ,I will not forgive you even if I apologize,0.5384615384615384
"I did come chasing after you to make fun of you, though.","追いかけて
きたのだけれど","In pursuit of
I've come",0.1875
Did you get hit by a car or something?,車にでも ひかれたのかしら？,Was it a car even in a car?,0.21428571428571427
"There's something over there that resembles your precious bike,","コンボイにでも ひかれないと
あんなことには ならないでしょう","Even if it is not scolded by the compo
That's not she will not be",0.09090909090909091
"which is pretty beaten up, or should I say, rammed into a telephone pole.",電柱に突き刺さっていたというか,It was pierced to a telephone pole,0.15
"No, I just fell on my own.",いや 僕が１人で転んだだけだよ,"No, I just turned alone",0.36363636363636365
"But for you to crash into a sturdy concrete wall with enough force to destroy it,",破壊する勢いで激突して,Crash with the momentum to destroy,0.2222222222222222
I assume you don't need an ambulance?,"えっと 救急車は
いらないんだっけ？","Emty ambulance
Do you not need?",0.45454545454545453
"Yeah, I'll be able to move again after I rest a bit.","（阿良々木）
ああ しばらく休んでりゃ
すぐ動けるようになるさ","Oh, I'll take a break
It will move right away",0.23809523809523808
I see.,阿良々木くん 感心するわ,I'm impressed by Atsuki Kun,0.125
Think happy thoughts until you're able to move around again.,"動けるようになるまで
幸せな気分でいなさいな","Until you move
I feel happy",0.2857142857142857
A,"そう　じゃ
そんな阿良々木くんに大サービス","So
Such a large service to Atsuki Kun",0.125
"No need to hold back, you know.",遠慮しなくて いいんだぞ？,You don't have to hold it?,0.21428571428571427
"I really admire that you're sensitive enough to hesitate before entering the room of a girl you barely know,","よく知らない女の子の部屋に
入るのに躊躇(ちゅうちょ)する—","In the room of a girl who does not know well
I'm hesitate to enter-",0.3333333333333333
but it's probably not the best time to be worrying about that.,今は そんな場合でもないだろう,It will not be such a case now,0.15789473684210525
Yeah...,（阿良々木）あ… ああ…,Ah ... ah ...,0.3333333333333333
What's up?,"（阿良々木）神原
（神原）何だ？","Kamihara 
 What is it?",0.2857142857142857
"One hour-no, thirty minutes is fine...","（阿良々木）
１時間 いや 30分でいいから",Because it is good for 1 hour and 30 minutes,0.125
Just give me some time to clean up this room.,"僕に この部屋を
掃除するための時間をくれ","I have this room
Give me the time to clean",0.5
Okay.,うん,Yes,0.0
"Well, at any rate,",まあ とりあえずは,"Well, for the time being",0.2222222222222222
please allow me to apologize for last night.,"昨夜のことを
謝らせてもらおうと思う","Last night
I think I will apologize",0.25
"Like I thought, that was you...",やっぱり あれは お前だったのか,After all that was you,0.3
"You completely saw through it, right?",完全に見抜いていたのだろう？,Did you have completely seen?,0.2727272727272727
then there's no way you'd come to talk to me.,"阿良々木先輩のほうから
私を訪ねてくるはずが ないからな","From Atsugi senior
It's because she should come to me",0.21052631578947367
"Not really,","歯がゆい言い方をするのだな
阿良々木先輩は","I do not say the teeth
Atsugi Senior",0.1
I also considered who'd know about my study session with Senjougahara.,"僕が勉強会で 戦場ヶ原の家に
行くことを知ってたヤツとか","I am a house in the battlefield at study session
A guy who knows going to go",0.16
I searched after narrowing it down with those factors.,"そういう条件から絞ったうえで
検索をかけて","After narrowing from such conditions
Searching",0.14285714285714285
"If you think of it like that, well, yeah...",そう考えれば… な,If you think so ...,0.3333333333333333
They say that there are guys who can differentiate girls based on their waists...,"男子の中には腰の形で
女子を判別できる者がいるというが","In boys, in the form of a waist
There is a person who can distinguish girls",0.15384615384615385
Sorry about that.,すまなかった,I'm sorry,0.16666666666666666
That wasn't my intention...,あんなつもりは なかったんだ,There was no such intention,0.2222222222222222
"Well, even if you apologize...","（阿良々木）
いや 謝ってもらっても…",Even if you apologize ...,0.7142857142857143
What I really want to know is the reason.,"僕が知りたいのは
むしろ理由のほうなんだけど","What I want to know
Rather, it is the reason",0.6153846153846154
"Well, actually, even more than the reason, that power...",いや 理由はともかく あの力,No reason is that power,0.23076923076923078
I want to ask about that superhuman strength...,"怪力のことを聞きたいんだけど
一体 お前…","I want to hear the mysteration
In one thing ...",0.26666666666666666
All right.,そうだな しかし,That's right,0.2
"Araragi-senpai, first I'd like to ask you",最初に質問しておきたいのだが,I want to ask questions first,0.36363636363636365
if you're the type of person that can believe in things that seem crazy.,"信じることができる
タイプの人間かどうか","Can believe
Whether or not a type of human",0.2
Do you not get it?,分からないだろうか？,Do you not understand?,0.5714285714285714
I don't believe in anything but what I've seen with my own eyes.,"つまり 阿良々木先輩は
自分の目で見たものを","In other words, Atsuki Seniors
What I saw with my own eyes",0.3333333333333333
"That includes what happened to Senjougahara, too, of course.",戦場ヶ原のことも もちろんな,Of course the battlefield,0.15384615384615385
"Oh, you had that figured out too?",何だ そこまでバレていたのか,What did you have?,0.16666666666666666
"Senjougahara, from the track and field club, and you, from the basketball club, were called the Valhalla Combination, right?","（阿良々木）
バスケットボール部のお前と
陸上部の戦場ヶ原とで","Basketball club
With Battlefuhara, a land",0.15
That's right!,（神原）そのとおりだ,That's right,0.75
"Wow, I'm surprised you even know about that, Araragi-senpai.",おみそれしたぞ,I'm sorry,0.15384615384615385
"I know where it comes from, too.",（阿良々木）由来も聞いたよ,I also heard from Mr. Arabi,0.15384615384615385
Isn't it? I thought of it.,よく考えられた通り名だよな,It is the name of the name that was carefully considered,0.21428571428571427
It's been a while since I've felt this miserable.,"こんな切ない気分
本当に久しぶりだな","I feel like this
It's really a long time",0.29411764705882354
"But yeah, putting the Valhalla Combination aside,",ヴァルハラコンビは ともかく,Valhalla Combi,0.1111111111111111
"Senjougahara-senpai and I have always, since middle school...",戦場ヶ原先輩と私は中学時代に…,Battlefield Senior and I am a junior high school ...,0.25
"Before I talk anymore about that,",いや その話をするよりも先に,No longer than I talk,0.2
"Honestly, it's not something I really want others to see.","先に見ておいてもらいたいものが
あるのだった","What I want to see earlier
It was",0.3125
"After all, I am still a girl.","私はこれでも 一応
女の子なのでな","I have one more thing
Because it is a girl",0.1875
"Well, this is it...",まあ こういうことなのだが,Well this is something,0.42857142857142855
Spirit,ああ…,Ah…,0.0
It looks like...,猿の手 みたいだ,It looks like a monkey,0.5
Stop deciding everything I do is impressive!,"（阿良々木）
かっ 勝手に納得するな！",Don't be convinced by yourself!,0.15384615384615385
I'm just telling you my impressions of what I see.,"僕は ただ
見たままの感想を述べただけだよ","I just
I just mentioned my impressions",0.3333333333333333
"Oh, really?",そうなのか？,Is that so?,0.14285714285714285
The Monkey's Paw is the title of a short story by William Wymark Jacobs.,短編小説のタイトルなのだが,It is a title of a short story,0.375
"It's said that it grants the owner's wishes, but in a way that conflicts with what they really intended.","持ち主の意に沿わぬ形で
願いをかなえるという","In the form of the owner's meaning
It is said that the wishes are",0.32
Never heard of it.,いわくつきのアイテムなんだ,It is an item of wack,0.2222222222222222
"Being able to see the truth behind this without knowing anything,","何も知らないままに
真実を言い当ててしまうなんて","Nothing to know
I'm talking about the truth",0.16666666666666666
I can't help but think you're chosen by someone in heaven!,選ばれているとしか思えないな,I can only think that it is chosen,0.15789473684210525
I-Is it okay if I touch it?,"（阿良々木）
さ…
触ってもいいのか？","difference…
May I touch?",0.3333333333333333
Yeah.,（神原）うん 今は別に大丈夫だ,Yeah I'm fine again,0.16666666666666666
I-I see.,（阿良々木）そ… そうか,... so,0.0
It's alive.,"（阿良々木）
生きている",alive,0.25
A living spirit,"生きているタイプの
怪異だ","Living type
Monster",0.2
Don't make weird noises!,ああ！,Ah!,0.14285714285714285
It's because you touched it weirdly!,"阿良々木先輩が
変な触り方をするからだ","Atsugi Senior
It's because I touch a strange touch",0.23076923076923078
I'm ticklish.,私は くすぐったがりなのだ,I'm a mess,0.3333333333333333
"Even so, don't make sounds that completely change impressions of you!","これまでのキャラを崩すような
声音をあげてんじゃねえよ","It seems to break the character so far
Don't give me a vocane",0.12
"Oh, come on.",まあまあ,Mama,0.0
"As you can see, it moves how I want it to right now,","（神原）
このとおり 今は
思いどおりに動くのだが","As this happens now
It works as desired",0.17647058823529413
but there are times when it won't.,"思いどおりに
動かなくなるときが あるのだ","As desired
There is she when she is no longer moving",0.125
"No, that's not quite right.",いや 違うな,No way,0.1111111111111111
Against your will?,"思いに反して動くようになる
というのだろうか","It will move against the thought
Is it?",0.3333333333333333
"Hmm, I guess this is hard to understand.",どうも分かりづらいな,It is hard to understand,0.36363636363636365
"In other words, Araragi-senpai,",つまり 阿良々木先輩,"In other words, Atsugi senior",0.5714285714285714
"the one who attacked you last night was definitely me,","昨晩 阿良々木先輩を襲ったのは
確かに私なのだが","Last night I attacked the senior
Certainly me",0.35714285714285715
"It's not like I don't remember it at all, but...","全く覚えていない
わけではないのだが","I do not remember at all
It does not mean",0.4666666666666667
Trance...,"（阿良々木）
トランス",Trance,0.5
That's called a trance.,夢うつつというか 夢心地というか,It is said that it is a dream secret,0.18181818181818182
I know about it.,"トランス状態ってやつだよ それ
知ってる","It is a guy who is in the transformer
I know",0.25
The type of aberration that manipulates humans works by desynchronizing the body and the mind.,人間に憑依(ひょうい)するタイプの怪異は,The person of the type that is a human beings,0.21052631578947367
"Well, it's not like I know that much about it either.","（阿良々木）
まあ 僕も とりたてて詳しい
というわけじゃないんだが","Well I am also familiar with her
That's not",0.2777777777777778
And there's this guy that knows a lot about that stuff.,"それに
そういうのに詳しいヤツがいて","in addition
That's why I have a detailed guy",0.2222222222222222
We wouldn't have been able to have this conversation if you'd run away after seeing my arm.,"この腕を見せた段階で
逃げ出されでもしていたら","At the stage of showing this arm
If you're running away",0.19230769230769232
"And I probably would've been hurt a little, too.","それに少なからず
傷ついていたと思う","As little
I think it was hurt",0.1875
"Even so, I really was a bit surprised.","とはいえ さすがに ちょっと
びっくりはしたけどな","However, it is a bit
I was surprised but",0.42857142857142855
"Of course, that's exactly the reason I showed you my arm first.","もちろん そのために 最初に
この腕を見てもらったのだがな","Of course for that purpose
I was asked to see this arm",0.22727272727272727
You got through the most difficult part at the very beginning.,"いちばん大変なことを
いちばん最初に済ませたのだ","The most difficult thing
I finished the first time",0.1875
"All right, I think I'll get on to the real topic then.","じゃあ いよいよ
本題に入らせてもらおうと思う","Well then
I'm going to get this subject",0.21052631578947367
I'm a lesbian.,私はレズなのだ,I am a lesbian,0.5
Those are exactly the same!,"（神原）私は百合なのだ
（阿良々木）一緒だ そんなもん！","I am a lily
 That's the same!",0.25
"Wait, what?! What do you mean?",えっ なに？ どういうこと？,Ehen?What do you mean?,0.5555555555555556
"You're saying that you and Senjougahara were known as the Valhalla Combination in middle school,","戦場ヶ原と中学時代に
ヴァルハラコンビとか言って？","In the battlefield and junior high school days
Did you say Valhala Conviation?",0.2
and she said yesterday that she'd never broken up with a guy before...,"ええ？ 昨日言ってた
“男と別れたことがない”","Yes?I said yesterday
""I have never been separated from a man""",0.17391304347826086
Are you saying that you mean...?!,"っていうの ひょっとして
そういう意味だったのか？","Hiyoshi
Was that mean?",0.3
That's not it.,（神原）それは違う,It is different,0.14285714285714285
Senjougahara-senpai was my unrequited love.,"戦場ヶ原先輩のことは
私の 一方的な片思いだったんだ","Mr. Battlewahara Senior
I was my one-way unrequited love",0.36363636363636365
"To me, Senjougahara-senpai is pure and perfect.",私にとって 戦場ヶ原先輩は,"For me, Tamagara Senior",0.16666666666666666
I was satisfied by just being near her.,"そばにいるだけで
満足だったんだ","Just just
I was satisfied",0.4444444444444444
Thoughts,私の戦場ヶ原先輩に対する思いは,My thoughts on my battlefield senior,0.2
"Senjougahara-senpai was popular with everyone,","（神原）
戦場ヶ原先輩は
みんなの人気者だったけれど","Battlefield Senior
He was a popular person of everyone",0.25
I even thought that I could die for Senjougahara-senpai's sake.,"戦場ヶ原先輩のためなら
死んでもいいとすら思っていたのだ","For the Senior Battlewahara
He thought he was dead",0.11764705882352941
I'd heard that she fell ill after she got to high school.,"高校生になってから 重い病気を
患ったということは聞いていた","Heavy disease after becoming high school students
He was heard that he had suffered",0.23809523809523808
I'd also heard that she stopped track and field because of a prolonged illness.,"長患いで 陸上を
やめてしまったことも聞いていた","Lands and land
She also heard that she had stopped",0.3157894736842105
I thought it was just a bad rumor.,悪い噂(うわさ)だと思っていた,I thought it was a bad rumor,0.7777777777777778
But I was wrong.,しかし 違った,But it was different,0.2857142857142857
"We were in different clubs and different classes in middle school,","中学生のころ
学年も部活も違ったけれど","During junior high school students
The school year has also been different from club activities",0.09090909090909091
"So, this time,","だから 今度は
私が戦場ヶ原先輩を助けようとした","So this time
I tried to help Mr. Kogawara seniors",0.2727272727272727
"Even if I couldn't, I could be by her side and heal her heart.","戦場ヶ原先輩の心を
癒すことができる","Heart of Tamagahara Senior
Be able to heal",0.15789473684210525
That's what I thought.,そう思っていた,I thought so,0.2857142857142857
I was hopelessly rejected.,それは取りつく島もなく拒絶された,It was rejected without the island,0.2222222222222222
"""I don't even think of you as an underclassman, let alone as a friend.""","“後輩とも思っていない
今も昔も”","""I do not think of juniors
Now in the past,",0.25
She said that clearly to me.,そんなことを はっきり言われた,It was clearly said that,0.3333333333333333
Since that was the one and only thing she had ever wanted from me...,"それが 戦場ヶ原先輩が私に望んだ
唯一のことだったからな","That is the Tamagahara senior wanted to me
Because it was the only thing",0.3333333333333333
"Of course, I couldn't forget about her...","もちろん 戦場ヶ原先輩のことを
忘れることなんて","Of course, the battlefield senior
Forgetting",0.21428571428571427
then I could accept it.,それを私は よしとできる,I can do it,0.25
You...,お前…,you…,0.0
"But a year went by, and I found out about you.",でも １年が たって,But one year,0.14285714285714285
You were talking to her one morning quite closely in the classroom.,"戦場ヶ原先輩は
阿良々木先輩と朝の教室で","Battlefield Senior
Atsugi senior and morning classroom",0.11764705882352941
"Even during middle school, she'd never talked to me with that kind of...","中学時代でも私に
見せてくれたことがないような","Even in junior high school days
I have never shown",0.13043478260869565
happy smile.,幸せそうな笑顔でな,Happy smile,0.6666666666666666
Do you get it?!,分かるか？,Do you understand?,0.42857142857142855
"You were doing something that I really, really wanted to do, but had given up on",でも できずに諦めていたことを,But I was given up without it,0.21052631578947367
like it was perfectly natural!,"（神原）まるで当然のように
（阿良々木）神原…","Maruro as it is natural
Kamihara  ...",0.18181818181818182
"No, that was...",（阿良々木）いや それは,"No, it is",0.2857142857142857
"At first, I was jealous.","（神原）
最初は嫉妬した",At first I was jealous,0.7142857142857143
"but in the end, I was still jealous of you.","途中で思い直そうとして
最後まで嫉妬した","As if you try to remember on the way
I was jealous until the end",0.3
I wondered why I wasn't good enough.,どうして私じゃダメなのかと思った,Why I thought I was not good,0.4
I wondered if it would be different if I were a guy.,男だったらいいのかと思った,I thought it would be good to be a man,0.3333333333333333
I wondered if it was because I was a girl.,私が女だからダメなのかと思った,I thought it was no good because I was a woman,0.38461538461538464
"If that was the case, why couldn't it be me?!","だったら
私でも いいはずじゃないか！","If
She should not be good with me!",0.21052631578947367
"I was jealous of you, and I was disappointed with her.","阿良々木先輩に嫉妬して
戦場ヶ原先輩に失望した","I am jealous of Arayagi senior
I was disappointed with the Tamagahara senior",0.375
To hell with healing her pain... to hell with keeping my distance from her...,"何が“戦場ヶ原先輩を癒す”だ
何が“身を引く”だ","What is ""Healing Tamagahara Senior""
What is ""Help""",0.05555555555555555
That's ridiculous!,バカバカしい　偽善にも程がある,There is a difference in stupid hypocrisy,0.0
Even then...,"褒めてもらえるとでも
思っていたのか？","Even if you give up
Did you think?",0.1
So that's why I asked this paw to grant my wish.,"だから 私は
この手に願ったんだ","so I
I wished this way",0.2
I want to be by her side.,"戦場ヶ原先輩の
そばにいたい… と","Battlewahara Senior
I want to be soba ...",0.3333333333333333
So that person's name is Oshino Meme?,"（神原）
で その人は
忍野(おしの)メメという名前なのか？","And he is that person
Is it the name of Oshino  Meme?",0.5
"Is ""Meme"" written in katakana?",メメは片仮名でいいのか？,Will the meme is a katagana or a pseudonym?,0.21428571428571427
"Although, he's not as cute as his name suggests.","とはいえ 名前ほど
かわいらしいヤツじゃないぞ","However, the name
It's not a pretty guy",0.23529411764705882
"Your left hand is dangerous at night, right?","夜になったらヤバいんだろ？
その左手","If it's at night, is it bad?
Left hand",0.5
"Yeah, though really, it's actually that there's no problem when the sun is out.","逆に言えば 日のあるうちは
問題がないということだ","Conversely, in the day of the day
There is no problem",0.2857142857142857
"At least for the next few hours, it should be fine.","少なくとも あと数時間くらいは
確実に大丈夫だな","At least for a few hours
It is okay surely",0.35294117647058826
"Araragi-senpai, there's one thing I want to ask you.","（神原）
阿良々木先輩
１つ 聞きたいことが あるんだが","Atsugi senior
I have one I want to hear",0.25
What is it?,何だ？,What?,0.5
"I mean, she was your classmate for over two years, and you guys never even talked.",２年以上 口も利いたことのない,I have never had a mouth for more than two years,0.20833333333333334
W-Why would you ask that?,"ど… どうして
そんなこと聞くんだよ？","... why
Do you ask such a thing?",0.25
I think I'm fairly cute.,私は そこそこ かわいいと思うのだ,I think it's pretty cute,0.3333333333333333
"If I let my hair grow a little bit, I think I'd be a bit more girly,","髪の毛を伸ばせば
もう少し女の子らしくなると思うし","If you extend your hair
I think it will be a little more girl",0.38095238095238093
"My waist is just narrow enough, and my body is nice and tight overall.",（神原）私の覚悟は本物だぞ,My preparation is real,0.13333333333333333
I'm completely serious.,"引き締まった
いい体をしているのだ","Tightened
I'm doing a good body",0.2
"If you wish so,","阿良々木先輩が求めるのなら
いつでも どこでも","If the Senior, Atsuki
Anytime he",0.2
Top...?! Bottom...?!,（阿良々木）はっ え…,Haya ...,0.16666666666666666
Why the hell would I wish for that?!,"なんで僕が そんなもんを
求めなくちゃならないんだ！","Why is I like that
I can not seek!",0.26666666666666666
"Oh, I see. You don't know anything about BL.",ん？ ああ そうか,"Yeah?Oh, I see",0.2857142857142857
That's surprising.,"阿良々木先輩は
ＢＬの素養がないのか　意外だな","Atsugi Senior
It is surprising that there is no BL's base",0.25
I don't want to talk about BL with an underclassman girl!,"（阿良々木）
後輩の女子とＢＬの話とか
したくねえよ！","Junior girl and BL story
I want to do it!",0.4117647058823529
"BL is short for boys' love, you know.","ん？ ＢＬとは
ボーイズラブの略だぞ？","Yeah?With BL
Is it a mass of Boys Love?",0.2222222222222222
I know! I'm not misunderstanding you!,"（阿良々木）
知っている！
そこで勘違いは していない！","know!
There is no mistake there!",0.18181818181818182
"Yeah, I noticed it when I was cleaning her room.",ああ 気付いては いたさ,"Oh, I realized",0.15384615384615385
You're not misunderstanding me?,（神原）勘違いは していないのか,Do not misunderstand,0.125
"Then, what exactly are you angry about, Araragi-senpai?","一体全体
何に怒っているのだろう？","All overall
What is angry?",0.23076923076923078
Don't tell me you like the bottom!,神原の部屋を片づけたときに,When you get up the room of Kamihara,0.13333333333333333
This conversation is over!,"（阿良々木）
うるさい この話は もう終わりだ！",Noisy This story is already over!,0.5
"Forgive me for being intrusive, Araragi-senpai,",ならば 阿良々木先輩は 今,"If so, the senior",0.09090909090909091
but I think that you won't survive in the world,"（神原）
恐れながら 差し出がましいことを
言わせていただくが 阿良々木先輩","It is difficult to get out of the fear
I will tell you, but Atsugi senior",0.16666666666666666
if you can't even enjoy a dirty conversation with an underclassman girl.,"後輩の女子と
お下劣な会話を楽しめないようでは","With junior girl
If you can't enjoy your downtime conversation",0.47058823529411764
I really don't want to be counseled by an underclassman girl.,"（阿良々木）
それこそ
後輩の女子に諭されたくないよ","It is
I do not want to be admired by junior girl",0.3888888888888889
"Even if you say that, Araragi-senpai,","貞淑であることを求められても
挨拶に困るぞ","Even if you are asked to be
I'm troubled with greetings",0.1875
