en_text,jp_text,google_translated,score
There was only a letter left in the vault.,「金庫室に置き手紙が残されているだけでした」,"""I just put a letter in the safe room.""",0.29411764705882354
"Bank Robbery? the police announced that the door to the back of the vault was wrenched open,",「警察の発表では 金庫室へと通じる裏口の扉が こじあけられており」,"""In the police announcement, the door of the back door that communicates to the safe room has a dull",0.32
and a letter was found inside the vault.,「金庫の中に置き手紙を発見したとの事です」,"""I have found a letter in the safe""",0.26666666666666666
"You see, this manga, which is currently serialized in a certain magazine, has protagonists that commit ""perfect crimes.""",「実は ある雑誌に主人公が完全犯罪を行うマンガが連載されておりまして」,"""In fact, a manga is serialized by the main character in a certain magazine""",0.37037037037037035
It featured a case very similar to this incident. incoming call,「作品の中に 大変 似た事件が」,"""A very similar incident in the work""",0.23529411764705882
I can't believe this incident happened!,こんな事件が起こるなんて,Such an incident happens,0.09090909090909091
"Imitation and next episode: ""imitation and subconscious""",平丸さんにも 事件が,Also in Hiramaru,0.0
"As long as you have dreams, you can overcome anything!",夢があれば どんなことも乗り越えられる,"If there is a dream, you can get over",0.17647058823529413
