en_text,jp_text,google_translated,score
Uninstall.,♪～,♪ ~,0.0
What did you tell your parents?,"（アンコ）親に何て言ってきた？
（コモ）ちゃんと話してきたよ","What did you say to parents?
 has been talking properly",0.38461538461538464
We'd like to catch the next bus...,（男性）バスに乗りたいんですが,I want to get on the bus,0.23076923076923078
Let's go together.,行きましょう　お願いします,Let's go,0.6
You guys!,"（美純(みすみ)）あなたたち！
（アンコ）田中(たなか)さん！",") You!
 Tanaka Tanaka!",0.4
Tanaka-san!,（カンジ）ウッ！,Uh!,0.3333333333333333
Get away from them!,"離れなさい！
（銃声）",Get away!,0.6
Who were they?!,"（関(せき)）田中さん！
あいつら 何者ですか？","Tanaka-san!
Who is there?",0.375
Are you all okay?,"可奈(かな)ちゃん 大丈夫？
（カナ）うん","Kanana  Chan okay?
 Yeah",0.25
I'm fine.,大丈夫です,fine,0.25
Yeah.,（一同）うん,Yeah,0.5
Do you think you could all walk to my apartment from here?,"（美純）みんな
私のマンションまで歩けるかしら？","everyone
Do you want to walk to my apartment?",0.5
Good evening.,"（佐々見(ささみ)）こんばんは
君たち 久しぶりだねえ",") Good evening
You're a long time",0.2222222222222222
Did something happen?,（桂木(かつらぎ)）何かあったんですか？,What happened?,0.16666666666666666
"Yes, sir. There were five men who\Nall looked to be in their thirties.","30前後の男たちが５人
武器も所持していました","Five men in front of 30 people
I also had weapons",0.13043478260869565
Was anyone hurt?,それは良かったねえ,That was good,0.16666666666666666
"Tanaka-san, there's actually something\NI'd like to talk to you about.","田中さん
実は少しお話があるんですが","Mr. Tanaka
Actually there is a little story",0.10526315789473684
"Of course, I don't mind if the children join us.","もちろん
子供たちも一緒でかまわない","of course
Children are not talking together",0.17647058823529413
They're very tired right now.,彼らは今 疲れていますから,Because they are tired now,0.3333333333333333
"Seki-kun, I'll leave the kids with you.","関君 子供たちを頼むわ
（関）はい","I ask for Kids
 Yes",0.15384615384615385
"Kanji-kun, would it be okay if everyone went to your place?","（美純）寛治(かんじ)君の所 いい？
（カンジ）はい","Hiroshi Kaneji  Is it ok?
 Yes",0.1111111111111111
I'll bring the car around.,（関）車を回してきます,I will turn the car,0.3333333333333333
"Tanaka-san, won't you be coming?","田中さんは来ないんですか？
（美純）あとで すぐ行くわ","Are Mr. Tanaka coming?
 After that she goes soon",0.125
Even though you're still so young...,こんなに小さいのに…,This is so small ...,0.18181818181818182
"you're really strong, aren't you?",あなたは強い子ね,You are a strong girl,0.3
Tanaka-san...,（カナ）田中さん…,Mr. Tanaka ...,0.25
Really?,（美純）うん？,yes?,0.3333333333333333
"As soon as I find out, you'll be the first to know.","うん　分かったら すぐに
可奈ちゃんに連絡する　約束よ","As soon as I understand
It is a promise to contact Kanana",0.19047619047619047
When do you plan to give them some bodyguards?!,"一体 いつ
護衛を増やしてくれるんですか？","Integrally
Can you increase escort?",0.13333333333333333
"You're acting so casually about it, but that\Ncould have turned out badly back there!","取り返しのつかないことに
なるところだったんですよ！","Not not returning
It was a place where it was!",0.08695652173913043
"Please have a seat. Let's calmly discuss\Nthis like adults, shall we?","座ってください
落ち着いて話しましょう","Please sit down
Let's talk calmly",0.2222222222222222
Who exactly were those men?,（美純）連中は 一体 誰ですか？,Who is the one in a row?,0.16666666666666666
Why?,"（桂木）多分 他国の企業だ
（美純）なぜ？","A number of companies in other countries
 Why?",0.2222222222222222
"In other words, power companies are only interested\Nin not having to lay wire anymore?","要するに 電力会社の電線が
要らなくなるだけの話ですよね？","In short, electric power company's electric wire
It is a story that only makes no needs, right?",0.20689655172413793
I can't believe the children are put in\Ndanger over something like that!,"そんなことのために
子供たちが危険にさらされるなんて","For such a thing
Children are dangerous",0.10526315789473684
The military wouldn't have to worry about\Nthe replenishment of supplies anymore.,"軍隊の補給が要らなくなるんだよ？
画期的なことだ","Is the military replenishment no longer need?
It is a revolutionary thing",0.13636363636363635
Wait a second...,あっ… 待ってください,Oh ... Please wait,0.3333333333333333
How did those men even know what the children look like?,"大体 彼らは
どうやって子供たちの顔を？","Mostly they are
How do you face children?",0.16666666666666666
Why has that information been leaked?,"なぜ
情報が外部に漏れているんですか？","why
Is the information leak to the outside?",0.25
That's something I'd like to ask you.,"その代わり
協力してほしいことがある","Instead
I want you to cooperate",0.23076923076923078
"To collect more data, we'd like to install\Nhacking chips into the children.","子供たちに
ハッキングチップを埋め込みたい","To children
I want to embed hacking chips",0.16666666666666666
Y-You must be joking!,そ… そんな！,So ... that!,0.125
It's so we can find the key to releasing\Nthem from their contract.,"（桂木）
契約を解くカギを見つけるためだよ",It is to find the key to solve the contract,0.375
Professor Yoshikawa's hoping you'll be willing to help.,吉川(よしかわ)教授たっての願いだ,Yoshikawa  Professor,0.18181818181818182
"That may be true, but I still believe it's necessary if we're\Nto find the key to freeing the children from the contract.","だが 子供たちの契約を解くために
必要なことだと考えています","But to solve the children's contract
I think it is necessary",0.34615384615384615
It's all about give and take. Wouldn't you agree?,"何事もギブアンドテークだ
そうでしょう？","It is Give and Take
I guess so?",0.29411764705882354
Can you say the same to those children\Nwho sacrificed themselves to fight?,"死んだ子供たちにも
そう言えますか？","Also for children who died
Can you say so?",0.2222222222222222
And what of all the loyal crew members\Nwho died in the battle at Shinagawa?,"品川(しながわ)の戦闘で沈んだ
従順な乗員たちは？","Sudden in the battle of Shinagawa 
How are you?",0.3333333333333333
"Well, yes, of course, but...",うん… もちろん そうだが,Yeah ... Of course it seems,0.3
What are you talking about?,"命と引き換えの見返りなど
求めませんよね？","Life and retranspowering
You are not asking, right?",0.23076923076923078
We were also careless.,我々も迂闊(うかつ)だったということだ,It is said that we were also stupid,0.3
We should've done our homework when you\Nvolunteered to be part of this operation.,"君が この件に志願してきたときに
調べるべきだった","When you are applying to this matter
Should have been examined",0.18181818181818182
"At the very least, I'd say you've gotten a little\Ntoo involved out of personal interest.",少なくとも 君は―,At least you-,0.1
"Calling it ""personal interest"" is going a bit too far...",“利害”は言い過ぎです,"""Interest"" is too much",0.35714285714285715
"I'm nearby, so...","（アンコ）
ハァ… おなかすいちゃった",Hua ... I'm sorry,0.375
I'm starving.,"（店員）
分かりました　お待ちしてます",I understand I'm waiting,0.3333333333333333
Should we go get something?,（マチ）何か買ってこようか？,What should I buy?,0.2222222222222222
"Kana-chan, you really know what hits the spot!","（アンコ）
ホント？ カナちゃん 気が利く！",really?Kana-chan is aware!,0.23076923076923078
About what you asked Tanaka-san before...,（ウシロ）あっ… ハッ！,... Ha!,0.1111111111111111
"She's been really busy lately. If you'd like,\NI'd be more than willing to help you out.","田中さん 今 忙しくてね
僕で良かったら力になるよ","Mr. Tanaka is busy now
If it is good, it will be power",0.14285714285714285
Water's good enough.,"（バーテンダー）いらっしゃいませ
（美純）水でいいわ","I do not know
 Water",0.1111111111111111
Sorry to keep you waiting.,（バーテンダー）お待たせしました,Thank you for waiting,0.25
President...,"（佐久間）方向転換だな
（美純）会長","Direction change
 President",0.25
The last person in that position was willing to sacrifice\Neverything necessary to do something about that monster.,"あの怪物を
なんとかしようという趣旨だった","That monster
It was the purpose of what to do",0.3
But it's completely different this time around.,だが これは違う,But this is different,0.3
"By using Zearths technology, they're talking\Nabout founding an entirely new industry.","ジアースのテクノロジーによって
新しい産業が生まれる可能性","By the Technology of Dials
Possibility of new industries",0.15789473684210525
Their main point this time is how it would transform the\Nframework for an East Asian National Security Council.,"安全保障の枠組みが
どう変化するかが主眼じゃ","Security framework
How to change is the focus",0.125
Are they considering using it to strengthen their\Nmilitary power to conquer other countries?,"他国を軍事的に支配しようと
しているのでしょうか？","Try to rule the military
Are you doing?",0.15789473684210525
I don't think they're that stupid.,フッ… そこまでバカじゃあるまい,Ho ... I'm stupid,0.16666666666666666
But the financial world's intentions\Nare as clear as day from this report.,"ただ このリポートには
財界の意向が反映されている","Just in this report
Financial intentions are reflected",0.16666666666666666
Yes...,"ええ… 子供たちのことなんか
どこにも書かれていない　ひどいわ","Yes ... something about children
It is awful not to write anywhere",0.16666666666666666
And there's nothing of the children written in here at all.,この穂走(ほばしり)会の力では―,In the power of this Hall-hiera,0.1875
"We want to do all we can for you, but our Hobashiri Group\Nwent as far as we could just by getting this report.","わしらとて お前さんのために
何でもやってやりたいが―","For you, for yourself
I want to do anything-",0.24
I'm sorry to always ask so much of you.,（美純）いつも すみません,I am always sorry,0.25
there's no one in this group who wouldn't\Nbe willing to give his life for you.,"もはや この組で お前さんのために
命を惜しむ者などおらん","Again, for you in this set
Someone who lives",0.22727272727272727
Do you remember him?,護衛には保(たもつ)をやろう　覚えとるか？,Do you remember to do the  for escort?,0.4444444444444444
Yes.,あっ はい,Yes,0.5
But let me at least say this.,だが これだけは言うておく,But I will say this,0.3
This is on a different level from\Nthe little disputes from before.,"これは そこいらのチンピラの
抗争とはワケが違う","This is the one of the
Wake is different from the anti-war",0.23529411764705882
"If you know you have no chance of winning, give up.",勝ち目がないと思ったら諦めろ,"If you think that there is no winning eyes, give up",0.4117647058823529
Just forget everything.,"全て忘れて
子供は また つくればいい","Forget everything
Children should also make he",0.2222222222222222
"I'm worried about you, too.",お前のことを心配しとるのだぞ,I'm worried about you,0.625
I won't be able to face Ichiro in the afterlife.,"あの世で
一郎に合わせる顔がないからな","In that world
Because there is no face to match the Ichiro",0.2631578947368421
How are the children?,"（関）関です
（美純）子供たちは どう？",How is the children?,0.6666666666666666
They just boiled some hot water for their cup noodles.,"（関）今 カップ麺に
お湯をかけたところです","Cup noodles
I'm addicted to hot water",0.26666666666666666
I see. I'm heading over that way now.,（美純）そう　今から行くから,so because I'm going from now,0.23076923076923078
About the issue of Ushiro-kun's mother...,"（関）それで 田中さん
宇白(うしろ)君の母親の件なんですが…","Tanaka-san
Ushi  of your mother's mother ...",0.36363636363636365
Why won't you just look it up for her?,"ええ
どうして調べてあげないんですか？","Yes
Why don't you check it?",0.35714285714285715
"You'd only need to order the record from\Nthe national family census, right?","戸籍を取り寄せればいいだけの
話ですよね？","I just need to get a family register
It's a story, right?",0.2608695652173913
Wouldn't that be illegal?,"それは違法じゃないかしら？
（関）あっ…","It's not illegal?
 ...",0.2
Yes?,"関君 あのね
（関）はい","Ahona-kun
 Yes",0.3333333333333333
Okay...,"（マチ）今更 そんなこと…
（アンコ）だって…","Today ...
 ...",0.3333333333333333
"Well, I'll be outside waiting for you.",それじゃ 表に出て待ってますから,Well then I'm waiting for the table,0.2857142857142857
"I... really don't want to fight, after all.",やっぱり 戦いたくないわ,After all I do not want to fight,0.5384615384615384
I... don't want to die.,"死にたくないし
（ウシロ）俺だって死にたくない","I do not want to die
 I do not want to die",0.5555555555555556
But how are we supposed to quit?,"でも
どうやって辞めればいいんだ？","but
How should I quit?",0.4
"Anyway, I don't think we should be fighting either.","（コモ）
とにかく 戦うべきじゃないと思う",I think I should fight anyway,0.3076923076923077
The enemies are the same as us. Humans.,"敵も私たちと同じ人間よ
もう１回 お父さんに話してみる","Enemy is also the same person as us
Talk to my dad again",0.23529411764705882
"Anko, would you be able to get your\Ndad to cooperate with us, too?","アンコも お父さんに
協力してもらえないかな？","Anko also father
Could you cooperate?",0.23529411764705882
My dad?,（アンコ）パパに？,Daddy?,0.25
Let's leak our information to the media.,"（コモ）
マスコミにリークしましょう",Let's leak on the media,0.5
"This is a worldwide problem, so don't you think\Nwe're carrying too much of the burden?",この地球全体の問題なのに―,What is the problem of the whole earth-,0.18181818181818182
Seki-san and Tanaka-san and everyone else are helping us!,"（マチ）関さんや田中さんたちが
助けてくれるじゃない","Seki and Tanaka
I will not help",0.06666666666666667
We might be able to get even more\Nsupport if we could get this on TV.,"テレビで
大きく取り上げてもらったら―","on TV
If you get a big deal",0.2222222222222222
That's...,あっ… それは…,Oh ... it's ...,0.4
"That's why we've all fought so far, right?","だからこそ
今まで みんな戦ったでしょう？","Because
Have you ever fought everyone until now?",0.10526315789473684
And Kirie-kun's battle might begin any minute now!,"そして 今すぐ キリエ君の戦いが
始まるかもしれない","And now Kirie's battle
May be started",0.2857142857142857
What's Kirie-kun supposed to do?!,キリエ君は どうすればいいの？,What should I do?,0.3
"That's... Kirie-kun's own problem, and his own choice.",それは キリエ君が決める問題よ,It is a problem that Kirie decides,0.125
I... was intending to fight.,（キリエ）一応 戦うつもりだけど,I'm going to fight once,0.3
That sounds about right.,"確かに そうだな
（コモ）そんなつもりじゃ…","Certainly it is
 That's right ...",0.2
Could one of you be the one not contracted?!,"ひょっとして 契約してないのは
あなたたちじゃないの？","I have not contracted
Aren't you?",0.2857142857142857
"I mean, you're the daughters of a bigshot politician\Nand a famous television announcer!","国のお偉いさんに
マスコミ関係者の娘だもんね","To the great country
A daughter of a mass communication person",0.13636363636363635
Your fathers are the ones who'd benefit from\Nusing the information about Zearth!,"ジアースの情報を
利用して得をするのは―","Information on the geese
To get it using",0.10526315789473684
Wait a second!,"あなたたちのお父さん
（アンコ）ちょっと待って","Your dad
 Wait a minute",0.2857142857142857
What?,どうなんだ？,What about that?,0.5
That's so obviously not the case!,違うに決まってるじゃない！,It is not decided differently!,0.16666666666666666
Sorry I took so long.,"あっ…
（美純）遅くなって ごめんなさい","Ah…
 I'm sorry I'm late",0.2222222222222222
This place looks pretty fun.,"（アンコ）田中さん
（美純）面白い所ね","Mr. Tanaka
 Funny place",0.1111111111111111
"Komoda-san, would you let me meet with your father?","古茂田(こもだ)さん
今度 お父さんに会わせてくれる？","Furuta 
Will you meet your father this time?",0.3333333333333333
I'm going to leak our information to the media.,"私たちのことを
マスコミにリークするわ","Our about us
I leak into the media",0.38461538461538464
"If you want to put us on Dad's program, it'll be hard\Nto bring the topic to him without any proof.","私たちのことをパパの番組で
取り上げてもらうにしても―","About us in the program of dad
Even if you try to pick up",0.23333333333333334
Top secret government information.,政府の機密文書,Government's confidential document,0.125
The Cognitive Robotics Research Institute's\Nresults have been documented in here.,"ここには 認知研による ジアースの
研究成果が書かれているの","Here is a dexualize by cognitive research
Research results are written",0.16666666666666666
Tanaka-san! The Cognitive Robotics Research\NInstitute is involved in this?,"田中さん
認知研が関わっているんですか？","Mr. Tanaka
Is cognitive research involved?",0.2857142857142857
What do you mean by that?,"あんたもグルってことか
（美純）どういう意味？","Is it all right?
 What does it mean?",0.25
"If we know who stands to gain something from this,\Nwe might be able to tell who's not contracted.","この事件で
誰が得をするかで考えたら―","In this case
If you consider who gets-",0.12
"Ushiro-kun, I want you to learn to believe in people more.","宇白君 あなたには もっと
人を信じることを学んでほしいわ","Uda-kun more for you
I want you to learn to believe in people",0.6428571428571429
My mother is the head professor of the\NCognitive Robotics Research Institute.,俺の母親は 認知研の教授なんだよ,My mother is a professor of cognitive research,0.42857142857142855
I get it now!,"（関）
あっ そうか！ 同じ“吉川”だった","Is it so!It was the same ""Yoshikawa""",0.15384615384615385
The results of an analysis of Zearth would be\Ntremendously valuable to the Institute.,"認知研にとって
ジアースの研究成果は―","For cognitive research
Research results of Diases-",0.125
"That's why I'd be the most suspicious person here, I guess.","だから
この中で いちばん怪しいのは俺さ","that's why
In this, he is the most suspicious thing",0.3684210526315789
Haven't you heard anything about this from your mother?,"君は お母さんから
何も聞いてなかったのか？","You are from your mother
She didn't hear anything?",0.4666666666666667
My mother is a workaholic and doesn't even come home.,"母は仕事だけの人で
家(うち)にも帰ってこないんです","Mother is a person who is alone
She does not come back to the house",0.23809523809523808
I haven't seen her in a while.,"しばらく会ってません
（関）驚いたな","I will not meet for a while
 I was surprised",0.2
Though I can't blame you for suspecting Komo and Anko.,"もう コモやアンコのこと
疑ったって しょうがないぜ","Another como and Anko
I doubt sorry",0.1875
"And anyway, whoever's not contracted,\Nwhat more could they even do?","第一 契約してないのが誰だろうと
そいつに何ができる？","Who is not the first contract
What can you do for?",0.13043478260869565
She's that type of woman.,"そんなの誰だっていいじゃないか
（コモ・アンコ）あっ…","Who is that of that?
 ...",0.18181818181818182
What do you mean?,"（カンジ）えっ？
（アンコ）どういうことですか？","Eh?
 What does that mean?",0.375
This is what we needed! Let's all go to see her tomorrow!,"そうよ！ あした
みんなで会いに行きましょう","that's right!tomorrow
Let's go to see you together",0.3888888888888889
Professor Yoshikawa is the key to learning\Nhow to release you all from the contract!,"吉川教授は
契約を解くカギを探すキーマン","Professor Yoshikawa
Search for keys to solve contract Keyman",0.2222222222222222
"Hello, Katsuragi-san?",（美純）もしもし 桂木さん？,Masa Katsura?,0.16666666666666666
Yes. Regarding the hacking chip... I'm headed to the\NResearch Institute right now with the children.,"これから子供たちを連れて
認知研に向かいます","Take children from now on
Go to cognitive research",0.13043478260869565
"Please prepare for our arrival, so we can get in.",中に入れるように手配してください,Please arrange to put it in,0.125
"Welcome, everyone.",（吉川）ようこそ 皆さん,Welcome everyone,0.5
"I'm Yoshikawa Mitsue, the chairwoman and head professor\Nof the Cognitive Robotics Research Institute.","私が この認知研究所 所長の
吉川光枝(みつえ)です","I am the director of this Censure Research Institute
It is Yoshikawa Mitsuaki",0.21739130434782608
It's a pleasure to meet you all.,どうぞ よろしく,Nice to meet you,0.3
Why are you...?,"寛治！
あっ… どうして あなたが？","Hiroshi!
Oh ... why are you?",0.625
See? This is my mother for you.,ほらな！ これが俺の母親なんだよ,Hey!This is my mother,0.36363636363636365
Professor Yoshikawa.,吉川教授,Professor Yoshikawa,0.6666666666666666
Your son is one of the children burdened\Nwith the fate of this Earth.,"地球の運命を
託されたひとりだったんです","The fate of the earth
It was one who was entrusted",0.3125
Could you tell us the results of your\Nresearch so far for these children?,"ジアースの研究成果を
教えていただけませんか？","Research results of Diases
could you please tell me?",0.3333333333333333
I tried reproducing the thought control system.,"（吉川）
思念コントロールシステムを
再現してみました","Thought control system
I tried to reproduce",0.5
This is...,"（キリエ）これ…
（マチ）マキの…","This ...
 Maki ...",0.5
This is something I've pulled from Seki's thoughts.,"（吉川）これは関さんの思念から
取り出したものよ","This is from Seki's thoughts
It was taken out",0.4
Amazing...,"（ウシロ）あっ…
（吉川）ただし―","...
 However-",0.3333333333333333
We've managed to solve one portion of Zearth's program.,"（吉川）
我々は ジアースのプログラムの
一部分は解明しました","We have a program of his dears
Some partials were elucidated",0.15
We can reproduce what someone has seen... their memories.,"見てきたもの
記憶までは再現できる","What I have seen
You can reproduce until memory",0.25
This is a simulation.,"（吉川）
これはシミュレーションです
関さんに動かしてもらってます","This is a simulation
I have you move it to Seki",0.3333333333333333
"However, we cannot yet transfer matter...",（一同）えっ…,...,0.1111111111111111
"And in order to do that, we'd like to ask\Nthat you children collaborate with us.","そのために
あなたたちに協力をお願いしたいの","for that
I would like to ask you to cooperate",0.18181818181818182
"To further access the depths of Zearth,\Nwe'd like to install chips within each of your bodies.","ジアースに
より深くアクセスするために―","In the dice
To access deeper",0.14285714285714285
Would there be any problems from a health standpoint?,"こちらからも条件があります
（吉川）うん？","There is also a condition from here
 yes?",0.26666666666666666
Of course not.,（吉川）もちろん,Of course,0.5
Please find the key to releasing them from their contract.,"（美純）
契約を解くカギを探してください",Look for a key to solve the contract,0.26666666666666666
"Well, of course...",（吉川）それは もちろん,Of course,0.4
I'd like to save this boy first.,"まず 彼を助けたい
そのためなら協力します","First I want to help him
Then cooperate",0.21428571428571427
"If you'll help us with this, we'll be more\Nthan happy to work with you.","ジアースの仕組みが
分かりさえすれば―","The mechanism of the diaz
If you understand-",0.1
