en_text,jp_text,google_translated,score
You're telling me to accept my destiny of sickness and die?,"病という運命を受け入れて
死んでしまえと？","Accept the destiny of disease
Did you die?",0.375
You won't be able to become superhuman either way!,"どの道 お前は
超人になどなれない","Which way
I can not be a superman",0.11764705882352941
No! lt'll be complete in two days!,"やめろ！
あと２日で完成なんだ","Stop!
It is completed in two more days",0.2857142857142857
Using that I'll turn from a caterpillar into a butterfly!,"俺は それを使って
芋虫から蝶になるんだ","I use it
I will be a butterfly from the worms",0.23529411764705882
That's my new life!,"それは俺の新しい命なんだ
（鷲(わし)の飛来音）","That's my new life
 飛)",0.625
"lf l'm not mistaken, this is... the last one!",これは たしか…,This is only ...,0.21428571428571427
Are you okay... Master?,"（鷲尾(わしお)）
大丈夫ですか 主(あるじ)",")
Is it okay?",0.2222222222222222
The tables are turned!,"化け物も超人も
どっちも止める！","Somewhat also superman
Which one stops!",0.09090909090909091
Girl! Turn into a monster and die!,"女 貴様は
化け物になって死ね","I'm sorry
Become a monster and die",0.3333333333333333
I'll turn into a superhuman and live!,俺は超人になって生きる,I will live and live,0.3
"So in other words, you're also saying for me to die like this?","お前も俺に
このまま死んでしまえと","You are also to me
I die as it is",0.23809523809523808
"No! l can't just thoughtlessly say something like ""die"" to a person!","死ねなんて
軽々しく人に言えるか","It is dead
Will a person to say to people",0.19047619047619047
l am saying make amends to the people you sacrificed until now,"今まで犠牲にした人たちに
ちゃんと償って―","For those who have been sacrificed until now
Compensate properly-",0.15789473684210525
and then live until the very end of your life!,"それから
命が終わる最後まで生きろ","after that
Live to the end of life",0.35714285714285715
"Master, leave this to me and please escape quickly.","（鷲尾）
主 ここは私に任せて
早くお逃げください","Lord here to leave me
Please run early",0.26666666666666666
People will soon be here.,すぐに人が来る,People come soon,0.2857142857142857
Have the police and the fire department been contacted?,警察と消防に連絡はしたのか？,Did you contact the police and fire department?,0.5
All right! You catch the Papillon Mask!\NI'll hold off Washio!,"（カズキ）
よし 斗貴子さんは
パピヨンマスクを捕まえて","Yoshiko Yoshiko
Catch the Papillon Mask",0.2857142857142857
What?,"俺は鷲尾を食い止める
（斗貴子）何？","I stop eating
 What?",0.4
My lance should be faster at this distance!,"突進だけなら
俺のランスのほうが速いはず","If only rush
My lantern should be faster",0.3076923076923077
You're going to challenge me with speed?,この私に速さで挑むか,Do you challenge this with speed,0.36363636363636365
but in this closed space\NKazuki can make the first strike,"（鷲尾）
この私を見くびったが最後",I saw this and the last,0.14285714285714285
before the homunculus completes his transformation!,"障害が多いこの場なら
やつが変形を完了する前に","If there is a lot of obstacles
Before the guy completes the deformation",0.1875
Buso...,武装…,Armed ...,0.3333333333333333
Prepare yourself!,覚悟しろ,Preliminary,0.0
were all products of animal experimentation,"人間型ホムンクルスになるための
動物実験の産物","To become human type Homculus
Product of animal experiment",0.15384615384615385
"in others words, to create my new life!","つまり俺の新しい命を
作るための―","In other words, my new life
To make-",0.5833333333333334
"But this hawk homunculus, Washio,","だが この大鷲のホムンクルス
鷲尾は出来が違うぞ","But this Otsuki's Homculus
I can not do it",0.14285714285714285
l don't know what it is...,"（まひろ）
何だろう
何かイヤな胸騒ぎがする","What
Something I don't like a big breast",0.21428571428571427
He's the type l hate most.,"きれい事ばかり言う偽善者
一番 嫌いなタイプだ","Mischievous person who only says beautiful things
It is the most dislike type",0.16666666666666666
"Yet again, l've lost the place l can belong to...","（カズキ）
息ができない このままじゃ…",I can not breathe ...,0.13333333333333333
"For the next two days, where am l suppose to go to?","あと２日
俺はどこへ行けばいい","Two more days
Where should I go",0.25
At this rate...,うっ ああ…,Uh ...,0.2
—Buso Renkin!\N—Buso Renkin!,（カズキ）斗貴子さん！,Ichiko Iko!,0.16666666666666666
"lt'll be difficult to support the weight of two people with the Valkryie Skirt,","人 ２人分の重量を
支えるのは難しいが―","Weight of two people
It is difficult to support-",0.3333333333333333
but I'll try!,やってみる,Try,0.2
"The special property of the lance,\NBuso Renkin, is this ornamental cloth!","（カズキ）
ランスの武装錬金の特性は
この飾り布","The characteristics of the armed alchemy of Lance
This decorated cloth",0.29411764705882354
lt becomes energy and activates acting in concert with my will!,"俺の意志に呼応して
エネルギーになって発動する","In response to my will
Energy and activate",0.3333333333333333
"Burst, my Buso Renkin!",はじけろ 俺の武装錬金！,My armed alchemy!,0.25
"With energy from the cloth, he cancelled out the impact of our fall.","（斗貴子）
布のエネルギーで
落下の衝撃を相殺した","With energy of cloth
I canceled the drop shock",0.2777777777777778
"As l suspected, this Buso Renkin is powerful!",やはり この武装錬金は強力,After all this armed alchemy is powerful,0.21428571428571427
"And though gradual, Kazuki's starting to master its use for certain!","それに徐々にだが カズキも確実に
使いこなせるようになってきている","But gradually but Kazuki ensure
It is being able to use it",0.14285714285714285
That was close.,ハア… 危なかった,Haa ... it was dangerous,0.125
Just what l'd expect of an alchemist warrior!,さすが 錬金の戦士,Alchemy warrior,0.09090909090909091
Just one part of his body has transformed into a homunculus!,"体の一部だけを
ホムンクルス化…","Only part of the body
Homculus ...",0.1875
He is indeed in a different league!,確かに こいつは出来が違う,Certainly this guy is different,0.18181818181818182
"lf we defeat him, all that's left is the Papillon Mask!","こいつを倒せば
あとはパピヨンマスク１人","If you beat this
After that, 1 Papillon Mask",0.2
I'll defeat all who do harm to my master!,主に害をなす者は すべて倒す,All people who harm the mainly defeat,0.2857142857142857
That wing is mine!,その翼 もらった！,I got that wing!,0.42857142857142855
l know.,（鷲尾）知ってるぞ,I know,0.25
lt's hard? No. This is...!,"（斗貴子）
硬い　違う これは…",Hard different This is ...,0.36363636363636365
"No matter how swift the blade,","（鷲尾）
いかに速い刃(やいば)でも―",How fast blade  -,0.2222222222222222
"as long as the angle of the blade is not erect, it's impossible to cut.","刃筋(はすじ)が立たない限り
切り裂くは不可能","Unless the blade  does not stand
It is impossible to cut",0.42105263157894735
Energy full blast!,エネルギー全開,Energy fully open,0.16666666666666666
Did he miss?! No. This is...!,"（斗貴子）
外した？ 違う これは…",Did you remove it?Different this is ...,0.35714285714285715
l know...,ハッ…,Ha ...,0.25
"No matter how sharp the spear tip,",いかに鋭い穂先でも―,How sharp ears-,0.2222222222222222
it's possible to evade if l slightly displace the tip!,"先端を わずかにずらせば
回避は可能","If you slightly cut the tip
Avoidance is possible",0.3125
Slice down!,切り裂け！,Scrack!,0.25
l've grasped your speed now.,"お前たちのスピードは
もう つかんだ","The speed of yours
I'm already grabbed",0.07142857142857142
l know. This is what's called reading the enemy's attack.,"今までのホムンクルスとは
格が違う","What is the previous Homculus
Is different",0.2
This monster...,（斗貴子）くっ…,...,0.3333333333333333
The fifth day is ending.\NOnly one day left.,"（斗貴子）
５日目が終わる
残り あと１日","Day 5 ends
1 day left",0.18181818181818182
"After you leave tomorrow morning, my life shall end by my own hands.","君がいなくなったら
私は自分で自身の始末をつける","If you do not
I put my own start by myself",0.19047619047619047
"Next time, ""To Protect Someone.""",次回 「守るべき人のために」,"Next time ""For those who should protect""",0.38461538461538464
