en_text,jp_text,google_translated,score,semantic_score
"Then, um... Do you guys \Ndo that kind of stuff?","じゃあ ２人はあるの？
そういうことしたり… とか","Well then there are two people?
That's why ...",0.2,0.19647612
She definitely hasn't!,"（真奈菜･ちお）
こいつは ないで〜す！",This guy is not she!,0.2222222222222222,0.40686658
W-We decided that our lips didn't \Nactually touch that time...,"（真奈菜）あります
（ちお）えっ 真奈菜 あれは…","There is
 Ehunana That is ...",0.14285714285714285,0.04108001
"What?! Manana, that was—",え〜？　じゃあ チューとかは？,"Huh~?Well then, what is it?",0.25,0.20204692
"I was in middle school, and the \Nother person was in college...","中学のときだけど
相手は大学生","I'm in junior high school
The opponent is a university student",0.2,0.3541599
In middle school? That's amazing!,中学で？　すご〜い,Is it junior high school? very,0.15384615384615385,0.4930065
"Well, we met online...",まあ きっかけはネットだけど,"Well, it's a net",0.2,0.2114195
I-I had no idea she was hiding \Nthat this whole time...,"し… 知らなかった
ずっと隠してたって…","... I did not know
I've been hidden for a long time ...",0.09090909090909093,0.6155394
Wait... What is this? Manana \Nsuddenly feels so far away...,えっ 何だろう？　この感情,What is it?This emotion,0.2857142857142857,0.33187914
"I'm the central person in our three,","この３人の中で
私は中心の存在で","Among these three people
I am in the presence of the center",0.25,0.71970505
so I figured I would be the one \Nwho could choose in this society.,"この社会では選ぶほうであると
確信していた","If you choose in this society
I was convinced",0.2777777777777778,0.7287078
"Hey, what should we do today?",ねえねえ 今日は何して遊ぶ？,Hey hey what to play today?,0.4,0.6163474
It's time for your studies right now.,今から学問の時間ですぞ,It is the time of study from now,0.21428571428571427,0.6433397
"""Heroides.""",「名婦の書簡」,"""The letter of the servant woman""",0.2222222222222222,0.26465085
Oho.,オウィディウスですね,It is Owidius,0.0,0.18827936
Are you well-versed in literature?,"（雪）
そなた 文学に造詣(ぞうけい)がおありか？",Is there a national literature?,0.2,0.50872403
"Before my fall, I had majored \Nin Latin literature.","（真奈菜）
身を落とす前は
ラテン文学を専攻しておりました","Before dropping
She majored in Latin literature",0.2857142857142857,0.71342427
"How about ""Metamorphoses""?",「メタモルポーセース」は…,"""Metamorposace"" is ...",0.2222222222222222,0.6597217
I'm fond of the Icarus episode.,私はイカロスのエピソードが,Ikaros episode,0.1111111111111111,0.4516845
No! This is too hard! No!,"（ちお）
やだ〜　難しい話 やだ〜！",Yada-difficult story!,0.125,0.24551967
What about Shakespeare?,ブドウおいしい〜,Grapew delicious ~,0.0,0.06575341
Manana...,"（ちお）
あ… あのガキ",Oh ... that oyster,0.2,0.19268593
So there seems to be a trick to it...,思い当たるフシもある,There is also a dream to think,0.2307692307692308,0.26967967
This is truly...,これは まさに,This is exactly,0.4,0.51404446
a betrayal!,裏切り！,betrayal!,0.6666666666666666,0.89027613
"Looks like you finally get it, Chio-chan.",あなた なかなか便利だったわ,It was quite convenient,0.08333333333333333,0.10013441
to join the elites at our school.,"おのれ〜！
奴隷の分際で〜！","Our!
At the interlection of slaves!",0.25,0.35989803
"I doubt we'll ever be \Nspeaking to each other again,","もう二度と
話すことはないと思うけど","never again
I think I will not talk",0.1176470588235294,0.43177658
but I did enjoy our time together.,気付いたようね ちおちゃん,I noticed that I was noticed,0.09090909090909093,0.12152666
"Goodbye, Chio-chan.",さようなら ちおちゃん,Goodbye Cho-chan,0.2,0.8213524
"Well, I was pretty young.",まあ 若かったから,Because it was young,0.2222222222222222,0.4894476
"For example,",例えば あそこにいる男性だけど,"For example, a man in there",0.42857142857142855,0.35485166
What?,（真奈菜）えっ？,Eh?,0.3333333333333333,0.32428223
Good morning!,おはようございます,good morning,0.6666666666666666,0.9083051
"Oh, sorry. Are you with a friend?","ああ ごめんなさい
お友達かな？","Oh sorry
Are you friends?",0.4545454545454545,0.7418771
This is Ushida-san. He works \Nat an office near our school.,"こちらは 学校の近くの会社の方で
牛田さんです","This is a company near school
Mr. Ushida",0.25,0.6368966
She talked to me one night while I \Nwas on a night run to lose weight.,"（牛田）
ダイエットに 夜 走ってたら
声かけてもらって","If you run at night on the diet
I asked",0.19047619047619047,0.40022376
Um... The way you're running \Nis really bad for your knees!,"あの！
その走り方 ひざに悪いですよ","that!
It is bad for the craving knee",0.21052631578947367,0.55939555
So he's dressed like that because \NHosokawa-san recommended it...,"（真奈菜）
あの格好って
細川さんのオススメなんだ","That's right
Mr. Hosokawa is recommended",0.2,0.53986347
Are you walking all the \Nway to the office again?,靴も専用だと…,If the shoes are also dedicated ...,0.13333333333333333,0.12605909
President?!,"（牛田）社長が太ってちゃ社員に…
（真奈菜）社長？","President is fat to employees ...
 President?",0.25,0.47771934
"Man, it's rough. Lately, I just wipe \Ndown with a wet towel and change,","（牛田）
大変だよ 今 ぬれタオルで拭いて
着替えてるけど","It's hard I wipe it with a wet towel now
I'm changing clothes",0.3636363636363637,0.7263625
It's Nonomura-san from the normie group!,"あれ？　あれれ？　あれ〜？
リア充グループの野々村さんだ！","that?Is it? that~?
It is Mr. Nono-mura of the rear full group!",0.2352941176470588,0.48187628
Huh? What?,あれ？　あれ？,that?  that?,0.25,0.42631623
"I'm sorry, your beauty almost sucked me in!",あっ すいません,I'm sorry,0.2727272727272727,0.37287173
"Man, you elites sure are beautiful.",骨格レベルで美形なんすね,Beautiful shape at the skeleton level,0.07692307692307693,0.28786358
You must go to a lot of mixers.,"合コンしまくりなんですよね
すごいな〜","It is a joint dust
Amazing ~",0.06666666666666668,0.12150083
"Nonomura-san, hup!","あっ もしよろしければですね
うっす","If there is no good
Hey",0.0,0.08157829
"Could you tell me about it, hup, \Nso I can learn from it?","後学のためにですね うっす
お聞かせ願え…","It is for athropology
Thank you for telling me ...",0.15,0.17588976
It was a lie!,ウソだよ,It is a lie,0.5,0.7567
It was all a lie.,全部ウソだよ,It's all lie,0.42857142857142855,0.7585133
I've never kissed a guy.,男とキスしたことなんてねえし,What I kissed with a man,0.3,0.6000319
I just ripped off something \NI read in a fashion magazine.,"ファッション誌にあった体験
パクっただけだよ","Experience in fashion magazine
I just got it",0.3333333333333333,0.63381696
to seduce a middle-schooler \Nwasn't your first kiss.,"真奈菜のファーストキスの
相手じゃなくて","Manna's first kiss
It is not a partner",0.1875,0.40960312
Chio-chan...,ちおちゃん,Chiyo,0.0,0.65481013
Welcome back.,おかえり,Welcome back,0.6666666666666666,0.89675516
"So, apparently that old guy is \Na president of some company.","（真奈菜）
そういえば 前のおじさん
社長だって","Speaking of such an uncle
It is president",0.16666666666666666,0.43786988
"Yeah, I heard.",（ちお）うん 聞こえてた,I heard it,0.3333333333333333,0.6066111
"I know, right?!",だよね！,right!,0.3333333333333333,0.5731532
"If I were some old guy and \NHosokawa-san suddenly talked to me,","もし急に
細川さんに話しかけられたら","Suddenly
If you can talk to Mr. Hosokawa",0.16666666666666666,0.6730378
Huh? My job?!,あっ 仕事ですか？,Is there a job?,0.25,0.45959806
Pardon us!,（牛田）うっ！,Uh!,0.25,0.36250493
We heard that you were some president!,"（ちお）
なんか社長さんって
聞いたんですけど","Something president
I heard",0.2,0.6253715
Could we ask you what your job is like?,"お仕事の内容とか
伺っていいですか？","Contents of work
May I ask you?",0.2,0.454747
"Oh, do you have a business card?",お名刺とかないですかね？,Isn't it a business card?,0.3333333333333333,0.75592744
"You're interested too, right, Hosokawa-san?",細川さんも興味あるもんね？,Mr. Hosokawa is also interested?,0.16666666666666666,0.7736657
Hm?,ん？,Yeah?,0.3333333333333333,0.6662807
I'm so sorry! I was lying about everything!,"（牛田）
すいません！
ウソついてました！","Excuse me!
It was a lie!",0.14285714285714285,0.59268636
"Yeah, yeah, we get it.",実は ただの平社員なんです,"In fact, it is just a person employee",0.15384615384615385,0.14706951
"Oh, that's okay! Sometimes, during meets,",大丈夫ですよ！,No problem!,0.09090909090909093,0.15204766
"Ushida-san, there's only \None important thing here.",牛田さん 大事なことは１つだけ,Mr. Ushida is only one thing,0.14285714285714285,0.52107525
The distance you ran isn't a lie!,走った距離は ウソをつきません,The distance you ran does not make a lie,0.5,0.91809744
Why are we running?,（真奈菜）なんで走ってんの？,Why do you run?,0.25,0.77867717
Maybe Hosokawa-san just wants to run...,"（ちお）
細川さんが走りたいだけでは？",Mr. Hosokawa just wants to run?,0.4,0.8215974
"That's what I thought at first,","最初は そう思ったけど
なんだかホントに楽しくなってきて","At first I thought so
It's really fun",0.4166666666666667,0.38244402
Maybe it doesn't really \Nmatter how others view you.,"自分が人から
どう見られているかなんて","I am from people
How is it sees",0.1176470588235294,0.49053755
"I want to tell them to stop running,","フッ 広がって走るなって
言いたいとこだが","I'm going to run through the spread
I want to say",0.2,0.25760913
but look at their happy faces— \NWho the hell is that old guy?!,真ん中のおっさん 誰だ〜？,Who is the middle of the middle?,0.16666666666666666,0.14887887
"Next time on Chio's School Road,","（真奈菜）
次回「ちおちゃんの通学路」は","Next time ""Cho-chan's School Road""",0.4545454545454545,0.67042845
"""Bloody Butterfly Effect 2"" \Nand ""The Kabaddic Four.""","「ブラッディ･バタフライ･
エフェクト２」","""Brady butterfly
Effect 2 """,0.3333333333333333,0.5250206
Look forward to it!,お楽しみに,looking forward to,0.3333333333333333,0.72897685
