en_text,jp_text,google_translated,score
So let's play a game together!,みんなでゲームをしましょう,Let'splay a gamewith everyone,0.09090909090909091
How is there a volume three?!,ボリューム３って何だ！,What is volume 3!,0.3
Games evolve every day!,"（芦花）ゲームは
日々 進化するのです","Game
Evolve every day",0.5
What the hell?! I want my anger back!,"（堅次）何だ それ
俺の怒りを返せ！","What is it
Return my anger!",0.3076923076923077
Oh? Did you get upset over something?,"（芦花）お？
何か怒ってくれたんですか？","for?
Did youmeangrywhat?",0.2
Your trials have just begun... I think.,"お前の試練は始まったばかりだ
たぶん","Your trial has just begun
perhaps",0.25
"Sorry, but as a teacher, I can't let this one slide.","（南）さすがに それは
教師として見逃せないな","As it is
I can not miss it as a teacher",0.21052631578947367
And what's with that stun gun?!,"（高尾）誤解です！
って何です？ そのスタンガン","misunderstanding!
What is it?That stun gun",0.5
You just had to step beyond \Nwhat is acceptable in my clubroom.,"私の許容を
大幅に超えてるんですが","My tolerance
It is bigger than ever",0.1111111111111111
Screw it! I'll be a man and take it on the chin!,ええい 男ならやってやれだ！,I'm going to do yes a man!,0.2222222222222222
Seriously?,（高尾）はあ？,?,0.5
Finished in ecstasy!,（中）ああー！,Oh!,0.2
