en_text,jp_text,google_translated,score,semantic_score
Yuko Amasawa...,天沢(あまさわ)勇子,Yusawa,0.0,0.74748826
"Hey, Uncle!","ダメだ ネコサバのスキャンでも
引っかからない","Even if it is not good, it is a scan of a cat
Unluck",0.06666666666666668,0.04426514
My brother will be back soon!,"もうすぐ
お兄ちゃんが戻ってくるの","very soon
My brother comes back",0.4444444444444444,0.77581906
I'm not joking!,そうかい そうかい うれしいね,I'm glad I'm so happy,0.25,0.16574869
"Yes, I know.",うん 分かってるよ,I know,0.4,0.77851146
But don't say a word to my aunt!,"おばさんには言わないでね
ウソだってバカにするから","Don't say to your aunt
Because I'm stupid",0.3333333333333333,0.7616361
"Or she'll take me for a fool, and say it's a lie.",冗談じゃないのよ,It's not a joke,0.17647058823529413,0.22961864
I just came here to tell you that.,"（イサコ）
それを知らせに来ただけだから",Because I just came to announce it,0.3333333333333333,0.3942649
"Well, she's my niece.",じゃ,well,0.14285714285714285,0.28589663
I want to go there—immediately.,行きたいんだ すぐ,I want to go,0.6666666666666666,0.66063577
I have to know what happened to Kanna's body!,"カンナの身に起こったことを
知らなくちゃ！","What happened to Kanna
I can not know!",0.5833333333333334,0.8575613
The route doesn't match.,"（ハラケン）
おかしい 道が合わない",Funny way does not fit,0.1,0.3179147
How about quitting for today?,（ヤサコ）もう 今日は諦めたら？,If you give up today?,0.2,0.5186523
No! I refuse to believe that!,そんなはずない！,That's right!,0.2222222222222222,0.22590931
"Haraken, summer break has just started, you know.","ハラケン まだ夏休みは
始まったばかりじゃない","Haraken still summer vacation
It's not just beginning",0.1875,0.78836066
We can do it tomorrow.,明日があるわ,I have tomorrow,0.125,0.6143503
I can't believe they're going to... just like that girl...,まさか あの少女と同じ…,Same as a girl ...,0.125,0.24644467
Next time,"（ヤサコ）
次回 「電脳コイル」","Next time ""Cyber coil""",0.3333333333333333,0.41224825
Submerged in Daikoku City!,〝沈没！　大黒市(だいこくし) 〞,"""Sashimi! Odoku City """,0.25,0.5298586
