en_text,jp_text,google_translated,score
"The Turtle Hermit, Tenshinhan, and Chaozu finally succeeded",〈そして 同じ頃 ついに➡,<And finally the same time,0.25
in acquiring four of the Dragon Balls.,"やっとの思いで ドラゴンボールを
４つ集めることに成功した｡〉","Dragon Ball with final thinking
I succeeded in collecting four.>",0.25
"Meanwhile, Goku and Piccolo Daimao finally faced off in an intense battle.","悟空とピッコロ大魔王が
激突していた｡〉","Goku and Piccolo Great Demon King
I was crashed.>",0.19047619047619047
When it comes to people like you...,"(ﾋﾟｯｺﾛ)
お前のようなやつは 当然…｡",Naturally the guy like you ....,0.25
...me...,(悟空)うう…｡ か… め…➡,Umm ... ... Me ... ➡,0.5
...ha...,は… め…➡,... ... ➡ ➡,0.3333333333333333
...ha!,"(悟空)おりゃりゃりゃ…！
(ﾋﾟｯｺﾛ)ふんっ！","Your ...!
 Fun!",0.4
Did you just do something?,えっ？,eh?,0.14285714285714285
Good thing I'm hiding...,"(ﾔｼﾞﾛﾍﾞｰ)
お… 俺 隠れてて えがった｡",Oh ... I hiding and he was erected.,0.25
Exactly. Bow down and beg for your life like the scum that you are.,"どうやっても
オラには勝てねえのか？","However
Are you won by Ora?",0.1
Never...,"ハァ ハァ…｡
ちきしょう ちきしょう…｡","Ha ha ....
Chiki Shiki ....",0.16666666666666666
I'll never give up!,オラは諦めねえ｡ 絶対にな｡,Ola can not give up. Absolutely.,0.18181818181818182
Then die!,フッ｡ ならば死ね｡,"If it is, it will die.",0.1111111111111111
H-He's going to use that technique?!,"そのとおりだ｡
虫けらは虫けららしく➡","That's right.
Blade seems to be insects",0.2
Do you suppose you can dodge this?,"負けねえぞ｡
くっ…｡","You can not lose.
....",0.18181818181818182
"After all, this is the level at which humans continue to live...","所詮 人間の行き着けるレベルは
こんなものだ｡","After all the people who go out
It is such a thing.",0.17391304347826086
His heart has stopped.,"心臓が止まっておる｡
さすがに死んだか｡","The heart is stopped.
Is it dead?",0.3
His strength is unimaginable!,ハハハハッ！➡,Hahaha haha!➡,0.125
A job well done.,"(ピラフ)
と… とんでもない強さですね｡",And ... It's a strong strength.,0.18181818181818182
So there are others seeking to collect the remaining Dragon Balls.,"確か 残りのドラゴンボールを
集めている連中がおったな｡","Certainly the remaining dragon ball
There was a series of collecting.",0.2631578947368421
"Yes, sire.",はい｡,Yes.,0.5
"It is only a matter of time until\NI, Piccolo-sama, am young again.","この ピッコロ様が若返るのも
時間の問題だ｡➡","This piccolo is rejuvenating
It is a problem of time.",0.3333333333333333
Um...,"(ピラフ)あ… あの…｡
(ピアノ)うん？","Oh ... that ....
?",0.16666666666666666
But of course.,(ピラフ)フフッ｡,fluff.,0.2
"Far, far stronger than he is now.","若返れば
今よりも もっとすごく？","If rejuvenated
Is it more more than now?",0.23076923076923078
That Son would be killed...,ま… まさか そんなはず｡,Masa ... It should be true.,0.18181818181818182
Guess I should bury him and put up a headstone.,"しょうがねえ｡ 一応 埋めて
墓でも作ってやるかな｡","Let's go.
I will make it even with a tomb.",0.15
Hey!,"(せきこみ)
(ﾔｼﾞﾛﾍﾞｰ)わあっ！",!,0.5
Unngh...,み… 水｡,Water ...,0.3333333333333333
What kind of heart you got in there?\NComing back to life like that...,"どういう心臓してんだ？
生き返っちゃうなんてよ｡","What kind of heart is it?
I will live back.",0.2727272727272727
Damn it...,"ハァ…｡ しかし お前
とんでもねえ生命力だな｡","Hua ... But you
It's a livelihood.",0.2
Couldn't be helped.\NThere was nothing you could do.,"なあ…｡
なあ カリン塔って知ってるか？","....
Do you know the karin tower?",0.2
That Piccolo Daimao's a monster!,"あのピッコロ大魔王ってのは
化け物だ｡","That piccolo Daemon king
It is a monster.",0.3333333333333333
What's that?,(ﾔｼﾞﾛﾍﾞｰ)カリン塔？ 何だそりゃ｡,Karin Tower?What is it.,0.2222222222222222
"Sorry to ask, but if I tell you where it is, could you take me there?","そのかわり 俺に たらふく
ごちそう食わせてくれると➡","Instead of it,
If you eat it",0.2
"I can't move, my entire body has been smashed up...","オ… オラ
体じゅう がたがたで動けねえ｡","Oh ... Ora
I'm going to move with my body.",0.25
Is there a really good doctor there or something?,"(ﾔｼﾞﾛﾍﾞｰ)そこに
腕のいい医者でもいるだか？",Are you a good doctor of your arms?,0.2857142857142857
"Yeah, alright. I'll take you there.",連れてってくれねえかな｡,I can not take me.,0.25
So that makes five.,ああ…｡ これで５つか｡,Oh .... This is five.,0.2222222222222222
which of the remaining two does Piccolo Daimao have?,"(天津飯)…ということは
残った２つのうちの どちらかを➡","...
One of the two remaining",0.3333333333333333
Eh? What's the matter?,(天津飯)ど… どうしたんですか？,... What happened?,0.25
And they appear to be moving this way!,し… しかも どうやら➡,... and how much,0.08333333333333333
It's Piccolo Daimao.,ピッコロ大魔王が来る｡,Piccolo Great Demon King comes.,0.2222222222222222
Piccolo-sama! The other five balls are heading this way!,"ピッコロ様｡ 向こうの５個も
こっちに向かっておりますが｡","Piccolo. Five other sides
I'm heading here.",0.1875
in possession of these two balls.,"まさか
この２個を持っているのが➡","Masadish
I have two of these",0.3
Not good.,身の程知らずな やつらめ｡,Ken no Kenji.,0.16666666666666666
We would stand no chance whatsoever in a fight.,戦っても 勝ち目はないぞよ｡,There is no win even if you fight.,0.1875
"We'll have to steal the other two balls when we get the chance,",隙をついて 向こうの２個を奪い➡,Take two of the other countries with a gap,0.15789473684210525
"""Please remove Piccolo\NDaimao from this world.""","ピッコロ大魔王を
この世から消してくださいとな｡","Piccolo Great Demon King
Please delete from this world.",0.35714285714285715
Understood.,分かりました｡,I understand.,0.25
It will be to our advantage to have many places to hide.,"あのピッコロに
立ち向かっていくなんてな｡","To that piccolo
What will be upset.",0.26666666666666666
You didn't try and help me...,"ヤジロベーこそ
助けてくれねえんだもんな｡","Yadirobe
I can help me.",0.16666666666666666
I hate dying more than anything else!,"俺が 一番 嫌いなのはよ
死ぬことだ｡","I hate my best
It is about dying.",0.21428571428571427
Which way?,(ﾔｼﾞﾛﾍﾞｰ)どっちだ？,Which one?,0.5
Let's see... More to the left...,えっと…｡ もうちょい左だ｡,Well .... It's a little left.,0.23076923076923078
"You have a really nice car, Yajirobe...","だけど ヤジロベー
いい車 持ってんな｡","But Yajirobe
I have a good car.",0.3076923076923077
He's just too strong!,相手が強すぎるぜ｡,The other party is too strong.,0.18181818181818182
Hey. You know about him?,"なあ｡
あいつのこと 知ってんのか？",".
Do you know that guy?",0.4
"I've heard about him in some old legends, that's all.","俺も
昔話で聞いたことがあるだけだ｡","me too
I just have heard in the old-fashioned story.",0.19047619047619047
"Anyway, he's this really evil guy...","とにかく めっちゃくちゃに
恐ろしい悪でよ｡➡","Anyway, it's really good
It is a horrible evil.",0.3333333333333333
How did he defeat someone like that?,"あんなやつ
どうやって倒したんだ？","Any means
How did you defeat?",0.36363636363636365
"Now that I think about it, he took your Dragon Ball...","あの とられちまった
ドラゴンボールっての➡","That's right
Dragon Ball",0.2
What happens if you get all seven of them again?,７つ集めると どうなるんだっけ？,What happens if you collect seven?,0.5
A dragon called Shen Long comes out and grants one wish.,"１つだけ 願い事
かなえてくれるんだ｡","Only one wish
It will come true.",0.17647058823529413
"All right, this area will do.","よし｡ この辺りが いいぞ｡
降りよう｡","Yes. This area is good.
Let's get off.",0.2
Revert the plane back into capsule form.,飛行機をカプセルに戻すんじゃ｡,If you return the plane to the capsule.,0.3333333333333333
Right.,よっ｡,.,0.5
Hide the Dragon Balls inside this hole.,"この穴に ドラゴンボールを埋めて
隠すのじゃ｡","Fill dragon ball in this hole
Hiding it.",0.3076923076923077
"This way, he won't locate the Dragon Balls right away.","こうすれば ドラゴンボールも
すぐには見つからんじゃろう｡","This is also dragon ball
I can not find it right away.",0.23809523809523808
This will buy us some time.,"時間を稼げる｡
(餃子)そっか！","Earn time.
 Somehow!",0.2
Listen well.,よく聞け｡,Listen carefully.,0.5
"While Piccolo searches for the Dragon Balls,","ピｯコロがボールを探している隙に
やつのボールを奪う｡","Piccolo is looking for balls
Take away the ball of the guy.",0.25
Tenshinhan and I will steal his Dragon Balls.,わしと天津飯は➡,I and Tianjin rice,0.18181818181818182
"Once we steal them, we will throw them to you.","投げて渡すから 受け取ったら
すぐに➡","If you receive it because you throw it
Soon",0.13333333333333333
"Say, ""Come forth, Dragon!"" then make the wish.",そして 願いを言うんじゃ｡,And let's say a wish.,0.17647058823529413
I see.,(天津飯)なるほど｡,I see.,1.0
Got it.,いでよ ドラゴンとな｡,It is a dragon.,0.3333333333333333
They've stopped at that location!,"あっ！ 向こうのやつ
あの位置で止まりましたよ｡","Ah!向 や
I stopped at that position.",0.3076923076923077
Directly above where the radar shows the Dragon Balls are.,"ピッコロ大魔王様 着きました｡
ドラゴンボール反応の真上です｡","I arrived at Piccolo Daemon King.
It is directly above the Dragon Ball Reaction.",0.25
Excellent.,ああ…｡,Ah….,0.3333333333333333
Now to go and get them.,置いてくるつもりかもしれん｡,It may be going to put it.,0.16666666666666666
He may plan to keep the other two balls inside the ship when he comes down.,"２個のボールは
あのまま飛行船の中に➡","Two balls
Among the airships in the airship",0.15789473684210525
"If so, then we'll have to jump on board and steal them without being noticed!","じゃとしたら 気付かれんように
飛び移って奪うか｡","If you are aware of it
Do you want to jump and take away?",0.14285714285714285
"It doesn't look like there's anything down there, if you ask me.","このわしが 持ってた方が
安全だな｡","If you have this
It's safe.",0.2777777777777778
They are hiding.,(シュウ･ピラフ)うわ…｡,Wow ....,0.16666666666666666
They will naturally try to come after these two.,"向こうも 当然
こっちの２個を狙ってくる｡➡","Naturally
I'm aiming for two here.",0.2
That's the legendary Piccolo Daimao?!,"あっ！ あれが
うわさのピッコロ大魔王か｡","Ah!that
Wow Piccolo Demon King?",0.3333333333333333
He swallowed the Dragon Balls!,"ド… ドラゴンボールを
飲み込みました｡","Do ... Dragon Ball
I swallowed it.",0.16666666666666666
What did you say?!,な… 何じゃと！,... What and what!,0.25
All we can do now is fight.,戦うしかありませんよ｡,I can only fight.,0.3
--You will stay behind.\N--Eh?,"お主は 引っ込んでおれ｡
(天津飯)えっ？","The Lord is retracted.
 Eh?",0.16666666666666666
I will take care of this somehow.,このわしが 何とかする｡,I will do this.,0.4444444444444444
I...,"じょ… 冗談じゃない｡
戦いますよ 俺は｡","Joy ... not joke.
I will fight.",0.25
Please let me fight.,戦わせてください｡ 俺に｡,Let me fight. To me.,0.6666666666666666
Don't worry. I won't die.,大丈夫｡ わしは死にはせんよ｡,All right. I will die.,0.3
But...!,しかし！ うっ！,However!Uh!,0.2
What are you...?!,な… 何を…｡,... What ... what ....,0.2857142857142857
There is no such thing as Furofushi water.,"不老不死の水などありゃせんよ｡
うそじゃ｡","There is no need for immortal immortal water.
Let's go.",0.3333333333333333
It's not real.,"じゃが 今のお主では
まだまだ無理じゃ｡","Well now
It is still impossible.",0.2
"If I happen to die, aside from Goku,","もし わしが死んだら
悟空もおらん今➡","If I died
Goku is also ➡",0.23076923076923078
you're the only one who can defeat the Daimao!,"更に 修行を積み
いつの日か きっと倒してくれ｡","Increase the training further
When will she will surely defeat.",0.1111111111111111
Give everyone my regards.,みんなに よろしくな｡,Thank you to everyone.,0.25
The plan is off!,例の作戦は もうなしじゃ｡,There is no way of operation of the example.,0.16666666666666666
Right! Got it!,"おっ！
(シュウ)で… 出てきたぞ｡","Oh!
 ... It came out.",0.2222222222222222
"Come down here, Piccolo!","降りてこい ピッコロ！
ドラゴンボールは ここじゃ！","Get off Piccolo!
Dragon Ball is here!",0.2727272727272727
"Oh, so you know who I am.","分かったな？
(餃子)う… うん｡ 分かった｡","Did you understand?
 ... yeah. I understand.",0.21428571428571427
But challenging me despite knowing who I am...,"しかし ピッコロ大魔王と
知っていながら➡","But Piccolo Great Demon King
While knowing",0.14285714285714285
"I will admit, though, that you have courage.","(ﾋﾟｯｺﾛ)
勇気だけは 認めてやるがな｡",I only approve the courage.,0.23076923076923078
The time for confrontation has come at last!,〈いよいよ 対決の時が来た｡〉,<Finally the time of confrontation came.>,0.2
Wanting to pursue the adventure,それは頼もしいのう｡ 死ぬか？,It seems to be reliable. Will it die?,0.07692307692307693
You'll never unravel the mystery of the miracle!,"次回 『ドラゴンボール』
｢亀仙人の最後の魔封波!!｣","Next time ""Dragon Ball""
""The last magic wave of Kame Senko!""",0.15
Go on and try to live even more wild and strong!,♬ 不思議したくて 冒険したくて,♬ I want to be strange and I want to adventure,0.11764705882352941
Honto no yuki misete kuretara,♬ 誰もみんな ウズウズしてる,♬ Everyone is all Uzusu,0.0
I am Piccolo Daimao.,♬ 解けないよ,♬ I can not solve,0.1111111111111111
"""The Turtle Hermit's Final Mafuba!!""",♬ ホントの勇気 見せてくれたら,♬ If you show me the courage,0.06666666666666667
