en_text,jp_text,google_translated,score,semantic_score
Something greater waiting not so far away,〜♪,~ ♪,0.0,0.118778914
"Although Goku had
a quick bout with Zamasu...",ンッ…,...,0.1111111111111111,0.16587386
"then I won't have you
being bested by anyone!",お前とは会ったことはないが…,I have never met you ...,0.21428571428571427,0.2663267
"I'd like to see Son Goku, you see.",17号の実力を知りたい孫悟空は…,"Son Goku, who wants to know the ability of No. 17 ...",0.2631578947368421,0.6982986
"""I'd Like to See Son Goku, You See--
A Summons from Zeno-sama!""","その実力を知り
“力の大会”への参加を打診する","Know the ability
Testate participation in ""power tournament""",0.08,0.12623325
"I'm about to get real busy,
so I ain't got a lot of time to spare.",消滅することは どうでもいい,It doesn't matter to disappear,0.09090909090909093,0.15687987
Ow-w-w-w! Wh-What are you doing?!,どうする？　孫悟空,what will you do?Goku Son Goku,0.16666666666666666,0.21447772
Zeno-sama?,えっ？,eh?,0.3333333333333333,0.095826186
I wonder if this is about the tournament.,誘いを断った17号,I refused the invitation 17,0.16666666666666666,0.15364005
"Even for me, it takes two days one way.",なあ 待ってくれよ 17号,Wait me to wait 17,0.07142857142857142,0.1868447
"Someone so ridiculous,
complaining that it's ridiculous...","ンッ…
まったく しつこいヤツだな","...
It's totally persistent guy",0.25,0.2380985
"Ah, Goku-san, you are friends
with Kaioshin, are you not?","ああ
超ドラゴンボールっちゅうやつだ","Ah
Super Dragon Ball Hatsu",0.07142857142857142,0.3016399
In an instant? For real?,そんな物があるのか？,Is there such a thing?,0.09090909090909093,0.21003965
"Beers-sama, what are you going to do?","お前に どうしても
参加してほしいんだ　頼むぞ","Why not
I want you to participate",0.14285714285714285,0.24746141
"It's gonna be fine.
I'll take care of this in no time.",しかも すんげえ数の気だ,And it's a matter of course,0.15,0.1497385
Oh!,ハッ！,Ha!,0.3333333333333333,0.5193815
Huh? No good?,どうすんだ？,What is it?,0.14285714285714285,0.09896954
"Why don't you go change
into something more formal?",そうはさせるか！,Do you let it go!,0.21428571428571427,0.08602843
"Well, I will offer an apology","当たり前だろう
まあ 好きにしろ","It will be natural
I love you",0.16666666666666666,0.18373659
Huh? How come?,穴に飛び込む　お前も来るのか？,Will you come into a hole?,0.2222222222222222,0.09282762
"If word of it reaches Zeno-sama's ears,
it is sure to anger him.","早くしろ！
宇宙に出ちまったら おしめえだ","hurry up!
I will see it if I went to space",0.13043478260869565,0.023045853
"And you know the rest, right?",ただし バイト代は払わんからな,"However, the byte fee is paying",0.15384615384615385,-0.039093066
Oh... Mm-hmm!,しまった！,Oops!,0.2,0.45012945
A set?,何だ？　ここ,What? here,0.2,0.09138848
"does that mean all I'd have to do
is take care of Kaioshin-sama?","あれ？
悟空の気が 遠くに離れていく","that?
Goku's spirit is far away",0.15,0.28983518
"Hey, Whis!","ハアッ！
ウワッ！","Haa!
Uwa!",0.16666666666666666,0.28961205
"Why are you telling him something
as major as that like it was nothing?!","あいつ
ちゃんと17号を誘えたのかな？","that person
Did you invite 17 to 17?",0.15,0.19637841
"Yeah! Don't you worry!
I'm sure of my ability to keep a secret!","一気に片づけるとするか
よし","Do you want to get up at once
Good",0.13636363636363635,0.10380715
Mmm...,ンンッ…,Network ...,0.3333333333333333,0.32922924
"The wisdom they received from divinity
does them absolutely no good.",どっちもガキっぽい所があるからね,Because there is a place where it is a good place,0.05263157894736842,0.21743493
"Don't do it, Zamasu!",まとめて たたきつぶしてやる！,I will crush it together!,0.2,0.3015359
H-How could you?,ああ？,Ah?,0.2,0.28179967
Zamasu...,ウハハハッ…,Uha ha ha ...,0.25,0.2202979
Huh?! Z-Zeno-sama's palace?!,ンンッ！,Nhen!,0.14285714285714285,0.20284715
"That's right. I hate to ask,
but would you mind taking me?","今日は臨時が もう１人
いるが いつもは俺だけだ","Today is another one
But he is always only me",0.08695652173913042,0.109638
Hmm? Hmm...,ウッ…,W ...,0.25,0.20677742
What?!,ヤッ！,Ya!,0.25,0.31302363
Why is everyone telling me the same thing?,"えっ？
それで十分だからだ","eh?
That's because it is enough",0.13333333333333333,0.08138329
Do I really look like that impolite a guy?,"なぜ俺が 大きなあの島を
１人で守っていると思う？","Why I am a big that island
Do you think you are protecting with one person?",0.2380952380952381,0.2040321
"--It has been too long.
--It has been too long.",くそ…　またジャマ者が増えたか,Kaso ... too jama has increased,0.18181818181818185,0.14654055
Heya!,決まってるだろう　金だ！,It's decided money!,0.16666666666666666,0.2806605
"We were in a rush to arrive here,","ウワサでは
不老不死の薬になるらしい","In Uwasa
It seems to be an immortal medicine",0.125,0.05981456
"so please forgive the
informal manner of this one's attire.",ミノタウロスの角は 高く売れる,The corners of Minotaurus are selling high,0.1176470588235294,0.028084077
"For you, that outfit is
your formal attire, is it not?","だが そんなことは
俺には関係ないことだ","But that is
It does not matter to me",0.2352941176470588,0.21284121
Nicely recognized.,あっ…,Ah…,0.0,0.2603814
"is said to be among
the top five of all the universes.",世の中 金だろう！,It will be the middle money of the world!,0.16666666666666666,0.24305157
Huh?! That's awesome!,ガハッ！,Gaha!,0.14285714285714285,0.18743587
"But it's got me curious, you know?",少しは 痛みは感じたか？,Did you feel a little pain?,0.13333333333333333,0.16396195
"Oh, yeah? That good?","ハッ…
おい！　何だ？　それ","Ha ...
Oi! What? That",0.18181818181818185,0.22343871
I guess it was worth making the trip.,"俺は
うんざりすることが嫌いなだけだ","I am
I just dislike it",0.16666666666666666,0.1278989
"--Heya!
--Ahem!",やめろ！,Stop!,0.2,0.24228723
And... what?,どうしたんですか？　ビルスさま,What happened?Bills,0.3333333333333333,0.1411277
Let's play!,あらまあ！,Oh!,0.2,0.3358718
"N-No, sir, perish the thought.","あ〜 ごめんね ブラちゃん
びっくりしちゃったね","Oh, sorry bra-chan
I was surprised",0.07692307692307693,0.12556425
"What are you trying to say, Son Goku-kun?","ビルスさま
お疲れなんじゃありませんか？","Bills
Are you tired?",0.25,0.07845861
"Zen-chan, huh? That's nice.
So, what are we going to play?",ど… どうする？　17号,... what do you do?No. 17,0.15,0.12879215
"Sorry, but I'm too busy right now.",あ〜 不吉だ…,"Oh, I'm sorry ...",0.3333333333333333,0.31782869
Mind your tongue when you speak!,"このスイッチを押した瞬間
この船はボ〜ンだ！","The moment when this switch was pressed
This ship is a boot!",0.1176470588235294,0.10852764
Really?,イヤだろう？,Is it an ear?,0.16666666666666666,0.07642969
Leave it to me!,木っ端みじんに消えちまうのは！,It is disappearing to the wooden end!,0.3,0.21638437
"Okay, it's a date.
Hey, that thing we did before",どこまでも汚ねえ野郎だな こいつ,It's a dirt and a dirty guy,0.17647058823529413,0.15977155
Huh? What is it?,どうだ！　反論できまい？,How is it!Can you do it?,0.3,0.19415951
Remember your friend promise.,"それと 妻と子供たち
18号に よろしく伝えてくれ","And children and children
Please tell me about 18",0.0,0.08588138
I-Is it over?,うん？　アアッ！,Yes?Ah!,0.14285714285714285,0.25496385
What am I gonna do with you?,"お前とは もう一度
たあいもない話をしてみたかったな","Another one than you
I wanted to talk about the story",0.1111111111111111,0.29706082
"Zen-chan, see you later!",ウワーッ！,Wear!,0.14285714285714285,0.21399479
"--Hey, take it easy, there. Are you sure you're all right?
--You have an interesting friend there.",人造人間17号だ,It is an artificial person 17,0.08695652173913042,0.08885087
"I would like to see him again, myself.",ああ どうも　お初にお目に…,"Oh, I'm first looking at ...",0.125,0.17324495
Kai-kai...,"じ… 自爆じゃと！
ええっ！","Just ...
Yeah!",0.2,0.13178548
This is a serious matter!,"バカ者！　置いてくな
危ないから こいつも連れてけ！","Bacarrier!Do not place
Because he is dangerous, take this guy!",0.1875,0.25061607
Z-Zen-chan?!,"ししし… 死んでても
怖いもんは怖いわい！","Shishi ... even dead
Scary Monto is scary!",0.1,0.24749883
Zen-chan...? Zen-chan...?,"あっ…　その声はデンデ？
はい","Oh ... that voice is Dende?
Yes",0.2222222222222222,0.19468777
Tea is a mirror of the soul.,"ありがとな デンデ
さすが神さまだ","Thank you Dende
It is a god",0.15384615384615385,0.24832807
"Gowasu-sama, you are always
saying something--",お前 ウソついてたんか？,Are you about the lie?,0.16666666666666666,0.12731174
"and build a better world
is what it is to be mortal.",なんだよ…,what is it…,0.15384615384615385,0.10135509
"As far as I can see, mortals do not learn.",えっと…　私 動けないんですが,Well ... I can not move,0.21428571428571427,0.15196759
Simply watch over them?,"えっ？
このあと—","eh? 
 after this-",0.125,0.18725458
"Yes, all the time.",悟空　今回は ご苦労だった,Goku This time was a hard time,0.09090909090909093,0.11609022
Justice is necessary for good to prosper.,ムダに目だけはいいヤツなんだ,It is a good guy who is a good guy,0.16666666666666666,0.31357792
is not that act of finding it just?,知り合いなのか？,Is it acquaintance?,0.3,0.21277061
"Evil must not be acknowledged,
Gowasu-sama.","我々は
なかなか居場所をつかめずにいてな","we
I can not get caught up",0.07142857142857142,0.124987856
"Evil is the violence
of those like the Babarians,","もちろんだ
ここは私の管轄だからな","of course
This is my jurisdiction",0.15384615384615385,0.1424204
Do you not find this to be unremarkable?,送らないかもしれない,May not be sent,0.18181818181818185,0.044639997
"It is marvelous that you have
such a strong sense of justice.","感謝状くらいは
あとで送るかもしれないが—","Thank you
You may send it later-",0.1176470588235294,0.16668461
"However, there are times when,
with a temperate heart,","超ドラゴンボールで
ボートでもいただくとするかな","With super dragon ball
Do you want to get a boat",0.10526315789473684,0.009138562
Being a god is not absolute.,"いつの日か
家族で 世界中を回るのが夢なんだ","Someday
It is a dream to go around the world with a family",0.1176470588235294,0.05563758
Gods are also able to learn.,"俺もチームに加わるよ
誰かさんに借りもできたことだしな","I will join the team
I was able to borrow somebody",0.13333333333333333,0.056455262
We were the ones who polished it!,"一緒のチームで戦うことになるとは
不思議な縁だな","It will fight with the team together
Mysterious edge",0.13333333333333333,0.061521437
"I helped them, too!",そっか？,I see?,0.125,0.08346199
"Vegeta, Son-kun,","お灸チビ…
いや クリリンさんだよ","Chobi ...
No, Curin",0.14285714285714285,0.26646155
"look after Trunks, okay?",義兄さん？　誰だ？　それ,My brother-in-law? Who? That,0.1,0.12597868
"Ugh, I was looking outside,
and it made me queasy.",そっか,I see,0.07692307692307693,0.13722652
What a punk.,随分と すごいチームになるな,Do not become a great team,0.1111111111111111,0.05816059
"Everything's been smashed up.
This is the future?","ブウ？
お前が元気玉で倒した あの？","Buu?
Is that he defeated with a spirit ball?",0.10526315789473684,0.02926328
Hmm?,"果たして 悟空たちは
優勝することができるのだろうか？","Goku plays
Can you win?",0.14285714285714285,0.12095858
"--What's wrong?
--It's Mai.",地球の命運は いかに？,How is the Earth's fit?,0.15384615384615385,0.039472766
She was supposed to be lying right here.,絶対に優勝しなきゃなんねえな,I have to win absolutely,0.07692307692307693,0.00066524
Heya! I'm Goku!,"悟飯のこと頼めんのは
やっぱ お前しかいねえ","I'm asked about Gohan
After all!",0.3,0.4950233
"Trunks, you have people who are
holding on because they believe in you.","えっ？
悟飯に修行つけてくれんのか？","eh?
Are you training in Gohan?",0.16666666666666666,0.1292128
"I'm coming at you at full power!
Show me your full power, too!","悟飯
お前のホントの力を見せてみろ！","Gohan
Show your real power!",0.26666666666666666,0.5094546
"Next time on Dragon Ball Super,",次回「ドラゴンボール超」,"Next time ""Dragon Ball Super""",0.5555555555555556,0.88276935
