en_text,jp_text,google_translated,score
"No, wait a minute! There are
still things I can use in there!","うっ つーか ちょっと待って！
まだ使えるもんが","Wait a minute wait!
Still available",0.3333333333333333
Hot!!,"お 俺のクリエがあ！
弔われちまうー","My Cryer is!
Request",0.16666666666666666
"I... I'm gonna need a
funeral for my Clies, now...!","（ストナー）おいおい 笑ってるよ
（マシュー）ほおー",I'm laughing,0.13333333333333333
Holy cow... She's laughing.,"“ニルヴァーシュの調子が
悪いんです”","""Nirvacha's condition
It is bad.",0.15384615384615385
"and ask him to fix the Nirvash
because it's running poorly?","“直してもらえますか”って
頼めばいいじゃん","""Can you fix it?""
You should ask",0.2222222222222222
"Well, I don't mind doing that...",知り合いなんでしょ？,Don't get acquainted?,0.16666666666666666
"But there's someone here who
doesn't want to meet him face-to-face.","直接 会いたくないっていう
お方がいらっしゃるからなあ","I do not want to meet directly
Because there are people",0.19047619047619047
"What's up with that?
Is that our leader's weakness?","（マシュー）何それ
リーダーの弱み？ 弱み？","What
Leader weakness?weakness?",0.4
"Ignoring me, huh?",（レントン）あれーっ？,?,0.2
Bad tide coming in...,嫌な潮の流れだ,It is a bad tide flow,0.2222222222222222
That's strange...,信じられないって… そんな…,I can not believe ... that ...,0.25
But...,あっ いや でも…,There is no way ...,0.16666666666666666
"It's been working fine for
all this time without it.",やっぱり外してよ,After all removing,0.07692307692307693
"Besides, I can't believe in
things I don't know about.","それに知らないものは
信じられないから","Those who do not know
Unbelievably",0.125
"It's not like something is going to
happen because I believe in it.","（エウレカ）信じたからといって
どうにかなるわけじゃないじゃない","I believed that I believed
It is not a matter of course",0.2
"Sometimes you end up worse off because
you believed in something too much.","信じすぎちゃったことで
不幸になることもある","By being trusted too much
Maybe",0.11764705882352941
No way...,"（アクセル）
いや そんなことはどうでもいい",No such thing,0.2
But...!,"（アクセル）これだな
（レントン）あ…","This is this
 ...",0.2
"I was planning on handing this
over no matter who came here.","誰が来ようと
渡すつもりでいたんだ","Anyone
I was going to pass",0.11764705882352941
"It's this, right?","何だよ 役所行ってたんじゃ
ないのかよ","What was it?
I wonder if",0.18181818181818182
The reason you came here.,お前さんが来た目的は,The purpose of Yofu came,0.2222222222222222
"If you want it, take it.","持っていきたければ
持っていけ そして…","If you want to bring it
Have and ...",0.3333333333333333
"Gramps, you don't have to put it that way!",そんな言い方ないじゃんか,Don't say that way,0.3076923076923077
What's wrong?,（レントン）どうしたの？,What happened?,0.4
Gramps!,（レントン）どわっ！,!,0.5
<i>Why'd they have to pick now to come?!</i>,（ドミニク）なぜ発射したのです,I fired why,0.13333333333333333
"<i>Why? Because we weren't
ordered to protect the Type Zero!</i>","我々はタイプ･ゼロを保護しろとは
命ぜられてはいない","We protect type zero
Not ordered",0.29411764705882354
"But...! As an Intelligence Bureau official,
I can't just let this pass!","（ドミニク）しかし 情報部として
この行為は容認できません","but as an information department
This act is not acceptable",0.18181818181818182
"You're saying we need to bring
even more shame upon ourselves?!","（ユルゲンス）我々に これ以上
恥をかかせようと言うのか？","more than this
Do you say shame?",0.2222222222222222
"Watch what you say,
Information Officer Dominic!","（ユルゲンス）
口を慎め！ ドミニク情報士官",Show your mouth!Dominic Information Officer,0.3333333333333333
"While under sail, the orders of we in
the Air Force have higher priority!","（ユルゲンス）公海上では
我々空軍の指揮権が優先される","on the Wakai
Opportunity of Air Force is prioritized",0.2
Didn't you learn that at the academy?,士官学校で教わらなかったのかね,I did not teach at the officer school,0.21428571428571427
What a snob!,（ドミニク）ですが！,!,0.25
Renton...,レントン…,Renton ...,1.0
What happened to the Nirvash?,"（アクセル）ハァッ
ニルヴァーシュはどうした？","Huh
What happened to Nirvacha?",0.5
Deliver this to that girl.,あの娘っ子に これを届けてやれ,Deliver this to that daughter child,0.5
Amita Drive?,アミタ･ドライヴ？,Amita Drive?,1.0
and truly awaken that LFO's powers.,あのＬＦＯは真に目覚める,That LFO will draw true true,0.18181818181818182
"Go, Renton!",行け レントン,Renton,0.25
"Use this, and make them all disappear!","そうだ これを載せれば
サトリは開かれ―","Yes, if you put this
Satori is open-",0.125
"<i>It's not that I'm doing such a reckless
thing because Gramps told me to, Sis.</i>","こんな無茶なことをしようと
思ったわけじゃないんだ 姉さん","Trying to do such a stupid thing
I'm not thinking I'm my sister",0.25925925925925924
"<i>But, I just had to tell that girl
what I couldn't tell her before!</i>","あの子に伝えなきゃいけないって
思っただけなんだ","I have to tell that child
I just thought",0.23809523809523808
<i>What you told me back then.</i>,"（レントン）別に俺は
じっちゃんに言われたから―","I
Because I was told by",0.15384615384615385
<i>And what I believe in right now. That's why...!</i>,"そして 俺が
今 信じていることを","And I am
What I believe now",0.29411764705882354
<i>I'm going to fly up to where she is!</i>,"行くぞ 俺！
俺は あの子の所に飛んでいく！","I'll go!
I will fly to her child!",0.2222222222222222
<i>Isn't this a little risky?</i>,ちょっとヤバくない？,Isn't it a little bit?,0.38461538461538464
<i>Am I really gonna be okay...?</i>,本当に大丈夫なのー？,Is it really okay?,0.21428571428571427
"Renton, with Amita Drive in hand,
flies the skies towards the Nirvash.",ニルヴァーシュに向かって空を飛ぶ,Fly in the sky towards Nirvac,0.1875
"The moment he arrives,
the Satori Program activates.","たどり着いたその瞬間
発動するサトリプログラム","The moment I arrived
Triggered Satoru Program",0.23076923076923078
What will Renton see in that rainbow of light?,"その七色の輝きの中で
レントンが見たものは…","In the seven color shine
What Renton saw ...",0.1875
