en_text,jp_text,google_translated,score
The wind flows away...,♪～,♪ ~,0.0
"<i>Hey, are you listening?</i>",（ストナー）なあ 聞いてるか？,Are you listening?,0.4
<i>To what?</i>,（マシュー）何がだよ,What's done,0.1111111111111111
"<i>As I was saying, the content
in music and movies...</i>","その中身がっていうよりも
その時の記憶っていうかさ―","Rather than saying that content
Memory of that time:",0.09090909090909091
"<i>We often remember the relationships
we had with others at the time, right?</i>","その時の人と人との関係を
思い出すことが多いだろ？","Relationship between person and person at that time
Is there many things to remember?",0.14814814814814814
"<i>Listen, can you shut up for
a while? I can't concentrate.</i>","（マシュー）
あのさあ 黙っててくんねえ？",That's why you shut up?,0.2
"What? I was just getting to
the good part of the story.",いいこと言おうと思ってたのに,I thought I would say good things,0.11764705882352941
"You should concentrate on your work, too.","（マシュー）
お前も仕事に集中しろよ",You will also concentrate on your work,0.45454545454545453
"<i>Shut up, it's coming up soon.</i>",ほー やってる やってる,I'm doing it,0.15384615384615385
"<i>A giant wave's coming in front of me.
25 seconds to engagement.</i>","目の前に大きな波が来てる
エンゲージまで あと25秒","A big wave comes in front of you
25 seconds to engagement",0.36363636363636365
"That's right. In other words,
memory does not exist by itself.",決して それ単体で存在せず―,Never exist not yet,0.125
"Therefore, it's controlled by the
environment in which it exists.","それを取り巻く環境に
支配されているというわけだ","In the environment surrounding it
It is dominated",0.26666666666666666
"Do you know whose words
those are, Matthieu?","誰の言葉か知ってるか？
マシュー","Do you know who anyone?
Mashew",0.3076923076923077
I have no idea.,"（ストナー）
まったく 学(がく)がねえなあ",I'm totally scared,0.125
Now we're gonna see something really good!,いいもん 拝ませてもらうぜ！,Let me worship good!,0.15384615384615385
I already know that!,それくらい 分かってんだよっ！,I understand that much!,0.42857142857142855
"A Cutback Drop Turn, huh...?","（ストナー）
カットバック･ドロップターンか…",Cut back drop turn ...,0.3
Confirm retreat of enemy vessel.,"こちら マシュー 606
敵機の撤退を確認","Here is Matthew 606
Confirm withdrawal of enemy aircraft",0.25
<i>This is the Gekko. Roger that.</i>,"ニルヴァーシュは予定どおり
ポイント“イ 62”を通過","Nirvacha is scheduled
Pass the point ""A 62""",0.10526315789473684
"<i>606, roger.</i>",（マシュー）606 了解,606 OK,0.125
"<i>Holland, what's your answer?</i>",（タルホ）はあ？ 何 言ってんのよ,is it?What's up,0.21428571428571427
"<i>You're the one that suddenly announced
you were going to Bell Forest!</i>","あんたが 突然 ベルフォレストに
行くっていうから―","Aunt suddenly in the Belforest
I'm going to go-",0.22727272727272727
<i>That's why everyone tagged along!</i>,みんな ついてきてんじゃない！,Everyone is not happy!,0.14285714285714285
"Yeah, yeah. I'll go.
Fine, I'll go!",（ホランド）行きたくねえ,I wanted to go,0.2
Geez... What a Monday.,まったく なんて月曜日だ…,Every Monday ...,0.2857142857142857
"<i>West Bell Forest- southern
winds, wind force 3.</i>","（ラジオ）
べルフォレスト西 南の風 風力３",Berorest West South Wind Wind Force 3,0.1875
"<i>North Bell Forest- southeasterly
winds, wind force 1.</i>",ベルフォレスト北 東南の風 風力１,Belforest North Southeast Wind Wind Force 1,0.1875
<i>Transparance light particles: 11...</i>,"トランサパランス･ライト･
パーティクル 11…","Transser Palancs Light
Particle 11 ...",0.23076923076923078
<i>14 years have passed since I was born.</i>,"（レントン）
僕が生まれてから14年が過ぎた",14 years have passed since I was born,0.5833333333333334
<i>It's already been 14 years.</i>,もう 14年だ,It is 14 years,0.16666666666666666
"<i>And I can't sense anything
is going to happen, either.</i>","かといって 何かが起こる気配すら
感じられないという―","If something happens,
I can not feel-",0.09523809523809523
<i>Such is the sucky life that I live...</i>,そんな最悪の人生だ,It is such worst life,0.21428571428571427
That's why I'm saying it's impossible for you.,"（ウーノ）
だから お前には無理だって",So it is impossible in you,0.21428571428571427
"Don't say that to a young
man with a bright future.",んなこと言うなよ,Don't say something,0.23076923076923078
I've told you many times already.,（ウーノ）何度も言ってんだろ？,What to say many times?,0.16666666666666666
"Renton, you don't believe
in the waves, do you?","レントン おめえ
波を信じてねえだろ","Renton
I believe in the waves",0.45454545454545453
"But they say Holland could
do a Cutback Drop Turn...","カットバック･
ドロップターンなんて無理 無理","Cutback
Drop turn is impossible",0.23076923076923078
"when he was 14. I'm sure I can, too!","決めたっていうじゃん
俺にだってさあ","I decided to decide
I'm sorry",0.13333333333333333
"Oh, Holland...","（ウーノ）
あー ホランドなあ…",Oh Horanda ...,0.4
"You're wasting your time.
I mean, he's a genius.","ムダ ムダ
だって あいつは天才だぜ","Mudmuda
Because he is a genius",0.1875
"Besides, he was born in North Shore.",“生まれた所は関係ない”,"""I don't know what I was born""",0.125
"The environment he grew
up in is too different.","育った環境が違うよ
（レントン）うう…","The environment you raised is different
 Umm ...",0.2857142857142857
"But, Holland often says...","でも よくホランドは
言ってんじゃんか","But the holland is
Say",0.2222222222222222
"The spot that one seeks is
always right in front of his eyes.","“いつも
そいつの目の前にある”って","""everytime
It is in front of the eyes",0.35294117647058826
I'm gonna gain a big name in this spot.,俺は このスポットで大きくなる,I will grow in this spot,0.2857142857142857
"I'll execute a Cutback Drop Turn
on an LFO, just like Holland!","ＬＦＯでカットバック･
ドロップターン 決めるんだ","Cut back with LFO
I decide the drop turn",0.2
"Is it really all right, Mistah Uno?",いいのかよ ウーノのおっちゃん,Is it okay?,0.3
"Yeah, it's a parting gift.",（ウーノ）ああ せん別だ,"Oh, it's another",0.3
A parting gift?,せん別？,Another?,0.2
"Yeah, I'm moving.","（ウーノ）うん 俺 引っ越すからさ
（レントン）ど ど どこに？","Yeah I moved
 What?",0.2222222222222222
To a Tower city with more waves.,もっと波の来る塔の街にだよ,It is in the city of the tower of more waves,0.3076923076923077
"I mean, I'm making no business at all here.","なんせ ここじゃあ
商売上がったりだかんな","That's why here
Your business sales",0.125
"""Scheduled
Training
Area""
You're my only customer,
and you just look at the stuff.","そのおめえも 見るだけで
買わねえしな","Just look at it
Bought",0.15
"<i>It's a hopeless city that seems to be
the very picture of the word sucks.</i>","最悪を絵に描いたような
どうしようもない街なのだ","It seems like I drew the worst in a picture
What is the city that can not be helped",0.32142857142857145
"<i>Even if I wanted to lift,
there are no decent waves.</i>","リフをしたくても
ろくな波は来ないし―","Even if you want to riff
No waves come-",0.2
"<i>But then, I don't know how
to escape from this city.</i>","かといって 僕は
この街を出る術(すべ)を知らない","I wonder if I
I do not know the art  to leave this city",0.21739130434782608
<i>I'm too young to know how.</i>,知るには若すぎる,May be young to know,0.25
"<i>I mean, I've only been alive for 14 years.</i>","だって僕は まだ14年間しか
生きていない","Because I still have only 14 years
Unworked",0.16666666666666666
"<i>That's why I have to stay here,
in the suckiest city there is.</i>","だから ここにいるしかないのだ
この最悪の街に","So I have no choice but to
In this worst city",0.20833333333333334
"The physical destruction this
caused threw the world into chaos.","および その物理的被害による
世界の混乱","And its physical damage
World confusion",0.14285714285714285
"Recent History
""Summer of Love""
That is what the world
calls the Summer of Love.","それが世に言う
“サマー･オブ･ラブ”であります","It says
""Summer of Love""",0.26666666666666666
"And the man that stopped that
catastrophe by sacrificing his own life...","そうした大災害を
命にかえて阻止したのが―","Such a major disaster
It was stopped by life-",0.10526315789473684
"was the legendary man who created
our country, Adroc Thurston.","我が国が生み出した伝説の人物
アドロック･サーストンであり―","Legendary person created by Japan
Adlock Saston-",0.11764705882352941
"And the son of the heroic Adroc is, of course...","えー そして その英雄である
アドロックの息子であるのが―","Eh and it is a hero
It is a son of adlock-",0.26666666666666666
S-Study hall!,"うわあっ
（生徒たち）キャー！","Leward
 car!",0.2
We teachers will dispose of the scubs!,"先生たちはスカブの処理に
向かいます","The teachers are in the processing of Skub
going now",0.21428571428571427
"So, did anyone actually see
your dad save the world?",お前の親父(おやじ)が世界を救ったとこをさ,When your father  saved the world,0.2
"Your sister ran away from
home to prove it, right?",（男子生徒）お前の姉ちゃん,Your sister,0.16666666666666666
"She said she got a message
on her Compac Drive.","コンパク･ドライヴに
お告げが来たってさ","Compk Drive
Announcement came",0.07692307692307693
"Hey, did you see it, did you
see this month's ray=out?","（女子生徒）ねえねえ 見た 見た？
今月の「レイ＝アウト」","I saw it hey?
This month's ""Ray = out""",0.3333333333333333
"Yeah, I saw it! You mean issue 17, right?","（女子生徒）見た見た 17号でしょ
タルホさん 超キレイだよねー","I saw it 17
Taruho is super beautiful",0.25
"But isn't Gekkostate actually
a bunch of criminals?",ろくでもない人間なんだから―,Because it is a person who is neither,0.13333333333333333
Mom said that I shouldn't trust them...,"信用しちゃダメだって
ママが言ってたもん","It is not good to trust
Mom said",0.21428571428571427
Really? I can't believe that!,"（女子生徒）えー 本当に？
信じらんないよー","Eh Really?
I do not believe",0.36363636363636365
"<i>Remember this, Renton.</i>","（ダイアン）
覚えておいて レントン",Remember and rent,0.1
"If you keep believing it, I'm sure
we will see each other again.",信じていれば きっと また会える,I will surely meet again if I believe,0.21052631578947367
Really?,"（レントン）本当に？
（ダイアン）ホントに","really?
 really",1.0
"Because the power of
beliefs will become reality.","ホントに信じることができたら
信じる力は現実になるから","If you can really believe in
Because the power you believe is reality",0.25
"Then, Renton, I'm sure you'll
be able to fly into the skies.","そしたらレントンは
きっと空も飛べるし―","Then Renton
Surely the sky also fly-",0.15789473684210525
"To rescue the people dear to you,
and to see me at any time.","大事な人も助けられるし
それに私にも いつでも会える","The important people can also help
Besides, he can meet at any time",0.2857142857142857
"So, please... Believe in me.",私を信じて いい子でいるのよ,I believe in me,0.3333333333333333
"Yes, Sis...",（レントン）ンフフ… あっ…,Nhufu ... ...,0.2
"You know, Renton's sorta gross, isn't he?","（女子生徒）
何か レントンってキモくない？",Something she is not a roenton?,0.125
"He's, like, totally grinning and
staring at his Compac Drive.","（女子生徒）コンパク･ドライヴ
見ながら ニヤニヤしてさあ","Compk Drive
While looking at it while watching",0.1111111111111111
Gramps...,じっちゃん…,...,0.5
"This is very difficult for me to say,
but Renton's current grades may not...","（担任教師）
非常に申し上げづらいのですが―",It is very difficult to express-,0.21052631578947367
"get him into high school,
let alone the military academy...","高校への進学も…
（アクセル）かまいません",Advanced to high school ...,0.21428571428571427
IRRELEVANT!,"（アクセル）かまわんのです！
（担任教師）えっ！","I'm sorry!
 Eh!",0.16666666666666666
"I have no plans to contribute any
more soldiers from my household!","これ以上 私の家から
軍人を出すつもりはない！","From my house more than this
I do not intend to put out a military person!",0.25
"Amazing! Are you sure about this, Gramps?","アドロック氏の
ご子息であるのなら…","Adlock's
If you are a child ...",0.13333333333333333
Let's eat!,"（レントン）
すっげえ いいのかよ じっちゃん",It's a good idea,0.125
Why did it end up this way...?,"（アクセル）ハァ…
何で こうなったのかのう","Hua ...
Why she might be like this",0.21428571428571427
How can I explain this to your late mother...?,"わしは お前の死んだ母親に
何と説明していいのか…","Wow to your dead mother
What should I explain ...",0.4
"<i>I live a sucky life in a sucky city,
but it's all okay as long as there are waves.</i>","波さえ来れば全部オッケー
リフさえできれば問題なし","If you come a wave, all octopus
There is no problem if it can be riff",0.15625
"<i>So Sis, I'm doing all right.</i>",だから姉さん 俺は大丈夫,So my sister I'm fine,0.21428571428571427
"<i>I have lifting. As long as I can lift,
any place I am is the best!</i>","リフさえあれば
どこであろうと最高なんだ","If you have riffs
It is the best to be anywhere",0.15384615384615385
"""KEEP OUT""",がはああああ,Oh oh oh,0.0
"""Tower State Federation Air Force
Government property.
Unauthorized personnel forbidden.""",はっ,Haze,0.0
No way... My spot!,そんな 俺のスポットが…,Such my spot ...,0.42857142857142855
A military LFO!,軍のＬＦＯ！ くっそお…,Army LFO!...,0.3333333333333333
This city... This city... This city...,こんな… こんな… こんな街は…,Such ... such a city ...,0.4
<i>Maybe it's true that Holland is a criminal.</i>,"でも俺は そんなホランドが
うらやましい","But I have such a holland
Envious",0.17647058823529413
"<i>Holland, who wanders the world freely with
his friends, in search of nothing but waves...</i>",波だけを追い求めてるホランドが…,Holland who is asking only the waves ...,0.20833333333333334
"<i>I want to live freely, too.</i>",俺も自由に生きたい,I also want to live freely,0.45454545454545453
"<i>And then, and then, someday...</i>","そして そして…
そして いつか俺は―","And and…
And someday I-",0.18181818181818182
<i>I'm going to become a member of Gekkostate.</i>,"ゲッコーステイトの
メンバーになるんだ…","Gecko State
Become a member ...",0.2
"What, Eureka again?",何だよ またエウレカか…,What is it again Eureka ...,0.375
This is the third time this month...,今月は もう３回目…,This month is the third time ...,1.0
I wonder what this is?,"エヘヘ～
これ 何なんだろ？","Ehehe
What is this?",0.5714285714285714
I wonder if it's a secret military code.,軍の暗証番号だったりすんのかなあ,I wonder if it is a military's PIN code,0.6666666666666666
"Oh, maybe it's a code from Gekkostate!","あ もしかしてゲッコーステイトの
暗号だったりして","Oh, it's a guecco stating
Cryptographic",0.38461538461538464
I wish it was...,だったらいいなあ,I wish I could,0.3333333333333333
"Like, ""the person who
receives this transmission...""",“この通信を受け取った者は―”,"""The person who received this communication is-""",0.42857142857142855
"""can become a member
of Gekkostate."" I wish...","“ゲッコーステイトの
メンバーになれる…”","""Gecko State
You can be a member ... """,0.3125
What are you doing?,なーんて… ん？,Nome ...?,0.14285714285714285
"Yes, it is!",な 何だよっ！,What is it!,0.5
"Hold it! When did I say that I was
going to become a mechanic?!","ちょっと待て！ 俺が いつ
メカニックになるって言った？","wait a minute!I am when he
Did you say that it will be a mechanic?",0.45454545454545453
"- Don't decide for me!
- Well, what other option is out there?!","じゃあ 他に何がある？
（レントン）あ…","Well then, what else?
 ...",0.21052631578947367
After your father died and became a hero...,"お前の親父が死んで
英雄になったところで―","Your father dead
Where he became a hero-",0.3076923076923077
"After Diane left this house
in search of her dreams...","ダイアンが夢を追っかけて
家を出たところで―","Diane chases his dream
He left home-",0.125
nothing has changed in this world!,この世界は何も変わっちゃおらん,This world has changed anything,0.5
"Those who believe in dreams
and ideals are all idiots!",夢や理想なんつーもんを―,Dreams and ideals-,0.16666666666666666
I understand...,分かってんよ…,I know ...,0.5
"than about what I want to do, Gramps!","（レントン）どうせ じっちゃんは
俺がやりたいことなんかよりも―","How can you do it?
More than what I want to do-",0.35294117647058826
Is this it?!,"たぶらかしたのか
（レントン）う うわああああっ","Is it a big deal
 Uwa ah ah",0.2
Is this what's leading you astray?!,ジジイ てめえ何しやがる,What do you do?,0.3
"That's a replica of Holland's
board! It's really rare!","そいつはホランドレプリカで
レアもんなんだぞ うわっ","That guy with a holland replica
Rare Masao She",0.25
An LFO...!,ＬＦＯ？,LFO?,0.2
A Cutback Drop Turn...,カットバック･ドロップターン！,Cut back drop turn!,0.25
Could it be Holland?!,まさか ホランド？ あっ！,Horando?Ah!,0.25
What the...?,何だ？,What?,0.5
My room!,"（レントン）っつう…
あっ… 俺の部屋！？","is always ...
Oh ... my room!?",0.375
"Wait a minute, what is this...?",ちょっと待って 何だ これ,Wait a minute What is this,0.6666666666666666
What is this LFO?!,何なんだ このＬＦＯ,What is this LFO,0.6666666666666666
I've never seen one like it before...,俺 こんなの見たことない…,I have never seen this ...,0.36363636363636365
It's the Nirvash Type Zero.,"（アクセル）
ニルヴァーシュ･タイプ･ゼロだ",Nirvarsh type · zero,0.2222222222222222
You know what it is?!,はっ 知ってんの？,Do you know?,0.375
Yeah. This is the oldest LFO in the world.,ああ これが史上最古のＬＦＯだ,Oh this is the oldest LFO ever,0.45454545454545453
This is the Nirvash...?,これがニルヴァーシュ あっ…,This is Nirvarsh ...,0.42857142857142855
Hey!,"（エウレカ）ねえっ
（２人）んっ…","Hey
 ...",0.3333333333333333
"Could you have a look at her, please?",だから ちょっと見てくれない？,So do you look for a moment?,0.2857142857142857
She's cute!,"（唾を飲み込む音）
（レントン）はあっ かわいい…",is cute ...,0.16666666666666666
"<i>""Garage Thurston""
Oh, it's all right.</i>","（アクセル）
すまねえなあ いつもいつも",It is always always,0.06666666666666667
"<i>""Garage Thurston""
We diggers wouldn't have any
business without mechanics like you.</i>","（発掘屋）いいってことよ
俺ら 発掘屋は―","Good
I don't know-",0.09523809523809523
"So, about the State Forces...","（アクセル）
で 州軍のやつらは…",The state army is ...,0.3333333333333333
"<i>Oh, that's all right.</i>",ああ 大丈夫だ すまないな,Oh it's okay,0.16666666666666666
<i>They were all laughing about that.</i>,あいつらも笑ってたよ,I also laughed,0.08333333333333333
<i>This is...</i>,"（レントン）これが…
これがニルヴァーシュかあ","This is ...
This is Nirvarsh",0.375
"<i>The mysterious craft that was the
first to be discovered in the world.</i>",世界で初めて発見された幻の機体,The first visionary aircraft found in the world,0.15789473684210525
"<i>""SAFETY FIRST""
The legendary machine that became
the basis of every LFO ever made.</i>","すべてのＬＦＯの基本となった
伝説のマシン","It became the basis of all LFOs
Legendary machine",0.2857142857142857
<i>That's why it's Type Zero.</i>,ということは…,That's why ...,0.2727272727272727
<i>The original of all originals...</i>,"故にタイプ･ゼロ
オリジナルの中のオリジナル…","Therefore, type zero
Original in the original ...",0.2
I'm so smart!,俺 アッタマいい,I'm good,0.3333333333333333
"And that would have the
original data for the LFOs...","オリジナルデータが
書きこまれてて…","Original data
Written ...",0.2727272727272727
That's strange.,あれ？ あれ？ あれ？ あれ？,that? that? that? that?,0.2
It's got a two-din unit type attachment socket...,"２ＤＩＮ(ツーディン)ユニット式の
アタッチメント･ソケット","2DIN  unit type
Attachment socket",0.36363636363636365
"And it's the latest model, too.",しかも最新型がついてるのに…,And even though the latest is attached ...,0.21428571428571427
I can't believe there's no Compac Drive here.,コンパク･ドライヴが無い,There is no compact drive,0.23076923076923078
"Gramps, this LFO is sorta...",じっちゃん このＬＦＯ 何か…,Something this LFO ...,0.375
"Hey, I have a favor to ask.","（エウレカ）ねえ お願いがあるの
（レントン）あっ え…","There is a request
.",0.16666666666666666
"Can you lend me that
flamethrower that's used...",貸してくれないかな？,Could you lend me?,0.2727272727272727
"to attach scub slates
I saw behind the factory?",（エウレカ）工場の裏にある―,is behind the factory-,0.16666666666666666
Wh-What's wrong?,ど どうしたの？,What happened?,0.16666666666666666
"Oh, this?",（エウレカ）ああ これ？,Oh this?,0.75
"Well, I smashed your room, right?","だって あなたの部屋
壊しちゃったでしょ？","Because your room
Did you break it?",0.23076923076923078
I have to do something to make up for it.,"せめてものことぐらいは
しておかないと","It is about at least
Don't do it",0.13333333333333333
Amazing! Such a good girl!!,すっげーっす！ 超いい子っす！,Snish!Super good girl!,0.375
What?,"何？
（レントン）あっ いや その…","what?
 there is no ...",0.3333333333333333
"Nothing, but... This LFO doesn't
have a Compac Drive, so...","このＬＦＯ コンパク･ドライヴが
ついてないんだけど…","This LFO compact drive
I'm not happy ...",0.23529411764705882
Th-There's only this socket.,ソ ソケットしかないんですけど,There is only a socket,0.2222222222222222
I don't need it because it's useless.,意味ないから いらないよ,I do not need because,0.4
"You need something called a Compac
Drive to connect to and control an LFO.","ＬＦＯを動かすには
人とマシンをつなぐ媒介である―","To move LFO
Mediation between people and machines-",0.15789473684210525
"You know that, right?",分かってるよね？,"You know, right?",0.8333333333333334
I can't take this anymore...,"（エウレカ）あ…
（レントン）よし 分かった","...
 I understand good",0.2222222222222222
"All right, then, I'll put mine in.
As an experiment.","それじゃあ 俺のをつけてみよう
実験だ","Well then let's put me
It is an experiment",0.21052631578947367
"It'll be fine! I may not look it,
but I'm a professional mechanic.","こう見えても 俺
プロのメカニックですから","Even if you look like this
Because it is a professional mechanic",0.21739130434782608
"When you become
a mechanic of my caliber,",俺くらいのメカニックになると―,If you become a mechanic as much as,0.3333333333333333
What are you talking about?,"（エウレカ）ん… 何言ってるのよ
（レントン）あ…","... what you're saying
 ...",0.2222222222222222
"<i>Sis, this is amazing.</i>","機械にも心があるって
分かるんですよ","There is also a heart in the machine
I understand",0.11764705882352941
"<i>She's the ideal girl who doesn't
think what I say is strange!</i>","俺の言うことを変に思わない
理想の女の子です","I do not think that I say
Ideal girl",0.25
"<i>Sure, she's a little weird, but she's
worried enough about my room...</i>","ぶっ壊した俺の部屋を気に病んで
火炎放射器で火を…","I'm worried about my room with my broken
Fire with flame radiator ...",0.24
Torch?!,火？,fire?,0.25
Wh-Wh-Wh-What are you doing?!,な な… 何をなさってるんで？,Nana ... What are you doing?,0.4444444444444444
A funeral?!,"弔い
（レントン）弔い？","funeral
?",0.5
