en_text,jp_text,google_translated,score,semantic_score
—HALF—,♪～,♪ ~,0.0,0.37710196
"As of this moment, 18 plants, or 95% of the terrestrial plant corals have been reactivated","プラントコーラルの
95％にあたる―","Plant coral
95 %-",0.15789473684210525,0.72637594
"At this rate, even if we deploy our full strength,",このままでは全力で対処しても―,Even if you deal with all your power as it is-,0.1,0.3421926
we won't be able to prevent Scub Bursts at most of the Plants.,"ほとんどのプラントで
スカブバーストを阻止できない","Most of the plants
I can not block the skubburst",0.2,0.5819901
"Therefore, we are commencing Operation Polaris.","よって 作戦名“ポラリス”を
発動する","Therefore, the work game ""Polaris""
Activate",0.21428571428571427,0.5867965
Papa...,（フレア）パパ…,dad ...,0.3333333333333333,0.57119334
to gather the Secrets spread throughout the world in one place.,"地球全土に散らばった
シークレットたちを１か所に集める","Scattered throughout the earth
Collect the secret each place",0.1875,0.61176515
"By putting all the Quartz on a descending orbit,","地上に投入
その強力な反応により―","Turn on the ground
By its powerful response-",0.2,0.27224705
and eventually crash the capsule at the North Pole.,"各地のシークレットを引き寄せ
最終的に北極へ落下","Attract the secret of each place
Finally falling to the North Pole",0.17647058823529413,0.5308684
Can't you at least split them up into multiple groups?,"（イビチャ）せめて
数か所に分散できなかったのか？","at least
Did not you can distribute it?",0.2352941176470588,0.21913208
It won't be as effective if we lower the explosion's yield.,"（ブラン）爆発規模を縮小すると
それだけ成功率は下がる","Reduce the scale of explosion
That's only success rate",0.14285714285714285,0.6772384
What is it?,何だ？,What?,0.5,0.43106046
"Seeing that you're stranded in South America anyway,","（ブラン）
せっかく南米に立ち寄るんだ",I stop by South America,0.15384615384615385,0.6028572
could you buy me some coffee beans?,コーヒー豆を買ってきてくれ,Buy coffee beans,0.375,0.81168014
I can't drink this crap. It tastes like Starbucks.,"このアメリカ人が入れたような
物では耐えられん","It seems like this American
It can be withstand with things",0.16666666666666666,0.16615213
Sorry for calling before you leave.,（ガゼル）出発前に悪いな,It is bad before departure,0.09090909090909093,0.27777112
"Ao, do you have the pills with you?","アオ アレは持ったのか？
交代で寝なきゃ もたないぞ","Did you have Aoiro?
If you don't go to bed, she has no she",0.2631578947368421,0.43131354
Yeah.,（アオ）ああ…,Oh ...,0.0,0.49661556
You still can't get it off your mind?,（ガゼル）まだ気にしてるのか？,Are you still concerned?,0.25,0.20657033
I've been fighting Secrets for all this time.,"今までシークレットと戦ってきた
でも…","I've been fighting with secret until now
but…",0.26666666666666666,0.82269037
"But, somehow, it feels different this time.",今回のは 何か違う気がするんだ,I feel like something different this time,0.2307692307692308,0.7177813
"Christophe Blanc, the CEO of the Swiss company, Generation Blue,","ＣＥＯ クリストフ
･ブラン氏より―","CEO Christophe
· From Mr. Blanc-",0.14285714285714285,0.79778403
has suggested the launch of Operation Polaris.,"作戦名 〝ポラリス〞の
実施が提言されました","Of the battle name ""Polaris""
Implementation has been recommended",0.26666666666666666,0.69963825
Generation Bleu hid the existence of this Quartz material from the rest of the world!,"“クォーツ”なる物質の存在を
隠蔽(いんぺい)してきた","""Quartz"" existence of substances
Hiding",0.17647058823529413,0.54073095
Who's going to take the responsibility for that?,（評論家）その責任はどうなる？,What happens to that responsibility?,0.3333333333333333,0.7270801
"The Japanese government reinforced its position that Secrets are the saviors of mankind,","（アナウンサー）
日本政府は―",The Japanese government,0.2307692307692308,0.72517574
Are you telling me to back the winning horse?,勝ち馬に乗れとでも？,Will you get on the winning horse?,0.38461538461538464,0.7796385
"If this operation succeeds, we will finally be freed from the threat of Scub Bursts,","スカブバーストの脅威から
解放されるだろう","From the threat of skubburst
It will be released",0.3157894736842105,0.54494184
I am Maruyama from the VOM.,（記者）ＶＯＭのマルヤマです,Vom Maruyama,0.2857142857142857,0.8412623
What are the chances of success for Generation Bleu's operation?,"（記者）ゲネラシオン･ブルの
作戦の成功率は？","Genera Shion Bull
What is the success rate of the operation?",0.35294117647058826,0.47284943
"According to our estimations, if the Scub Bursts were to occur around the world,",（国務長官）試算によれば―,According to the statement of the Secretary of State-,0.17647058823529413,-0.0024393895
and the environmental aftereffects \Nwould endanger another 300 million.,３億人の人類に影響が出る,I affect the humanity of 300 million people,0.2,0.50366694
We have no choice but to put our trust in them.,彼らに 懸けるしかない…,I only have to go to them ...,0.1875,0.18388742
You could've at least notified the Big Blue World.,"（上司）ビッグ･ブルー･ワールドに
一言 欲しかったな","Big Blue World
I wanted a word",0.2,0.6492493
Does Blanc think the Quartz are his private property?,"（上司）ブランは あれを
私物だと思ってるのか？","Blanc
Do you think it is a private thing?",0.25,0.710906
I am very sorry.,（スタンリー）申し訳ありません,Sorry,0.2,0.49320754
He doesn't seem to comprehend that Generation Blue is an organization created for the Quartz.,"ゲネラシオン･ブルは
クォーツのために作られた組織","Genera Shion Bull
Organization made for quartz",0.14285714285714285,0.37352484
What does that mean?,（クロエ）どういうこと？,What does it mean?,0.6666666666666666,0.7075205
Is that Ao?,"（トシオ）
うん？ あれは アオかっ！？",Yes?That is anchoring!?,0.42857142857142855,0.2463536
Don't be afraid! I'll do something about it!,"（ナル）怖がらないで
みんな あれは私が何とかする！！","Do not scare
Everyone is I do something!!",0.2857142857142857,0.5298113
Naru?!,"（トシオ･ミツオ）えっ
（ミツオ）ナ… ナル！？",Na ... Naru!?,0.6,0.88759536
Where's Ao and the other kids?,（ハンナ）アオ君たちは？,What is Ao?,0.2,0.5592834
They are on standby at the starting point.,"（ブラン）
スタート位置で待機している",Wait at the start position,0.16666666666666666,0.5155942
You must have suppressed their radiation so that we couldn't sense them.,"反応が抑制されていたために
感知できなかったのか","Because the reaction was suppressed
Was it impossible to sense",0.09523809523809523,0.58023083
Georg?,"（レラト）ん？
（ラジクマール）ゲオルグ？","?
 Georgu?",0.3333333333333333,0.81261796
Please ignore that.,"（シークレット）
これほどのクォーツ―",That quartz-,0.2,0.17407596
Five seconds left.,（リュウ）ちょっ… いきなり？,Chopchi ... I wonder.,0.125,0.13953294
Let Operation Polaris begin.,ポラリス 発動,Polaris activation,0.16666666666666666,0.6154409
What's that light?,"（アオ）あれは！？
あれは 何の光！？","That's!?
What light!?",0.8333333333333334,0.8260413
It's the capsule that was launched from the Poseidon.,"（フレア）
ポセイドンから射出されたカプセル",Capsule emitted from Poseidon,0.2727272727272727,0.8514058
Got him!,（ナル）くっ！！,!!,0.3333333333333333,0.29072985
It ran away?,ううっ… よけた！？,Uh ... it was good!?,0.2222222222222222,0.23736289
Don't try to destroy them.,無理に倒そうとはしないで,Don't try to defeat,0.5,0.5284317
Roger!,了解！,Roger that!,0.6666666666666666,0.8614298
Secrets... So you're not our enemies?,"シークレット…
お前たちは 敵じゃないのか","secret…
Are you not an enemy?",0.2307692307692308,0.8556343
But we've been fighting you all this time.,"だけど…
俺たちはずっと戦ってきたんだ","However…
We have been fighting for a long time",0.26666666666666666,0.7713574
You smell nice.,"（エレナ）うーん いい匂い
（アオ）あっ",uh good smell,0.16666666666666666,0.7261151
I'd kill for a shower...,やっぱシャワーはなしか…,After all shower is ...,0.2,0.6190437
Good morning. You've slept soundly.,おはよ よく寝てたね,Good morning I slept well,0.3333333333333333,0.8002414
"Oh, I see...",うっ…,Uey ...,0.16666666666666666,0.26874495
I didn't!,してない！,Not done!,0.16666666666666666,0.32860315
You're good to go.,"（アレックス）
おっ すぐに飛べる",Fly quickly,0.0,0.16056171
See you guys at the next supply point.,"（アレックス）
次の補給ポイントで会おう",Let's meet at the next supplement point,0.3076923076923077,0.47570795
What's the American casualty count?,（アオ）米軍の損害は？,What is US military damage?,0.18181818181818185,0.48232576
"Seven units were hit and destroyed,","（レベッカ）
７機が反撃を受けて損壊",Seven aircraft is damaged and destroyed,0.3,0.6543594
Wow... Alex and his engineering team brought all that from the HQ.,"アレックスさんたちが
本社の外まで…","Alex
Until the head office outside ...",0.16666666666666666,0.48761228
And...,（フレア）何か 縁起 悪い…,Something bad ...,0.25,0.28112775
The Allied Forces are fighting alongside us.,"それに…
連合軍が一緒に戦ってくれる","in addition…
Allied armies will fight together",0.07142857142857142,0.69817764
It feels like we're nearing the last episode!,"（エレナ）
最終回 １話 手前ってノリだね",It is Nori before the final episode 1 episode,0.2,0.38437268
There's a Secret at the Vesterålen Plant?,"プラントにご両親が就職して
引っ越したの","My parents have a job in the plant
Moving",0.2,0.23129801
Isn't that Maeve and Chloe's place?,"（エレナ）
それって 確かメイヴとクロエの…",That is certainly Mave and Chloe ...,0.3333333333333333,0.69187796
What?,どういうこと？,What do you mean?,0.4,0.38408917
It's their hometown.,（フレア）２人の故郷よ,2 hometown,0.16666666666666666,0.52788156
That's why Chloe's gotten used to trapar since she was little.,"だからクロエは
子供の頃からトラパーに慣れてて","So Chloe is
She gets used to trapper from the time of a child",0.17391304347826084,0.866298
The Secret from Norway is headed for the Quartz too.,"ノルウェーのシークレットも
クォーツに向かっている","Norway secret also
I'm heading for quartz",0.2857142857142857,0.8340174
"If their hometown is like that, then Iwato Island is...","クロエたちの故郷がそうなら
磐戸島だって…","If the hometown of Chloe is so
It is Kirishima ...",0.2352941176470588,0.47269255
But will this operation whatever really work out?,この何とか作戦,This kind of operation,0.18181818181818185,0.5810151
Of course. Our army is fully cooperating as well.,"（タナカ）当然だ
我が軍も全面協力している","Naturally
My army is also working on full",0.125,0.53188556
"Unfortunately, you're all going down.",残念 貴様らは全滅だな,"Unfortunately, it is annihilation",0.18181818181818185,0.18621854
Our only purpose is to erase alien materials from this space.,"この宇宙に侵入する異物を
排除できればよい","Foreign matter that invades this universe
It is only necessary to be able to eliminate",0.18181818181818185,0.45209894
"By doing this, we can eliminate large amounts of such materials.","これで 大量のコア物質が
消滅させられる","This is a large number of core materials
Disappear",0.2222222222222222,0.5385215
I'm afraid they're quite serious about that.,いや… 案外 本気かも…,No ... I'm sorry I'm sorry ...,0.15384615384615385,0.1720589
I was born from the Scub Coral.,"（エウレカ）
私はスカブコーラルから生まれた",I was born from Skub Coral,0.5555555555555556,0.9132004
So were you.,（エウレカ）だから あなたも…,", so you too ...",0.2857142857142857,0.38105375
"You are a child of the Scub, Ao.","（ナル）アオはスカブの子
私もスカブと一緒になった","Ao is a child of Skub
I also got along with Skub",0.2352941176470588,0.71846604
Ao...,（アオ）あ…,...,0.5,0.2696692
Ao!,（フレア）アオ！ アオ！,Ao!Ao!,1.0,0.9620177
I'm sorry!,"あっ あああっ
ご… ごめんなさい！","Oh oh
... sorry!",0.3333333333333333,0.5412504
What are you talking about?!,"（アオ）ソ連も ポラリスに
参加してるんでしょ？","Soviet Union also to Polaris
Are you participating?",0.2307692307692308,0.10640253
"Twelve minutes ago, Soviet ballistic missiles were launched.","（レベッカ）
12分前 ソ連の弾道ミサイルが
突然 発射されたわ","12 minutes ago Soviet ballistic missile
I was suddenly launched",0.3333333333333333,0.85658616
But the missiles are on a course of collision with the capsule.,"クォーツカプセルとの
衝突コースだ","With quartz capsule
It is a collision course",0.3333333333333333,0.5594816
I won't let you!,"（警告音）
（メイヴ）行かせない！！",I can not go!!,0.2222222222222222,0.5706605
The Quartz are very important to us! We're gonna protect it!,必ず守ってみせる！,Be sure to protect!,0.1875,0.43616205
The missiles' shockwaves have pushed the capsule off its trajectory.,"（ブラン）ミサイルの爆風で
カプセルの軌道がずれた","Missile blast
Capsule trajectory is off",0.21428571428571427,0.76284295
"At this rate, it'll crash south from the North Pole—in North Europe.","このままでは北極よりはるか南
北ヨーロッパに落下する","As it is, it is much more south than the Arctic
Fall into Northern Europe",0.21739130434782608,0.65447783
The IFOs must carry it to the North Pole.,"ＩＦＯでカプセルを支え
北極まで運ぶしかない","Support capsules with IFO
I can only carry to the Arctic",0.17647058823529413,0.5334877
We're gonna carry it until Alleluia and Kyrie run out of fuel.,"（フレア）アレルヤとキリエで
タンクが空になるまで支えるわ","Alera and Kirie
Support until the tank is empty",0.09090909090909093,0.3426036
Then we're leaving it to Nirvash's Third Engine.,"その先はニルヴァーシュの
サードエンジンに任せる","That ahead of Nirvacha
Please leave it to the third engine",0.2222222222222222,0.84322083
Elena?,エレナ！？,Elena!?,0.6666666666666666,0.940711
"After Alleluia and Kyrie have launched,","（イビチャ）
アレルヤ キリエ発進後―",Afternea Kirie after start-,0.1,0.40286598
the Triton will proceed to its final position.,"トリトン号は
最終作戦地点に先行する","Triton
Preceding the final operation point",0.25,0.7714537
Chief?,"チーフ！？
（イビチャ）ムチャは承知だ","chief!?
 Mucha is aware",0.3333333333333333,0.6412354
I know it's risky...,"（マギー）
ウフフ… うれしいくせに",Uhufu ...,0.14285714285714285,0.21605822
What about team Goldilocks?,"で あの…
ゴルディロックスは？","That ...
What is Golderox?",0.2222222222222222,0.33448327
But I'm not!,んっ… うれしくないもん！,... I'm not happy!,0.5714285714285714,0.35107964
"Ao, we're counting on you to protect our hometown.","私たちの ふるさとも近いの
よろしくね","Our hometown is near
Thank you",0.2,0.42570505
"Let's go, Alleluia!","追いついた
行くよっ アレルヤ！","Caught up
Let's go ahead!",0.4444444444444444,0.3114368
Geez—,（エレナ）ナーイスキャッ… あっ,Names Ca ...,0.0,0.14726745
There should've been enough distance!,"（フレア）
距離は十分だったはずなのに…",Even though the distance should have been enough ...,0.3333333333333333,0.856029
Alrighty!,（エレナ）はい はーい！,Yes Yes!,0.3333333333333333,0.3880133
Elena! Elena!,（フレア）エレナ！ エレナ！,Elena!Elena!,1.0,1.0000002
Georg! The status on Kyrie!,"（レベッカ）
ゲオルグ キリエは！？",Georg Kirie!?,0.25,0.64515424
"There is some damage, but it can still fly.","（ゲオルグ）数か所被弾しましたが
飛行に問題はありません","I only premium
There is no problem in flight",0.1111111111111111,0.3851002
The pilot's fine as well.,パイロットも無事です,Pilot is also safe,0.1,0.731988
"Elena, we're sending the Allied Forces to pick you up, so retreat for now.","エレナ 連合軍に回収に
向かわせるから 撤退を…","Collected to Elena Allied Forces
Withdrawal because it is directed ...",0.16666666666666666,0.6804895
I'm doing it!,やります！,I'll do it!,0.42857142857142855,0.6809767
Booting Third Engine...,"サードエンジン起動
アクティベート","Third engine startup
Activate",0.3333333333333333,0.72281677
Why... Why won't it start?!,"どうしてよ
どうして 動かないのよっ！","However
Why don't you move!",0.25,0.19353433
This is President Christophe Blanc.,"（ブラン）社長の
クリストフ･ブランだ 作戦変更","President
Christoph Blanc Change",0.25,0.7276729
we're going to commence the confluence explosion.,"目標地点には到達していないが
融合爆裂を開始する","I have not reached the target site
Start fusion explosion",0.1176470588235294,0.37996274
Fleur! Throw away the Quartz and get as far away from it as possible.,可能な限り離れなさい,Leave as far as possible,0.2,0.18940282
This is an order.,これは命令だ,this is an order,0.8,0.97000784
"Our calculations tell us that if we have it detonate now, most of the Secrets would be destroyed.","その位置でもシークレットの大半は
融合爆裂に巻き込まれる","Even in that position, most of the secret is
Fusion explosion",0.1851851851851852,0.58219194
We'll deploy team Harlequin to deal with the rest.,"残りは ハーレクインを
降ろして対処する","The rest is Harlequin
Substrate",0.2307692307692308,0.45662946
What about potential casualties?,（レベッカ）人間への影響は？,What is the impact on humans?,0.2,0.37702993
A part of the Scandinavian Peninsula will be erased.,"スカンジナビア半島の一部が
消滅する","Some of the Scandinavian Peninsula
Disappear",0.3333333333333333,0.7738069
Gazelle...,ガゼル…,Gazelle ...,1.0,1.0000001
What happened?,"（３人）ん？
（イビチャ）どうした！？","?
 What happened!?",0.75,0.77054214
"Ao, are you acting on your own again?!","（レベッカ）アオ！
あなた また勝手に行動する気！？","Ao!
I will try to act myself again!?",0.2352941176470588,0.70868033
Nirvash is the only one with an operational Third Engine!,"（アオ）サードエンジンが動くのは
ニルヴァーシュだけなんでしょ！？","Third engine moves
Only Nirvacu!?",0.2857142857142857,0.7383998
That's why I have to go and do it!,だったら俺がいきます！,"If so, I will go!",0.2,0.4543276
Chief?!,"出撃を許可する
（レベッカ）チーフ！？","Allow dispatch
 Chief!?",0.6,0.61633295
You aren't Eureka.,"ただし 必ず帰ってこい
お前は エウレカではない","However, be sure to come back
You are not Eureka",0.2307692307692308,0.72156596
Yessir!,うわあっ！,Wow!,0.3333333333333333,0.30592653
Dammit... The manipulator won't last much longer.,"ダメ… マニピュレーターが
もう もたない…","No use ... Manipulator
She has no longer ...",0.21428571428571427,0.64395565
"Fleur, I'll do it!","うっ
（アオ）フレア 俺がやる！","Pet
 Flare I will do it!",0.4,0.38920164
Ao? But...,アオ！？ でも…,Ao!?but…,0.3333333333333333,0.89339095
Pick up Elena and return to the Triton!,エレナを拾ってトリトン号に戻れ！,Pick up Elena and return to Triton!,0.8888888888888888,0.99270684
Alleluia left the capsule and Nirvash started accelerating.,"ニルヴァーシュ
加速を開始しました","Nirvash
Accelerated started",0.2,0.6308842
I know!,（アオ）分かってます！,I understand!,0.5,0.62824553
The chances of you escaping the confluence explosion alive is 3% at this point.,"本機が融合爆裂から
逃れられる確率は３％","This unit is from fusion explosion
The probability of escaping is 3%",0.42105263157894735,0.66722846
"Ten years ago, Mom disappeared somewhere with the Quartz.",どこかへ 消えた…,It disappeared somewhere ...,0.15384615384615385,0.4034379
I don't know where Mom came from.,"アンマーが何人なのか
俺は知らない","How many ammers are
I do not know",0.21428571428571427,0.092901155
If we share the same blood...,同じ血が流れてるなら―,If the same blood flows-,0.5,0.630234
Then I must be able to fly too.,俺も 飛べるはずだ,I should fly too,0.3,0.64683586
"Fly with me, Quartz!","俺と一緒に
飛べ クォーツ！！","With me
Flying quartz!!",0.5714285714285714,0.8758181
What's this?!,この光！？,This light!?,0.5,0.23648085
"Ao, what's going on?!","（イビチャ）おい アオ
何が起こってる！？","Ookai Ao
what is up!?",0.3636363636363637,0.5333278
What's this?,何だ？ これ…,What?this…,0.4,0.3690979
A weapon? Is this a weapon?,"あっ！
武器… これは武器なのか！？","Ah!
Weapons ... this is a weapon!?",0.5555555555555556,0.8192417
"If it's a weapon, then save the world with it!","武器なら…
武器なら世界を救ってくれよ！","If it is a weapon ...
If you are a weapon, save the world!",0.5625,0.9296196
Can you explain to us about that weapon?,"あれは…
（フレア･エレナ）ん？","That is…
?",0.2,0.12210311
I...,俺は… ん？,I ...?,0.6666666666666666,0.6886581
A North Pole light.,ノースポールライトじゃない,It is not a no-spole light,0.2222222222222222,0.41501665
It's a mysterious light phenomenon often seen around here.,"この辺りで昔から見える
不思議な光の現象","It looks like this area
Mysterious light phenomenon",0.26666666666666666,0.8359913
"No, that light is...","違う…
俺が撃つまでは あんな光は…","different…
He is such a light until I shot ...",0.2307692307692308,0.41498393
It's the Vester Shuttle's supply point.,"（レベッカ）
ヴェステル諸島補給ポイントです",Vaster Islands Supply Point,0.2,0.39774802
And the Coral Plant?,"（アオ）コーラルプラントは？
（エレナ）え？","Coral plant?
?",0.6,0.82631123
There's never been one here.,"こっちには なかったはずだけど
（アオ）え？","It should have been not here
?",0.16666666666666666,0.3978989
Well...,いや… その…,No ... ...,0.3333333333333333,0.4106246
Chloe?,クロエ？,Chloe?,1.0,1.0000001
"I'll ask you again, Ao.",（イビチャ）もう一度 聞く,I listen again,0.2222222222222222,0.28125486
What is this team Goldilocks you're talking about?,アオ ゴルディロックスとは何だ？,What is A Golderox?,0.25,0.4163928
They are an IFO team just like us.,"（アオ）ゴルディは 俺たちと同じ
ＩＦＯチームです","Gordi is the same as we
IFO team",0.13333333333333333,0.64974725
Pied Piper handles terrestrial affairs while Harlequin is stationed in space.,"ハーレクインは宇宙を
それぞれ担当している","Harlequin is the universe
I am in charge of each",0.15789473684210525,0.4742805
But...,（アオ）けど…,but ...,1.0,1.0000002
Why won't you remember them?,どうして覚えてないんですか！,Why don't you remember!,0.4444444444444444,0.61866933
Why doesn't anyone...,（アオ）どうして… 誰も…,Why ... no one ...,0.2857142857142857,0.63779825
"No matter how hard you look, there's nothing.","（ガゼル）なっ？
何度 確かめても 何もないだろ？","?
There is nothing to check again and again?",0.1176470588235294,0.25885385
No one's lived here for centuries.,この辺りは何百年も誰も住んでない,No one lives in this area for hundreds of years,0.2,0.7810901
No. Chloe said she was...,"（アオ）
うそだ 確かにクロエは…",Certainly Chloe ...,0.25,0.73731685
There never have been.,これまで籍を置いたこともない,I have never had a nationality,0.2222222222222222,0.2863196
"What have I done, Mom?","俺は 一体何をしたんだ…
アンマー…","What did I do?
Unmark ...",0.2727272727272727,0.272709
To be continued.,（アオ）つづく,continuing,0.0,0.6492017
*T/L Note: I'm so uncertain,きっと疲れてるのさ,Surely I'm tired,0.2222222222222222,0.15997906
Next time on Eureka Seven AO.,"（レベッカ）
次回 「エウレカセブンＡＯ」","Next time ""Eureka Seven AO""",0.5555555555555556,0.9309992
The world should have been saved by the light Nirvash unleashed.,"ニルヴァーシュの放った光により
世界は救われたはずだった","By the light emitted by Nirvac
The world was supposed to be saved",0.29411764705882354,0.78789055
"But as Ao is the only one who knows the truth, he must shoulder the heavy price all alone.","だが その代償は真実を知る
アオ１人に重くのしかかる","But that price knows the truth
Heavy with one person",0.3181818181818182,0.58289003
