en_text,jp_text,google_translated,score,semantic_score
And if you do that then fire won't lose to water or wind...,"そうすりゃ
火は 水にも風にも負けやしねえ","So
The fire also loses to the wind and the wind",0.21052631578947367,0.7566681
"Change the properties of the fire, huh?","ヘヘッ… “火の質を変える”ね
やったぜ マカオ","Heheet ... ""Change the quality of fire""
I did Macao",0.25,0.5336224
What the heck was that?,な… 何だ？ 今のは,... What?Now,0.25,0.28169587
How about I warm you up?,"お前 裸じゃ寒いだろう
暖めてやろうか？","You will be cold naked
Will it warm up?",0.3333333333333333,0.5821936
Roar of the Fire Dragon!,火竜の咆哮！,Fire Dragon's Mt.,0.2222222222222222,0.66633666
Storm Wall!,暴風壁！,A storm wall!,0.75,0.90590304
What is this guy?,"なんて野郎だ
やること全部 でたらめじゃねえか","What is a guy
It's all about doing it",0.2727272727272727,0.3179342
So this is what a Fairy Tail wizard is like?,これが妖精の尻尾の魔導士か,This is a fairy tail of the Magician,0.38461538461538464,0.7369793
It seems I underestimated your power a bit.,貴様の力 少々 侮っていたようだ,It seems that you were scolding a little bit,0.2857142857142857,0.37345853
How about we get serious now?,"ここからは本気でいこうか
お互いにな","Let's get serious from here
Each other",0.15384615384615385,0.66876227
Both of us...,ヘヘッ…,Heheet ...,0.2,0.33942944
Storm Mail!,暴風衣！,Storm!,0.6666666666666666,0.7605155
Damn it! Now you've gone and wrapped \Nyourself in something annoying!,これで引っぺがしてやる！,This will give you a pope!,0.1111111111111111,0.17543364
I'll tear it to shreds!,"くそ！ うっとうしいもん
まとわりつかせやがって","Fuck!Rusty
I'm going to",0.2727272727272727,0.32557222
Iron Fist of the Fire Dragon!,火竜の鉄拳！,Tekken of fire dragon!,0.5,0.7632954
What happened?,どうした？ そんなもんか？,What happened?Such a?,0.6,0.56599694
The Storm Mail's winds constantly blow outward.,"暴風衣は
常に 外に向かって風が吹いている","Storm
The wind is always blowing outward",0.2307692307692308,0.7641153
Don't you get it?,"分かるか？
炎は向かい風には逆らえねえ","Do you understand?
Flame is opposite to the wind wind",0.2307692307692308,0.13359614
Say what?,…んだと？,... What is it?,0.3333333333333333,0.18745172
Flames can never defeat wind!,炎は 風には勝てねえんだ！,The flame wins the wind!,0.2222222222222222,0.82553196
There's nothing more to say!,ですよね ですよね,That's right,0.1111111111111111,0.09883577
True. Feels to me like the best team in all of Fairy Tail.,そうね　妖精の尻尾の中でも―,Even in the fairy tail-,0.1875,0.5454086
I know! Don't you think?,"結構バランスが取れてると
思いません？","If you have a well balanced balance
I do not think so?",0.3125,0.11616441
"Then the only question is how many cities \Nthis team will destroy... 2, maybe 3?","さて このチームで壊れる町は
２つか ３つか いや ４つ ５つ…","Well, the town that breaks in this team
Two or more three or four five ...",0.13333333333333333,0.6027754
Give me a break here!,ウウ… もう許してください！,Uu ... Please forgive me!,0.2,0.2571583
