en_text,jp_text,google_translated,score
Transmissions?,なに？ この光,what?This light,0.2
Since you're here for me...,アッ…,...,0.14285714285714285
Heaven's Game!,"メイビスの墓は どこかって
聞いてんのよ","Mavis's tomb is
I heard",0.1111111111111111
"I accept that he wasn't \Ntrying to kill us, but...",し… 知らないわよ 私たちだって！,... I do not know!,0.11764705882352941
You heard me then?,"お前も
Ｓ級魔導士になりたいんだな？","Hopefully
Do you want to be a S-class magician?",0.15384615384615385
And I was confident that Natsu wouldn't die.,そっか オイラ 分かっちゃった！,I knew I was so I've been,0.14285714285714285
"Uh, what about me, then?",俺が てめえに聞いたか？,Did you ask me?,0.2
he will destroy all evil before him!,ふざけてるのは そっちでしょう！,It will be a funny thing!,0.15384615384615385
Eww!,"アアッ！
ルーシィ！","Ah!
Lucy!",0.25
Maybe I really should take this off...,"たとえ知ってても
絶対 あんたなんかに教えない…","Even if you know
I absolutely not told me ...",0.125
It's the blockhead!,何だよ それ　知らねえっつうの！,What is it? It's not good!,0.3
"Why, you...",つ… つぶれる…,Tsu ... crush ...,0.16666666666666666
Take this!,"アアッ！
ナツさん！","Ah!
Natsu!",0.2
Cat Barrier!,ハッピー しっかりしなさい！,Happy good!,0.2
Cat Fire!,走った！,Ran!,0.25
"Millia, back me up!","跳んだ！
どんだけ負けず嫌いなの！","I jumped up!
I don't lose only!",0.16666666666666666
Pretending to be a kitty cat when you're \Na person? That's totally un-spiffy!,"その場所を教えてくれんかね？
ウオーッ！","Could you tell me that place?
Woo!",0.18181818181818182
You're one to talk!,俺の話 聞いてる？,Are you listening to me?,0.2
Cat-ch you tubes!,ドワッ！,Dow!,0.2
Huh?,うん？,Yes?,0.3333333333333333
Is it this thing's fault?,な… 何なの？ こいつ,... What is it?this guy,0.4
Die!,ウワッ！,Uwa!,0.3333333333333333
...your fate was sealed...,ウッ…,W ...,0.16666666666666666
Happy!,誰か… 誰か！,Someone ... someone!,0.25
"I'll let the talking slide, but the flying?","試験は どうなってんのよ？
マスター どこにいるの？","What is the test?
Where are Master?",0.125
"What are you doing, Millianna?","お嬢ちゃん
こんな所で何してんだ？","Grandmother
What do you do in such a place?",0.23076923076923078
But the kitty-cat was...,"私は 父を捜し
妖精の尻尾にたどりついた","I look for father
I went to the fairy tail",0.07692307692307693
Wing Slash of the Fire Dragon!,"12年前
病気で死んだ母の遺言で―","12 years ago
In the disease of her mother who died in sickness-",0.11764705882352941
My revenge on the blockhead is complete!,父の名はギルダーツ,Father's name is Guilds,0.08333333333333333
I can't get it off...,言いそびれちゃった…,I'm talking ...,0.2222222222222222
This is how it should be. There is nothing \Nmore boring than a one-sided game.,"ひと月かもしんねえし
分かんねえなぁ","It may be a month
I'm sorry",0.15
This is no longer the time \Nto be playing around.,いや… あの…,No ... That ...,0.07692307692307693
Are you sure?,えっ？,eh?,0.2
Go to hell!,よっ！ お疲れさん！,Oh!Well done!,0.14285714285714285
Hell! I'll show you the lowest \Npits of the ultimate hell!,"依頼主から郵便鳥で
感謝状が届いておったぞ","From the requester to the mailbird
I received a letter of thanks",0.15789473684210525
Fukuro.,でも…,but…,0.0
"And their commander, Ikaruga.",フゥ… ただいま マスター,Hu ... Master Master,0.0
This eve shall be a festival.,"お前に
紹介しとくヤツがいんだがよ","Over
Introduces a guy",0.1
"The Special Guerrilla Squad: \NTrinity Raven, have arrived.","この間 出がけに入り口に
立ってた お嬢ちゃんだろう？","During this time, at the entrance
Will she standing?",0.1
Go.,"悪い悪い お前だったか
あっ…","Bad bad before
Ah…",0.0
I'm pulling as hard as I can!,"そうか ギルドに入ったんか
まあ よろしくな！","Or I entered the guild
Well thank you!",0.14285714285714285
It came off!,大きくなったなぁ カナ,It became bigger,0.16666666666666666
Now it's the blockhead who's trapped!,"よう！
あっ…","Let's go!
Ah…",0.18181818181818182
I wonder what's with that mask's head-hole?,マジか… 何の依頼だよ？,Seriously ... What is the request?,0.14285714285714285
Yeah!,ヤベッ！ じゃ またな！,Yabe!Well!,0.25
The world where we can rule...,オッ… 占い覚えたんか？,O'... I remembered the horoscope?,0.15384615384615385
"Welcome, everyone, to the Tower of Heaven.","私は お父さんが帰ってくる日を
占うためにカードを覚えた","I have a day when my father returns
I learned the card to tell",0.1
The ruler of this tower.,"心… 全ては
信じる心から始まるんじゃよ カナ","Heart ...
Believe from the heart of believing",0.18181818181818182
A game?!,カードマジック？ 私が？,Card magic?I?,0.14285714285714285
"In other words, if the door to \Nheaven opens, victory is mine.","そう…
魔法の存在を信じ 自分の力を信じ","Yes…
Believe in the existence of magic and believe in your own power",0.08695652173913043
However that alone would not be any fun.,"自然と共にあることを
信じる者だけが―","That there is a nature
Only believers-",0.06666666666666667
So I have assembled three warriors.,"そして
私はカードマジックを覚えた","and
I learned card magic",0.09090909090909091
Three warriors?,心…,heart…,0.0
"If you cannot overcome them, \Nthen you will not reach me.",魔法を使えるようになれば―,If you can use magic-,0.21428571428571427
In other words it is a 3 vs. 8 battle royal.,"私なんかとは
比べ物にならないくらい―","What is me
It does not become a comparison-",0.16666666666666666
"With the ultimate magic that returns \Neverything to nothingness, Etherion!","少しは
お父さんに近づけると思ったから","Slightly
Because I thought that my father gets close to my father",0.1
"That wasn't in the deal, Jellal!","いつしか 本当のことを伝えるのが
怖くなっていた","I will tell you the real thing
I was scared",0.125
Reverse!,あっ… うん！,Oh ... yeah!,0.2
This is the ultimate high!,きっかけは Ｓ級魔導士 昇格試験,The trigger is S-class Mage Promotion Test,0.18181818181818182
The Council is doing what?,だけど 結果は４年連続 不合格…,But the result is 4 consecutive years ...,0.16666666666666666
Erza!,"私より
あとに入ったエルザやミラが―","I
Erza and Mira I entered after",0.14285714285714285
Now...,…というわけだ,...,0.5
I will defeat Jellal myself!,私がカナのパートナーになる！,I will be a partner of Kana!,0.2727272727272727
Stop this! It's impossible alone!,"だから
今回で最後にしようと決めた","that's why
I decided to go last this time",0.13333333333333333
"I suppose this Jellal guy \Nis at the top, right?",ギルドを辞めて 町を出る,I quit the guild and leave the town,0.11764705882352941
"Etherion? If that's fired, \Nthen everyone will...","今回がダメなら 私は きっと
ギルダーツの娘である資格がない","If this time is no good I will surely
There is no qualification that is a girl of Guilds",0.125
but the freedom we have in \NFairy Tail is pretty awesome.,もし試験中に こいつが光ったら,If this is shining during the exam,0.11764705882352941
Let's head to the very top right away!,"たとえ どんなに離れていようと
私が助けに行くから","Anyway what's far away
Because I go to help",0.17647058823529413
Salamander...,ハッ…,Ha ...,0.3333333333333333
No! I'm on your side!,私は もうダメ…,I'm no good ...,0.3333333333333333
I will pass judgment upon \Nyou in the name of justice!,"私が どこにいようと
心は いつも同じ場所にあるから！","Where I can
Because the mind is always in the same place!",0.2
How do you like it?,心を育てる糧である,It is a source of growing mind,0.08333333333333333
Assassin's Guild?,妖精の輝きをそなたに貸そう,Let's lend the fairy glow,0.1111111111111111
They're the worst kind of guild that \Nspecializes in assassination requests!,"12年分の恩返しするからね！
妖精の尻尾のみんな！","Because it will give back for 12 years!
Everyone of the fairy tail!",0.125
I only eliminated evil!,はい！,Yes!,0.16666666666666666
Today this warrior of justice \Nwill bury your evil!,"この魔法があれば
どんな敵にも勝てる！","With this magic
You can win any enemy!",0.11764705882352941
You can't fight members of the Assassin's Guild!,私がギルドを守るんだ！,I will protect the guild!,0.21428571428571427
"Bring it on, birdbrain!","無事だったのね！
あい！","It was safe!
love!",0.2222222222222222
There is evil in this world \Nthat cannot be left alive!,"これ以上
仲間を傷つけんじゃないよ！","more than this
I'm not hurting my friends!",0.15
Thrusters!,"カナ！
カナさん！","Kana!
Kana!",0.3333333333333333
You are one of those who \Nshould best disappear!,お前か！,Are you!,0.3
Natsu!,アッ！,!,0.5
Oww!,確実に倒せる！,You can definitely defeat it!,0.14285714285714285
This will be a rare job worth doing!,こいつを倒すために協力して ナツ,Cooperate to defeat this,0.08333333333333333
Trinity Raven... They're \Nbeyond even the rumors...,"まさか 試験は…
アハハッ…","The test is ...
Ahaha ...",0.16666666666666666
And there are three of them?,今は その話 置いとかない？,Now you can't stand that story?,0.07142857142857142
but perhaps he's at a disadvantage.,ウッ… ウウッ…,Uh ... Uh ...,0.0
Natsu-san!,ンッ！,!,0.5
Note: -kun is an honorific used for young boys and people lower than your status.,この魔法はギルドの者しか使えない,This magic can only be used by guild people,0.08333333333333333
"I shall do it for Gray-sama's sake,",お前らには使えないんだ！,I can not use it for you!,0.21428571428571427
"Look, I'm trying really hard \Nnot to be involved in this.","この話
どこかで聞いたことあるような…","This story
I have heard somewhere ...",0.10526315789473684
A guitar?,たったひとつの魔法？,A bit of the magic?,0.2857142857142857
"Man, that's loud!",アアッ！,Ah!,0.14285714285714285
"Something is wrong with you, seriously.",クッ… 当たり前だ,Ku ... It is natural,0.08333333333333333
It's a live performance from hell! Destroy!,"てめえごときに
使えるわけねえだろうが！","Once
It will be usable!",0.15384615384615385
"The three warriors that Jellal \Nwas talking about, then?",やった？,Hooray?,0.08333333333333333
"Vidaldus Taka, that's me!",いや あれは違う,That's different,0.25
Rock you!,咆哮！,Roar!,0.25
Water Lock!,ナイス ナツ！,Nice Natsu!,0.2
Rock?,"うん？
いけー！","Yes?
い!",0.2
You weren't one of the Element 4 for nothing!,妖精の輝き！,The glow of the fairy!,0.23076923076923078
You'd be pretty scary as an enemy...,ンンッ…,Network ...,0.1
And... Eww!,ウオーッ…,Wow ...,0.2
It's best to wash out your hair \Nwith water in the morning.,照らせ 邪悪なる牙を滅するために,In order to eliminate the evil fang,0.16666666666666666
Water is ineffective?,この程度で妖精の輝きだと？,What is the glow of the fairy in this extent?,0.16666666666666666
"Oh, no!",落ちろー！,Fall!,0.2
Eeny-meeny-miny-moe...,そんな…,Such ...,0.3333333333333333
You'll be my succubus today!,"知ってるかね？ 殺したあとでも
魔法を取り出せるって","Do you know?Even after killing
Magic can be taken out",0.11764705882352941
"No, stop it!","やめて！
お願い！","stop! 
 Please!",0.3333333333333333
Juvia!,ギルダーツ！,Guilds!,0.3333333333333333
I bet that she puts on a tough shell to \Nprotect her heart from the pain of her past.,"ナツの頭には
食う 寝る 勝負 以外はないの？","In the head of Natsu
Aren't there any other than a match to eat?",0.12903225806451613
That's not what I meant. I \Nmean she closes off her heart.,“妖精の木”とかじゃねえんだな,"It's not a ""fairy tree""",0.10526315789473684
