en_text,jp_text,google_translated,score
Previously on Fairy Tail:,「FAIRY TAIL」 前回までは…,"""FAIRY TAIL"" until last time ...",0.18181818181818182
"There's one thing that I \Nwonder about, though...","…てなわけで
何やら いろいろあったんだけど","... That's why
Somehow she had various things",0.17647058823529413
"There's Mystogan too, right? What is he...","…で 俺たちのギルドが
どうなってたかっていうと","... Our guild is
What to do",0.2
This isn't it!,"それは 魔法を使ったさまざまな
競技で “魔”を競い合う祭り","It is various using magic
Festival that competes ""magic"" in the competition",0.125
So why am I the only Dragon \NSlayer without a cat!?,"だけど ７年間の
ブランクがある私たち天狼組は―","But it's 7 years
Blank I am Tenzo team-",0.09523809523809523
Do you still have any figures of Gajeel left?,"ついていけないかも
しれないんだよね","Maybe
I can not do it",0.06666666666666667
"Yes, we have some, most definitely...",フフッ…,Fufu ...,0.1111111111111111
"It's even got a stand for \Nthe cat, just in case!",そんな格好のヤツに言われてもな,Even if it is said to be such a good guy,0.13636363636363635
"You're one to talk, when you're \Nalready drinking at noon...",お前らな 合宿が終わるまでには…,Before you have finished you ...,0.13333333333333333
"Shut it, you!","海だ！
よっしゃ～！","It's sea!
Yes!",0.25
"I'm not bothering anyone, am I?","せめて 俺らくれえには
勝てるようになってもらうぜ","At least I'm sorry
Get it to win",0.13333333333333333
What are you reading?,さあ 宿に戻って寝るか,Do you go back to the hotel?,0.18181818181818182
both disappeared on the same day.,"一方 そのころ
妖精の尻尾の ほかのメンバーも","On the other hand,
Her other members of the fairy tail",0.13333333333333333
All set...,ンンッ…,Network ...,0.25
"The Fire Dragon Igneel, the Iron Dragon \NMetalicana, and the Sky Dragon Grandine...",火竜の咆哮を撃てるんだ？,Do you shoot the fire dragon?,0.2
"I was thinking I could \Ngive it to you, Carla...","ハァ…
すごいね ナツ","Hua ...
It's amazing",0.14285714285714285
You didn't have to go that far...,それには精神力を鍛え―,To do this-,0.09090909090909091
I wonder why...,ハァハァ ハァハァ…,Ha Ha Ha Ha ...,0.2
"Did I, maybe, do something wrong to you?","あっ… ねえ “一なる魔法”って
聞いたことある？","Ah ... Hey ""Aim""
Have you ever heard?",0.10526315789473684
"No, that's not it...","その調子です ルーシィさま
続けて","That's why Lucy
continue",0.2
What... I am?,想像すらできないもの…,I can not even imagine ...,0.2222222222222222
Where are you?,"ハデスも
そう考えることができたら―","Hades
If you can think so-",0.1111111111111111
Jellal!,あい！,love!,0.3333333333333333
"I mean, you're clearly Jellal!",見せてやるぞ～！,I will show you!,0.3
"I am Mystogan, a member of Fairy Tail.","妖精の尻尾の力を
見せてやるんだ～！","The power of the fairy tail
I will show you!",0.25
I...,ンンッ… 充実してるな,... I'm fulfilling,0.5
But... Now is not the time \Nfor happy reunions...,"ナハハハッ…
見てろよ ほかのギルドのヤツら","Naha ha ha ...
Let's see the guild's guy",0.11764705882352941
I have failed in my mission...,"この時代に追いつくのも
夢ではなさそうだ","I will catch up in this era
It seems not to be a dream",0.10526315789473684
Anima!,"ウワッ！
姫 大変です","Uwa!
It is a great princess",0.125
What?,"“まだ３か月もあるの？”って
感じね","""Is there still three months?""
I feel",0.09090909090909091
What's wrong?,"バルゴ
メイドの星霊","Bulgo
Maid's star spirit",0.125
No! I'm coming with you!,"アアッ！
どこから出てきてんのよ！","Ah!
Where are you coming out!",0.2727272727272727
"Before long, Magnolia will be wiped out...","その間 ずっと星霊界とやらに
いたってことになるのか","In the meantime, it is always a star spirit
Is it what will be",0.15789473684210525
It's over. The destruction \Nis already certain...,星霊界が滅亡の危機なんです,The flathelial world is a crisis of destruction,0.125
"At the very least, you could...",星霊界にて王がお待ちです,The king is waiting for at the stars,0.15384615384615385
What about Fairy Tail?,"なんだと？
そりゃ 一体…","what?
I'm out of ...",0.2
You know?,はぁ？,Has?,0.25
Let's scribble on his face!,"おっし 任せとけ
友達の頼みとあっちゃ…","Let's leave
Thank you for your friends and ...",0.13333333333333333
Tell me! What about everyone in the guild?,ここが星霊界？,Where is the star spirit?,0.14285714285714285
By myself? I could never think of it!,"なんで俺たちだけ…
置いてけぼり？","Why is we only ...
Put it?",0.125
Is there a fight?!,お前が ここの王か？,Is your king here?,0.2222222222222222
What are you muttering about?,“お前”って言った,"""You"" said",0.1111111111111111
"Was it you, Gray?",えっ？,eh?,0.14285714285714285
You bastard!,オーッ！,Oh!,0.25
"Cana, make sure to leave enough of your \N""boyfriend"" to serve guests, okay?",“滅亡の危機”って？,"""The crisis of destruction""?",0.15
Y-Yeah...,テヘッ…,Tehe ...,0.3333333333333333
"Elfman, we're leaving!",しかも星霊界のコス 最高！,"Moreover, the best cost of the star spirit world!",0.14285714285714285
It hurts to hear about it.,"ルーシィさまたちの帰還を祝して
私たちなりに考えていたのです","Lucy Celebrating the return of
He was thinking about it",0.14285714285714285
We suck so bad...,"だから 皆さんのほうを
星霊界に呼んだんです　すみません","So everyone
I'm sorry I called to the stars",0.07692307692307693
...such as it is.,な～んだ そういうことか,What is that?,0.1111111111111111
Ouch!,ピーリ ピーリ！,Peely Peep!,0.25
I wonder.,びっくりさせやがって,I'm surprised,0.2
"Oh, right.",さあ 今宵は大いに飲め,"Come on, drink greatly",0.125
Lisanna?,元気だったか？,How was it?,0.2
Mira and Elfman's little sister.,歌え　騒げや騒げ,Singing and baking,0.1111111111111111
"Now that you mention it, you \Nremind me a bit of Lisanna.","あのときは
どうも ありがとうございました","At that time
Thank you very much",0.1111111111111111
I do?,“失礼しました”と申しております,"""I'm sorry""",0.14285714285714285
Damn it... That guy's got too much energy...,いや あれは その…,That's that ...,0.3
"So Natsu used to have a girl, huh?",男は できたかい？,Have you made a man?,0.23076923076923078
Can't you eat it without \Ngetting it everywhere?,あ～あ 情けないね,"Oh, I can't get angry",0.14285714285714285
This is the first time Juvia has eaten it.,"寝た！
大丈夫 考え中だから","slept!
Because it is all right",0.13333333333333333
There they go again...,"わあ いっぱいいる！
わあ！ ハハハッ…","There is a lot!
Wow!Hahaha ...",0.18181818181818182
We are?,そうか？,Really?,0.25
It's about that 100-year quest...,"そっちは
ハマルソースの子羊ステーキです","What about that one
It is a lamb steak of Hamar Source",0.1875
"I've been looking into it, and...",ウッ… ごめんなさい！,Uh ... I'm sorry!,0.15384615384615385
Any objections?,私のプルー どれだろう？,What is my pluer?,0.14285714285714285
I wish something interesting would happen...,あっ… フフッ…,Oh ... Fuhu ...,0.1111111111111111
Anima is...,♪ あなたの為の星だから,♪ Because it is a star for your,0.1
Why am I the only one?,みんな 大好き,I love everyone,0.1111111111111111
"Oh, Wendy...",変なプルーが離れないよ…,I can not leave a strange pull ...,0.09090909090909091
You don't remember anything?,食ったのか？ 食ったのか お前…,Did you eat?Do you eat?,0.375
"Well, I was asleep.",苦労してんだね あんた,I'm struggling,0.125
This is the guild.,私 この服 欲しいです,I want this clothes,0.125
No!,うん！,Yes!,0.3333333333333333
"Thank goodness, you're safe...","皆さん ルーシィさんを
これからも よろしくお願いします","Everyone Lucy
She thank you from now on",0.15384615384615385
You should thank the special magic \Npower you have as a Dragon Slayer.,またギルドに顔を出すよ,I will give you a face to the guild,0.15789473684210525
I'm glad that at least you two are safe.,"本当に
お前は 星霊に愛されているな","very
You are loved by the star spirit",0.11764705882352941
Carla...,では…,In ...,0.3333333333333333
"Hey, everyone!",みんな 最高の仲間だよ,Everyone is the best friend,0.125
"They're gone. Or, more precisely...","さぁて だいぶ遊んじまったし
帰ったら たっぷり修行しねえとな","Well, I played
If you return, you're just doing",0.11764705882352941
The hole in the sky from before.,"星霊界は
人間界とは時間の流れが違うのです","The stars
The flow of time is different from the human world",0.13333333333333333
"It's the gate to Edolas, the \Nworld on the other side.","そうだ　３か月で ほかのギルドの
ヤツらに追いつかねえと","That's it three months in other guilds
Having caught up with the guys",0.18181818181818182
Where is everyone?,夢のような修行ゾーンなのか？,Is it a dream-like training zone?,0.2222222222222222
Happy!,みんな 待ちくたびれたぜ！,Everyone waited for it!,0.16666666666666666
"You're safe, I see.",３か月たってます,I have three months,0.1
"I've come from the other world, Edolas.","星霊界で１日過ごすと
人間界では―","When I spend a day in the star spirit world
In the human world-",0.15789473684210525
"Natsu, have you heard there's another \Nworld that resembles this one?","ねえ ナツ
エルザをからかいに行こうよ","Hey Natsu
Let's go from Elsa",0.10526315789473684
"I've heard it's a world that's kind of \Nlike ours, but with some differences...","俺は やるぞ！ …て あれ？
エルザが いなくねえか？","I will do it!... that?
Is Elza no she?",0.15384615384615385
"So, what about this something-or-other world?",すっごく痛いらしいけどね,It seems to be so painful,0.07692307692307693
"If you're a king, Happy, then I'd be a god!","引き出してもらえば
なんとかなるって","If you pull it out
What to do",0.10526315789473684
