en_text,jp_text,google_translated,score,semantic_score
"We're gonna be killed...
If I don't stop him, we'll die.","（衛宮(えみや)士郎(しろう)）
殺される！
こいつを止められなければ死ぬ！","Shiro )
be killed!
If you can not stop this, die!",0.25,0.48333263
Not just me...,くっ…,...,0.25,0.2753548
"A weapon...
I want a powerful weapon.",武器… 強い武器が欲しい！,Weapons ... I want a strong weapon!,0.5,0.89693666
"I shall use this girl as my human sacrifice
to call forth the Grail.","（キャスター）
この娘は聖杯を呼ぶいけにえに
もらっていくわ","This daughter calls the Holy Grail
I'll get it",0.19047619047619047,0.63073504
"If you wish to take her back,
come to my temple!","取り返したければ
私の神殿にいらっしゃい","If you want to get back
I'm in my temple",0.35294117647058826,0.6754048
"So, this is the end...",これまで… ね…,So far ... Ne ...,0.2222222222222222,0.32982284
"What are you
doing out here?","（葛木(くずき)宗一郎(そういちろう)）
何をしている？",")
What are you doing?",0.625,0.7911813
"It was raining that day, too,
wasn't it?",あの時も雨… でしたね,It was rainy at that time ...,0.2307692307692308,0.72621465
Can you drink this?,"（葛木）
飲めるか？",Can you drink?,0.8,0.847569
"If you tell me to forget I ever saw you,
I'll forget you.",忘れろと言うのなら 忘れよう,Let's forget if you say,0.2,0.62208843
"Go out that door and walk straight ahead,
and it will take you outside.","そこの扉を出て
真っすぐ行けば外だ","Out of the door there
It is out of right if you go straight",0.2857142857142857,0.46815276
"Please, wait.",待って,wait,0.25,0.6236286
"Yes, what?",何だ？,What?,0.5,0.6020971
Your umbrella...,"（キャスター）
傘は…",Umbrella ...,0.6666666666666666,0.8963528
Do I need one?,"（葛木）
必要か？",Do you need it?,0.42857142857142855,0.7574383
I suppose not.,あとは 好きにするがいい,I hope I like it,0.14285714285714285,0.0979667
"Kirameku namida wa
hoshi ni.",♪～,♪ ~,0.0,0.22721535
"Episode 18:
Decisive Battle",～♪,~ ♪,0.0,0.12322504
You can sense it?,神殿か？,Is it a temple?,0.25,0.16147384
"Caster said it herself, right?
She's going to sacrifice her.","キャスターの奴が言ってたでしょ
“いけにえにする”って","The guy of the caster said
""I'm going""",0.15,0.54720604
"But why did Caster abduct Sakura
in the first place?",しかし キャスターは なぜ桜を？,But why is the Caster?,0.4166666666666667,0.57328403
"I was under the impression that Sakura
had no abilities as a Magus.","桜には 魔術師としての力は
なかったのではないですか？","For cherry blossoms, the power as a magician
Isn't it not?",0.12,0.2828982
"But she DOES have
magic circuits.",魔術回路は残っているのよ,The magic circuit remains,0.1,0.6470742
"After all, she's from a
long line of Magi, too...","あの子だって…
魔術師の家系なんだから","That child ...
Because it is a sorcerer's family",0.15,0.2837338
"We don't have time
to stand around.","ぼやぼやしている
時間はないわよ","Blurred
I have no time",0.16666666666666666,0.22504991
"Rin, what is it?","（セイバー）
凛　どうしたのです？",How is it?,0.42857142857142855,0.22490795
This way!,あっ！,Ah!,0.25,0.31460884
Be quiet.,黙って,shut up,0.0,0.36421442
What's that?!,な… 何だ？,... What?,0.3333333333333333,0.4749379
"It's another temple...
Isn't it, Rin?","別の神殿が…
そうなのですね？　凛","Another temple ...
That's right, right?Rose",0.4615384615384616,0.694905
I smell blood...,血のにおい…,Blood smell ...,0.75,0.8667004
The Holy Grail desires you.,聖杯が あなたを欲しているわ,The Holy Grail wants you,0.5714285714285714,0.8949388
On your feet.,立ちなさい,Slay,0.0,0.22461596
"So, this is Caster's temple?","（セイバー）
これが… キャスターの神殿？",This is ... Temple of Caster?,0.5,0.94166756
"How in the world did
she make this?","（士郎）
こんなものを どうやって…",How do they do this?,0.2727272727272727,0.30695516
Magic?,"（凛）魔術よ
（士郎）魔術？","Magic
 magic?",1.0,0.92893136
"Yes. She used the mana she's
stored up to create all this.",まずは雑魚が相手ってわけね,"First of all, the miscellaneous fish is the other party",0.09523809523809523,0.19200635
Got it.,来るわよ,It will come,0.2,0.22403446
"What would you
have me do?",何をすればいい？,What should I do?,0.3333333333333333,0.4724556
"When it comes to the Holy Grail,
I know nothing.",聖杯について 私は何も分からん,About the Holy Grail I do not know anything,0.3125,0.9004432
"I will follow
your directions.",お前の方針に従おう,Follow your policy,0.2857142857142857,0.31098711
"Very well. In that case, might I
offer a suggestion, Master?","ならば １つ提案があります
マスター","If so, there is one suggestion
Master",0.15789473684210525,0.6297438
"Saber!
Above you!","（凛）セイバー 上！
（セイバー）分かりました　凛","Saber on Saber!
 I understand",0.2857142857142857,0.769915
Shirou!,"（セイバー）士郎！
（士郎）うっ…","Shiro!
 Uh ...",0.2,0.702091
Where is he?,どこだ？,Where's?,0.4,0.50135905
You needn't worry.,"（アサシン）
安心しろ",do not worry,0.14285714285714285,0.5460005
"I wouldn't dream of doing something so
dishonorable as striking without warning.",不粋なマネはせぬ,I do not think,0.05882352941176471,0.15370527
Assassin...,アサシン,Assassin,0.5,0.884737
"Why are you surprised? You should know
full well that I am the gatekeeper here.","私が門番だと
お前は承知しているはずだが","If I am a gatekeeper
You should be aware",0.25,0.7266822
"Abide, miss.",待て 娘,Wait and daughter,0.0,0.25017923
"What are you
talking about?","（アサシン）
何を驚いている？",What are you surprised?,0.5714285714285714,0.2613669
"My duty here is to
eliminate Servants.","（アサシン）
私の役目は
サーヴァントの撃退でな","My role is
Don't repel the Servant",0.14285714285714285,0.714972
"I intend to face Saber, the
most capable of all Servants.","最優のサーヴァント
セイバーを相手にするのだ","Most of the Servant
I will deal with Saber",0.29411764705882354,0.8496336
"Surely it would be no fault of my own
if a human or two were to slip past me.","１人や２人 通してしまうのは
仕方なかろう","One person or two people will
How to do it",0.15384615384615385,0.18395829
Saber...,"（セイバー）士郎 凛　先へ
（士郎）セイバー","To Shiro
 Saber",0.25,0.65351635
Understood.,はい,Yes,0.0,0.24091525
"I merely wish to enjoy my fight with you
for as long as possible.","お前との戦い
少しでも長く楽しみたいだけのこと","Fight with you
I just want to enjoy a little longer",0.3157894736842105,0.7489176
"There is a limit to the mana possessed
by this body of mine,",サーヴァントに召還された この身,This body summoned to the Servant,0.25,0.4654249
"It is likely that it will not
even last until morning.",おそらく 朝まではもつまい,Perhaps it is good until morning,0.3076923076923077,0.6445008
Sakura!,あっ 遠坂！,Misaka!,0.3333333333333333,0.53935933
"Shirou, you...",うっ…,Uey ...,0.2,0.30954117
"Nicely blocked. You seem accustomed
to being ambushed.","（葛木）
奇襲には慣れているようだな",It seems to be accustomed to surprise,0.15384615384615385,0.2515767
Don't be stupid!,"（凛）士郎は下がってて
（士郎）バカ言うな","Shiro is lowered
 Don't speak stupid",0.3333333333333333,0.2317702
"Hurry and go
to Sakura!",早く桜の所へ行け,Go to the place of cherry blossoms early,0.16666666666666666,0.34183332
"Shirou... Are you trying
to play the hero here?",まさか カッコつけてるつもり？,Are you going to wear it?,0.2857142857142857,0.10721631
"I could say the same
about you!","（セイバー）
うっ ふっ えいっ！",I'm sorry!,0.2,0.31169456
"""Kojiro,"" you said
your name was?",小次郎(こじろう)… といいましたね？,Kojiro  ... is it good?,0.14285714285714285,0.51523423
"Please, call me Assassin.
It's a pseudonym, anyway.","（アサシン）
フッ アサシンでよい
しょせん偽りの名だ","It is good
It is a false name",0.13333333333333333,0.4230145
A pseudonym?,"（セイバー）偽り？
（アサシン）いかにも","? False?
 How",0.2,0.06752239
"Indeed. The man named Kojiro Sasaki
does not exist.","佐々木(ささき)小次郎などという人物は
実在しない","Sasaki  Kojiro etc.
Unrealistic",0.25,0.69170004
"Then you are a fictional
Epic Hero?",では あなたは架空の英霊,So you are a fictional speech,0.4,0.60109234
"Yes. I have no place to return to,
nor any wishes I desire granted.","そう　戻るべき場所も
かなえるべき願いもない","Your place to be back
There is no wish to make",0.14285714285714285,0.5584198
"I am but a nameless swordsman who
was given the name Kojiro Sasaki!","過去をねつ造し
人々の記憶だけで剣豪とされた人物","Start of the past
A person who was a swordsman with only the memory of people",0.2272727272727273,0.46390545
"And so... this battle,
THIS is what I wish for!",この戦いこそが！,This battle is!,0.3333333333333333,0.68662953
"On the contrary, it is YOU who
are the inscrutable one here.","（アサシン）
むしろ解せんのは お前だ
セイバー！","It is you to understand rather
Saber!",0.16666666666666666,0.2142104
"For what reason do you
take up your sword?",何が お前に その剣を握らせる？,What do you hold your sword?,0.5454545454545454,0.78862685
What I want...,うっ… 私は…,Uh ... I ...,0.4,0.33358064
My wish is...,私の… 望みは…,My ... hope is ...,0.6,0.5500146
"Yes, I am right behind you.","（キャスター）
ええ　あなたの後ろに",Yes behind you,0.375,0.7346264
"Welcome. Your precious Sakura
has been eagerly awaiting you.","ようこそ　お待ちかねよ
あなたの大切な桜さんが","Welcome you
Your important cherry blossoms",0.2307692307692308,0.4235315
"So, it looks like you know
everything about all of us.","どうやら 私たちのことは
全部お見通しのようね","Apparently we
It looks like a whole visit",0.16666666666666666,0.37630177
"Yes. I took the liberty of rummaging
through the girl's head.","（キャスター）
ええ　あの子の頭の中を
のぞかせてもらいましから","Yeah in the head of that child
Because I'm sorry",0.21052631578947367,0.40018398
"I have no intention
of fighting you.","あなたと
戦うつもりなんてないわ","You and
I'm not going to fight",0.14285714285714285,0.6383698
"If you wish to take her away,
feel free to do so.","連れていきたいのなら
どうぞご自由に","If you want to take
just as you like",0.2352941176470588,0.30951753
"Of course, I don't know if this
girl wishes to go or not.","もっとも この子が行きたいと
言うかどうかは知りませんけど","If this child wants to go
I do not know if she says",0.4,0.67724776
"The person you have been waiting for
all this time has finally come.","来たわよ
あなたがずっと待ってた人が","I came
People who have been waiting forever",0.15789473684210525,0.7249142
Sakura?,"（凛）
桜…",Cherry blossoms…,0.0,0.27845663
"I don't have much choice...
This might hurt a little.","しょうがない
少し痛いかもしれないけど","It can not be helped
It may be a little painful",0.1,0.33822343
Set!,"（殴る音）
（士郎）うっ！",!,0.5,0.46950114
"If you don't hurry, she will be
drained dry of mana by the Holy Grail.","早くしないと 聖杯に魔力を
全部 吸われてしまうわよ","If you don't go fast, you can
It will be sucked everything",0.2916666666666667,0.30163032
"Why did you become
a Master?","ううっ…　あんた
どうしてマスターになった？","Uh ...
Why did you become a master?",0.7777777777777778,0.9578959
"You're not a Magus, and you're not
interested in the Holy Grail!","魔術師でもなく
聖杯に興味もない あんたが","As a magician
He is not interested in the Holy Grail",0.4117647058823529,0.66487867
Good question.,"（葛木）
そうだな",Yes,0.0,0.27586615
"For the same reason
you did, I suppose.",おそらくは同じだろうな　お前と,Perhaps the same thing,0.16666666666666666,0.26765975
I'm nothing like you!,"（士郎）
俺は お前とは違う！",I'm different from him!,0.3333333333333333,0.48088259
"You're wrong!
You and I are nothing alike!",俺と お前とでは…,I and you ...,0.3,0.32667506
"You appear to be out of time,
young lady.","（キャスター）
どうやら時間切れね　お嬢さん",Apparently the time out,0.15384615384615385,0.40197378
"Sechs! Ein Fluß!
Ein Halt!",うわあっ！,Wow!,0.16666666666666666,0.055528715
"If I don't do something, the Holy
Grail is really going to...",このままじゃ… 本当に聖杯に…,This is true ... really to the Holy Grail ...,0.4375,0.68086267
"To a Magus... To a Magus, what's
most important isn't their life.","魔術師にとって一番大切なのは
命じゃない","The most important thing for magician
Not a life",0.2222222222222222,0.49290538
"What they have to protect
is the sanctity of their soul!","守らなくては いけないのは
魂の尊厳","I have to protect
Soul dignity",0.2857142857142857,0.6152054
Sakura... Matou?,そう　間桐桜,Sakura,0.25,0.8249059
Weltende!,はあーっ　はっ！,Oh yeah!,0.25,0.24231869
"I'm sorry.
I'm sorry...",独りぼっちにして…,I'm alone ...,0.5,0.47221947
"I guess I'm a weakling, too...",甘いな… 私も,Sweet ... I too,0.3333333333333333,0.27966222
"Forget everything.
The bad dream is over now.",もう悪い夢は終わりだから,Another bad dream is over,0.4,0.77789605
It's okay.,さあ,here we go,0.0,0.17867218
"For my human sacrifice, I only require one
Magus with magic circuits, young lady.","いけにえは 魔術回路を持つ
魔術師が１人いればいいのよ","Saken has a magic circuit
I wish I had one magician",0.13043478260869565,0.4989385
"Fukai fukai mori no naka
honoka kaoru itoshii...","（キャスター）
ウッフフ…",Uphfu ...,0.1111111111111111,0.2068527
