en_text,jp_text,google_translated,score
"Bad news, Brother!",大変だ！ 兄さん！,It's hard!Brother!,0.25
"Ed, do you know him?",エドの知ってる人？,People who know Ed?,0.3333333333333333
That means...,てことは…,...,0.3333333333333333
"Where do you think you're going, Ed?
I can tell everything you're going to do.",どこへ行くつもりだ？ エド,Where are you going to go?Ed,0.35294117647058826
S. Sensei...! What are you doing here?,せっ 先生… どうして ここへ？,Supreme ... Why here?,0.25
Sensei?,じゃあ この人？,Then this person?,0.2
She's our alchemy teacher.,俺たちの錬金術の師匠だよ,Our alchemy teacher,0.5
Where is Al!?,アルは どこだ！,Where is Al!,0.8
"Yes, Ma'am!",は… はい！,... Yes!,0.4
"Oh, I beg your pardon.",あっ いや すみません,I'm sorry,0.1111111111111111
"Thanks for leading us here,
when you must be so busy.","お忙しいところ
ご案内していただいて","Busy place
Please guide me",0.058823529411764705
Do you know where Al is as well?,アルの居場所も ご存じで？,Do you know the place of Al?,0.4166666666666667
"Um, you see, I am Alphonse...",僕が… アルフォンスです,I am ... Alphonse,0.5
"Ah, is that so? My, my...",あっ あの その…,That's that ...,0.2222222222222222
"Were you trying to escape
by disguising yourself!?",変装して逃げるつもりだったのか！,Did you intend to disguise and run away!,0.1875
"Man cannot obtain anything
without first sacrificing something.","人は何かの犠牲なしに
何も得ることはできない","People are without any sacrifices
I can not get anything",0.25
"In order to obtain anything,
something of equaI vaIue is required.","何かを得るためには
同等の代価が必要になる","To get something
Equivalent of equivalent",0.2
"That is aIchemy's
Law of EquivaIent Exchange.","それが
錬金術における等価交換の原則だ","that is
Principles of equivalence exchange in alchemy",0.3333333333333333
"At the time, we beIieved that
to be the true way of the worId.","そのころ 僕らは
それが世界の真実だと信じていた","At that time we
I believed that it was the truth of the world",0.3
"Starting next week,
you'll be serving in Central, huh?",君 来週から セントラル勤務ね,Please work from next week,0.13333333333333333
Yes.,はい,Yes,0.5
Not at all.,待ったなしですよ 将軍,I have not waited for a generals,0.1
"Not as much as when you
were younger, General. Check.",チェック,check,0.09090909090909091
"It's now or never, General.","いえいえ
将軍のお若いころほどでは…","Hence
In the young man of the general ...",0.06666666666666667
"And here with all of your work,
I was able to take it easy.","君の働きのおかげで
わしも楽ができたのにな","Thanks to your work
Even though I could enjoy it",0.23809523809523808
You have my deepest sympathy.,ありがたく頂戴します,Thank you very much,0.1111111111111111
Checkmate.,チェックメイト,Checkmate,0.5
"I've lost after all, eh?",あ〜 とうとう負けたか,"Oh, finally lost",0.2
Your one victory is my parting gift.,この１勝は餞別だな,This one wins are 餞,0.08333333333333333
General...,"将軍
ん？","General
Yeah?",0.25
"I have some subordinates that I would
like to take with me to Central.","餞別ついでに セントラルに
連れていきたい部下がいるのですが","In the central basis
I have a subordinate to take",0.2777777777777778
"Mm.hmm, sure. Take it.",持ってけ,Take,0.16666666666666666
Are you two all right?,大丈夫？ ２人とも,All right?Both of them,0.3333333333333333
Damn...,痛て…,It hurts ...,0.25
She even took away my silver watch.,"クッソ〜！
銀時計も取り上げられちまったしよ","Kusso ~!
Silver watch has also been taken up",0.125
I guess we're going straight to Dublith.,"僕たちが先生に弟子入りしたの
リゼンブールなんだよ","We had a disciple to the teacher
It is a Lisen Boolean",0.1111111111111111
"Still, I'm surprised. I expected
your teacher to be someone rougher,","先生が来るだなんて
思いもしなかったよね 兄さん…","The teacher comes
I didn't think I'm an older brother ...",0.13636363636363635
not a pretty lady like her.,あんなきれいな人だなんて,It's such a beautiful person,0.08333333333333333
"What are you talking about?
You've met her before, you know.","何 言ってんだ
前に会ったことあるだろ？","What are you saying
Have you ever met before?",0.375
Resembool?,リゼンブールで？,Is it Lisen Bool?,0.16666666666666666
"Remember, when we had
all that heavy rain?",ほら あの大雨のとき…,When the heavy rain ...,0.25
"ECW, 26%; ICW, 34%;
lipids, 19%; proteins... um...","ＥＣＷ 26パーセント
ＩＣＷ 34パーセント","ECW 26 percent
ICW 34%",0.38461538461538464
"Wouldn't it be quicker if we just went
with the elements composing a human body?","人体の構成成分からやったほうが
早いんじゃないか？","It is better to do from the component of the human body
Isn't it early?",0.24
"Say, what have you been
studying so hard about lately?","ねえ 最近
何を 一生懸命 勉強してるの？","Hey recently
What are you working hard?",0.25
"..It's a secret!
..It's a secret!",秘密！,secret!,0.4
"You sneaks! You're always
keeping secrets between you two!",ずるい！ いつも２人で内緒にして,Unfair!Always in secret with two people,0.21428571428571427
Yay!,ヘヘヘッ じゃあね！,Hyehehe!,0.3333333333333333
Okay! We'll see you later!,"やった！
おう！ またあとでな","Hooray!
King!Again later",0.2
Whoever invented stew is great!,シチューを発明した人は偉大だ！,Those who invented stew are great!,0.4444444444444444
What are you going on about?,何だよ？ それ,What?that,0.25
"The idea of sticking milk
into vegetable soup was awesome!","野菜スープに牛乳なんか突っ込む
っつう考えが すげえよ","Milk in vegetable soup
She thinks that she",0.2
We can't make it on our knowledge alone.,僕たちの知識だけじゃ 無理だよ,It is impossible only for our knowledge,0.21428571428571427
"I wonder what we're missing
for human transmutation.","何が足りないんだろうね
人体錬成…","What is not enough
Human body smelting ...",0.125
"Why is human transmutation
forbidden in the first place?","そもそも なんで
人体錬成は禁じられてるんだ？","Why
Are you prohibited by human body smelting?",0.1875
"Isn't it because it's a
dangerous transmutation,","成功した人がいない
危険な錬成だからじゃない？","There is no successful person
Isn't it because it is dangerous smelting?",0.3333333333333333
"Remember, they say that a whole country
was destroyed in one night...",ほら 一夜で国が滅んだっていう…,The country says that the country will be destroyed in the evening ...,0.2631578947368421
"The story of the Philosopher's Stone
in the eastern desert, right?",東の砂漠の賢者の石の話か？,Is it a sage stone of the east desert?,0.29411764705882354
"Right, right. It tells of them
trying to create a complete human,","完全な人間を作ろうとして
国民が巻き込まれたってさ","Trying to make a complete person
The people were caught up",0.2
That's just a fairy tale.,あんなの ただのおとぎ話だろ？,It's just a fairy tale?,0.5555555555555556
His formulas...,あいつの式…,Atsushi ...,0.25
If we can make sense of this...,こいつが解読できれば…,If this guy can decipher ...,0.4
"But it's written there,
that human transmutation is forbidden.","でも… やっぱり 書いてあるよ
人体錬成は禁じられているって","But ... I'm writing after all
Human body smelting is prohibited",0.14285714285714285
"I've made up my mind, Al.",決めただろ アル,I decided,0.1
We're going to go help!,俺たち 手伝ってくる！,We will help you!,0.3333333333333333
"Hey, what are you doing!?
It's dangerous there!",おい 何してんだ？ 危ないぞ！,What do you do?I'm dangerous!,0.3333333333333333
All right...!,"お… おい！
ん？","Oh ...!
Yeah?",0.2857142857142857
Brother!,兄さん！,Brother!,1.0
"This is dangerous, so please keep back.",危ないから離れててください,Please leave it because it is dangerous,0.25
That's what I should be saying to you!,そりゃ こっちのセリフだ,That's a line here,0.15384615384615385
Whoa...,ああっ…,Oh ...,0.3333333333333333
"She didn't even use a
transmutation circle...!",う… ブハッ！,Wow ... Buha!,0.16666666666666666
"That huge amount of mass,
all at once...!",こんな大質量を 一瞬で…,In an instant of such a large amount ...,0.17647058823529413
That should hold it for a while.,これで しばらく もつでしょう,It will be a while with this,0.25
Unbelievable. Who are you?,信じられねえ… あんた 何者だ？,Having believed ... who is it?,0.18181818181818182
Just a couple who are passing through.,通りすがりの主婦です,It is a housewife of passing,0.16666666666666666
"..Where is your hospital!?
..A doctor! Get a doctor!",病院は どこだ！,Where is the hospital!,0.25
"You really saved us.
Resembool is in your debt.","ああ 本当に助かったよ
あんたはリゼンブールの恩人だ","Oh it was really saved
You are a lisen Boolean benefactor",0.16666666666666666
Who are you calling your Auntie!?,誰が おばさんだって？,Who is the aunt?,0.18181818181818182
We're sorry...,ごっ ごめんなさい…,I'm sorry ...,0.3333333333333333
...Sissy.,で… 弟子にしてください！,.... Please be a disciple!,0.25
We're able to use a little alchemy.,"僕たち
少しだけ錬金術が使えるんです","We
A little alchemy can be used",0.3333333333333333
No way.,"ダメ！
うっ…","No good!
Uey ...",0.14285714285714285
Why not!?,どうして？,Why?,0.5
"I don't take on pupils. We have a store,
so we have to be getting back to Dublith.","店もあるから
ダブリスに戻らないといけないし…","Because there is also a store
I have to return to Dublis ...",0.2
"..Take us with you! Take us as pupils!
..Take us with you! Take us as pupils!",連れってって！ 弟子にして！,Take it!Make a disciple!,0.16666666666666666
"If you do learn alchemy,
what do you two want to do with it!?","大体 錬金術を習って
何をしたいの？ あんたたちは","Learn alchemy
What do you want to do?Anti",0.5333333333333333
We want to be helpful to others!,ひ… 人の役に立ちたい！,... I want to be a person's helpful!,0.4166666666666667
What about your parents' permission?,両親の許可は？,What is the permission of your parents?,0.5
"Well, about that...",えっと…,Well ...,0.4
I'm the one who looks after them now.,今は私が 面倒 見てるんだ,I'm taking care of me now,0.21428571428571427
"One month... Can I take them
for provisional training?","１か月 仮修行ってことで
私に預けてくれますか？","By taking 1 month postproduction
Can you leave me?",0.16666666666666666
"To see if it's really worth
teaching them alchemy.",本当に錬金術を教えるに値するか,Do you really want to teach alchemy?,0.1875
And if they don't have any talent?,もし 才能がなかったら？,If there is no talent?,0.25
And if we pass our provisional training?,仮修行に合格したら？,If you pass the temporary course?,0.25
I knew you'd say that.,言うと思ったよ,I thought to say,0.2222222222222222
"..Training! Training!
..Training! Training!",修行！ 修行！,Conduct!Conduct!,0.25
"I'm sure there must be
a huge laboratory there!","きっと
でっけえ研究所があるんだぜ","surely
There is a laboratory",0.25
And maybe we can read lots of books!,本も いっぱい読めるかな？,Can you read a lot of books?,0.3076923076923077
That's right!,そりゃあそうだ　修行だからな,That's because it is training,0.25
"without even a transmutation circle, huh?",先生 もしかして 国家錬金術師？,Teacher also a national alchemy?,0.16666666666666666
"Don't you include me in
with those dogs of the military,",軍の狗と一緒にするな！,Don't be with the army of the army!,0.3125
"who can calmly take
people's lives if ordered to!","命令とあれば
平気で人の命も奪うような","If it is an order
It seems that people's lives are",0.2222222222222222
I see. That person from back then...,そっか あのときの人が…,There is a person at that time ...,0.21428571428571427
I'm loose.,逃げるぞ アル,I'll run away,0.14285714285714285
All right!,よし！,OK!,0.25
"Looks like you still haven't
learned your lesson, huh?",何すか？ ありゃあ,What do you do?There,0.14285714285714285
"I heard it's a style of chess
from the eastern island countries.",東の島国式チェスだとさ,It is said that it is the East Islandary Chess,0.15789473684210525
"That sure was fun the other night, huh?
So, about this weekend...",でさ 今度の週末なんだけど…,That's right now on the weekend ...,0.21052631578947367
"Ah, hello. I'm a little
busy right now...","あ〜 もしもし？ ちょっと 今
立て込んでるんですが…","Oh yes?A little
I'm standing ...",0.3125
Thank you so much.,ありがとうございます！,Thank you!,0.3333333333333333
"by all means, please include me too!",ぜひ 私も加えてください！,Please add me by all means!,0.6
"When you were in the
Investigations Department,","君は調査部時代
ヒューズの部下だったな","You are the Survey Department
It was a part of the fuse",0.1875
Come in.,入れ,Get in,0.25
"Master Sergeant Kain Fuery,","ケイン･フュリー曹長
ハイマンス･ブレダ少尉","Kain Furie Sunsman
High Mans Breda",0.1
"Second Lieutenant Jean Havoc,","ジャン･ハボック少尉
リザ･ホークアイ中尉","Jean Havok lie
Liza Hawk I",0.1
"It has been decided that these five
will transfer with me to Central.","私と共に
セントラルへ異動が決まった","With me
Changes in Central were decided",0.23529411764705882
I will accept no objections.,文句は言わせん,I am not complaining,0.1111111111111111
"I get chills just thinking
about what's going to happen now.",とうとう逃げられなかったね,I was not able to escape,0.11764705882352941
Sensei!,先生〜！,teacher~!,0.3333333333333333
Menny! How is Chico doing?,メニイ！ チコの様子は どうだい？,Meni!How is the state of Chico?,0.45454545454545453
Izumi.san!,イズミさん！,Izumi!,0.3333333333333333
Welcome back!,"おかえりなさい
メイスンさん！","welcome home
Mr. Mison!",0.3333333333333333
You've really grown a lot!,あれ？ エドワード君 久しぶり！,that?Edward you're a long time!,0.23076923076923078
Huh? Who is this in the armor?,あれ？ こっちの鎧の人は？,that?What is the person of this kite?,0.3076923076923077
"Er, his younger brother, Alphonse.",えっ あ… 弟のアルフォンスです,Yes ... My brother's alphonse,0.18181818181818182
Huh? Aren't you eating?,あれ？ 食べないの？,that? Are not you going to eat?,0.2727272727272727
N. no...,え？ あ… ああ,picture?Oh ... ah,0.14285714285714285
Just eat it.,いいから 食え,I can eat it,0.3333333333333333
I'm already full.,"あっ 僕は おなかいっぱいで
アハハハ…","Oh, I'm full of stomach
Ahahaha ...",0.2727272727272727
"You've had quite a brutal journey,
haven't you?","へえ！
随分と殺伐とした旅をしてたんだね","Hey!
I had a trip to kill a lot",0.1111111111111111
"But it hasn't been all terrible.
We've also helped people. That's right,","でも
ひどいことばかりじゃないですよ","but
It's not a bad thing",0.14285714285714285
we helped in the delivery of a baby.,"僕たち 赤ん坊を取り上げるの
手伝ったんですよ","We take up our baby
I helped helped",0.23076923076923078
"That's true. But then, the family
helps out as the mother risks her life,","でも 家族が協力して
母親も命を懸けて","But my family cooperates
My mother also lives",0.15
"and everyone is blessed
when a person is born.","みんなに祝福されて
人間は産まれてくるんですね","Bless everyone
Humans are born",0.16666666666666666
"That's right. That's the way
you guys received life, too.",そうだよ,that's right,0.25
Take pride in the life you have.,"お前たちも
そうやって生を受けたんだ","You
I was raw a life",0.16666666666666666
"Now that you mention it,
Izumi.san, do you have any children?","そういえば イズミさんは
お子さん いないんですか？","Speaking of that, Mr. Izumi
Children do not have she?",0.3333333333333333
"Hey there, you know, this...!",これ！,this!,0.25
"Alchemy! You must have
gotten better, right?",錬金術！,alchemy!,0.2
Show me something!,"あれから上達したんだろ？
見せてくれよ","Was it up from that?
Show me",0.2
"I'll come, too.",私も行く,I go,0.14285714285714285
Izumi...,イズミ…,Izumi ...,1.0
"Those children had themselves
a nice experience.",いい経験をしたね あの子たちは,I had a good experience,0.3
I'm next.,へえ！ 上手くなったじゃないか,Hey!I'm getting better,0.25
Welcome home!,"先生 おかえり！
おかえりなさい！","Teacher Welcome!
welcome home!",0.75
"Sensei, my train is broken. Fix it.",先生 僕の汽車 壊れちゃった,Teacher my train broken,0.3
"The axle broke, huh?",車軸が折れたのか…,Is the axle broken ...,0.2222222222222222
Fix it with alchemy!,え〜！ 錬金術で直してよ,Huh~!Return with alchemy,0.42857142857142855
"Nuh.uh. Don't rely on
alchemy for everything.","ダ〜メ！
何でも錬金術に頼らないの","No good!
Everything does not rely on alchemy",0.2857142857142857
"Fix whatever you can fix
by yourself on your own.","自分の手で直せるものは
自分で直す","What can be done with your own hand
Reconcile",0.1875
"Well, excuse me. If you don't
want it fixed so ungracefully,","こんな下手っぴに
直されたくなかったら","Such a bad
If you do not want to fix",0.15
"be more careful with it
so it doesn't break.",壊れないよう 大切に扱いな,It is important to be careful not to break,0.2857142857142857
"Sensei, thanks!","先生！
ん？","teacher!
Yeah?",0.14285714285714285
I'll be back when I break it again!,壊したら また来るね！,If you break it again!,0.36363636363636365
"What's the matter, Menny?",どうしたの？ メニイ,What's wrong?Menie,0.3333333333333333
Chico... It's Chico!,チコが… チコが…,Chico ... Chiko ...,0.3333333333333333
Nice catch!,ナイスキャッチ！,Nice catch!,1.0
Chico... Chico...,チコ… チコ？,Chico ... Chiko?,0.5
"Sensei, fix Chico!",だったら チコだって！,"If so, it's chick!",0.2
"Izumi.sensei, you can
make anything, right?","イズミ先生は
何でも作れるんでしょ？","Izumi teacher
Can you make anything?",0.5
I can't do that.,それは できないよ,I can not do that,0.375
"A life is different from a thing,
you see, and I am not God.",命と物は違うし 私は神様じゃない,Life and things are different and I am not God,0.4117647058823529
But...,だって…,Because ...,0.3333333333333333
"I cannot create a life for Chico,","チコの命は
作ってあげられないけど…","Chico's life
I can not make it, but ...",0.42857142857142855
but I can make a grave for her.,お墓は作ってあげられるね,You can make a grave,0.4
"The body wiII return to the earth,
where fIowers wiII bIoom on top it.","生きていれば
いつか命は尽きて 肉体は土に還り","If you live
Someday life is exhausted and the body redresses to the soil",0.125
"and continue to Iive on
inside their hearts.","魂は思いという糧となり
人々の心に生き続ける","The soul is a food
Skut on people's hearts",0.11764705882352941
"PeopIe's Iives are Iike that, too.",人の命も またしかり,People's lives again,0.08333333333333333
"Even though I know
as much about it as I do,","自分では
こんなに分かりきっているのにな…","For yourself
I know this way ...",0.13333333333333333
"it's still so hard to make
a child understand about death.","いまだに
子供に死を納得させるのは難しい","Still
It is difficult to convince the death to the child",0.29411764705882354
"have you ever wanted to
bring someone back to life?","死んだ者を生き返らせたいと
思ったことはありますか？","I want to live back the dead
Have you ever thought?",0.375
"That's the second time
you've asked that question.",その質問は２度目だな,The question is the second time,0.36363636363636365
"I was only wondering, that's all.","俺は
ちょっと聞いてみただけなのに","I am
I just asked for a moment",0.06666666666666667
"The circle demonstrates
the circulation of power,",円は力の循環を示し,The circle indicates the circulation of force,0.4444444444444444
"By knowing the laws and flow of power,
you can contend with all things.","力の流れと法則を知ることで
あらゆることに対応できる","By knowing the flow of power and the law
It can respond to everything",0.38095238095238093
"Those who would create things after
accepting and understanding this...","それを受け入れて理解したうえで
創造する者","Accepting it and understood
Person who creates",0.2
"The world constantly follows
the motion of a great current.","世の中は
常に大きな流れに従って動いている","In the world
Always moving according to a big flow",0.17647058823529413
"The death of people
is part of that flow,","人が死ぬのも
その流れのうちだから","People die
Because of the flow",0.36363636363636365
"and as such, you must not think
about bringing them back to life.","人を生き返らせようなんてことは
思ってはいけない","What to live back to people
Don't think",0.15
"Al, that armor is empty
on the inside, isn't it?",アル… その鎧の中は空っぽだな,Al ... The inside of the armor is empty,0.42857142857142855
The weight from when I threw you...,"投げ飛ばしたときの重さ
左右で違う足音","Heavy weight when throwing
No footsteps on the left and right",0.1875
"Did you think I wouldn't notice?
You fools!",気付かないと思ったか？ バカ者,Did you not notice?Stupid,0.3333333333333333
Sensei...,お前 ひょっとして…,Hiyogo ...,0.3333333333333333
What happened? Tell me everything.,何があった？ 全て話せ,What happened?Spoken,0.375
I...,先生 俺は…,Teacher I ...,0.6666666666666666
we...,俺たちは…,We are ...,0.6666666666666666
"Episode 28: ''All is One, One is All''",第28話「一は全 全は一」,"Episode 28 ""One is all all""",0.7777777777777778
We are so very smaII.,俺たちは とてもちっぽけで,We are very tired,0.42857142857142855
"However, we have everything
in the worId within us.","でも
俺たちの中に世界の全てがある","but
There are all the world in our",0.11764705882352941
