en_text,jp_text,google_translated,score
"That is a surprise. I didn't think
you were going to come back to life.","びっくりしたな
生き返るとは思わなかったよ","I was surprised
I did not think that I would like to live",0.22727272727272727
Where am I?,ここは？,here?,0.2
"Don't worry! This is
a town of Ishbalans!","ここはイシュヴァール人
の町だよ","This is Ischwar
It is the town of",0.3076923076923077
Grandpa! He's back to life!,じっちゃん！ 生き返ったよ,Hey!I'm back,0.2
"You've held on to your life, young one.",命１つ もうけたの 若いの,One of my life is young,0.21428571428571427
"You're the guy, aren't you?
The one on the wanted list.","お前さん あれじゃろ？
指名手配されとった…","Are you so much?
Appointed to be ordered ...",0.15
"Relax. There's no one here who
would sell out one of their own.",身内を売る者なんざ １人もおらん,There are one person who sells,0.17647058823529413
"It's not just here. There are
little villages all over the land,","“世の中 全て 我らが神
イシュヴァラの懐なり”じゃ","""All in the world we are God
Ishwala's nostalgia",0.18181818181818182
"No results today either, huh?",今日も成果はなしか,There is no result today,0.2
"I don't know what it is
that they're studying,","何 調べてるか知らないけど
いいかげんにしてほしいっすよ","I do not know what I'm checking
I'm sorry I'm sorry",0.25
"Those boys won't give up
until they've found something.","あの子たちは
何かを見つけるまで諦めないわ","That child
I can not give up until I find something",0.2222222222222222
And it's our job to protect them.,それを守るのが私たちの仕事よ,Our work is to protect it,0.36363636363636365
You've gotta be yanking me!,ふざけんな！,Do not be silly!,0.18181818181818182
"Now I understand... the reason this
is called the devil's research...",悪魔の研究と言われる訳も,It is also said that the demon's research is said,0.23529411764705882
"the reason Marcoh.san
abandoned his research...","マルコーさんが
研究を捨てた理由もな","Marco
The reason for throwing the research",0.3
"It's no wonder! The material needed
for making a Philosopher's Stone...",賢者の石の材料が,Sorcerer's stone material,0.2
is live human beings!,生きた人間だなんて！,It is a living person!,0.2222222222222222
"And here... I finally thought
it was within our grasp...!",やっと 手が届いたと思ったのに,I finally thought that I had reached my hand,0.17647058823529413
You're going?,行っちゃうの？,Will you go?,0.3333333333333333
"I cannot do that. I am a person
who has betrayed the way of God.",我は神の道を裏切りし人間だ,I am a person who betrays the way of God,0.5294117647058824
That arm is amazing.,それは できぬ,It is not possible,0.125
"It's something precious
that I got from my family.",その腕 すごいね…,That's my arms ...,0.23076923076923078
"Episode 19: ''Behind What
is Behind the Truths''",第19話「真実の奥の奥」,"Episode 19 ""The back of the truth""",0.38461538461538464
CentraI Laboratory No. 5...,セントラル 第五研究所,Central Fifth Laboratory,0.125
"There is a heII there
that we were unaware of.","そこに
俺たちの知らない地獄があった","there
There was a hell that we did not know",0.26666666666666666
