en_text,jp_text,google_translated,score,semantic_score
Please... stop...,お願い やめて…,Please stop ...,1.0,0.88106406
Winry...,ウィンリィ…,Winley ...,0.3333333333333333,0.5154903
"Once, I killed two people.",かつて 私は ２人の人間を殺した,Once I killed two people,0.7142857142857143,0.9329765
They were doctors.,彼らは医師だった,They were doctors,0.75,0.9853518
"There were no friends or foes
among their patients.",“患者には敵も味方もない”,"""Patients have no enemies and allies""",0.125,0.49775377
"That's what they said as they
treated those around the battlefield.",そう言って 戦場で治療をしていた,"That said, I was treating on the battlefield",0.2352941176470588,0.66734654
but they refused to listen.,"だが 彼らが助けた患者が
我々の敵となる","But the patient they helped
Our enemy",0.18181818181818185,0.37539822
"I was given an order...
and I... shot them.","私は命令によって
彼らを…","I am by instruction
They are ...",0.13333333333333333,0.29484367
"I would not follow anything
that was unreasonable.","たとえ命令であろうと
理不尽なことに従うべきではない","Even if it is an order
It should not follow the unreasonable thing",0.16666666666666666,0.59424627
"That I would put myself in a position
where I didn't have to follow them.",従わなくていい立場になろうと,"If you do not know, it will be in a position",0.12,0.18416911
"The reason I'm chasing after you
is not because I was ordered to.","お前たちを追うのは
命令だからじゃない","To chase you
It is not because it is an order",0.2777777777777778,0.7048316
"Why did you run off on your own
without coming to me for protection!?","なぜ 私の保護を求めず
勝手に逃亡した？","Why not ask for my protection
Did you escape without permission?",0.3333333333333333,0.6552472
Episode 44; ''Hohenheim of Light'',第44話「光のホーエンハイム」,"Episode 44 ""Hohenheim of Light""",0.875,0.9789208
