en_text,jp_text,google_translated,score,semantic_score
"I'm sorry, but there's nothing I can do about it.",悪いけど　僕らじゃどうしようもないことってあるよ,"It's bad, but I'm not doing anything",0.35294117647058826,0.42003435
No!,いや　絶対にいや,No absolute,0.3333333333333333,0.27984062
I can't believe I have to share space in a small room with this perverted peeping tom of a ghost!,個室の中で「あの」感覚を共有するなんて,"Sharing the sense of ""that"" in the private room",0.1111111111111111,0.39052168
The Keyword is Tomato,キーワードはトマト,Keyword is tomato,0.75,0.9733464
Tomato?,トマト？,tomato?,1.0,1.0
