en_text,jp_text,google_translated,score
But a sled can't move in a place without any slopes.,しかし こんな 傾斜も何もないところで➡,"However, there is no such inclination.",0.05263157894736842
There is something!,いました～ 長老～!!,Now-Nagoya- !!,0.2
They're planning on making him pull the coffin to get to the church!,教会まで たどりつくつもりだ～!!,I'm going to go to the church ~ !!,0.2222222222222222
What will the elder do about the hero's unorthodox actions?!,旅人の 規格外の行動に➡,For traveler's regulatory action,0.0625
"As usual, he's moving at random.",相変わらず ﾗﾝﾀﾞﾑに 動き続けています！,I'm still working at randomly!,0.06666666666666667
"Old man! Hey, act like an old man and go to pray! Please!",おい じじい ｺﾗ～！ じじいらしく お祈りに行け～！,Otojiri Kora-!Go to prayer!,0.1875
They're headed into the field into the worst possible situation!,最悪の状況のまま ﾌｨｰﾙﾄﾞに 出てしまった～！,I got out in the field with the worst situation!,0.3333333333333333
That can't be! The elder exists only to give travelers antidote herbs!,んなわけ ねえだろ！ 長老は 旅人に➡,It's not good!The elder is a traveler,0.14285714285714285
No! The elder is just walking at random! The elder isn't that sort of person!,違う！ 長老は ﾗﾝﾀﾞﾑに歩いてるだけだ！,different!The elder is just walking random!,0.4666666666666667
[Monster A has attacked] this is bad. they're coming!,ぐぉぉ～っ!!,!!,0.07142857142857142
"Hey, wait! Don't tell me that you're going to use the elder to…",おい 待て！ お前 まさか 長老を…!?,Wait!You are exactly the elder ...!?,0.23809523809523808
What incredible power…,すげえ 威力だ…｡ 助かりました 長老！,It's great power .... It was saved elder!,0.0
[There is no response. It's just a corpse.],すいませんでした…｡,I was sorry ....,0.0625
"Hey, this is completely your doing…",お前… お前 これ 完全に お前が…｡,You're this fully ....,0.08333333333333333
No. The elder's natural life just came to an end.,違う｡ 長老は 天寿を まっとうされたんだ…｡,Different. The elder has always been Tenju ....,0.16666666666666666
It just happened to come exactly at this moment.,たまたま ﾀｲﾐﾝｸﾞが ｼﾞｬｽﾄﾌｨｯﾄしただけだ｡,The timing only happened just fit.,0.21428571428571427
You definitely did it! Turn yourself in!,絶対 お前が やった！ 自首しろ！,Absolutely you did!My neck!,0.2727272727272727
"Shut up. You're just a corpse, too. Don't talk back.",うるさいんだよ！ お前も ただの 屍だろうが！ 返事を すんな！,I'm sorry!You will also be just the baby!He reply!,0.08
[KAGURA Level 82 HP 523],長老の気が 消えた！,The elderness disappeared!,0.0
That elder is no longer of this world.,もはや 長老も この世には いまい｡,No longer elders are also in this world.,0.38461538461538464
She's already defeating guys who look way stronger than bandits!,もう 完全に 盗賊より強そうなﾔﾂ 倒してんじゃ～ん！,It's totally stronger than the thieves!,0.25
The dark lord already has the medicine…,あの薬は すでに 魔王様が…｡,That medicine is already the devil.,0.18181818181818182
That's enough. Go and defeat the bandits already!,もう いいから！ さっさと 盗賊を倒しにいけ～！,that's enough!Don't beat the thief quickly!,0.3125
I've got to do something about it myself.,もう 自分で なんとかするしかねえ！,I have no idea what to do!,0.2
How are you using the elder?!,お前 長老 どんな使い方してんの～!?,What kind of way is your elder way!?,0.21428571428571427
The hero Kintoki has finally charged into the bandit's cave!,勇者 きんとき｡ ついに 盗賊の洞窟に 乗り込んだ～！,If the brave kino. I finally got into a hootpar cave-!,0.2
Oh! That's a save point and a spring of healing.,あっ あれは！ ｾｰﾌﾞﾎﾟｲﾝﾄと 回復の泉です！,That's!Save point and recovery fountain!,0.42857142857142855
"Sorry, but from this point on, we're enemies.",悪いが こっからは 敵どうしだ｡,"Bad, but this is the enemy.",0.26666666666666666
Hold up! Give me the elder.,待ちやがれ｡ 長老を こっちに渡せ｡,Wait. Pass the elder this way.,0.25
What?! We've come this far because of Elder-sama.,なんだと!? ここまで 来れたのは 長老様の おかげだろう！,What is it!? It would be thanks to the elderly that came here!,0.13043478260869565
That's why I'm telling you to not desecrate the dead anymore.,だから 言ってんだ！ これ以上 死者を 冒涜すんじゃねえ!!,So I say!I'm not going to burn more than this!!,0.18181818181818182
The elder's not dead. He's still alive in my heart.,長老は 死んでねえ！ ｵﾚの心の中で 生き続けるよ!!,Elder died!I will continue to live in my heart !!,0.21052631578947367
Whoa! The two are starting to fight over the elder right before their battle with the boss.,お～っと… ﾎﾞｽを 前にして➡,"Oh, ... in front of the boss",0.08695652173913043
I can't live without the elder anymore.,ｵﾚは もう 長老なしじゃ 生きられねえんだよ～!!,"I'm already alive, I'm not living!!",0.0625
The elder should be returned to the town.,長老は 街へ帰すべきだ！,The elders should return to the city!,0.25
Adventurers need the elder.,冒険者たちには 長老が 必要だろうが！,Adventurers will need elders!,0.25
The elder is forever going to be known amongst adventurers,長老は これから 盗賊を倒した 伝説のﾌﾞｰﾒﾗﾝとして➡,As a legendary boomerang who defeated the thief from now on,0.05
as the legendary boomerang that defeated the bandits.,冒険者たちの間で 永遠に 語り継がれていくんだよ!!,I'm going to talk about forever between adventurers!!,0.0
Make sure you split him evenly down the middle.,ちゃんと 均等になるように 真ん中で 折れよ｡,Break in the middle to be equal.,0.2
They split him!,うわぁぁぁぁ～!! 折った～!! 長老を 折った～!!,Wow!! Folded ~ !! Folded the elder!,0.1111111111111111
They split the elder!,うぉぉぉぉ～っ!!,Uh! !!,0.16666666666666666
"Hey, it's kind of difficult to use his top half.",おい！ なんか これ 上半身 使いづれえな｡,Oi!Somehow it is good to use it.,0.2222222222222222
Bandits continue to be defeated thanks to the elder.,長老の おかげで 盗賊団が 次々と倒されています！,The bandits are defeated one after another thanks to the elderly!,0.3333333333333333
What is this power that rivals even that of the elder?!,長老をも 凌駕する この力は…！,This power that surpasses elders ...!,0.26666666666666666
"I hit a jackpot at the casino, and I bought a king.",ｶｼﾞﾉで 一発 当てましてね 王様 買ってきました｡,I bought one shot with a casino.,0.3333333333333333
What do you mean you bought a king?! What in the world did you do?!,王様 買うって どういうことだよ!?,What does it mean to buy the king?,0.29411764705882354
Why won't any of you fight with regular weapons?!,つうか ｵﾒｴら 普通の武器で 戦わんかい！,Let's fight with your ordinary weapons!,0.25
Crap! I never thought you would bring a king.,ｸｿ～ｯ！ まさか 王様を持ってくるなんざ➡,Fucking!I will bring the king,0.2857142857142857
The elder is nothing in comparison… At this rate…,とても 長老じゃ かなわねえ！ このままじゃ…！,It is very long!This is ...!,0.14285714285714285
Whoa! There's suddenly a giant hole in the roof of the cave!,あ～っと！ 突然 洞窟の天井に 大穴が…！,Oh!Suddenly a large hole in the cave in the cave ...!,0.4375
"Oh, what's that?",あっ！ あれは…！,Ah! That is…!,0.1111111111111111
The OwEe is mine!,ぶははは～！ Oweeは 私のものｱﾙ～！,Hahaha!Owee is my something!,0.375
You've got to be kidding?! It’s cheating to use the dark lord.,ふざけんじゃねえ！ 魔王なんて 反則技だ！,It's not funny!The devil is a foul work!,0.12
That's not fair! He's not a weapon! Die!,不公平だぜ！ 武器じゃねえよ そんなもん！,It is unfair!It's not a weapon!,0.4166666666666667
Damn it! I won't lose! I'll show you the elder's true power!,ｸｿが～！ 負けるか～！,Fucking ~!Lose!,0.11764705882352941
"Where's the leader?! Is it you? Hey, spit it out!",首領は どこだ～!? ﾃﾒｴか～!? おい！,Where is the lead to!? Temeew!?,0.3125
"Hey! Kagura, I'm going to take a piss. In the meanwhile…",ちょ… 神楽… ｵﾚ しょんべん行ってくっから➡,Cho ... Kagura ... I'm going to go,0.2777777777777778
Sale of the new OwEe game console has been halted due to the discovery of a serious flaw.,新型ｹﾞｰﾑ機 Oweeに 重大な欠陥が 発見され➡,Critical defects are found in the new game machine OWEE ➡,0.16666666666666666
