en_text,jp_text,google_translated,score
"Now then, everyone, what kind of show",さて 皆さん 新型ｹﾞｰﾑ機 弁天堂 Owee｡,"By the way, everyone new game machine Bento Owee.",0.11764705882352941
will these chosen individuals give us in order to win the new Bentendo OwEe game console?,これを手に入れるために 選ばれた者たちが➡,Those who were selected to get this,0.043478260869565216
"The first battle, the girl game challenge, will now begin!",それでは １戦目 ｷﾞｬﾙｹﾞｰ勝負 始めぇぇ～!!,"Then, the first game gal game game starts.",0.26666666666666666
I don't care if you're Mario or Sonic--it doesn't matter to me.,ﾏﾘｵだか ｿﾆｯｸだか知らんが ｿﾞﾆｰ派のｵﾚには 関係ない！,"I don't know if I'm Mario or Sonic, but I don't care about Zoney 's.",0.375
I'm a Zony fan! I'm going to give you a thorough thrashing! [note: zony is a parody of sony.],完膚なきまで たたき潰してやる！,I will crush it to the skin!,0.11538461538461539
"Whoa, what's this?!",おおっと これは➡,"Oh, this is ➡",0.2
He's fast! We can't tell what the story's about!,早い！ しかし これでは 話の内容が 一切わからない！,early!But this does not know the content of the story at all!,0.13636363636363635
I told you that I know all about girl games.,言ったはずだ｡ ｷﾞｬﾙｹﾞｰを知り尽くした ｵﾚには➡,You should have said. I know the gal game,0.25
"I know exactly what I have to do, even in the new ones.",新作だろうと 話の筋が読めると｡,If you can read the story of the story when it is a new work.,0.12
"In this part, I'm going to meet the heroine by bumping into her.",このﾊﾟﾀｰﾝは ﾊﾟﾝを くわえてやってくる➡,This pattern will be breaded.,0.1
[This is bad. I'm going to be late.],ﾋﾛｲﾝとぶつかって ﾊﾟﾝﾂが見えるという 出会い方だ！,It is a way of meeting that pants can be seen with heroines!,0.08333333333333333
There it is!,きた～っ!,It has come!,0.3333333333333333
A swordfish?!,《ｶｼﾞｷｨｨｨ～!? 食ﾊﾟﾝじゃなくて➡,"""Kajikyi ~!",0.14285714285714285
The heroine of Bakiboki Memorial is quite different. She's rather eccentric.,どういうことでしょう これは？ 『ﾊﾞｷﾎﾞｷﾒﾓﾘｱﾙ』のﾋﾛｲﾝは➡,"What does this mean?The heroine of ""Bakiboki Memorial"" is ➡",0.2857142857142857
She's eccentric?! This is pretty fishy!,天然もんだよ！ 相当の 活きのよさだよ これ！,Natural yet!It's a good lure good luck!,0.125
Are you saying that I have to bonk a smelly girl who has a swordfish in her mouth?,《ﾏｸﾞﾛくわえた 生臭い娘を おとせってのか？,"""Do you give me a loud girl with a tuna?",0.16
"No, calm down. No matter what she has in her mouth, she's still a girl from a girl game.",いや 落ち着け！ 何をくわえていようと➡,No calm!What to do,0.14285714285714285
"""A, help her. B, hurry to school."" The answer is, of course, to help her...",Ａ 助け起こす｡ Ｂ 寺子屋へ急ぐ｡,A Help. Hurry to Terakoya.,0.2777777777777778
Why is there such a drastic choice right in the beginning?!,なんで しょっぱなから そんな 危険な選択肢があんだよ！,Why is such a dangerous option!,0.3333333333333333
I-Impossible. All that data I've gathered up to now doesn't help!,ばっ ﾊﾞｶな！ ｵﾚの今までのﾃﾞｰﾀが 通じないなんて！,Bump!I can not pass the data so far!,0.13636363636363635
Thirty minutes of lost time! This is quite a blow to the Shinsengumi team!,30分のﾛｽ！ 真選組ﾁｰﾑ これは痛い！,30 minutes ros!Hiden set team This is painful!,0.25
Love doesn't always go according to the data you've collected.,ﾌﾝ… 恋愛が ﾃﾞｰﾀどおりに いくものか｡,Hun ... Do you go to the data?,0.29411764705882354
Unexpected things always happen in love.,予測もつかない事態が起こるのが 恋愛というものだろう｡,It will be a love that the situation where you can not predict it will occur.,0.1
There's a limit to how unexpected things can get!,予測がつかないにも ほどがあるだろう!!,There will be more than no prediction!!,0.11764705882352941
I never expected her to stab me with the swordfish...,まさか ｶｼﾞｷで刺されるとは…｡,It is stabbed by Kajiki ....,0.058823529411764705
What kind of world has a love story where the main character gets stabbed,どこの世界に 会って５分で ｶｼﾞｷﾏｸﾞﾛに刺される➡,Meet the world and get caught in 5 minutes in 5 minutes ➡,0.09090909090909091
Whoa! The Odd Jobs team has to start from the beginning.,おおっと！ 万事屋ﾁｰﾑも 最初からやり直し！,Oops!A special shop team also redo it from the beginning!,0.2631578947368421
Both players are neck-and-neck!,両者 一進一退の互角の戦いです！,Both is a battle of one-way retention!,0.18181818181818182
This is more than just even!,互角とか そういうﾚﾍﾞﾙじゃねえだろう！,It would be a tight or such level!,0.06666666666666667
"Besides, it's weird to be challenging each other in a girl game!",そもそも ｷﾞｬﾙｹﾞｰ勝負 ってこと自体 おかしいぞ！,"In the first place, the gal game match itself is funny!",0.17391304347826086
Whoa! The spectators are voicing their discontent.,おおっと 観客から 不満の声があがっておりますが？,Are you sure you have a dissatisfaction voice from the audience?,0.1111111111111111
"[Nobunaga's Regurgitation] [Note: Parody of the game ""Nobunaga's Ambition.""] this is the game: nobunaga's regurgitation.",ｹﾞｰﾑは これ！ 『信長のｹﾞﾎﾞｪ』｡,"The game is this!""Nobunaga's Gebe"".",0.47368421052631576
"When you line them up in a row, the vomit will disappear...",これを 横一列に揃えると ｹﾞﾎﾞｪが消えて 敵の信長が吐きます｡,"When this is aligned with a horizontal row, Gebe disappears and the enemy's Nobunaga will vomit.",0.2692307692307692
"And your opponent's Nobunaga will throw up. when your screen is filled with vomit, you lose.",画面いっぱい ｹﾞﾎﾞｪで埋まると 負けになります｡,It will lose if it is filled with the screen full of gibe.,0.2916666666666667
That's just a terrible version of Tetris! What's with this screen?!,それ ただの 最低のﾃﾄﾘｽだろうが!!,It's just the lowest tetris!!,0.23529411764705882
Why are you trying to make it look like it's part of the Ambition series?!,何 この画面！ 何 野望ｼﾘｰｽﾞっぽくしてんの!!,What this screen!How much noises are good!!,0.08333333333333333
"Shinpachi, it's your turn. why me?",なんで ﾎﾞｸなんですか？ いや なんとなく｡,Why is it me?No somehow.,0.38461538461538464
Whoa! Bland looking players have been chosen to play this unexpectedly bland looking game.,おおっと これは 予想以上に 地味なｹﾞｰﾑに➡,Oops This is a sober game than expected,0.1
This is a complete joke!!,誰だよ このｹﾞｰﾑ作ったの！ 完全に悪ふざけだよ！,Who is this game made!It's completely prank!,0.23076923076923078
What's the meaning of this?!,どういうこと!? 何で こっちの信長だけ➡,What does it mean!,0.18181818181818182
"He probably got smashed after the incident at Honnoji Temple. [note: historically, oda nobunaga was attacked by his traitorous general alechi mitsuhide at honnoji temple.]",おそらく 本能寺の変の件で 深酒したんでしょう｡,I was probably deep-sided in the case of Notoji Temple.,0.15151515151515152
I don't care!! Don't drag things from the past with you!!,知らねえよ！ 昔のこと ひきずってんじゃねえよ!!,I know!It's not a long time ago !!,0.1
The Shinsengumi team's Nobunaga doesn't seem so drunk.,真選組ﾁｰﾑのほうは あまり 酔ってないようですね｡,It seems that the guide team is not too drunk.,0.2222222222222222
Shinpachi's begun to panic. He's lost his calm sense of judgment.,新八の野郎… 焦りで 冷静な判断力を失ってやがる｡,Shin-Eight Bastard ... I will lose the cool and calm judgment.,0.13636363636363635
He won't be able to make the rows disappear like he would normally be able to.,あれじゃ 消せる列も消せねえ｡,"If so, you can erase the eraser.",0.09523809523809523
"In contrast, his opponent is slowly but steadily getting rid of each row.",それに比べて 向こうは 地味に ｺﾂｺﾂ 一列ずつ➡,"Compared to that, the sober is soberly",0.09523809523809523
The person who uses the blandest method will win this battle.,この勝負 地味な手に徹したほうが 勝利を手にする｡,This game is better for the sober hand.,0.17647058823529413
Shinpachi will lose if he doesn't realize this.,新八の野郎 それに気づかないと 負けるぜ｡,Shin-Eight Bastard I lose if I don't notice it.,0.25
It looks like that challenge has already been decided.,ﾌﾝ… どうやら向こうは 勝負あったようだな｡,Hun ... It seems that there was a match there.,0.17647058823529413
"I should say, it's been decided on this side as well.",いや こちらもというべきか｡,"No, why not?",0.05555555555555555
I managed to set up a date with Maguko-chan.,ｵﾚは ﾏｸﾞ子ちゃんとの ﾃﾞｰﾄの約束に こぎつけたぞ｡,I was addicted to the promise of the date of Magu-chan.,0.25
With her mother tagging along? You can't really call that a date.,それは ﾃﾞｰﾄとは言わんだろう｡,It will be said that it is a date.,0.2
What?!,なに!?,what!?,1.0
With her mother?!,って お母さんとかい～!!,My mom and my wife!!,0.1111111111111111
She said she lost her husband earlier and she's lonely.,旦那さんを 早くに亡くして 寂しいと言うんでな｡,I say that my husband dies quickly and lonely.,0.25
This is a girl game! This isn't a soap opera!,いや これ ｷﾞｬﾙｹﾞｰだよ！ 昼ﾄﾞﾗじゃないんだよ!!,"No, it's a gal game!It's not noon Dora !!",0.17647058823529413
This is amazing! He's ignored the main heroine and went on to seduce her mother.,これは なんと ﾒｲﾝﾋﾛｲﾝ ほったらかし！,This is how to do the main heroine!,0.35
Where shall we go today?!,これは まずい｡,This is bad.,0.0
This is bad. Zura's love of housewives has turned problematic!,《まずい… ﾂﾞﾗの人妻好きが 災いしたか》,"""Do you have a mischievous woman womna love?""",0.043478260869565216
"This challenge has been decided! Even if her mother's with her, this is a da...",親同伴とはいえ こちらは 立派な ﾃﾞｰ…｡,It is a good day ... but this is a good day ....,0.18181818181818182
"Isn't that cheap? he's being suckered! they see him as a sucker, not a boyfriend.",ｶﾓられたぁぁ～！ 向こうは 彼というより➡,Cherry ~!The other side is rather than him,0.1111111111111111
"Furthermore, because of his choices, he has to buy the jar. [what will you do? a) buy the jar b) be happy]",しかも 選択肢がなんやかんやで ﾂﾎﾞを買うしかありません！,"Moreover, there is no choice but to buy a point with what kind of choice!",0.17142857142857143
It's game over! This is harsh! He's come this far only to start all over again. [you are on a tuna fishing boat.],ｹﾞｰﾑｵｰﾊﾞｰ… これは ｷﾂｲ…｡ ここまできて➡,Game over ... This is kitten .... I will come here,0.1935483870967742
The other side isn't going to bonk the main heroine any time soon.,向こうは ﾒｲﾝﾋﾛｲﾝを おとすどころじゃないんだ｡,"Beyond the main heroine, it is not a place.",0.25
"Katsuo-san, my daughter is in our way.",ｶﾂｵさん 私たち ２人だけで暮らすには➡,Catsuo-san alone us alone,0.0
"In order for us to live together, we have to kill her.",もう ｼﾞｬﾏなあの子を 殺すしかないわ｡,I have no choice but to kill Jamao.,0.2222222222222222
I'll lure her out and you bonk her off the cliff!,私が あの子を 崖に誘い出すから➡,Because I invite that child to a cliff ➡,0.10526315789473684
Bonked? What?! Is that what they meant?!,おとすって何!? そっちの落とすだったの!?,What is it? What did you drop?,0.25
Hold on a second! No way... Huh? Hey...,ちょっと待て～！ だって そんな… え… ちょっ…｡,Wait a minute!Even though it is ... ... ....,0.16666666666666666
Was he going for that from the start?,《まさか ｺｲﾂ… それを狙って お母さんに近づいていた？》,"""Masaka Koizu ... Did you go to your mother and approach your mother?""",0.045454545454545456
Is that why he approached her mother?! i told you that you can't predict what's going to happen in love.,言ったはずだ｡ 恋愛には 何が起きるかわからんと…｡,You should say. I don't know what happens to love ....,0.2413793103448276
I thought you would be on the same level as me.,ｷﾐなら ｵﾚと同じ境地まで たどり着けると思っていたのに➡,If you thought that you want to arrive up to the same boundary with me,0.25
I only have badminton and kabaddi. We're of a different class.,ﾐﾝﾄﾝと ｶﾊﾞﾃﾞｨしかないｵﾚとは 所詮 格が違ったんだ｡,The prostitution was different from me with only Minton and Kavadi.,0.19047619047619047
You and I are of different levels of blandness.,ｷﾐと ｵﾚとじゃ 地味の器が違う｡,Your sober is different.,0.16666666666666666
The Odd Jobs team has taken his hands off his controller...,これは 終わりでしょう！ 万事屋ﾁｰﾑ ついに ｺﾝﾄﾛｰﾗｰから➡,This will be over!All-day shop team finally from the controller,0.15
Wh-What's this?! Maguko's nipple!!,これは… ﾏｸﾞ子の乳首が！,This is ... Magu's nipple!,0.4
He's using the command to inspect it over and over!!,ｺﾏﾝﾄﾞ調べるで 小刻みに 何度も調べられているぅ！,I checked the command many times to check the command,0.1875
And what's this?! Vomit is being slammed against the wall between the players!,そして これは!? ｹﾞﾎﾞｪが 対戦者を仕切る➡,And this is!,0.26666666666666666
They're not dead yet!,彼らは まだ死んでいなかった！,They were not dead yet!,0.7142857142857143
They're getting in rapid hits!! Maguko's nipple is being poked at incredible speeds!,連打です！ とてつもないｽﾋﾟｰﾄﾞで➡,It is a continuous hit!At no no Total speed,0.13043478260869565
And on this side...he's using a ruler!! He's using a ruler to make rapid hits!!,そして こちらは… 定規です！,And this is a ruler!,0.3125
"It's bland. It's bland and unfair, but they have incredible power!",地味です 地味でせこいが すごい威力だ！,It is sober and sober and it is great power!,0.25
It's useless! Are you saying that you're going to bonk Maguko before I kill her?!,ﾑﾀﾞだ！ ｵﾚが ﾏｸﾞ子を殺す前に➡,I'm sorry!Before I kill Magu,0.19047619047619047
Impossible! The wall between the players broke and vomit is flowing into the other side!,ﾊﾞｶな！ 画面の壁が割れて➡,Stupid!The screen wall breaks ➡,0.16666666666666666
The guts to never give up or yield.,最後まで諦めねえ 折れねえ根性…｡,"To the end, I can not give up and break.",0.3125
That's what brought on the miracle at Okehazama.,それが 桶狭間の奇跡を 呼び起こしたんだ｡,It has evoked a miracle between the palm.,0.1875
You don't know what's going to happen in love.,恋愛は 何が起こるかわからない｡,I do not know what happens.,0.26666666666666666
But that has absolutely nothing to do with this.,全然 関係ないんだけども｡,It doesn't matter at all.,0.0625
The winner is Katsuo! i lost kind of blandly.,普通に 地味に負けた…｡ なんか 恥ずかしっ！,I was normally soberly .... Something is embarrassed!,0.23529411764705882
This is kind of embarrassing.,これで １対１か｡,Is this one to one?,0.2222222222222222
Let's clean up the garbage and start up the third year fresh.,ｺﾞﾐ片付けて 爽やかに ３年目 迎えるとしますか➡,Do you want to get rid of garbage and get three years in refreshing?,0.08333333333333333
Huh? Is that so...,えっ？ そうなの!?,eh? Is that so!?,0.5
"Now then, the battle for the OwEe is headed towards its climax.",さて この Owee争奪戦も➡,Well this OWEE battle also ➡,0.11764705882352941
The Odd Jobs team won by understanding the game's strange scenario,甘酸っぱいというより 酸っぱいだけの➡,It is more sour than sweet and sour,0.0
"that wasn't really bittersweet, but just plain sour.",奇抜なｼﾅﾘｵを読み解いた 万事屋ﾁｰﾑの勝利｡,Winning the unusual scenario Winning the Self-Solvited Sea Team.,0.05555555555555555
The second battle was a puzzle game battle.,２回戦 ﾊﾟｽﾞﾙｹﾞｰﾑ対決は➡,Two-time puzzle game confrontation is ➡,0.16666666666666666
The final battle will decide the victors.,そして 勝利は 次の最終戦➡,And the victory is the final final battle,0.3
It is a two-on-two tag match.,２対２のﾀｯｸﾞ対決を 制したﾁｰﾑに与えられます！,It is given to a team that won a two-to-two tag confrontation!,0.26666666666666666
A tag match? I never heard anything about this.,ﾀｯｸﾞ戦？ 聞いてねえぞ｡,Tag fight?Please listen.,0.21428571428571427
[Note: Parody of Dragon Quest.] this is the game you will play! dragon hunter 3!,ﾌﾟﾚｲしてもらうｹﾞｰﾑは こちら！,The game to play play here!,0.19047619047619047
It's an online game in which you are a hero who has to defeat a dark lord who's planning to take over the world.,世界征服を企む魔王を倒す 勇者となり➡,Become a brave to defeat the devil who complains about the world conquest,0.20689655172413793
You form a party and try to complete the game.,仲間とﾊﾟｰﾃｨｰを組んで ｸﾘｱを目指す ｵﾝﾗｲﾝｹﾞｰﾑです｡,It is an online game that aims to clear and close and parties.,0.2
This game is the OwEe's best selling point.,このｹﾞｰﾑは Oweeの 最大の売りとされる➡,This game is the largest seller of Owee,0.38461538461538464
It's a new game that makes use of a virtual controller.,ﾊﾞｰﾁｬﾙｺﾝﾄﾛｰﾗｰに対応した 最新のｹﾞｰﾑです｡,It is the latest game corresponding to the virtual controller.,0.29411764705882354
"By wearing these goggles, gloves, and boots...",このｺﾞｰｸﾞﾙと手袋 ﾌﾞｰﾂを 装着することによって➡,By attaching this goggle and gloves boots,0.3333333333333333
You can enjoy this game as if you were really inside the game world.,まるで ｹﾞｰﾑ機の世界に そのまま入り込んだような➡,It seems that the world of game consoles is entered as it is ➡,0.19047619047619047
"Gin-chan, hurry this way!",銀ちゃん 早く来てみ！,Silver-chan come soon!,0.1111111111111111
"And you can't change you name once it's been assigned, so please tolerate it.",濁点も １文字に入るんで 我慢してください｡,Please be patient with the turbidity point to enter one letter.,0.07692307692307693
Why is only this part of it like a Famicom?,なんで そこだけ ﾌｧﾐｺﾝ並のｽﾍﾟｯｸなんだよ！,Why is it just like the NTC.,0.26666666666666666
"I'd like to say that the first person to defeat the dark lord is the winner,",勝負は 先に魔王を倒したほう｡,The game will defeat the devil first.,0.15789473684210525
but we don't have the time for that. so the first person to defeat the group of bandits who live in the cave to the north will be the winner.,北の洞窟に巣食う盗賊団を 退治したほうを➡,You will get rid of the bandwit licks to eat north caves,0.15151515151515152
All right! Let's go!,よっしゃあ！ いくｱﾙ!!,Yo!Let's go !!,0.5714285714285714
Wait. We'll be easily defeated at this level.,待て… このﾚﾍﾞﾙじゃ 簡単にやられちまう｡,Wait ... This level is easy to do.,0.26666666666666666
What should we do? Shall we go buy some weapons?,どうします？ 武器でも買いにいきますか？,What do you do?Do you want to buy a weapon or buy?,0.25
"Or should we gather some information in town, Smegma-san?",それとも 街で 情報でも集めますか？,Or do you want to collect information in the city?,0.2222222222222222
Why am I in the red from the moment I was created?,なんで 生まれたときから 画面 真っ赤なんだ？,Why is the screen red since I was born?,0.4
Who knows? I guess it's because you're Smegma.,さぁ… ち○かすだからじゃないですか？,Well ... isn't it?,0.125
You can slowly raise your levels here!,お前は そこで ｺﾂｺﾂ ﾚﾍﾞﾙ上げてろ！,You can raise the chopping level there!,0.3333333333333333
"Kagura, get me an antidote! Quickly, get me some antidote herbs!",神楽 毒消しだ！ 早く 毒消しを持ってこい!!,Kagura poison eras!Bring the toxic erosion early !!,0.11764705882352941
What the-?!,いてっ｡,Has.,0.0
It seems that he lost all his hit points when he stubbed his toe on that sign.,どうやら 看板に 足の小指を ぶつけ➡,Approxy the finger of the foot on the signboard,0.047619047619047616
It's all right.,大丈夫です… 教会 行って➡,Okay ... I went to the church,0.0
I don't have the gold pieces necessary to bring you back to life at a church.,生き返らせるには ｺﾞｰﾙﾄﾞが足りんので➡,Gold is enough to live back ➡,0.14285714285714285
I'm going to defeat some monsters and make some money.,ちょっくら ﾓﾝｽﾀｰ倒して 稼いできまさぁ｡,I can earn a little monster and earn.,0.1875
There's only the monster called desire!,欲望という名のﾓﾝｽﾀｰしか いねえよぉ！,Only monsters named desire!,0.3
He's been left behind! The hero Smegma has been completely left behind!,置き去りです！ 勇者ち○かす➡,I'm leaving!Hero Chika ○,0.125
Somewhere in this world there's a medicine that an elf made that can cure any disease.,この世界のどこかに ｴﾙﾌが作った➡,Elves made somewhere in this world ➡,0.2631578947368421
"According to rumors, it's in a treasure trove in the fortress city of Pales.",ｳﾜｻでは 城塞都市ﾊﾟﾚｽの 宝物庫にあると聞いたが➡,I heard that I was in the treasure entrance of the Citadel City Palace in Uwasa,0.20833333333333334
"But Pales is occupied by Berias, the leader of the demons.",ﾊﾟﾚｽは 妖魔宰相ﾍﾞﾘｱｽに 占拠されてしまったようじゃ｡,Palace seems to have been occupied by the Masayama Phase Belief.,0.2
Really? Can it even cure poison?,ﾏｼﾞでか！ 毒も治るｱﾙか！,Seriously!Poison is also cured!,0.08333333333333333
I won't know unless I try.,やってみなきゃわからないｱﾙ！,I do not know if I have to do it!,0.14285714285714285
I just need antidote herbs! They sell it at the item shops for ten gold pieces.,毒消し草！ その辺の道具屋で➡,Poison eradication grass!It is a tool shop on the side,0.1111111111111111
Take these antidote herbs.,この毒消し草を持っていくがいい｡,It is good to bring this poison erotic grass.,0.07142857142857142
"Thank you, elder. I'm going to defeat Berias.",ありがとう 長老！ 私 絶対 ﾍﾞﾘｱｽ倒すね!!,Thank you elder!I absolutely Believe!!,0.2857142857142857
Are you listening to me?! And why are you eating those?!,人の話 聞いてんのかぁ!?,Are you listening to people?,0.4166666666666667
Beria's weak spot is his head. Don't lose.,ﾍﾞﾘｱｽの弱点は頭だ｡,Berial's weakness is head.,0.3076923076923077
"Gin-chan, wait for me!",銀ちゃん 待ってるｱﾙ！ おいぃ 待てぇ！,Gin-chan Waiting Al!Good morning!,0.2
"Hey, wait! he's been left behind! someone has been left behind on this side, too!",置き去り！ こちらも置き去りです!!,Get away!I'm leaving here too !!,0.09523809523809523
Now what is he going to do?! Nothing's going to get better at this rate.,さぁ どうする？ このままでは➡,Well what do you do?As it is,0.19047619047619047
We're not going anywhere at this rate.,これじゃ 埒があかねえ…｡,This is good ....,0.16666666666666666
"You could wait in that coffin for your partner who shows no signs of returning,",帰るあてのない相方を 棺おけの中で待つのと➡,Wait for the side where you can return home,0.13636363636363635
or you could get yourself out of this situation and advance. Which do you choose?,己でこの状況を打開して 先に進むのと どっちを選ぶ？,Which one chooses to break this situation and go ahead?,0.22727272727272727
I'm just a corpse. What can I do?,死体のｵﾚに 何ができるってんだ｡,What I can do in my corpse.,0.5
Right now... curing my poison and bringing you back to life can be all dealt with if we see a priest at a church.,差し当たり ｵﾚの解毒と お前の蘇生は➡,Ore's detoxification and your resuscitation,0.03333333333333333
But I need to walk more than fifteen steps to get to a church.,だが どう見ても ここから 教会までは➡,But no matter how you see the church from here,0.09523809523809523
"If I do that, I'll use up all of my hit points. I'll die.",そうすれば ｵﾚは 毒によって すべてのﾋｯﾄﾎﾟｲﾝﾄを 消費する｡,"If so, I will consume all hit points by poison.",0.35
[SMEGMA Level 1 HP 0 Dead] [kintoki level 1 hp 11 poisoned],棺桶を ｿﾘ代わりに～！,Solozo of the coffin!,0.0
