en_text,jp_text,google_translated,score
I got one!,おっ 釣れた！う～！,I was caught!!,0.3333333333333333
Congratulations!,"デカいぞ これは！
おめでとうございます！","This is true!
congratulations!",0.4
"Hey Ippo, you should leave the boat to the boss and me, and focus on boxing.","なあ 一歩 船は社長と俺に任せて
お前は ボクシングに専念しろよ","Nana one step by leaving me to me
You are concentrating on boxing",0.21739130434782608
against the world champion.,世界チャンピオンと,With the world champion,0.5
Ippo-kun!,ええ！,Yes!,0.3333333333333333
You've got a world title match?!,"スパーリングってだけで
何だ 世界タイトルじゃないのか","Only sparring
What is the world title?",0.21428571428571427
The day has come!,"いつ？
ついに この日が来たか","when?
Finally this day has come",0.3333333333333333
"No, it's not like that.",いやいや それでも すごいよ,"No, it's great.",0.5555555555555556
It'll be a good experience.,"いい経験になるよな
頑張って 一歩君","It will be a good experience
Good luck and one step",0.4166666666666667
"Yes, I'll give it my best!",はい！頑張ります！,Yes!I will do my best!,0.45454545454545453
So how strong is this Ricardo guy?,"で どのぐらい強いんだよ
そのリカルドってヤツ","So what is strong
That reckish guy",0.36363636363636365
It's difficult enough just fighting sixty-two matches.,62戦するのですら至難の業なのに,"If you fight 62, it's a difficult business",0.1875
"On top of that, he's never lost!","その上 負けたことがないなんて…
ああ ああ 分かった 分かった","I have never lost it ...
Oh she I understand that I understand",0.17647058823529413
"Right, right.","だけどよ
よく考えたら62勝つったって","But
If you think carefully, 62 won",0.1
But sixty-two wins is only about five times the number of your wins—thirteen.,お前の13勝の約５倍だ,It is about 5 times the win,0.23529411764705882
I've never thought of it that way.,"自分５人と戦うと思えば
気が楽だろうが","If you think that you fight five people
I think it's easy",0.17647058823529413
You have quite an imagination...,"そういう発想は なかったな
そっか 自分が５人いると思えば…","There was no such idea
If you think there are 5 people ...",0.125
But what matters is that you beat one.,"しかし
１人やっつけたってのが大事だぜ","However
It is important that one person",0.23076923076923078
It's not that simple!,そんな簡単なもんじゃないよ,It's not such a simple,0.5
I'll just be a child's toy to him!,"僕なんか遊ばれちゃうよ
そうは思わねえな","I will be playing something
That's right",0.1875
"You are the champion of Japan, after all.","お前は
仮にも日本チャンピオンだぜ","You are
It is Japan champion",0.3333333333333333
"There's a limit to how tough a human can be, no matter how much you train yourself.","人間の耐久力ってのは
いくら鍛えても限界があるんだ","Human durability
There is a limit to the limit",0.23809523809523808
Even the world champion will go down if you connect one!,"当たれば世界ﾁｬﾝﾋﾟｵﾝだろうが
間違いなく倒れるぜ！","If you hit it, it will be the world champion
I will definitely fall!",0.3684210526315789
The world champion...,世界チャンピオンが…,World champion ...,0.75
going down?,倒れる,Fall,0.0
Show what you've got to the world's strongest man.,"目に物 見せてやんな
世界一 強い男によ","Show things in my eyes
By the world's strongest man",0.35294117647058826
I want to see how I fare against the world now.,"今の自分の力が
どれだけのものか試してみたい","My power is now
How much I want to try it",0.29411764705882354
but it's such a rare opportunity.,"《逆に言えば
これほどの機会はない》","""Conversely
There is no such opportunity",0.15384615384615385
I'll give it all I've got!,"うん？
き… 来たぞ！","Yes?
... I'm coming!",0.15384615384615385
"Camera, ready!","コメント取れ！
カメラマン用意！","Comment!
Camer man preparation!",0.125
"The man leading the pack is Bill Stewart, the manager and trainer.","先頭にいるのは
ﾄﾚｰﾅｰ兼ﾏﾈｼﾞｬｰのﾋﾞﾙ･ｽﾁｭﾜｰﾄ","What is at the top
Trainer and manager Bill Stewart",0.4666666666666667
He's a super-trainer who's coached seven world champions.,"７人の世界チャンピオンを育てた
大物トレーナーだ","I raised seven world champions
Great trainer",0.21428571428571427
And behind him...,そして その後ろ,And behind it,0.4
"the historic world hero making his first visit to Japan,",ついに歴史的英雄の初来日だぜ,Finally the first visit of the historical hero,0.2857142857142857
"WBA Featherweight champion, Ricardo Martinez.","WBA世界フェザー級チャンピオン
リカルド･マルチネス","WBA World Feather Class Champion
Ricardo Martinez",0.4
It's finally the day you fight against the world champion.,"ついに世界チャンピオンと
戦う日が来たな","Finally with the World Champion
The day to fight has come",0.4
D-Do you think so?,も… もらってくれますかね？,Can you get ... Can you get it?,0.2222222222222222
You idiot!,バカ！,fool!,0.25
"I know that you want to test how well you'll fare,","フフ 自分の力を
試してみたい気持ちも分かる","Hofu
I also understand the feeling I want to try",0.16666666666666666
The champion may be surprised if you can even graze him with a punch.,"しかし 相手は現役にして 既に
伝説になろうという名ﾁｬﾝﾋﾟｵﾝ","But the other party has already been active
Name champion to be a legend",0.16
If I can graze him...,それができれば褒めてやるわい,"If it can, I will give up",0.2727272727272727
That sounds like a really low goal.,"｢かすれば｣か… すごい低い
目標のような気がするけど","""If it's a long time"" ... very low
I feel like a goal",0.21052631578947367
The spar is planned for three rounds.,スパーは ３ラウンドですからね,Because the supermarket is 3 rounds,0.2727272727272727
Yeah! I'll graze him!,よ～し！かするぞ！,Yo!I'll do it!,0.3333333333333333
Even the champion would take some damage if the kid somehow lands a solid blow.,"《小僧のパンチが
もし まともに当たれば》","""The punch of the small man
If he joins """,0.09090909090909091
"Coach Kamogawa, Ippo-kun.",鴨川会長 一歩君,Kamogawa Chairman 1 step,0.125
The spars against the Japanese rankers have already started.,"もう 日本ランカーとの
スパーリング 始まってますよ","With Japan Ranker
Sparring has started",0.07142857142857142
How is Ricardo Martinez?,"どうじゃな？
リカルド･マルチネスは","What is it?
Ricardo Martinez",0.5714285714285714
He does show some super techniques here and there...,"随所にスーパーテクニックを
見せるんですがね","Super technique everywhere
I will show you",0.13333333333333333
"I came to check on him, but I have nothing to report back to Date.","偵察に来たんだが
これじゃ 伊達に報告しようがない","I came to reconnaissance
Well, I can not report to Date",0.3333333333333333
Take a look for yourself.,"とりあえず 見てごらん
はい！","For now, look at it
Yes!",0.16666666666666666
the world's strongest man!,《世界一 強い男が！》,"""The world's stronger man is!""",0.5
The legendary world champion...,"《本物だ
伝説の世界チャンピオンが》","""It is real
Legendary World Champion",0.3333333333333333
is standing in front of me.,《僕の目の前に立っている！》,"""I'm standing in front of my eyes!""",0.2857142857142857
The second one is starting now.,"(ブザー)
２人目が始まりますよ",The second person begins,0.2222222222222222
I-I will give this my best.,"よろしくお願いします！
が… 頑張らせていただきます！","thank you!
... I will do my best!",0.23076923076923078
He's more an idol than an opponent.,"無理もない
敵というより憧れの人物だ","Impossible
It is a longing person than an enemy",0.13333333333333333
They're happy enough just to be able to stand in the same ring as him.,"同じリングに立てるだけでも
光栄というところだろう","Just stand in the same ring
It would be a poem",0.35
I know that sentiment well.,《その気持ち よく分かる》,"""I understand that feeling well""",0.3
I'm counting on you. You may be able to make the champion become serious.,"頼むぜ 君ならチャンピオンを
ムキに させることができるだろう","I ask you to ask you champion
He will be able to make him",0.3684210526315789
I need at least some news to take back to Date.,"少しでも
伊達に手土産が欲しいんだよ","Even if only slightly
I want a shaped land to Date",0.15789473684210525
He's in the same weight class as me.,"《僕と同じ階級
背が少し高いだけで》","""Same class as me
Just a bit high",0.26666666666666666
He's human too! Don't be scared!,《同じ人間だ ビビるな！》,"""The same human being is Bib!""",0.125
Thank you.,よろしくお願いします！,thank you!,0.5
Okay!,はい！,Yes!,0.3333333333333333
"He's not wearing his headgear, so he must be trying to spar as though it were a real match.","小僧！
試合着で？やる気満々じゃないか","Small monk!
Will it be a match?I'm not motivating",0.1724137931034483
I'll leave it up to you.,"君に任せよう
ねじ伏せるもよし あしらうもよし","Let's leave it to you
It is good to be screwed off",0.26666666666666666
Show him how big of a difference there is between him and the world champ.,"世界チャンプとの
器の違いを教えてあげたまえ","With the world champ
Tell me the difference between the vessels",0.2631578947368421
My boxer is facing the world champion!,"《わしのﾎﾞｸｻｰが今
世界ﾁｬﾝﾋﾟｵﾝと相対しておる》","""Wow Boxer is now
Top with the World Champion",0.38461538461538464
Japan's future hopeful against the world champion...,"《日本のホープ 対
世界チャンピオン》","""Japan's Hope vs.
World champion",0.3333333333333333
"We could charge people to see this, even though it's just a sparring match.",《こうして間近で接すると》,"""In this way, when it gets close",0.13043478260869565
he seems so much bigger that it's hard to believe he's in the same weight class as me.,"《同じ階級とは
思えないほど大きく見える》","""With the same class
""I can not think so big",0.14814814814814814
I'll set my pace before he can set his!,"《のまれる前に
リズムを つくるんだ！》","""Before you get
I will create a rhythm!""",0.16666666666666666
Go all out right from the start!,《初っ端から全力で行くぞ！》,"""I will go with all my power from the beginning!""",0.3125
But I'll do all I can!,"《どこまで通用するか分からない
でも 行けるところまで！》","""I do not know how much it is
But to the place where you can go!""",0.23809523809523808
Left!,左！スピードに乗ってる！,left!I'm riding on the speed!,0.25
No! It's a feint!,得意のリバーブローだ！,It is a river blow of goodbye!,0.2727272727272727
"He feinted up, then went down!",幕之内から仕掛けた！,Makumonouchi was set up!,0.18181818181818182
Keep that speed and stir up the champion!,"《狙いは良かった そのスピードを
保って チャンピオンを翻弄しろ》","""The aim was good that speed
Keep his champion with his champion",0.3333333333333333
"If the vertical movement doesn't work, go horizontal!","《上下が駄目なら左右
横の揺さぶりだ》","""If up and down is not good, left and right
Horizontal shaking """,0.14285714285714285
He's moving like it's a real match!,"頭を振り始めた
まるで試合のノリだぜ","I felt my head
It's like a game",0.2857142857142857
"Start with the peek-a-boo style, then step in while weaving to each side.","《ほう ピーカブースタイルから
体を振って ステップインか》","""From the lower peakaboo style
Waving your body her step in",0.17391304347826086
That style is similar to Mike Tyson's.,"《ﾏｲｸ･ﾀｲｿﾝに よく似ている
間違いなくﾊﾟﾜｰもあるだろう》","""Mike Tyson Similar to Tyson
There will definitely be power.",0.3333333333333333
This is a thrilling partner.,"《こいつは
スリルのあるパートナーだな》","""This guy
It is a partner with a thrill """,0.36363636363636365
I can set the pace if I can connect even one!,"《１発でも当たれば
リズムに乗れる！》","""If you hit one shot
Ride on the rhythm!""",0.2222222222222222
One!,《ワン ツー！》,"""One-to-two!""",0.2
H-Huh? Something interfered with the one-two!,"《な… 何だ ワンツーの間に
何かが割り込んできた！》","""What ... during one-to-one
Something has been interrupted!""",0.11764705882352941
The champion's stance hasn't changed.,"《チャンピオンの構えは
変わっていない》","""The championship is
Not changed""",0.15384615384615385
Was it his left? Or his right?,"《左か右か
どっちを もらったんだ？》","""Left or right
Which one did he get he?""",0.2857142857142857
Stay calm...,《落ち着いて 落ち着いて》,"""Calm and calm""",0.16666666666666666
"Dodge his left as usual,","《いつものように
相手の左を かいくぐって》","""As usual
The left of his opponent 's left """,0.36363636363636365
and get close to him!,"また もらった！
簡単に左を もらっちまうよ","I got it again!
It will easily get the left",0.14285714285714285
His glove suddenly became big!,"《いきなり
グローブが大きくなった！》","""Suddenly
Globe has grown!""",0.18181818181818182
Why is it so easy for Ricardo? Is there some trick?,"なんで あんな簡単に？
何かトリックでもあるのか？","Why is that easy?
Is it a trick or a trick?",0.42857142857142855
There's no trick; he's not cheating at all.,トリックなどない,There is no trick,0.25
It's nearly impossible for any human to dodge a punch if he reacts after he sees it coming.,"パンチを見てから
避けるというのは 不可能に近い","After looking at the punch
It is not impossible to avoid",0.20833333333333334
That's when experience comes into play: Making predictions.,"訓練や経験による
予測が必要となってくる","Training and experience
Prediction is required",0.0625
You figure out the next punch from movements in the opponent's elbow and shoulder.,"相手の肩や肘の動きを見逃さず
パンチを読み取るのじゃ","Without missing the movement of the opponent's shoulder and elbows
You can read a punch",0.30434782608695654
but by using the shortest distance possible.,最短距離を飛んでくる,Fly the shortest distance,0.3333333333333333
It's the opposite of a trick; it's the most basic form of a jab.,"トリックどころか
むしろ 最も基本に忠実な左","Trick
Rather the most basic loyal left",0.25
You can't do that unless you check your own form thousands of times in front of a mirror.,"鏡の前で何万回とフォームを
チェックすれば できっことじゃ！","Forms and foams in front of the mirror
If you check it, you can do it!",0.25925925925925924
Even his jab is first class.,"左一つ取っても
一級品ということか","Even if left one
What is the first class",0.3333333333333333
The champion has only thrown left jabs so far!,"チャンピオンは
左しか出してないじゃないか","Champion
I'm not left to go left",0.13333333333333333
"He needs to do something, or he'll get beaten with only left jabs.","《何とかしないと幕之内君
左一本で やられるぜ》","""I'm not doing something
He can do him in the left",0.16666666666666666
He'll really knock me out if I keep taking them.,"《浴び続けたら
間違いなく倒される》","If you keep in touch
It is definitely defeated """,0.1
I'm trying so hard...,《いろいろ やってるのに！》,"""I'm doing it in various ways!""",0.14285714285714285
but I can't hit him at all!,《１発 当てるどころじゃない！》,"""I'm not going to hit one!""",0.1875
Not even once!,"《チャンピオンは
左しか出してないのに》","""Champion
Even though it is not left """,0.2
"The champion has only thrown left jabs, but I can't do anything.",《僕は 何も できない》,"""I can not do anything""",0.15789473684210525
The difference is this big?,"《こんなに
差があるのか こんなに！》","""so
Is there a difference?""",0.2727272727272727
He'll really get beaten with just left jabs.,本当に左一本で倒されちまう,I'm really defeated with one left,0.21428571428571427
How pathetic is this?!,"《この左は
僕には よけられない！》","""This left is
I can not get it for me!""",0.1875
Just one shot... make at least one shot...,《けど せめて… せめて一太刀》,"""I'm sorry ... At least one sword""",0.3076923076923077
The kid has one weapon that can surprise the champion!,"《チャンピオンの顔色を
変えることのできる武器が！》","""The face color of the champion
A weapon that can change!""",0.35294117647058826
A little closer...,《もう少し》,"""A little more""",0.2857142857142857
Now!,出た！,!,0.5
There it is!,"いくらチャンピオンでも
あれが決まれば！","No matter how much champions
If it is decided!",0.2727272727272727
Dempsey roll!,デンプシー･ロール！,Dempsey Role!,0.5
Users of the Dempsey roll are far and few between throughout the world!,"それじゃ！デンプシー･ロールの
使い手は 世界でも数少ない！","Well then!Dempsey Role
Musty is still in the world!",0.2
Not even the champion will be able to react against movements he's never seen before!,"見たことのないﾊﾟﾝﾁなら
ﾁｬﾝﾋﾟｵﾝでも反応できないはず！","If you have never seen a punch
You should not react with the champion!",0.2916666666666667
"Go, kid!",行け！小僧！,go!Small monk!,0.3333333333333333
N-No way! He connected his jabs amidst the side-to-side motion!,"左右の動きに合わせて
左を たたき込むだと！","In accordance with the left and right movements
If you put her left on the left!",0.08695652173913043
He can even see such fast motion?!,"あれだけ頭を激しく振っても
見えているというのか！","Even if you shake it up vigorously
Is it visible!",0.11764705882352941
H-He's too good...,み… 見事すぎて,... too wonderful,0.3333333333333333
I'm at a loss for words.,"｢たたき潰すつもりはない｣と
言っています","""I'm not going to crush it""
I say",0.125
C-Champion? The spar is not over yet.,"チャ… チャンピオン
まだ スパー 終わってませんけど","Champion ... Champion
Although it is not over spur yet",0.2857142857142857
Ricardo said that he has no intention of crushing the Japanese champion.,"ああ 皆さん リカルドは
｢日本チャンピオンのプライドを｣","Oh, everyone Ricardo
""Japan champion pride""",0.10526315789473684
He only wanted to test his left jabs today.,｢今日は 左の感触を つかむだけ｣,"""Today only grab the left feel""",0.2
"The test went well, so he doesn't need to go on.",小僧 服を着ろ 帰るぞ,I will come back to the small monks,0.1
"What are you doing?! It's over, kid!",何しとる！終わりじゃ 小僧！,What do you do!The end of the end!,0.2
We're heading back!,"帰るぞ！
あっ！会長？","I will go back!
Ah!Chairman?",0.18181818181818182
Go thank the champion.,チャンピオンに感謝するんだな,Thank you for the champion,0.42857142857142855
"Oh, so it's over.","えっ！
あっ… そうですか 終わりですか","eh!
Oh ... that's it end",0.25
This is huge!,こりゃあ 大ニュースだ！,It is a big news!,0.25
The world champion is strong!,"｢世界ﾁｬﾝﾋﾟｵﾝ強し！
左一本で 日本ﾁｬﾝﾋﾟｵﾝを一蹴！｣","""World champion strong!
Kick the Japan champion with one left!""",0.38461538461538464
Yes...,"はあ…
まあ いい","...
Good",0.3333333333333333
I didn't expect that you had any chance of winning today.,正直 分かりませんでした,I did not know honestly,0.125
It's good enough that we could see how high the world-class level is.,"世界のレベルが
分かっただけでも収穫じゃて","Level of the world
Even if it is understood, it is harvest",0.18181818181818182
The level?,レベルですか？,Is it a level?,0.3333333333333333
He was too strong. The gap was too great.,"あまりにも強すぎて
差がありすぎて","Too too strong
There is too much difference",0.16666666666666666
I couldn't do anything.,何も できなかった…,I could not do anything ...,0.5
Didn't he even scare you for a moment?,"一瞬 君も
ヒヤリとしたんじゃないのか？","A moment too
Isn't it a hiyari?",0.2857142857142857
"You never are shocked, no matter who the opponent is or what the opponent does.","相手が誰だろうと何をしようと
君が動じるはずもない","What should I do if the other party is
You can not move",0.16666666666666666
Eiji Date will also learn how high the peak of the world is.,世界の頂点の高さというものを,The height of the vertex of the world,0.2
"Ippo, what happened to your face?","どうしたの？その顔
えっ？","What's wrong?That face
eh?",0.25
Go look at yourself in the mirror! It's really bad.,"鏡 見てらっしゃい
普通じゃないわよ","Look at the mirror
It is not normal",0.3125
"Only from one round, and he only used left jabs.","たった１ラウンド
しかも 左一本で","Taru 1 round
Moreover, with one left",0.26666666666666666
This is the world's best left jab...,これが 世界一の左か,Is this the left of the world?,0.45454545454545453
Can Date-san win?,《伊達さんは 勝てるだろうか？》,"""Will Date Will you win?""",0.2222222222222222
I can't imagine that champion losing.,"《あのチャンピオンが
負けることなんて考えられない》","""That champion
I can not think about losing",0.3076923076923077
At least make him use both fists.,"いくら相手が強くっても
両手ぐらい使わせろや","How much the other party is strong
Use about both hands",0.11764705882352941
You shamed Japan!,日本の恥め！,Japan's shameful!,0.3333333333333333
Date-san will feel a lot of pressure if he reads this!,"これ読んだら えれえ
プレッシャーかかっちまうぜ","I can read this
Pressure",0.13333333333333333
"Go apologize to the old geezer, not me!","す… すいません
謝るなら オッサンに謝れ","... I'm sorry
If you apologize, she apologized to the Ossan",0.21052631578947367
But I just don't know how...,はあ… 気が重いな,Has ... I feel heavy,0.18181818181818182
I'm sure my face will show how powerful the champion's left jabs are.,"その面だ！
だあ！","That's the face!
Oh!",0.15789473684210525
And what should I say to him?,何て言えばいいんだろう？,What should I say?,0.625
A sparring match?,《スパーかな？》,"""Is it a spur?""",0.2222222222222222
Date-san!,《あっ！》,"""Ah!""",0.2
Who's his partner?,"《パートナーは誰だ？
普通の人じゃ務まらないはず》","""Who is the partner?
It should not be a common person",0.2
Miyata-kun!,《宮田君！》,"""Miyata-kun!""",0.5
The OPBF champion is perfect for this!,"《東洋太平洋ﾁｬﾝﾋﾟｵﾝが相手なら
何の不足もないよ！》","""If the Toyo Pacific Champion is the other party
There is no shortage!""",0.2222222222222222
"Also, Miyata-kun's left jabs take the shortest route from that position.","《それに宮田君の左は 肩口から
最短距離を まっすぐ走る》","""It is from the shoulder from the left of Miyata
He runs straight for the shortest distance",0.16
It's just like the champion's left jabs.,"《チャンピオンの左に
よく似ている》","""To the left of the champion
Similar """,0.23076923076923078
Maybe Takamura-san sent me here to show me this awesome spar.,"《すごい 鷹村さんは
この豪華スパーを見せるために》","""Amazu Muramura
To show this luxury spar",0.26666666666666666
Miyata-kun is totally serious.,《宮田君 もろ マジだ》,"""Miyata-kun Momoda""",0.125
Perhaps this is the match that'll decide the best featherweight fighter in the country!,"《これって 国内フェザー級の
最強決定戦だ！》","""This is a domestic feather class
It is the strongest decision match!""",0.21739130434782608
At that rate he'll be able to handle the champion's left jabs too.,"《左を全く もらわない あれなら
チャンピオンの左も さばける！》","""If you do not have the left at all
The left of the champion and he hurts!""",0.17857142857142858
I don't have any time to attempt a counter.,"《カウンター取る暇もねえや
なら！》","""The time to take the counter
!""",0.1875
but Miyata-kun is better when it comes to speed.,"《ものすごい
高速打の打ち合いだ》","""Fresh
It is a close match of high speed",0.17647058823529413
That gave me some good hints.,いい感触つかめたぜ,I feel good feeling,0.1
He was dominating this match.,"《あしらわれた
今 確実に倒されてた》","""I was killed
It was definitely defeated now",0.07692307692307693
"I'm in my best condition, not having done the weight control, yet he easily took me down.","あっ！まだまだ！
俺は ピンピンしてますよ！","Ah!not yet!
I'm pinpin!",0.17391304347826086
