en_text,jp_text,google_translated,score
He really knocked me down with that shot.,"強い 伊達さんは
僕とやった時とは別人だ","Strong Date
He is another person who did me with me",0.1875
He's strong!,伊達さん！,Date!,0.2
Date-san is totally different compared to when I fought him.,"《あの宮田君が
いとも簡単に… 信じられない》","""That Miyata is
Easy to easily ...",0.11764705882352941
"No, the world champion is strong too.","い… いや
でも 世界チャンピオンも強いし","No
But the world champion is also strong",0.5454545454545454
I don't get it!,"でも 伊達さんだって！
ああ！分からない！","But it is Date!
Ah!I do not understand!",0.3333333333333333
U-Um... Well...,あ… あの その…,Oh ... that ...,0.2
B-But it really was an incredible spar!,"い… いや
すごいスパーだったよ！","No
It was a great spar!",0.36363636363636365
It really was awesome.,見てたのか,Was it watched,0.3333333333333333
I almost got knocked out by the world champion.,"僕も同じ 僕も世界チャンピオンに
倒されかけたし 一緒！","I am the same time in the world champion
I'm killed and I'm together!",0.21052631578947367
"Japan champion, The OPBF champion...","けどよ 日本チャンピオン
東洋チャンピオン","But Japan champion
Oriental champion",0.25
"We both have our titles, but we've still got a long way to go.","お互い肩書きあるのに
まだまだだな","Even though there is a title of each other
It is still",0.08
Yeah. I realize that.,うん 思い知った,I understand,0.16666666666666666
The world is vast.,世界は 広いぜ,The world is wide,0.5
