en_text,jp_text,google_translated,score
This is a perfect chance to show everyone that I'm not the only young lion in the Huang family.,"倣家の若き獅子は　倣立人　一人
でないと印象づける　良いチャンスだ。","Mimimer's young Lion is one converter
It is a good chance to impress.",0.25925925925925924
Because you're the kind of talented man we need to advance our family's fortunes.,"君は　我が一族の繁栄のためには
欠かせない人材なのだからね。","You are for the prosperity of our family
It's an essential person.",0.2916666666666667
I--I'll try to bear that in mind.,"そ　その自覚は
あるつもりだよ。","That's awareness
I'm going to.",0.2857142857142857
Excellent.,結構。,very well.,0.25
"a timid, easy to handle person like Master Fi.","扱いやすい　小心な方ですね
符義様は。","It is a very difficult person who is easy to handle
The code is.",0.3333333333333333
"He's polished and elite. Men like that are needed in business, too.","（立人）上品なエリートさ。
企業には　ああいう男も必要だ。","elite elite.
Companies need a man who is like that.",0.19047619047619047
As to whether or not you're going...,"立人様が
行くと行かないとでは…。","Viable
If you do not go to ....",0.2857142857142857
"If I make an appearance, I'll just be asked for contributions.","（立人）顔を出したところで
献金でも　ねだられるのがオチだ。","Where I put out my face
It is Ochi even if it is donation.",0.13043478260869565
"Miss Kajika over the President, huh?","大統領より
花鹿様…ですか？","From the president
Hira ...?",0.2727272727272727
Forgive me for interrupting.,"（ボーイ）お話中
失礼いたします。","story
excuse me.",0.2857142857142857
"Master Huang, there's a message for you.","倣様　メッセージで
ございます。","In Moistance Message
There is.",0.23076923076923078
A message?,メッセージ？,message?,0.6666666666666666
My departure will be a little delayed.,"曹　出発を少し遅らす。
お前は車で待ってろ。","Little slowly slowly departure.
Wait for a car.",0.3333333333333333
This is...,これは…。,this is….,0.2
Thank you for coming...,"（カール）よく来て下さいました。
倣立人。","Thank you very much.
Momerative person.",0.2
"I thought that was you, Carl Rosenthal.","やはり君でしたか。
カール・ローゼンタール。","After all was you?
Carl Rosental.",0.3076923076923077
Congratulations on the launch of Planets TV.,"（カール）プラネッツテレビ
開局おめでとう。","Planets TV
Congratulations on opening.",0.5555555555555556
I look forward to seeing the expansion of the Huang Group's enterprises in broadcasting.,"倣グループの放送事業の展開
楽しみにしていますよ。","Development of Broadcasting Business of Body
I'm looking forward to it.",0.2857142857142857
Somehow I doubt you came all the way to Singapore to tell me that...,"わざわざ　シンガポールへ
いらしたとは思えないが？","To Singapore
I do not think it was everything?",0.14285714285714285
"You're quite right. Well, then, let's get to the point.","（カール）ごもっともです。
では　本題に入りましょう。","It is also good.
Let's enter this subject.",0.14285714285714285
Rosenthal intends to support him.,"イズマル殿下を
推すつもりです。","Izumin
I'm going to recommend it.",0.16666666666666666
And what will they do about King Somand's abdication?,（立人）では　ソマンド王の退位を？,At the King of Somando?,0.13333333333333333
They plan to manufacture support for his Highness Rumaty in exile...,"（カール）亡命中の　ルマティ殿下を
担ぐ勢力を作り出し→","Lumati Hall in exile
Create a bearing power →",0.10526315789473684
and force him into a confrontation with King Somand.,"ソマンド王と
対立させる計画です。","With the king of somand
It is a plan to conflict.",0.29411764705882354
Aiming for mutual destruction...,"共倒れを
狙っているのか…。","Mutant
Are you aiming ....",0.2222222222222222
But why are you telling me this?,しかし　なぜ　君が　それを。,But why you are.,0.4444444444444444
My father and I currently stand opposed.,今　父と私は　対立状態にあります。,Now my father and I have a conflict.,0.4166666666666667
Opposing your father?,（立人）お父上と？,Top?,0.2
My father clings fanatically to moldy beliefs and doesn't see that the world has changed.,"父は　カビの生えた信念で　凝り
固まっていて世界の変化を見ない。","My father stiffs with a born belief
It has been solid and does not look at the world change.",0.27586206896551724
"As things stand, Rosenthal will decline.","このままでは
ローゼンタールは　衰退するでしょう。","If this goes on
Rosenthal will decline.",0.3333333333333333
I can't agree with our tactics towards Raginei.,"それに
ラギネイへの戦略は　納得できない。","in addition
I can not convince the strategy to Raginei.",0.16666666666666666
Determining the fate of a nation for the profit of one company...,"一企業の
利益のために
一国家の存亡を左右させるなど。","One company
For profit
Left and right the outsesities of the state.",0.35294117647058826
"Even worse, it all started with his personal feelings towards Burnsworth.","（カール）しかも　それは
バーンズワースへの私情から始まった。","and it is
It started with the nature to Barns Worth.",0.2
"In the first six months of this year, three years' worth of budget was spent on pointless arms buildup.","上半期だけでも
３年分の予算が使われています。","Even in the first half
A three-year budget is used.",0.18518518518518517
"For its sake, the development of new businesses, in anticipation of the oil running dry...","そのため
石油枯渇を見越した新事業も→","for that reason
New business that expected oil exhaustion is also →",0.13043478260869565
"and even basic social services, have all stopped.","更には　福祉さえ　ストップしました。
そこへ　課税が開始された。","Furthermore, I stopped even welfare.
Taxation was started there.",0.23529411764705882
"The people of Raginei, accustomed to wealth, may not take kindly to that...","豊かさに慣れた国民は
納得しないという事か。","The people who got used to richness
Do not understand.",0.19047619047619047
"There are already signs of it. The other day, I saw a leaflet criticizing the King.","すでに　その兆しは　あります。
先日　国王批判のビラを見ました。","There is already a sign.
I saw the Villa of King Critique the other day.",0.5238095238095238
Criticizing the King?,"（立人）国王批判の？
ラギネイ史上　こんな事は
ありませんでした。","What is the King King?
Such thing in the history of Lagini
There was no.",0.1875
The gap in consciousness between the royal family and the people has grown too large.,"王室と国民の間に
意識のギャップが　ありすぎる。","Between the royal and people
The gap of consciousness is too good.",0.5294117647058824
I see. That's dangerous.,なるほど　危険だな。,I see it is dangerous.,0.5
She can be wild sometimes.,彼女は　時々　突拍子もないから。,She sometimes never has no surprises.,0.3
Tell me about it.,それと　花鹿も。,It and Flower.,0.2857142857142857
Is she well?,"（カール）彼女は
元気ですか？
（立人）ああ。","She is
how are you?
 ah.",0.3333333333333333
somehow I can start to imagine there being no quarrel between Burnsworth and Rosenthal.,"いさかいなど
ないのだと思えてくる。","I
I think there is no.",0.23529411764705882
You've changed.,君は　変わったな。,You changed.,0.75
I was obsessed with becoming like my father.,"（カール）
僕は　父のようにならねば　という
強迫観念に　とりつかれていた。","I just like my father
He was taken with obsessive observations.",0.5
But someone taught me that I am who I am.,"だが　僕は僕だと
教えてくれた人がいたのです。","But I'm me
There was a person who taught me.",0.42857142857142855
And who was that?,それは？,that is?,0.3333333333333333
Mr. Harry Burnsworth.,ハリー・バーンズワース氏ですよ。,Harry Burns Worth.,0.3333333333333333
Harry?,"　立人・・心の声　
ハリーが!?","Voice of a viciousness
Harry!?",0.2857142857142857
"A year ago, perhaps, he came to see me suddenly.","（カール）１年ほど前かな
突然　尋ねていらした。","About a year ago
I suddenly asked.",0.3333333333333333
"""If you want her, you can have her. It all depends on Kajika.""","（カール）「欲しければ取るがいい。
すべては花鹿しだいだ」と。","""You should take it if you want.
Everything is Flower. """,0.3
Lee-leng Huang... I want her.,"（カール）倣立人
僕は　彼女を望んでいます。",I want her.,0.5714285714285714
"Sooner or later, I'm going to propose to Kajika.","いずれ　僕は
花鹿に　結婚を申し込むでしょう。","Anyway I
I will apply for a marriage to Flower.",0.16666666666666666
Why tell me?,"なぜ　私に？
さあ　なぜかな。","Why?
Somehow.",0.3333333333333333
"I thought he was just like Fi, but I was sorely mistaken.","符義と同じタイプかと
思っていたが　とんだ見当違いだ。","With the same type as the code
I thought but he is a difference.",0.23809523809523808
"What is he, then?",と言われますと？,Is it said that?,0.2222222222222222
He's a well-trained tiger.,あいつは　躾のいい虎だ。,He is a good tiger.,0.5
But why show his hand like that?,"しかし　なぜ　あなたに
手の内を見せるような事を。","But why
Things to show in your hand.",0.3076923076923077
to not take advantage of the chaos in his company to crush it...,"　立人・・心の声　
やるさ…
そのうえ　駄目押しを加えてきた。","Voice of a viciousness
Doing ...
It has made a good idea.",0.13636363636363635
I'm going to propose to Kajika.,やりますね　若様も。,I will do it.,0.2
I can't be swallowed up by the whirlpool...,"腹を据えて　かからねば。
渦に　のみ込まれないように。","I have a hungry.
Don't be in a whirlpool.",0.25
"Above all, I can't let Kajika be swallowed up.","何より　花鹿が
巻き込まれないように…。","Above all the flower
Don't get caught up ....",0.2777777777777778
It's amazing! It's a Princess' bed!,"（由依）すご～いっ！
お姫様のベッドだあ！","!
It's a princess's bed!",0.75
Is there anything you need? Anything at all?,"足りない物ない？
何でも言ってね。","Isn't it enough?
Please say anything.",0.21428571428571427
No way. This is plenty.,ごめんね。　皆　忙しいのに。,sorry.Everyone is busy.,0.25
"Lee-leng and Eugene will both be back tomorrow, I heard a little while ago.","立人もユージィンも　明日には戻って
くるって。　さっき連絡あった。","Shitato and Eugen also return to tomorrow
It will come.I contacted you soon.",0.15384615384615385
"It's fine, it's for your and my sake.",ううん　十分だよぉ。,It's enough.,0.2727272727272727
"They're all so nice. Oh, Rumaty, too, of course.","皆　いい人たちね。
あ　もちろん　ルマティも。","Everyone who is a good person.
Oh, of course, Lumati.",0.2631578947368421
I thought a Prince had come in! Isn't that funny?,"クスッ　私ね　ルマティを見た時　王子様が
入ってきたのかと思っちゃったの。","The prince when I saw the Lumati
He thought he came in.",0.2
and hurry and find my own Prince to watch over me.,"私を守ってくれる王子様
早く探さなきゃ…　ファァ…。","Prince who protects me
I have to look for early ... Fa ....",0.2
Shall we go shopping tomorrow morning?,"疲れた？　ゆっくり休んで。
明日は　朝から買い物でしょ。","tired? Rest well.
Tomorrow is shopping from morning.",0.3076923076923077
"G'night, then.",じゃあ　お休み。,Well then.,0.4
G'night...,うん　楽しみ。　ファー…。,Good luck.Far ....,0.2
Did your friend go to bed already?,友人は　もう寝たのか？,Did my friend go to bed already?,0.7777777777777778
"when she first saw you, she thought you were a Prince.","あのね　由依がね　最初にルマティを
見た時　王子様かと思ったって。","It is true that it is the first lumatic
When I saw it, I thought it was the prince.",0.3684210526315789
"Right now, I'm not a Prince or anything else.","フ…　今の俺は　王子でも
何でもない。　ただの居候だ。","Fu ... I'm the prince
Nothing.It is just a climate.",0.2631578947368421
Just a freeloader.,おかしい。　本物なのにね。,strange.It's a real thing.,0.25
"If that's what my brother wants, that's fine.","兄上が望むなら
それでも　いいんだ。","If your brother wants
Still he is good.",0.26666666666666666
Even if I live out my whole life in a foreign land.,"このまま外国で
一生を終えても。","This is a foreign country
Even after her lifetime.",0.21052631578947367
But my brother...,"でも　兄上は　決して
俺の言葉を聞いて下さらない。","But my brother is never
I will not hear my words.",0.25
You have me.,俺を　信用しては下さらない。,I will not trust me.,0.25
I guess you're right.,うん　そうだな。,I'm sorry.,0.25
"Soon, Mustafa and Lee-leng will come back, too.","もうすぐ　立人やムスターファも
帰ってくるよ。","Trusty and Musterfa
I will come back.",0.38461538461538464
"And Yui will be here, too, for a week. You'll hear tons of funny stories about Japan.","由依も１週間いてくれる。
日本の面白い話　いっぱい聞こう。","It will be one week.
I'm interested in Japan's interesting story.",0.1724137931034483
She used a puzzling phrase.,彼女が　謎の言葉を使ったんだ。,She used mysterious words.,0.375
Mm-hmm?,え？　由依に？,"picture?Oh, right?",0.16666666666666666
"What's a ""part-time job?""",バイトって…　何だ？,What is a byte ... what?,0.2727272727272727
So I'm starting to search for your heart.,"♪♪「君の心
探しはじめている」","♪ ♪ ""your heart
I'm starting to look for",0.5384615384615384
And I'm afraid of being alone.,"♪♪「いつも　そばにいて
守られていたから」","♪ ♪ ""I'm always soba
Because it was protected",0.125
"Though it's been a long time, everyone's just the same.","♪♪「流れる時間なんて
みんな同じなのに…」","♪ ♪ ""What is the flowing time
Everyone is the same ... """,0.21052631578947367
"Whether sleeping now, or crying, I want to see your smiling face.","♪♪「今　眠ってる？　泣いている？
笑顔でいて欲しい」","♪ ♪ ""Are you sleeping now? Are you crying?
I want you to smile",0.3
"Because I will love you, with heart overflowing.","♪♪「溢れ出す　想いを　抱いて
会いに行くから」","♪ ♪ ""Hugging the feeling overflowing
Because we go to see you",0.15789473684210525
"Don't turn away, look at me. I believe in you.","♪♪「逸らさないで　ちゃんと見て
君を信じてる」","♪ ♪ ""I look at it without disturbing
I believe you",0.2777777777777778
"So, no one else knows our secret thoughts","♪♪「そう　誰も　知らない
二人だけの思い出は」","♪ ♪ ""Yo no one knows
Memories of only two people """,0.17647058823529413
The blue sea of a strong and beautiful time.,"♪♪「強くて　美しい
時の碧い海」","♪ ♪ ""strong and beautiful
Seagull sea",0.3076923076923077
"In those arms, in that embrace, I'm alive.","♪♪「その腕　その胸に
私は生きている」","♪ ♪ ""The arms in the chest
I'm alive""",0.3333333333333333
