en_text,jp_text,google_translated,score,semantic_score
that the Elite piloting it is the eldest son of a prominent noble.,ついでに言えば　乗ってるエリートは有力貴族の長男坊だ,"At the same time, the elite who rides is the chief of the lead",0.19047619047619047,0.47525167
"You'll be fine if you fight sloppy as ordered and just roll with it, right?",言われた通りに手を抜いて　適当にやり過ごせばいいんじゃねぇの？,You should be careful about your hand and try properly?,0.16666666666666666,0.38030455
the mass media will look at the numbers on the spec sheet,マスコミの連中がスペックシートの数字を見てこう言うの,Saying the numbers of the specs seat,0.14285714285714285,0.41854364
and say that the real Baby Magnum should've been able to fight harder.,本来のベイビーマグナムならもっと戦えたはずだって,The original baby Magnum should have fought more,0.21052631578947367,0.8738701
"Whoa, what a pain...",うわー　面倒くさい…,Wow ...,0.14285714285714285,0.3358872
"Seriously, I hate it.",本当嫌になっちゃう,I really like it,0.25,0.32188088
Maybe I'll change tack on him at the last minute,土壇場で方針変えて,Change the policy at the last minute,0.4166666666666667,0.34764764
"Check of pertinent area, complete.",該当エリアのチェック完了,Completed the check of the relevant area,0.3,0.5917688
Metal detected at multiple points on the slopes of the mountains.,山の斜面に複数の金属反応あり,Multiple metallic reactions on the slope of the mountain,0.26666666666666666,0.6867574
Metal detected at multiple points?,複数の金属反応？,Multiple Metal Responses?,0.42857142857142855,0.70446527
This is the Charlemagne.,こちらシャルルマーニュ,Here is Charlemagne,0.3333333333333333,0.84727496
indicating those mountains contain large deposits of iron ore.,ベイビーマグナムへ　その山は鉄鉱石が大量に埋蔵されているという報告を受けている,Baby Magnum has been reported that the mountain is buried in a large amount of iron ore,0.17391304347826084,0.60788345
Iron ore...,…だそうよ,...,0.3333333333333333,0.19690523
But there's no positive proof...,でも　確証はない,But there is no confirmation,0.3333333333333333,0.5291889
"We're scanning via satellite, but at present,",衛星で走査しているが,Scanning with satellites,0.09090909090909093,0.76014787
Really?,本当に？,Really?,1.0,1.0000002
"I said there's no problem, so there's no problem.",問題ないったら問題ないんだもん,There is no problem if there is a problem,0.25,0.7487961
"Then, if the metal that was detected really turns out to be gun batteries,",なら　もしその金属反応が本当に砲台だった暁には,"Then, in the case where the metal response was really a bargain",0.2857142857142857,0.37404794
maybe I'll ask you to make special Bavarian cream,おっぱいで型を取った特殊なババロアでも作ってもらおうかな？,Can you make a special Bavaroa that takes a mold with tits?,0.15789473684210525,0.34123793
"In a live presentation, of course.",もちろん　実演でね,Of course it is a demonstration,0.2727272727272727,0.405162
No response. I think there really isn't anyone there.,反応なし　やっぱり誰もいないと思う,I think there is no one without reaction,0.38461538461538464,0.5157441
"If you're wrong, I'm serious about the Bavarian cream, okay?",間違っていたら本当にババロアだからね,"If you're wrong, it's really Bavaroa",0.2777777777777778,0.24732845
This pointless chitchat ends now.,バカ話はそれまで,Bakai talk,0.0,0.06593997
and set about constructing a base zone and removing the Object's floats.,ベースゾーン構築と　オブジェクトのフロート取り外し作業にかかれ,Base zone construction and object float removal work,0.2352941176470588,0.7428643
I saw some flashes there.,なんか　チカって光ったぞ,Something chika was shining,0.0,0.2476568
Woohoo! Bavarian cream!,ひゃっほう！　ババロア！,Hye!Bavaroa!,0.16666666666666666,0.26100153
Shoot them down!,撃ち落とせ！,Shot down!,0.4,0.6930669
Continue to make for shore!,上陸続行,Continuing to land,0.125,0.46294665
You won't die as long as you don't suffer a direct hit!,直撃しなければ死にはしない,Do not die if you do not hit,0.2857142857142857,0.7386301
"When she lets these orders fly, \Nthe glee in her voice is no joke!",こういう命令飛ばす時の声の艶が半端ねぇぞ,The luster of the voice when you fly like this,0.13636363636363635,0.4946429
"so I'd say you're something else yourself, Havia.",その声を聞いて体を震わせているヘイヴィアも相当なもんだと思うよ,"I think Havia, who is trembling the body and trembling the voices,",0.15,0.36592942
the Mass Driver Conglomerate's Object is hiding in those mountains?,山ん中にマスドライバー財閥のオブジェクトが隠れていると思うか,Do you think that the object of the mass driver Bako is hidden during the mountains,0.3,0.73641354
"No, it's likely to be the same as in Antarctica.",いや　恐らく南極の時と同じだ,"No, probably the same as Antarctica",0.42857142857142855,0.93055004
They probably had spare Object guns hidden on the slopes.,斜面上にオブジェクトのスペア砲を隠していたんじゃないのか,Didn't you hide the spare gun of the object on the slope?,0.21052631578947367,0.65565395
No human-size heat sources or electromagnetic readings.,熱源　電磁気ともに人間大の反応なし,Both heat source electromagnetic with no human-large reaction,0.2307692307692308,0.5643137
"Blast them apart, mountain and all!",山ごとぶち抜け！,Mountains and puffs!,0.2,0.49525797
Is this all right?,余所の土地で無許可でこんなことやっちまって大丈夫なのか？,Is it all right with unauthorized land in the area of the place?,0.2857142857142857,0.21623883
They're not affiliated with any power.,どこの勢力にも所属していない,Do not belong to any force,0.16666666666666666,0.3878285
"And here come two powers from elsewhere,",{\fs38}そんなところで余所からやってきた二つの勢力がオブジェクトをぶつけ合って勝手にドンパチか,Two powers who have come from the place in that place hit the object,0.25,0.54419947
It's not only true here.,ここだけじゃねぇ,It's just here,0.375,0.35768062
"No matter where the battlefield is,",そもそも政府はねぇんだ,"In the first place, the government is not",0.25,0.22565296
"Platoon Charlie. As expected, we haven't found any enemy combatants.",チャーリー小隊　やはり敵兵は発見できず,Charlie squadron still enemy soldiers can not be found,0.15789473684210525,0.7443338
and thick power transmission cables.,土砂に埋もれた砲身らしきものと太い送電ケーブルを見つけただけだ,I just found the built-in paddy and thick power transmission cable buried in the earth and sand,0.2352941176470588,0.51931685
expanding the search radius to 5 klicks.,引き続き捜索半径を五キロまで広げて捜索を続行,Continue to expand the search radius to five kg and continue search,0.3076923076923077,0.73535264
and construct the base zone.,残りの班は海岸に引き返し　ベースゾーンの設営,The remaining group is a base zone's establishment to the coast,0.21428571428571427,0.54691577
"You say that now, but if we suddenly run into the Mass Driver Object,",いきなりマスドライバーのオブジェクトと出くわしても泣くんじゃねぇぞ,You're suddenly crying even if it comes out suddenly with mass driver objects,0.21739130434782608,0.6327468
"Come to think of it, why is this region called Iguazu?",そういえば　この辺ってなんでイグアスって呼ばれてんの？,"Speaking of which, is it called Iguas because it is this side?",0.3888888888888889,0.799862
"There's a river called Iguazu, \Nwhich is one of the biggest in the world.",イグアスっていう世界有数のでかい川があるんだよ,There is an Iguazu's one of the world's leading river,0.5,0.82210624
What's going on here?,どうなってやがるんだ,What happens,0.14285714285714285,0.28039145
This is Platoon Hotel.,こちらホテル小隊,This hotel platoon,0.6,0.93451744
"We've generally investigated the area as directed,",ご指定のエリアを一通り洗いましたが,I washed up the specified area,0.15384615384615385,0.21397574
but no verifiable signs of the Mass Driver Conglomerate.,マスドライバー財閥の影は確認できず,I can not confirm the shadow of the mass driver,0.26666666666666666,0.47917363
Good work.,ご苦労,Hard work,0.25,0.2827266
after we've built the maintenance base.,あとは整備基地を作ってからゆっくり考えよう,"After that, let's think slowly after making a maintenance base",0.1875,0.78218484
I will grant you the privilege of sitting down to rest.,お前たちには座って休む権利を与えてやる,I will sit and take the right to sit down and rest,0.375,0.6735154
Take a nice long break and replenish your stamina.,ゆっくり休んで　スタミナを回復しておきなさい,Rest rest and restore stamina,0.16666666666666666,0.62822336
where do you think the Mass Driver Conglomerate's Object is?,マスドライバー財閥のオブジェクト　どこにあると思う？,Mass Driver Board Object Where do you think?,0.6153846153846154,0.7054372
Um...,えっと…,Well ...,0.3333333333333333,0.56966674
"According to the map, it looks like there's a coal mine around here,",地図だと　この辺は炭鉱があるみたいだけど,It is a map and this area seems to have coal mines,0.2272727272727273,0.88911456
but I wonder if it can hide a 50m-class Object...,五十メートル級のオブジェクトを隠せるもんかな,Muka that can hide a fifty-meter-class object,0.2857142857142857,0.6679998
"Even in Antarctica,",南極の時も結局　電力を供給していたオブジェクトは見つからなかった,"Even at the time of Antarctica, no objects were supplied with power",0.21428571428571427,0.51208025
that can't be detected by radar or satellite?,もしかして　本当にレーダーや衛星で探知できないステルスオブジェクト…,Sometimes stealth objects that can not be detected by radar and satellites ...,0.2777777777777778,0.74822557
"Over here, Qwenthur.",こっちだ　クウェンサー,Kuwansar here,0.16666666666666666,0.38366517
I kind of got invited to tea by an elderly couple running a coffee farm...,なんか　コーヒー農園経営している爺ちゃん婆ちゃんにお茶誘われちゃってさ,Coffee Farm Management I'm in tea,0.21052631578947367,0.5874513
Tea in the middle of the battlefield?!,戦場のど真ん中でお茶？,Tea in the middle of the battlefield?,0.875,0.96386695
They say this was all their land to begin with.,ここはもともと爺ちゃんたちの私有地なんだって,This is originally a private land of,0.125,0.51854426
"No, no, no, no! You're being way too chill here!",いやいやいやいや　和み過ぎでしょう,No No No Taei,0.09090909090909093,0.17494094
But never mind that. You don't want tea?,それよりお茶飲まないの？,Don't you drink tea more?,0.38461538461538464,0.73825854
You prefer rations that badly?,そんなにレーションのほうがいい？,Is that good for this way?,0.18181818181818185,0.2995415
So it's not coffee?,コーヒーじゃないんだ,It's not coffee,0.6666666666666666,0.92239076
They're apparently tired of drinking the black stuff.,黒いのは飲み飽きたんだとさ,It is black that black is tired,0.15384615384615385,0.5140922
This makes me think about world peace.,世界平和について考えちゃうよ,I think about the world peace,0.4,0.82057965
"War is fundamentally such a pain, you know?",戦争って基本的に面倒くせぇよな,The war is basically troublesome,0.15384615384615385,0.64583194
"Legitimate Kingdom, 37th Mechanized Maintenance Battalion.",正統王国第三十七機動整備大隊へ,To the original kingdom 37 -7 Mobile maintenance Battalion,0.21428571428571427,0.77489084
"This is Major Halreed Copacabana of the Legitimate Kingdom,",こちらは正統王国第五十二機動整備大隊所属の,This is the Logo Mobile Mechanics Machine Machine Motor,0.2,0.086493485
Crap...,やべぇ…,Yabe ...,0.3333333333333333,0.28964698
Halreed...,ハルリードって…,Halley ...,0.3333333333333333,0.48737866
Who?,誰？,Who?,1.0,1.0000005
The pilot Elite of the Bright Hopper and a member of the nobility.,ブライドホッパーの操縦士のエリートで　貴族様だよ,It is a nobleman in the elite of the bridopper pilot,0.3125,0.64915746
The one the Princess talked about doing a mock battle with earlier?,さっきお姫様が模擬戦をやるって言ってた？,Did you say that the princess will do a simulated match?,0.2,0.57922107
We're currently thinking of taking a route through Central America,われわれは現在中米ルートを通って,We are currently through the US route,0.2857142857142857,0.64269924
to rendezvous with you from the direction of the Amazon region.,アマゾン方面からそちらへ合流しようと考えている,I'm thinking of joining you from the Amazon,0.3333333333333333,0.3796442
but is that viable in terms of the schedule?,スケジュール的には可能か,Is it possible to schedule?,0.2307692307692308,0.71722716
This is Major Frolaytia Capistrano.,こちらフローレイティア・カピストラーノ少佐,Here is a Floretia Capistrano Major,0.3333333333333333,0.6409083
"I've confirmed your coordinates, but it'll be far from there.",貴殿の座標位置は確認したが　そこからでは遠い,"You confirmed the coordinate position of you, but from there",0.2631578947368421,0.78922623
"I could wish for nothing more than your cooperation,",協力するなら願ったり叶ったりだが,"If you cooperate, I hope you",0.14285714285714285,0.47669756
"but if we can't wait, we'll commence our operation as scheduled.",待っていられない場合は定刻通りに作戦を開始する,"If you can't wait, start the operation as scheduled",0.4705882352941176,0.76083416
Roger that.,了解した,understood,0.0,0.16957252
"Then, I shall look forward to events unfolding in such a way",それにとどめをさせるような展開に期待しよう,Let's look forward to the development,0.17647058823529413,0.3277825
that when the Mass Driver Conglomerate's Object,では君たちが撃ち漏らしたマスドライバー財閥のオブジェクトが北方へ逃亡した際,In the case where the object of the mass driver of the mass driver shit shocked by you shot escaped to the north,0.2,0.52967614
"Unfortunately, unlike the 52nd, \Nwe don't have the surplus manpower",あいにくと　こちらは五十二と違って,"Unfortunately, this is different from fifty",0.125,0.34671572
to chase around the enemy with any accuracy.,敵を確実に追い回すほどの余力はない,There is no remaining capacity enough to ensure the enemy,0.1875,0.39115062
"When we can kill it, we will.",やれる時にはやらせてもらう,Get it when you can do it,0.2727272727272727,0.2586751
"We won't be able to comply with your proposal, but will that be all right?",もしかして　わざと手負いにしてとどめはこっちに回せって要求してる？,"If you're going to take a hand for your hand, you will be asked to make it here?",0.20689655172413796,0.25761408
You should meekly accept my proposal.,君は素直に私の申し出を受けるべきだ,You should receive my offer honestly,0.3,0.3978481
In matters both public and private.,…公私ともにな,... Both public and private,0.5,0.8154131
What did you make of that?,今のどう思う？,What do you think now?,0.3,0.2994418
"Not only that, but Frolaytia seemed none too happy about it.",実は二人は顔見知りだった　しかもフローレイティアのほうは嫌々っぽかった,"Actually, two people seemed to look at face and it was more likely to do with Floretia",0.1111111111111111,0.38738236
That's all I got.,なんつーか　貴族社会特有の嫌な空気が漂ってるな,I have a bad air that is unique to noble society,0.13333333333333333,0.10232777
What?! Miss Frolaytia is a member of the nobility?!,美人の貴婦人さまもいろいろ苦労しているらしい,It seems that a beautiful girl of a beautiful woman is struggling,0.16666666666666666,0.28075787
It's famous among those in the know.,その筋じゃ有名だよ,It is a skill in that muscle,0.14285714285714285,0.26604956
In the know about what?,どの筋だよ？,Which muscle?,0.125,0.1588506
Qwenthur. Havia.,クウェンサー　ヘイヴィア,Kwenser Havia,0.25,0.64346236
Change of plans.,予定変更よ,Change schedule,0.2,0.5196733
Hurry up and get back to base.,さっさと基地まで帰ってきて,Come back to the base,0.3,0.7331742
and mess up the pacing of our operation.,ブライトホッパーに介入されて作戦のペースを乱される前に　さっさとケリをつけたいの,I want to put a quick reputation before being intervened by Brighthopper and disturbed the pace of operation,0.17391304347826084,0.27414492
"Thinking that as long as everyone else is happy, everything’s fine","{\fad(200,200)\be20}みんなが笑って喜ぶなら　それでいいんだって","If everyone laughs and rejoices, it is good",0.15789473684210525,0.45280188
That’s what I was always telling myself…,"{\fad(200,200)\be20}そう言い聞かせていたんだ",I was told by saying so,0.15384615384615385,0.46088246
I’m not wrong to think this way… I’m not… That’s what I always thought,"{\fad(200,200)\be20}間違ってない　間違ってないって思ってたのに",I thought it was not wrong,0.2352941176470588,0.57719743
This tiny voice I’d been keeping subdued all this time,"{\fad(200,200)\be20}押し殺してきたこの小さな声を",This little voice that has been pushed down,0.1875,0.6790717
When was it that I starting feeling I wanted to be by your side?,"{\fad(200,200)\be20}いつからだろう　そばにいたいと思ったんだ",I thought I wanted to be soba,0.25,0.22807279
When I brushed the warmth of that hand you extended to me,"{\fad(200,200)\be20}差し出されたその手の温もりに",The warmth of the hand,0.3333333333333333,0.6428722
The Artillery Battle in the Iguazu Mountains II,イグアス山岳砲撃戦　Ⅱ,Iguas Mountain Warming Battle II,0.2,0.6664166
Three-Legged Mountain-Climbing Is Life-and-Death,"{\fad(200,200)\be20}もうひとりじゃないんだって",It is not another,0.14285714285714285,0.18000478
