en_text,jp_text,google_translated,score
U.m 0 0 l 100 0 100 1\Nm 0 0 l 0 100 1 100,----OP JP----,---- OP JP ----,0.0
Not a UMA! Umaru!,"{\fad(400,400)}ＵＭＲ（ハイ） ＵＭＲ（ハイ） ＵＭＡじゃないよ ＵＭＡＲＵ",UMR  UMR  UMA UMARU,0.3333333333333333
m 0 0 l 0 100 1 100\Nshin,"{\fad(400,400)}何時だって全身全霊遊び倒せ",What time is it all body whole spirit play,0.0
m 0 0 l 0 100 1 100\Ntto,"{\fad(400,400)}もっともっと楽しめよ乙女",More fun,0.0
"So long as nobody else finds out,","{\fad(400,400)}皆に気付かれないように",As everyone is noticeable,0.09090909090909091
m 501 -78.33 b 499.19 -73.93 498.19 -68.83 497.67 -63.33 l 860.67 -11 b 862.9 -14.58 863.43 -19.26 863.33 -24.33,"{\fad(400,400)\blur0.5}いざ行け干物妹ライフ",Izumi Dried Draft Sister Life,0.0
no \Nm 0 0 l 0 100 1 100,"{\fad(400,400)\blur0.5}お気に入りのフード被り",Favorites hood,0.0
u \Nm 0 0 l 0 100 1 100,"{\fad(400,400)}今日も今日とてゴロゴロして",Today is also gorogolo today,0.0
tsu \Nm 0 0 l 0 100 1 100,"{\fad(400,400)\blur0.5}大好物のポテチを手に",Hold the potchet of a favorite thing,0.0
Obtained Bonba's Afro,"{\fad(400,400)}パソコンと睨めっこしよう",Let's get a pitch with a PC,0.1
ku\Nm 0 0 l 0 100 1 100,"{\fad(400,400)}立てば芍薬 座れば牡丹","If you set a peony, peony",0.0
a lily in bloom when she walks.,"{\fad(400,400)\blur0.5}歩く姿は百合の花",Walking figure is a lily flower,0.16666666666666666
u\Nm 0 0 l 0 100 1 100,"{\fad(400,400)\blur0.5}誰もが羨む完璧ＪＫ",Everyone embreed perfection JK,0.0
But I dive through the door and transform in a flash!,"{\fad(400,400)\blur0.5}ほら 玄関潜ったら変身だ",If you dive the entrance,0.13333333333333333
ra \Nm 0 0 l 0 100 1 100,"{\fad(400,400)}さあ グータラしよう",Good luck,0.0
ge\Nm 0 0 l 0 100 1 100,"{\fad(400,400)}ずっとずっとゲームは友達",The game has been a friend,0.0
is the backhanded way I show my love.,"{\fad(400,400)}わがまま放題は大好きの裏返し",I love to be self-lively,0.16666666666666666
m 0 0 l 0 100 1 100\Nmai,"{\fad(400,400)}ハイ おしまい",high,0.0
"Hey, Onii-chan!","{\fad(400,400)\blur2}更多中日雙語字幕，盡在www.kamigami.org 及微博@諸神字幕組","Midaka Nakasu Waw Subtitles, Lynthetic www.kamigami.org and Microphods @ various scenic coins",0.0625
Let's order pizza for lunch!,ねね お兄ちゃんお昼ピザとろうよ,Ne Ne brother I will be a lunch pizza,0.15384615384615385
We just had it the other day.,なんだろ,what is it,0.1
Who's there?,"{\fad(400,400)\blur2}翻譯校對：安少   時間軸：淅瀝嘩啦   壓制：Coolkid",Ashin: Anyway: 淅 淅 啦 啦 壓:: Coolkid,0.0
"Well, hello.",こんにちは,Hello,0.25
"Hi, Ebina-chan!",うまるーん,Umaruma,0.0
Here to hang out with her?,遊びに来たの？,Did you come to play?,0.18181818181818182
"Um, no. Actually...",いえ…あの…,No ... That ...,0.2857142857142857
Please have it!,食べてください,Please eat,0.2
"Wow, rice?",お米？悪いなあ 助かるよ,Rice?Bad it helps,0.2857142857142857
I-I'm so sorry!,すすす すみません お腹が…,I'm sorry I'm hungry ...,0.25
Would you like to stay for lunch?,よかったらお昼食べて行かない？,"If you like, don't you eat lunch?",0.3076923076923077
Born from the marriage of Akita an,せっかく秋田のお米ももらったし,I also got the rice of Akita,0.2727272727272727
I'll teach that junk-food-obsessed\NUmaru the joy of Japanese cuisine!,和食の美味しさを教えてやる,Tell me the taste of Japanese food,0.2
All right! Let's do this right\Nand cook it in a clay pot!,よーし 気合いを入れて土鍋で炊こう,Let's cook well and cook in a pot,0.375
"S-So your brother cooks, too?",お お兄さんもお料理するんだね,My brother is also cooking,0.09090909090909091
Sorry about that.,うん 何だかごめんね すごいやる気になっちゃってて,Yumo I'm sorry I'm worried about it,0.2222222222222222
"No, it's totally fine.",ううん そんなことないよ,"Umm, there is no such thing",0.16666666666666666
We should really be eating out if you're joining us.,海老名ちゃんと食べるなら 外食の方がいいのにね,"If you eat with the shrimp, you should eat out food",0.2222222222222222
"Y'know, like pizza...",ピザとか…,Pizza ...,0.4
"But, well, since I live alone,",でも…私 何時も1人だから…,But ... because I am one person ...,0.16666666666666666
Ebina-chan...,海老名ちゃん…,Seni-chan ...,0.3333333333333333
So many vegetables!,野菜多い…,Many vegetables ...,0.4
I wanted to have pizza...,うまる ピザが食べたかったなぁ,I wanted to eat a cool pizza,0.4444444444444444
This is great!,いただきます,I'll enjoy having this,0.125
I'm sorry! My accent slipped...,んだんだよ,I'm sorry,0.375
You betcha?,んだ？,Is it?,0.2
Your Akita rice was delicious!,秋田のお米美味しかったね,Akita's rice was delicious,0.5714285714285714
"Um, thank you for having me for lunch!",あの ご飯誘ってくれて ありがとうございます,Thank you for leaving that rice,0.25
Thanks!,ううん またおいでよ,Ummmo again,0.0
"Then why don't we order pizza, Onii-chan?",じゃあ ピザでも頼む？お兄ちゃん,"Well then, do you ask for a pizza?brother",0.3125
What a drag.,組織の意思伝達で最も重要なのが 会議である,The most important thing in the organization's communication is a meeting,0.07142857142857142
It's not like any of our team's proposals have ever been approved.,ウチのチームから企画が通った事ないですしね,There is no plan to plan from the team of Uchi,0.09090909090909091
"As such, we require all departments to attend the presentations of new proposals.",よって 我が社は全ての部署の人間を参加させ,"Therefore, Japan participates in human beings in all departments",0.14285714285714285
"After all, one cannot be expected to arrive at the optimal solution alone.",最高の結論に1人では辿り着く事はできないからである,It is because one person can not arrive in the best conclusions,0.21739130434782608
"Something sweet? No, salty, perhaps?",さて どのお菓子を買おうか,So what kind of sweet can will,0.07692307692307693
Potayto Chips are the obvious choice!,これだから年寄りはいけない,This is not the elderly,0.09090909090909091
They're tried and true! Anything else is unthinkable!,これは定石であり 至極当然の選択であるぞ,This is a regular stone and it is an extremely selected choice,0.10526315789473684
What?!,何と,What,0.3333333333333333
It's time you let go of your\Noutdated ways of thinking.,あれでしょ たまに偽物っぽくなる時の…,When it is time to be fake snugly ...,0.1111111111111111
"Then what would you suggest, Umaru?",んじゃ うまるは何がいいと思うの？,What do you think is good?,0.25
"Going forward, we must broaden our perspective on snacks.",これからはもっと広い視野でお菓子を選ぶべきです,"From now on, you should choose sweets with a broader perspective",0.15
Behold this new product!,新商品です！,It is a new product!,0.375
"If that's your suggestion,\NI'd rather have chocolate.",それだったら うまる チョコがいいな,It's good if it is it,0.13333333333333333
Mushroom Fields or bust!,だよね！うまるキノコの畑がいい！,right!Umaru mushroom field is good!,0.2
"Nah, cake's out of the question.",スギノコの街に決まってるでしょう,It will be decided to the city of Suginoko,0.125
No kidding.,いや ケーキはないでしょ,No cake,0.25
B-But you never know...,だよねえ…,It is ...,0.14285714285714285
"If we go with cake, we'll just be asking for it.",ケーキなんかにしたら大変な事になっちゃうって,"If you make a cake, it will be difficult",0.2777777777777778
"These days, beef jerky\Nis the must-have snack!",否！今のマストはビーフジャーキーである,no!Now Mast is Beef Jerky,0.14285714285714285
Who invited this Umaru?,誰なのこのうまるは？,Who are you going?,0.25
There's no way we can decide this alone!,ダ…ダメだ！やっぱり1人でなんて決められないよ,Da ... No!After all I can not decide in one person,0.21052631578947367
"Hey, Umaru without the hoodie. What do you say?",そこのフードのないうまるは何がいいと思うの？,What do you think there is no hood there?,0.23529411764705882
Um...,えっと…あの…うまるは 元気が出るやつかな,Well ... that ... Umaru is a good thing to get well,0.09090909090909091
I'm home.,ただいま,I'm back,0.4
Welcome back.,お帰り,welcome home,0.25
Yes?,どうした？,What happened?,0.25
Yes!,はい お兄ちゃん 会議お疲れさま！,Yes brother Meeting Thank you very much!,0.25
I really should have gotten cake.,ケーキにすれば良かったかな…,It would have been good if it was a cake ...,0.13333333333333333
Huh? Your brother?,お兄さんが？,My brother?,0.4
"Ever since his proposal was approved yesterday, he's been on cloud nine.",昨日からテンション高いの,Tension is high since yesterday,0.1111111111111111
"So anyway, Ebina-chan, about Sunday...",それで 海老名ちゃん 今度の日曜なんだけど…,So it is Sunday next Sunday ...,0.3
"Um, are you sure you\Ndon't mind me coming?",あの 本当に私もいいんですか？,That really good?,0.07142857142857142
Of course not!,もちろん！こういうお祝いを次の活力にするんだよ！,of course!I'm doing this kind of celebration next time!,0.25
I-I should try not to eat so much today.,きょ…今日はあんまり食べないようにしなきゃ…,Key ... I have to try not to eat so much today ...,0.5
"Last time, not only was my stomach growling,",この前はお腹が鳴って そのままピザも食べちゃったし,"Before this, my stomach rang and I also eating pizza as it is",0.15
It's been forever since I had a parfait!,パフェなんて食べるの久しぶり,It's been a while since I eat a parfait,0.5833333333333334
Par...,パ…,...,0.5
This is thanks for the\Nsnacks you bought me.,お菓子のお礼だ 遠慮は要らないぞ,Thank you for your sweets,0.16666666666666666
What will Umaru-chan think if she\N sees me shoveling food into my face?,海老名ちゃんどれにする？,What is the Sena-chan?,0.11764705882352941
Can you girls finish those?,結構でかいな 食べ切れるのか？,Is it quite good?,0.1
A girl can make a parfait\Ndisappear in the blink of an eye!,女の子はパフェなんてペロっと食べちゃうんだよ,The girl eats a parfait,0.21428571428571427
"They do say ""there's always room for sweets.""",「甘い物は別腹」ってやつか？,"""Sweet things are different""?",0.11764705882352941
"Come on, let's dig in, Ebina-chan!",さ 食べよう 海老名ちゃん,Let's eat it,0.18181818181818182
"So good, eh?",いいけど さすがに無理だろう,"Like, it will be impossible",0.1
So good!,うまー,Eagle,0.0
Don't be shy!,遠慮しないで,Do not be shy,0.5
Let's eat up!,食べよう,Let's eat,0.6
That was good!,美味しかったね,It was delicious,0.16666666666666666
And much easier to finish than I expected.,意外と食べられちゃったね,I was able to eat surprisingly,0.15384615384615385
"Oh, you too?",うまるちゃんも？,Umaru-chan too?,0.3333333333333333
The constant rain during\Nthis season is such a nuisance.,この季節は雨ばかりで困るな,This season is not troubled with rain,0.21428571428571427
What's wrong?,うま… どうしたんだよ,Uma ... what happened,0.14285714285714285
"We're at the height of the rainy season, after all.",まっ 梅雨の真っ只中だからな,Because it is in the midst of the rainy season,0.23529411764705882
"Honestly, I can't muster the motivation to do anything in this gloom.",なんか何もやる気が無くなっちゃうよね,Anything will do nothing,0.11764705882352941
That's business as usual for you.,いつもと変わらないだろ,It will not change as usual,0.16666666666666666
H-Hi.,どうも お兄さん,Thank you very much,0.0
"Um, what's the matter, Kirie-chan?",って どうしたの 切絵ちゃん,How is the picture,0.09090909090909091
"O-Oh, this always happens on rainy days.",い…いや 実は私 雨の日はいつもこんな感じで,"Yes ... No, I always feel like a rainy day",0.17647058823529413
Th-That smile scares me...,ど…どうも,How ...,0.16666666666666666
I'm scared!,怖いよ,I'm scared,0.75
The rainy season has its own good points.,梅雨には梅雨の良さがあるんだよ,The rainy season has the goodness of the rainy season,0.36363636363636365
"The sound of the rain, for instance.",例えばこの雨音,"For example, this rain tower",0.2727272727272727
Let its soothing patter trickle in through your ears and down to your heart.,心を落ち着かせてくれる音に耳を傾けてみろ,Listen to the sound that calms down your mind,0.15
Don't you think it has\Na certain je ne sais quois?,趣があると思わないか,Do you think it is a taste,0.26666666666666666
I suppose such subtle beauty is lost on high schoolers.,高校生にこの風情は厳しいか,Is this taste tough for high school students?,0.1111111111111111
Maybe it's best if I give them\N something to look forward to.,何か先の楽しみを作ってやった方がいいか,Should I make something more fun and doing it,0.15789473684210525
"Once the rainy season ends, it'll be summer!",そうだ 梅雨が明けたら夏が来るぞ,That's right if the rainy season comes out summer,0.23529411764705882
Why don't we go to the beach?,海でも行くか,Do you go in the sea,0.25
Good question.,電車は疲れるからこまるはヤだよ,It is good because the train gets tired,0.1
B-Bonba?,ぼ ぼんばー？ 人間ですか,ば?Is it human?,0.16666666666666666
"That's a person, right?",お 男の人ですか,Are you a guy?,0.2
"Right, you've never met him.",切絵ちゃんは会った事ないんだっけ,"Currently, I have never met",0.2727272727272727
He's a friend of mine.,お兄さんの友達なら大丈夫そうですけど,It seems to be okay if your brother's friend,0.13333333333333333
But it's so hot in the summer.,でも夏は暑いじゃん,But summer is hot,0.3
Ice cream!,アイス,ice,0.3333333333333333
Master! Summer is the best!,師匠 夏って最高ですね,It is the best in the master,0.5
"Summer brings with it ice cream, the ultimate treat!",夏はアイスという最強のお菓子があるじゃん,Summer has the strongest sweets of ice,0.2
"Welcome, summer! Welcome, summer!",ウェルカム夏 ウェルカム夏,Welcome Summer Welcome Summer,0.5
"Come on. Wake up, Umaru.",おい 起きろ うまる,I'm going to get up,0.08333333333333333
What? It's still early.,まぁ 何にせよ 元気になったからいいか,"Well, what should I get well?",0.16666666666666666
Take a look outside.,外見てみろ,Let's look out,0.125
It's a beautiful day.,夏だね お兄ちゃん,It is summer. Brother,0.2222222222222222
"My younger sister, Umaru, is pretty and popular.",僕の妹うまるは美人で評判だ,My sister is a good reputation,0.23076923076923078
"At least, that's what I'm told everyone thinks.",とみんな思ってるらしい,I think everyone thinks,0.23076923076923078
"That was a fun shopping trip, Umaru-chan.",買い物楽しかったね うまるちゃん,It was fun to buy shopping Umaru-chan,0.3333333333333333
Another hot day.,今日も暑いね,It is hot today,0.14285714285714285
I could use a cold treat right now.,冷たいもの食べたい,I want to eat cold things,0.15384615384615385
Yeah. I love this kind.,うん これ 好きで,"Yeah, I like this",0.375
Yours is soda flavored?,うまるちゃんはソーダ？,Umaru-chan is soda?,0.5
Summer's not summer without ice cream!,やっぱり夏と言ったらアイスだよね,After all it is ice if it says summer,0.15384615384615385
UMR-san! Aim there!,UMRさん そこですわよ,UMR is there,0.16666666666666666
No...,いや あの向き 角度,No orientation angle,0.25
You're going for two?,２個狙いですの,Two aims,0.14285714285714285
Such splendid balance!,なんですの このバランス,What is this balance,0.14285714285714285
You did it!,やりましたわ さすがですわ UMRさん,I did it. UMR,0.2857142857142857
I like all things Japanese.,わたくし日本の物が好きなので,Because I like the things of Japan,0.3
It's splendidly delicious!,美味しいですわ,It is delicious,0.3333333333333333
"When you eat an ice cream cup,",カップアイスを食べるときはまず蓋を舐める,When eating cup ice first lid first,0.2727272727272727
The lid?,蓋を？,Lid?,0.6666666666666666
Emperor penguins live on the frozen tundra.,皇帝ペンギンは寒い地方で暮らし,The emperor penguin lives in a cold region,0.14285714285714285
"Here they stand stock still, keeping their eggs warm.",卵を温める時もじっと立っています,I'm standing when I warm eggs,0.13333333333333333
Summer is best spent eating ice cream and watching DVDs about emperor penguins!,やっぱり夏は皇帝ペンギンDVDを見ながらアイスだよね,After all summer is Ice while watching the emperor penguin DVD,0.25
"You said it, Master!",全くです 師匠,It is quite a master,0.2222222222222222
I-I couldn't possibly take your ice cream!,切絵ちゃんもアイス食べなよ,Cutting is also eating ice,0.07692307692307693
I bought a ton!,大丈夫だよ いっぱい買ったから,It's okay because I bought a lot,0.3
And even a dedicated cooler?,なんと 専用クーラーボックスまで？,What a dedicated cooler box?,0.5
It's a must-have summer item!,夏の必須アイテムだよ,It is a required item of summer,0.4
Th-Then may I have this mint chocolate ice cream?,で ではこのチョコミントを頂いてもよろしいですか,"Well, may I get this chocomfort?",0.2857142857142857
Mint chocolate—a summer classic!,夏の定番チョコミント,Summer classic chocomics,0.3333333333333333
I got a winning stick!,どうしました 師匠,What a teacher,0.125
WINNER!,当たった ほら,Hoped,0.0
"You did it, Master!",やりましたね 師匠,I did my master,0.25
It's my good karma coming back to me!,よし 出来た,Good,0.1
"Well deserved, Master!",さすがです 師匠,I'm sorry Master,0.125
Umaru! I have a dessert for you!,うまる デザート出来たぞ,I was able to dessert,0.18181818181818182
Huh? Dessert?,デザート？,dessert?,0.6666666666666666
Look! Shaved ice!,ほら かき氷,Luxurious ice,0.2
Just like those parfaits from the other day!,この前のパフェみたいだろ,It looks like this parfait,0.07692307692307693
Let's eat!,いただきまーす,Let's eat,0.75
That's my little sister.,それが僕のたった一人の妹 うまるなんだ,That's my one-sister's sister,0.5714285714285714
See you later!,行ってきまーす,"I'm off, see you lateeer",0.2222222222222222
...and she acts completely\Ndifferent at home and outside.,外と家では全然違う,It is totally different from outside and home,0.21428571428571427
"You've been eating tons of ice cream every day, haven't you?",うまる お前毎日アイス食いまくってるだろ,Umaru You will eat ice every day every day,0.23529411764705882
When did you buy this cooler?,いつの間にクーラーボックス買ったんだ,I bought a cooler box forever,0.08333333333333333
"I'm always near you, smiling,","{\fad(400,400)\blur2.5}いつも近くで微笑んで",Always smiles nearby,0.1111111111111111
w,----ED JP----,---- ED JP ----,0.0
Our time together's full of tenderness.,"{\fad(400,400)\blur2.5}そんな優しい時間",such kind of time,0.2
"Even from afar, I understand you.","{\fad(400,400)\blur2.5}離れていても分かるんだ",I know even if it is left,0.15384615384615385
itazura na hitomi,"{\fad(400,400)\blur2.5}いたずらな瞳",Naughty eyes,0.0
sonna nanige nai hibi dakishime,"{\fad(150,150)\blur2.5}そんな何気ない日々 抱きしめ",Such casual day hugging,0.0
calling your name.,"{\fad(400,400)\blur2.5}不意に名前",Unexpectedly name,0.2
It's time,"{\fad(400,400)\blur2.5}伝えていいかな",I wonder if it is good,0.125
Thank you!,"{\fad(400,400)\blur2.5}ありがとう",Thank you,0.6666666666666666
"We'll never change, our smiles","{\fad(400,400)\blur2.5}変わらないよ",I do not change,0.1
kira kira egao no mama de,"{\fad(400,400)\blur2.5}いつでもキラキラ笑顔のままで",Always splashes a smile,0.0
We'll treasure the seasons we spent together.,"{\fad(400,400)\blur2.5}歩いた季節は宝物",The seasons walked are treasures,0.18181818181818182
We'll never forget,"{\fad(400,400)\blur2.5}忘れない",forget,0.25
but that's still a distant dream.,"{\fad(400,400)\blur2.5}いつから 大人になるその日を夢見て",When you dream of that day from when,0.15384615384615385
"For now, let me slumber by your side.","{\fad(400,400)\blur2.5}今はそばで眠らせてね",Let me sleep by the side,0.3333333333333333
"Next week is the finale, everyone!",みんな 次回は最終回だよ,Everyone is the last time,0.3
I'll do my best till the very end!,最後まで頑張るね,I will do my best until the end,0.5
I shall follow you\N wherever you lead!,どこまでも付いて行きます,I will go with you,0.18181818181818182
