en_text,jp_text,google_translated,score,semantic_score
And I'd rather choose my fate myself.,"なら 俺は自分の意志で
行く道を決める","Then I'm my will
Determine the way to go",0.1176470588235294,0.3915163
Mr. Ido...,イドさん…,Ido ...,0.6666666666666666,0.6302351
"Wait, Maya!","（アマンザ）させないよ
（イド）なっ！","not
!",0.2,0.28433582
Face forward and raise your hands.,"（アマンザ）
前を向いて 手を上げろ",Toward the front and raise your hand,0.2727272727272727,0.769268
Can't you hear me?,聞こえないのか？,Can you hear it?,0.375,0.7569918
Slowly.,ゆっくりとな,Slowly,0.5,0.9015627
The detonation switch?,（アマンザ）起爆スイッチか？,Is it an outbreak switch?,0.25,0.33370253
I refuse.,"（アマンザ）
エバートランサーになってまで―",Until I Become an Evert Lancer-,0.125,0.11115347
The next one will go right through your brain unit.,"（アマンザ）
次はブレイン･ユニットを撃ち抜く",Next Shoot Brain Unit,0.25,0.55589634
You robot bastard.,このロボット野郎が,This robot bastard,0.4,0.7515099
It's not like I'm clinging to life.,（イド）生きたいわけじゃない,I do not want to live,0.2307692307692308,0.40575877
But a reason for dying?,"だが 死ぬ理由も…
（アマンザ）何？","But the reason for death is also ...
 What?",0.3333333333333333,0.82762456
"Run away, please!","（マヤ）皆さん！
早く逃げてください！","Everyone!
Please run early!",0.42857142857142855,0.5048048
"Well done, little lady!",（リック）よくやった お嬢さん！,A good girl who did well!,0.18181818181818185,0.47509724
Not going to shoot?,"（イド）撃たないのか
ま どちらでも変わりはないがな","Do not shoot
Her she is neither changing",0.18181818181818185,0.47769105
Grayman!,（イド）グレイマン！,Grayman!,1.0,1.0000002
"I got it, you damn adventurer.","（グレイマン）
分かったよ この冒険野郎が",I understand this adventure guy,0.08333333333333333,0.35504693
Miguel Jump!,ミゲル･ジャンプだ！,Miguel Jump!,1.0,1.0000005
Stopping the containment mechanism!,"封じ込め機構停止
オリハルト解放！","Clearing mechanism stop
Orihaltral release!",0.2222222222222222,0.41087618
There's a major error in the navigation system!,"（オペレーター３）
空間情報システムに重大なエラー",Error in space information system,0.25,0.49024257
"Return to ordinary space, complete!","（クレア）
通常空間への移動 完了です！",Movement to normal space is complete!,0.4,0.6989076
We did it!,やったー！ やれたよ パパ,Yay!I did it daddy,0.42857142857142855,0.5627776
Someone! Someone!,"（アマンザ）
応答しろ 誰か 誰か！",Responding Someone!,0.6666666666666666,0.5349581
"Looks like you're the only one 
who Miguel Jumped with us, then.","（イド）お前だけが俺たちと一緒に
ミゲル･ジャンプしたようだな","only you are together with us
Miguel jumped",0.35294117647058826,0.81197476
What are you going to do?,（イド）どうする？,What do you do?,0.5714285714285714,0.6112475
Do whatever you want.,好きにしろ,do what you want,0.5,0.76199424
That was a surprise!,（リック）助かったよ お嬢さん,I was saved,0.14285714285714285,0.19526638
To think Maya would attack them.,"（カーラ）びっくりしたわ
まさかマヤさんが攻撃をするなんて","I was surprised
Masa Maya attack",0.18181818181818185,0.68922806
I kind of lost myself there...,（マヤ）む… 無我夢中で…,... I'm in a dream ...,0.18181818181818185,0.345363
What am I gonna do?!,"（マヤ）
え？ うわ～ どうしよう！ あ…",picture?Wow ~ What to do!a…,0.3076923076923077,0.33972374
Huh?,（イド）ん？,?,0.5,0.663547
An emergency rescue signal?,緊急救難信号？,Emergency saving signal?,0.5,0.82133025
Is she supposed to be crazy or responsible?,"（リック）
無茶なんだか 真面目なんだか",Is it stupid or serious?,0.25,0.3190373
I don't dislike that.,"（カーラ）
フフッ 私 嫌いじゃないわ",I don't hate me,0.375,0.4784303
Found it!,（マヤ）あった！,was!,0.25,0.2809474
What a crazy woman.,イカれた女だ,It is a woman who was squid,0.2,0.3217443
I thank you for retrieving my body.,"（アマンザ）肉体を
回収してくれたことには感謝する","body
Thank you for collecting",0.4444444444444444,0.6403872
But...,（クレア･マヤ）ああ…,Oh ...,0.3333333333333333,0.5999138
I'm not going to forget this humiliation.,この屈辱は忘れない,I will not forget this humiliation,0.5,0.9440035
This officer here is a total beauty!,"この隊長さん
すごい美人じゃないの","Mr. this captain
It's not a great beauty",0.21428571428571427,0.4513152
We picked up...,"（リック）す… すげえお宝
拾っちゃった～","... Grow treasure
I picked up",0.42857142857142855,0.5346558
"What are you looking at, you bastard?",何だ？ 貴様 気安く見るな,What?Do not look at your cheap,0.2307692307692308,0.32646915
"To make a living, we sink into the vessel called society and live as in a cage.","社会という器に沈む
澱(おり)のような存在","Sink to a society
Presence like starch",0.19047619047619047,0.39075106
Is that used for good or evil?,"それを利用するは
邪悪か 正義か","Use it
Is it evil or justice?",0.3636363636363637,0.6665318
"Now the false peace falls, 
and pure ambition fills the hearts.","今 偽りの平穏が
終わり―","Now false peace
the end-",0.3076923076923077,0.7014859
