en_text,jp_text,google_translated,score,semantic_score
"And it's high purity Orichalt, too.",しかも純度の高いオリハルト,And high purity Oriharto,0.3,0.6918333
But someone was already digging it.,"（有楽）
しかし すでに掘削した者がいる",But he has already drilled,0.2,0.39246324
That's not good for your blood pressure.,せっかちですね 血圧に障りますよ,It's a crazy blood pressure,0.25,0.69551224
"Well, I shall be waiting then.",まだ何とも言えませんよ,I can not say anything yet,0.07692307692307693,0.22055633
Look forward to it.,楽しみにしてください,Please look forward to,0.5,0.7483438
The rainy season is coming soon...,そろそろ雨季か,Soon the rainy season,0.5714285714285714,0.8168349
"Yes, that's why I want you to take a look.","（クレア）ええ なので
マヤさんに見てほしいんです","so
I want Maya to see",0.1875,0.16714789
Tell me its composition.,"何か気付くところがあったら
教えてくださいね","If there is something you notice
Please tell me",0.16666666666666666,0.15579312
100%?!,"（クレア）オリハルトの純度…
ひゃ… 100％？","Orihart's purity ...
Hy ... 100%?",0.3333333333333333,0.35178882
What's going on?,（グレイマン）何？,What?,0.4,0.22315578
Cute...,（クレア）かわいい,cute,0.5,0.6337638
That's not the issue here.,"（グレイマン）
そういう問題じゃないだろ",It's not that problem,0.3333333333333333,0.5684057
There at the end...,"（カーラ）気圧が
生存可能レベルにまで上がって…","pressure is
Up to the viable level ...",0.18181818181818185,0.13416965
That was Mr. Ido?,（マヤ）最後の… イドさん？,Last ... Ido?,0.2857142857142857,0.61045337
He was too surprised.,"（グレイマン）
ああ 驚きすぎだよな","Oh, it's too surprised",0.2222222222222222,0.6043956
But he had already calmed down when you came.,"マヤさんが来た時には
もう落ち着いてましたけど","When Maya came
I'm still calm",0.13333333333333333,0.4414685
"Well, that really was surprising.","（マヤ）
そりゃあ びっくりしますよ","Well, I'm surprised",0.2,0.5682722
"Karla, what's going on?",どういうことだよ？ カーラ,What does it mean?Cala,0.18181818181818185,0.29243195
In that case that illusion must have been...,"だとすれば
あのイリュージョンは…","If
That Illusion ...",0.3333333333333333,0.6799867
Did her consciousness bypass the MT system and flow directly to me?,"個体の意識がＭＴシステムを通して
俺に流れ込んだか？","Individual awareness through MT system
Did you flow into me?",0.3333333333333333,0.5647156
"Afraid, no, that's not it.",いや それとも…,"No, or ...",0.2,0.29733586
Me?,俺に？,What to me?,0.5,0.45675224
Don't look at me with those pitying eyes!,"（謎の声１）見るな…
哀れんだ目で私を見るな","Don't watch ...
Don't look at me with the eyes",0.5384615384615384,0.57286835
You're the one who betrayed us!,"（謎の声２）冗談はやめろ！
裏切ったのはお前だ","Stop kidding!
It is you who betrayed",0.3333333333333333,0.7898543
You beast!,（謎の声３）貴様の… 罪だ！,You're a sin!,0.3333333333333333,0.26518047
What is it?,（イド）何だ？,What is it?,1.0,0.99999994
Memories?,記憶？,Memory?,0.3333333333333333,0.74884546
"There's a gravitational wave 
from an imminent Miguel Jump!","（カーラ）
ミゲル･ジャンプの前駆重力波！",Miguel Jump Predal Gravity Wave!,0.3076923076923077,0.8444737
Who?,"（リック）
ミゲルアウト？ 誰が？",Miguel out?Who?,0.5,0.28598583
I caught a warning signal from an advance probe!,"（クレア）先行ブローブによる
警告信号をキャッチ","By the preceding brove
Catch a warning signal",0.2,0.48698735
The Federation?,（グレイマン）連盟か？,Federation?,0.6666666666666666,0.93911344
"Well look at that, one of the 
Planetary Federation's military interstellar ships.","（グレイマン）惑星連盟軍の
インターステラーシップじゃねえか","of the Planetary Federation
I'm not an intersteller ship",0.19047619047619047,0.6609171
Retrieving advance probe.,"（オペレーター１）空間転移完了
先行プローブを回収","Spatial Metastization Completed
Collect preceding probe",0.1111111111111111,0.4494094
"Deploying spatial mesh 
with Vega as the base coordinate.","（オペレーター２）ベガを
基準点とする空間メッシュ展開","Vega
Space mesh development to be a reference point",0.1176470588235294,0.7659891
Combined search sensors locked on to target.,"（オペレーター３）
統合索敵によるターゲット補足",Target supplement by integrated celebration,0.08333333333333333,0.08517695
"This is Contact, commence operation.","（オペレーター４）
こちらコンタクト 作戦開始",This starts contact operation,0.375,0.8309607
"This is Recon 01, roger.","（アマンザ）
こちらリーコン01 了解",Leuko 01 Obtaining,0.1111111111111111,0.29823866
"All units, let's finish this mission quickly.",全機 迅速に任務遂行せよ,Let's carry out the mission quickly,0.3076923076923077,0.6501934
Emergency jump!,クレア！ 緊急ジャンプだ,Claire!Emergency jump,0.75,0.7278286
I don't care where you take us!,"（リック）よぉ おい
売りもん捨てるのかよ",Do you want to stay sell,0.15384615384615385,0.1733949
Rick! Ido!,（グレイマン）リック イド,Rick Id,0.25,0.76340127
Got it.,"（リック）ああ… それはマズいな
よし まいちゃえ～","ah ... it is palm
Yoshihara she is too",0.1,0.09684571
Target has released a large number of mineral-like objects in your direction.,"（オペレーター）対象ターゲット
軌道上に鉱物らしき物体を多数放出","Target target
Many of the mineral crawl objects on the orbit",0.15789473684210525,0.60218465
"Recon 01, use of S2 strategy is permitted.","（中佐）リーコン01
Ｓ２戦術を許可する","Leacon 01
Allow S2 tactics",0.15384615384615385,0.62580127
"Time until Orichalt release from 
containment device is 170 seconds!","オリハルト封じ込め機構停止まで
あと170秒","From Orihard Containment Mechanism Stop
170 seconds",0.2857142857142857,0.7293682
The Federation ship deployed troops!,連盟軍航宙艦から兵員出撃,Soldier dispatch from federation army ship,0.2,0.6982765
"Recon 01, advancing.",（アマンザ）リーコン01 先行する,Leacon 01 preceding,0.14285714285714285,0.4904264
Orichalt torpedoes?,（グレイマン）オリハルト弾頭か？,Orihard Barrost?,0.2,0.4155423
A short jump.,"（リック）何だ？
（イド）ショートジャンプだ","What is it?
 Short jump",0.25,0.864045
"Oh no, they're going to break through these too!","（リック）
しゃらくさいこと しやがるぜ",I'm going to do something,0.125,0.22448443
Resistance is...,（アマンザ）抵抗を…,Resistance ...,0.6666666666666666,0.92396355
I repeat!,（イド）くっ！,!,0.3333333333333333,0.3236389
"Stop the resistance and 
disarm yourselves immediately!","繰り返す
抵抗をやめ ただちに武装を―","repeat
Stop resistance He immediately armed-",0.2727272727272727,0.57835186
Obey the Federation military's orders!,連盟軍の指示に従え,Follow the instructions of the federation army,0.18181818181818185,0.7717509
You there.,さもなくば 貴船を無力化する,If you're no longer help you,0.125,0.14896631
What's your name?,（アマンザ）貴様 名前は？,What is your name?,0.6666666666666666,0.92928183
"Ido, huh.",（イド）イド,id,0.0,0.263738
I'll remember that name.,覚えておくよ その名前,I will remember that name,0.5714285714285714,0.9176377
"Physical connection to the
 target ship established via wires.","（オペレーター１）目標船に対して
物理ラインの構築完了","For the target vessel
Completed physical line construction",0.2,0.51546526
Target ship has been seized.,"（オペレーター１）
目標船 拿捕完了",Target Capture,0.14285714285714285,0.38762462
So what are we supposed to be guilty of?,"（グレイマン）
だから 罪状は何だ？",So what is your sin?,0.2307692307692308,0.37966862
"Where's the Orichalt you've 
excavated from the new planet?","（隊長）新惑星から掘削した
オリハルトは どこにある？","I drilled from the new planet
Where is Oriharto he?",0.375,0.69611424
"I'm asking you, what are the charges?",（グレイマン）罪状は何だ？,What is the sin?,0.25,0.18651651
We'd like to avoid any further harm.,"（隊長）
なるべく危害は加えたくない",I do not want to add harm as much as possible,0.1176470588235294,0.5286086
Man...,（マヤ）ああ…,Oh ...,0.3333333333333333,0.5659775
Observation chamber in block 32.,ったく… 32区画の観測室だ,It is an observation room of 32 compartments,0.16666666666666666,0.67113703
Right.,（隊長）よし,good,0.0,0.37489897
"So they're after the Orichalt 
from the new planet, after all.","（グレイマン）やはり新惑星の
オリハルトが目当てか","After all the new planet
Orihart is here",0.3333333333333333,0.7815667
But why are they doing it so forcibly?,しかし なぜここまで強引に？,But why do you do not get caught here?,0.2,0.32919124
No talking!,"（隊長）会話は行うな
（マヤ･クレア）ひぃ！","Do not talk
 Hi!",0.14285714285714285,0.6495635
"Out of the ship, all of you!",（隊長）全員 船外に出ろ！,All out of the outboard!,0.5555555555555556,0.58821684
"Good, this is it.","どっかに隠れてくれてると
いいんだけど","If you hide it somewhere
Good",0.2,0.20150776
Let's ask the guys outside for help.,"（Ｉマシン兵２）
外の連中に 援軍を頼もう",Request a reinforcement to the outside,0.15384615384615385,0.37462637
But is this really all of it?,"（Ｉマシン兵３）
しかし これで全部なのか？",But is he all with this?,0.5,0.536872
"No idea whether it is, 
but the orders are to retrieve it.","（Ｉマシン兵１）
全部かどうか知らんが命令は―",If it is all whether or not the instruction is-,0.21052631578947367,0.3735147
How long are you gonna stay in the machine?,"（アマンザ）
いつまでマシンのままでいる？",How long are you staying?,0.4166666666666667,0.6138733
Hurry up and Mind Out.,"早くマインドアウトしろ
（イド）できない","Mind out quickly
 can not",0.2222222222222222,0.5984652
Still trying to resist?!,ふあぁ？,Fa?,0.14285714285714285,0.20966667
Mr. Ido is an Evertrancer.,"（マヤ）イドさんは
エバートランサーなんです","Ido
It is an Ever Arcer",0.3333333333333333,0.355379
"That's why, uh...",ですから その…,So that ...,0.2857142857142857,0.40614513
"Even if he wanted to Mind Out, he can't do it.","マインドアウトしたくても
できないというか…","Even if you want to mind
It can not be done ...",0.25,0.61188865
Ever... trancer?,"（マヤ）あ あの…
（アマンザ）ん？","Ano ...
?",0.4,0.22002183
But that's a serious crime!,重犯罪行為じゃないか,It is not a heavy criminal act,0.07692307692307693,0.47066125
"I'm the same, by the way.","（リック）
ちなみに俺もそうなんだ","By the way, I am also",0.5,0.64728147
Oh? We didn't tell you?,"（グレイマン）あれ～？
言ってなかったか？ 俺もだよ","What?
Did not say?I'm also",0.15384615384615385,0.39150417
Evertrancer... First time seeing one.,"（アマンザ）
エバートランサー 初めて見た",I saw it for the first time Evert Lancer,0.14285714285714285,0.4665706
Why did you abandon your bodies?,"肉体を捨てた理由は？
機械の体に憧れたか？","Why did you discard the body?
Did you admire the machine's body?",0.3076923076923077,0.5262832
Seeking eternal life?,永遠の命が欲しいか？,Do you want an eternal life?,0.375,0.80213225
Neither of those.,（イド）どちらでもない,is neither,0.2,0.4947493
And you still call yourself human?,"それでも自分が人間だと
言い切れるか？","Still it is human being
Do you say?",0.3333333333333333,0.6917626
That's not for me to decide.,"（イド）
それを決めるのは俺じゃない",It is not me to decide that,0.5,0.8347205
"Pleased to meet you, captain Jake Hojo.",ジェイク･ホウジョウ大佐,Jake Hojo Colonel,0.2,0.70102626
Captain?,大佐？,Colonel?,0.3333333333333333,0.6078591
"It's a great honor to meet you, former captain-","（中佐）元大佐殿に
お目にかかれるとは光栄の極み","Former Saga
It is an honor to see",0.26666666666666666,0.43810517
What are the charges against us?,"（グレイマン）
俺たちの罪状は何だ？",What is our sin?,0.2,0.26928887
You're accused of illegal mining on the new planet.,新惑星の違法掘削容疑です,It is an illegal drilling suspicion of the new planet,0.3125,0.65880275
Illegal mining?,違法掘削？,Illegal drilling?,0.5,0.64035726
We accepted a formal request from Planet Works!,"私たちはプラネットワークス社から
正式な依頼を受けて…","We are from Planet Works
Get formal request ...",0.5,0.8187868
"There is no company called 
""Planet Works"" anywhere in this universe.",全宇宙のどこにも存在しない,It does not exist anywhere in the whole universe,0.15789473684210525,0.45700413
No way!,そんな！,Such!,0.25,0.38915652
To think I'd fail to notice the information was fake...,"（カーラ）この私が偽の情報を
見抜けなかったなんて…","This I am fake information
I couldn't see it ...",0.2352941176470588,0.56625545
"But still, to think the former captain 
was still sailing through the universe.","元大佐殿がいまだに
こうして宇宙で ご活躍とは","General Saga is still
Thus, he is active in the universe",0.2,0.41320422
"Was losing a state of the art ship and 
740 subordinates not enough for you?",まだ足りないというのですか？,Is it still not enough?,0.15789473684210525,0.3144957
I'm doing it because I like it.,好きでやってるんだから,Because I like it,0.5714285714285714,0.5921713
"Former top racer whose body 
was paralyzed in an accident.","事故で全身不随となった
元トップレーサー","It became a whole body in an accident
Former top racer",0.4666666666666667,0.8131292
"Former fund manager who exercised 
outstanding talent in the space resource market.","（中佐）宇宙資源マーケットで
辣腕(らつわん)を振るった―","In the space resource market
Waving wandering-",0.3333333333333333,0.44068018
A wild animal from the endangered species of the Cetus constellation.,"（中佐）
くじら座で生息を確認されている
絶滅危惧種の野生動物","A habit of habitat is confirmed
Endangered species wildlife",0.25,0.50087714
An animal?,動物…？,animal…?,0.25,0.84608287
"going not only against Federation law, but even the taboos of bioethics.","（中佐）そのどれもが
連盟法違反どころか―","Which one is
Dead of the Federation Laws-",0.15789473684210525,0.5506979
But there is an even more interesting specimen.,"しかし それ以上に
興味深い対象がある","But more
There is an interesting target",0.6,0.5423979
And then there's you.,それは 君だ,That's you,0.2857142857142857,0.45007965
"Machine number, consciousness mapping, we can't find your ID no matter the approach.",機体番号 意識マッピング,Machine number awareness mapping,0.17647058823529413,0.48225003
"Basically, you don't exist in this world.","つまり この世界に
君は存在してないことになる","In other words, in this world
You will not exist",0.42857142857142855,0.77906716
I exist right here.,（イド）俺は ここにいる,I am here,0.3333333333333333,0.4799851
So who are you?,（中佐）君は何者だ？,Who is you?,0.5,0.7156037
That's what I'd like to know.,"（イド）
こっちが知りたいくらいさ",I want to know this,0.2727272727272727,0.44625378
Watch your mouth.,"（アマンザ）
口の利き方に気を付けろ",Be careful with the way of mouth,0.1,0.6085787
"Um, we were just mining as per per the accepted request! We're not lying!","あ あの… 私たちは依頼を受けて
掘削作業を行っただけです","Oh ... we receive a request
I just did the drilling work",0.17391304347826084,0.43524784
Especially you.,特に君はね,Especially you,0.6666666666666666,0.9282317
Mikuri Maya.,"ええ？
（中佐）ミクリ･マヤ","Yes?
 Mikuri Maya",0.4,0.8808502
scientific use of the Federation Academy to the Fujima Corporation.,"連邦アカデミーが
学術保護認定した天体情報を―","Federal Academy
Academic protection certified astronomical information-",0.0625,0.41465366
That's wrong! I'm innocent! Really!,"ち… 違います
私は無実です 本当です","Chi ... difference
I am in innocent",0.15384615384615385,0.51890135
Please listen to me!,"私の話を聞いてください
（中佐）本当かどうかは","Please listen to my story
 Whether it is true",0.2727272727272727,0.29931676
That girl...,"あの子
（クレア）見つかっちゃった","That girl
 I was found",0.3333333333333333,0.6263811
"Hey, you! Don't struggle!","（Ｉマシン兵２）
おい こら 暴れるな",Don't go wild,0.2222222222222222,0.24534325
I've heard the news.,（有楽）聞いたよ フフフ…,I heard  Huhufu ...,0.25,0.42543465
But isn't the amount a bit low?,"でも 量が少ないじゃないか
とんだ誤算だな","But the amount is small
It is a tight miscalculation",0.38461538461538464,0.67125493
I bet the mining company is just trying to fool us.,"掘削業者に
ナメられているだけでしょう","To the drilling company
It will only be called",0.16666666666666666,0.37021226
Guess we'll have the military get it together then.,"じゃあ軍の人に
しっかりしてもらわないとね","Then be a military person
I have to do it firmly",0.2222222222222222,0.43050215
Should I put in a word?,ハハッ 僕が口を利こうか？,Haha I have a mouth?,0.3,0.18605745
That's my job.,ご冗談を それは私の仕事です,It is a joke that is my job,0.3333333333333333,0.4108109
"There should be more Orichalt 
you've dug up from that new planet!","（中佐）新惑星から掘削した
オリハルトは まだあるはずだ","I drilled from the new planet
Orihart should have yet",0.2,0.64250684
Where are you hiding it?,どこに隠している？,Where are you hiding?,0.8333333333333334,0.8976659
The one in block 32 was all of it.,"（グレイマン）
32区画にあったやつで すべてだ",It is everything in the 32 partitions,0.3076923076923077,0.39211035
"If it's not enough for you,","足りねえって言うなら
あんたらが新惑星に行って―","If you say enough
Anno goes to the new planet-",0.2,0.24862032
Papa!,パパ？ …！,Daddy?...!,0.2,0.5053648
Don't move!,"（リック）てめえ！
（Ｉマシン兵）動くな！","!
 Do not move!",0.6,0.91993254
"In the military, orders are absolute.","（アマンザ）
軍にとって命令は絶対だ",The command is absolute for the army,0.16666666666666666,0.7264291
Trying to be ironic?,（リック）ああん？,Oh?,0.16666666666666666,0.18193832
As if a machine like you could-,お前のような機械でも冗談を…,Machine as you like ...,0.5,0.6254358
A gravity wave?,（カーラ）前駆重力波？,precursor weight wave?,0.3333333333333333,0.56997424
Estimated mass...,出現想定質量…,Occasional expected volume ...,0.16666666666666666,0.35320985
Half the mass of the Moon!,…！！ 月質量の２分の１です,...!!It is one half of the month of month,0.3636363636363637,0.32708293
Is it a man-made object?,何？ それは人工物なのか？,what?Is it an artifact?,0.3333333333333333,0.3340758
Materialized in normal space!,（オペレーター２）通常空間に出現,Appears in normal space,0.5,0.50766957
Those are...,（オペレーター３）これは…,This is ...,0.2,0.66489923
Are these asteroids heading here?,"（リック）
隕石(いんせき)があんなに！ こっちへ来る",Meteorites  are so!Come here,0.2,0.56312376
"Strictly speaking, not asteroids.","（カーラ）
厳密には隕石じゃないって",Strictly not meteorites,0.2857142857142857,0.66001976
Is this your work too?,"（アマンザ）
これも貴様らの仕業か？",Is this too work?,0.8333333333333334,0.49060732
What's happening?,"（グレイマン）何だ？
こりゃ ただごとじゃねえぞ","What is it?
Just because he is just",0.2222222222222222,0.1791674
What kind of phenomenon is this?,"こ… こんなことって
どんな現象なの？ どうして？","This ... such a thing
What kind of phenomenon is it?Why?",0.5384615384615384,0.8392661
"Into the ship, right now!","（グレイマン）
詮索はあとだ！ 船に入れ！",Situation is later!Put on the ship!,0.25,0.60655326
You want to die or what?,お前ら 死にてえのか？,Are you going to die?,0.4444444444444444,0.6391875
"All hands, brace for impact!","（オペレーター２）
総員 衝撃に備えよ",Prepare for general shock,0.1,0.27997583
Time until collision:,（オペレーター３）移動体 接近,Mobile approach,0.0,0.18091059
16...,移動体接触まで 16… 15… 14…,Mobile contact 16 ... 15 ... 14 ...,0.3333333333333333,0.3824068
12...,13… 12… 11…,13 ... 12 ... 11 ...,0.5,0.82488036
9...,10… ９… ８… ７… ６…,10 ... 9 ... 8 ... 7 ... 6 ...,0.3333333333333333,0.7357358
4...,５… ４… ３… ２… １…,5 ... 4 ... 3 ... 2 ... 1 ...,0.3333333333333333,0.7386322
Maya!,マヤさ～ん！,Maya!,1.0,1.0
Go back to the ship.,（イド）船に戻ってろ,Return to the ship,0.42857142857142855,0.8192358
Where are you going?,"（Ｉマシン兵２）
あっ 待て どこへ行く？",Where are you waiting?,0.6666666666666666,0.5971031
Lieutenant!,（Ｉマシン兵たち）うわあ！,Wow!,0.3333333333333333,0.24423236
We can't do this!,（アマンザ）泣き言を言うな！,Don't cry a crying!,0.3333333333333333,0.25231197
Could it be...,"（クレア）
よかった 無事だったんだ",It was good safe,0.14285714285714285,0.07899984
Come here!,こっち来て！ えっと えーっと…,Come here!え え ...,0.6,0.44037223
"Permitting use of weapons 
against the mining company.","（Ｉマシン兵１）
掘削業者に対する発砲を許可する",Allows the drilling company to fire,0.15384615384615385,0.50638855
Focus on securing the target!,対象の確保を優先！,Take advantage of the target of the target!,0.3333333333333333,0.68486273
"If you don't wanna die, 
get the hell out of my ship!","（グレイマン）死にたくなけりゃ
とっとと俺の船から降りろ！","If you want to die
Get off from my ship!",0.35,0.88277614
You okay?,"（グレイマン）大丈夫か？
（謎の少女）ハハハハ…","okay?
 Hahahaha ...",0.4,0.38440692
"Boss, we're detecting more gravity waves.","（カーラ）ボス！
多数の前駆重力波を検知","Boss!
Detect a large number of precursor gravity waves",0.1875,0.725962
There'll be a whole lot more coming!,さっきの倍以上の数が来る,A number of times or more is coming,0.21428571428571427,0.4969463
"Hey, hey, hey!","（リック）おいおいおい！
どうすんだよ これ","Hey!
I'm sorry",0.3333333333333333,0.5342524
We can't jump away!,こっちはジャンプできねえんだぞ,I can jump here,0.1111111111111111,0.51835847
Let's leave that to the military.,（イド）それは軍に任せておけ,I leave it to the army,0.2727272727272727,0.586099
Are they going to jump?,"（リック）
連中 ジャンプする気か？",Do you want to jump in a row?,0.25,0.5646888
"Time until moving objects enter 
the Miguel Field: 0277.","（オペレーター１）移動体
ミゲルフィールド領域到達まで―","Mobile
Miguel Field Arrangle-",0.15384615384615385,0.4996319
Commencing emergency Miguel Jump along with the captured ship.,"（オペレーター２）拿捕船を含む
緊急ミゲル･ジャンプ 開始します","Including a captain
Emergency Miguel Jump starts",0.21428571428571427,0.779256
Damage report!,（中佐）艦の被害状況 報告！,Shipping status report!,0.4,0.5078447
What is the state of the disabled ship?,拿捕船の状況は？,What is the situation of the vessel?,0.5,0.5018745
Physical connection is normal.,"（オペレーター３）
物理ラインに異常なし",No abnormality in physical line,0.1111111111111111,0.51848
"Recon 01, roger.",（アマンザ）リーコン01 了解,Leacon 01 Obtaining,0.14285714285714285,0.3642597
Where... did they go?,やつらは… どこへ？,Yatsura ... Where?,0.42857142857142855,0.26188892
Should we look for them on board?,"（Ｉマシン兵）
掘削業者の船内を捜索しますか？",Do you want to search for the ship of the drilling company?,0.1111111111111111,0.30615398
So that means.,なるほど,So that's it,0.3333333333333333,0.4669781
Ido!,（グレイマン）イド！,Ido!,1.0,1.0000001
What is this about doing a Miguel Jump at the moment of the explosion?,"爆破と同時に
ミゲル･ジャンプするって？","At the same time as a blast
Miguel Jump?",0.3333333333333333,0.83381325
Theoretically it should be possible.,（イド）理論的には可能なはずだ,Theoretically should be possible,0.6666666666666666,0.9474705
"If it fails, we'll die!","（クレア）そんなこと言って
失敗したら死んじゃいますよ","saying that
If you fail, you're dead",0.14285714285714285,0.58860034
Same thing as staying here.,（イド）ここにいても同じことだ,It is the same thing even here,0.3,0.35685658
