en_text,jp_text,google_translated,score
"If that's how he raises his motivation, that's fine.",それが あいつのモチベーションの上げ方ならそれもいいだろう,That would be good if it is how to raise the motivation of that,0.2
Their presence gives me chills. It must  come from the momentum of continuous wins.,ゾクッとするような存在感ですよ,It is a sense of presence that is thrust,0.15
"And yet, they aren't desperate, or aggressive toward their opponent.",それでいて 気負ったところがまったくなくて,That's why I felt at all,0.0
They're so calm that they look  more pro than the real ones.,落ち着き払っていて下手なプロよりもプロっぽいというか,It is paid calmly and is not good than a poor professional,0.043478260869565216
"This is the perfect stage to test my Zero theory, which I've been advocating.",俺が日ごろから提唱するゼロの理論が試される最高の舞台だぜ,It is the best stage where the theory of zero advocated from the sun is tried,0.2
The key is to free yourself from destruction before you begin the race.,いかに心の雑念を振り払って戦いに望めるかが肝だ,How is it liver how to shake your heart's mind and want to fight against the battle,0.11538461538461539
I believe that the ideal driving style can be  achieved through a mental state of zero noise.,無になることこそ理想的なドライビングスタイルだと,It is an ideal driving style that is nothing,0.18181818181818182
"The air is moist, so it'll rain from dawn through the day tomorrow, like the weather forecast said.",空気が湿ってますな,The air is wet,0.15
"Wet conditions will probably benefit the locals, because they know the course.",ウエットコンディションなら地元が有利かな,If the wet condition is advantageous,0.11764705882352941
"Generally, that would be true...",一般的にはそうでしょうが,Generally it will be,0.2222222222222222
...but Team Spiral tends to  rely on their cars' potential...,スパイラルっちゅうチームは,Spiral Team,0.16666666666666666
...so they probably don't like rain.,雨はありがたくないのと違いますかな,It is different that the rain is not thankful,0.0625
"Compared to Okuyama's car, the difference in performance is just too big.",奥山の車と比べて戦闘力に差がありすぎますからな,Because there is too much difference in combat power compared to the car from Okuzan,0.36363636363636365
"But in rain, it will equal out.",しかし 雨となれば 互角,"But if it is rain,",0.36363636363636365
"Plus, I can think of another condition, besides the rain.",おまけに雨以外のもう一つ別の状況も考えられます,Another situation other than rain is also possible,0.1111111111111111
"In that case, Okuyama won't be able to defeat Project D's lad.",その場合 奥山ではプロジェクトDのボーヤには 勝てんでしょうな,"In that case, I will win the Boya of Project D in Okuyama",0.3181818181818182
A Central Anime Production  Translation: Hiro-kun  Timing: Todd Perkins  Editing: Lillian-Hime Barbara Todd Perkins Brain Dave Mouse Steve S. tayori ni naru mono wa sore shika mienakatta,頼りになるものはそれしか見えなかった,I could only see what I rely on,0.0
Kono namiki michi wo nukete ikeba kitto,この並木道を抜けていけばきっと,I will surely miss this line trees,0.0
Tsukameru youna ki ga shita,つかめるような気がした,I felt like it,0.0
Kono basho kara,この場所から,From this place,0.0
Shiroku kumotta mado to,白く曇った窓と的外れなNavigation,White cloudy windows and off-off Navigation,0.0
Akaku kawatta shingou de,赤く変わった信号で,With a red change signal,0.0
Side mirror ni utsuru shikai wo saegiru light,サイドミラーに映る視界を遮るLight,Light blocking the view reflected in the side mirror,0.23076923076923078
Tsumetai kaze ga hairikomanai youni,冷たい風が入り込まないように,Not to get cold wind,0.0
Mado wo sotto shimetanda,窓をそっと締めたんだ,I tightened the window,0.0
Soko ni hirogaru michi wo erande susumu bokuwa,そこに広がる道を選んで進む僕は,Choose the way that spreads there and proceed,0.0
