en_text,jp_text,google_translated,score,semantic_score
You're right!,"（シェラ）そうそう！
そうやって押しつけてると―","looks like!
If you are pressing that way-",0.18181818181818185,0.31087434
What is happening right now?!,"（ディアヴロ）なんだ この状況！
ってかヤバイ！","What is this situation!
I'm sorry!",0.25,0.42301255
It's shocking me!,元気になってくるらしいよ,It seems to be fine,0.1111111111111111,0.08332236
Klem's pouring a ton of magic power into me!,"ビリビリくる！　クルムから
膨大な魔力が流れ込んでくる！","Viriviri!From Kulm
A huge magical power comes in!",0.16666666666666666,0.54523134
"Diablo, how is it?","んっ ふっ…
ディアヴロ… どう？","...
Diavro ... How?",0.25,0.13649803
Are you feeling active?,元気になってきた？,Have you been well?,0.25,0.42550185
I want to ogle them!,"（ディアヴロ）ぐっ… クソ…
クソーッ！　凝視したい！","... fucking ...
I'm addicted!I want to garde!",0.3636363636363637,0.2915397
Just how different would my life have been,どれだけ違った人生だったろうか…,How different life would you ...,0.4,0.8177669
This is kind of amazing!,ん… なんかスゴいのだ！,... Something is great!,0.2222222222222222,0.33851603
My Magic Points are fully recovered.,"（ディアヴロ）
マジックポイントが全快した",Magic points were all right,0.2,0.66434866
The Demon Lord's incredible.,スゲえな 魔王,Suga Demon,0.14285714285714285,0.52197784
"My, metal on a woman's face?","（アリシアの母）
まあ 女の顔に金物なんて",Well what kind of thing to the woman's face,0.1875,0.62867785
I saw you had books that were \Ninappropriate to your education.,"（アリシアの父）お前の教育に
ふさわしくない本があったのでね","For your education
There was a book that was not suitable",0.15789473684210525,0.6810707
So I threw them out.,捨てておいた,I abandoned,0.14285714285714285,0.3813544
"When an emergency arises, \Nprotect Humans first.","（国家騎士）有事において
守るべきは まずヒューマンだ","In accommodation
He should protect he first is Human",0.0625,0.46387687
Demihumans can come afterward.,亜人は後回しでかまわん,Aspects,0.0,0.0867061
Sometimes sacrifices are necessary \Nfor the prosperity of the nation.,"（国王）国の繁栄のためには
時として犠牲が必要なのだ","For the prosperity of the country
Sometimes it is necessary",0.35714285714285715,0.6838247
Do you understand?,分かるかね？,Do you understand?,1.0,0.99999964
I need the Demon Lord to fulfill \Nthe Demon Lord's duty.,"魔王様には
魔王様の務めを―","To the devil
Magic King's Success",0.2,0.55629236
She must rid this world \Nof the mortal races,人族をこの世から消し去り…,Remove the human from this world ...,0.2307692307692308,0.48319733
in order to create a beautiful world.,美しい世界を実現するために…,To realize a beautiful world ...,0.4,0.7913439
How are you feeling?,（従騎士）ご気分は？,What do you feel?,0.25,0.6823764
Obviously not good.,"（サドラー）いいわけないでしょう
最悪の気分です","will not be good
I feel the worst",0.2,0.45772582
who doesn't believe in my power.,"僕の力を信じぬ
不届き者の存在など","Believe my power
Existence of persons who have no longer",0.2857142857142857,0.71075857
I'll never forgive,"（サドラー）絶対に許しませんよ
あの亜人ども！","absolutely not forgive
That subperson!",0.1111111111111111,0.5660019
You're saying the Demon Lord has revived?!,"（サドラー）
魔王が復活しただと？",Is the devil revived?,0.25,0.7825417
"I'm sorry, Klem.","（レム）
ごめんなさい… クルム…",I'm sorry ... Kulm ...,0.375,0.6421788
