en_text,jp_text,google_translated,score
The name's Formaggio.,どうだ どうだ どうだ どうだ,How about how.,0.14285714285714285
I just have to get back without being followed!,とことん俺を尾行するつもりだろうな,I will be going to go to the tail,0.125
I'm gonna follow my orders!,しょうがねぇなぁ,I'm sorry,0.2222222222222222
I wonder what it was...,何かすごい音しなかったっすか,I wonder if something was not able to sound,0.25
"With all these people around, \Nattacking with my Stand's a bad idea.",人が集まって来てはよ 俺のスタンドで攻撃するのはヤバいぜ,People come together and attack on my stand,0.15789473684210525
Huh? The bleeding already stopped...,あれ もう血が止まってるぞ,The blood is already stopped,0.3333333333333333
My knife isn't this big.,俺のナイフはこんなでかくないもの,My knife is not like this,0.4444444444444444
Where the hell did mine go?,どこ行った 俺のナイフは,Where did my knife went?,0.3
"This shoe isn't mine, either! \NIt's way too big!",この靴も俺のじゃあねえ 全然でけぇ,This shoe is also me too,0.26666666666666666
Something feels off about this seat...,なんか このシート変だぞ,Something is strange this sheet,0.2
My foot can't reach the pedals... and the seat is huge!,と…届かないぞ,And ... I can not reach,0.1875
I can't see the windshield!,フロントガラスから前が見えねぇ,Before the windshield can be seen,0.18181818181818182
"What the hell? \NThis isn't my car, either!",何だ この車も俺のじゃあねぇ,What is this car too.,0.2
"Where'd it go? \NDude, where's my car?!",どこだ どこ行ったんだ 俺の乗ってきた車は,Where did you go?,0.23076923076923078
The effects of the cut I made on your cheek \Nare finally starting to show!,やっと現れてきたんだよ てめぇの頬につけてやった傷の効果がな,"I'm finally I've appeared, I have a wound effect I put on my cheek",0.16
"W-Wait, these are my shoes and knife...",や…やっぱり俺の靴とナイフか とすると…,Yes ... If it is my shoes and knife ...,0.38461538461538464
S-So this is that stalker guy's Stand ability?,こ…これがあの尾行野郎のスタンド能力か,This is the stand ability of that tail bastard.,0.3333333333333333
I'm gonna force the location of \Nthe boss's daughter right out of you!,ボスの娘の居所は絶対吐かせる,Boss's daughter's whereabouts,0.17647058823529413
A heavy stone of fate,重たい運命の石に,To the stone of heavy fate,0.5714285714285714
marude oshitsubusarete,"{\move(1750,1070,1900,1070)\fad(200,500)\fax-0.1\t(500,0,\3c&H02E2F0&)\t(500,0,\c&H02E2F0&)\t(500,0,\blur6)}まるで押し潰されて",Maru crushed,0.0
is threatening to crush me,まるで押し潰されて,It is crushed,0.14285714285714285
"Struggle as I may,",どこにも逃げられない,I can not escape anywhere,0.1111111111111111
hitasura agaki nagara,ひたすら足掻きながら,While trying,0.0
But I'll never give in,"{\move(1750,1070,1900,1070)\fad(200,500)\fax-0.1\t(500,0,\3c&H02E2F0&)\t(500,0,\c&H02E2F0&)\t(500,0,\blur6)}だけどあきらめない",But I can not give up,0.3333333333333333
Though fragments of hope lie buried beneath the rubble,"{\move(1750,1070,1900,1070)\fad(200,500)\fax-0.1\t(500,0,\3c&H02E2F0&)\t(500,0,\c&H02E2F0&)\t(500,0,\blur6)}瓦礫の底に埋もれた",Buried at the bottom of the rubble,0.36363636363636365
in order to make a difference in this world,世界を変えるために,To change the world,0.2
Only those who believe in the path they take,自分の道を信じた者だけがいつか輝ける,Only those who believe in their way will shine someday,0.35714285714285715
"As long as they live,","{\move(1750,1070,1900,1070)\fad(200,500)\fax-0.1\t(500,0,\3c&H02E2F0&)\t(500,0,\c&H02E2F0&)\t(500,0,\blur6)}命の限り 神にも逆らい 戦い続ける",As long as Life continues to fight against God,0.18181818181818182
"even if opposed by God,",命の限り 神にも逆らい 戦い続ける,Only life continues to fight against God,0.08333333333333333
fukutsu no tamashii tachi yo,不屈の魂たちよ,I'm sorry,0.0
"Hey, did one of you fetch my mineral water yet?",ねえ ミネラルウォーターはまだかしら,Hey mineral water still,0.23076923076923078
I'm going to die of thirst at this rate.,あたし 喉が渇いているのよ このままだと渇き死にしてしまいそうなのよ,My thirsty is thirsty I'm going to die thirsty,0.35714285714285715
True... I'd like to have lunch soon.,確かによー そろそろランチにしてぇんだがな,"Certainly, I'm going to be lunch soon",0.26666666666666666
Feed us!,食わせろ,Fertilize,0.0
Narancia is late...,遅いですね ナランチャ,It is late Nalancha,0.3333333333333333
This is why I was worried about him going!,だから僕は あいつを行かせんのは心配だと言ったんです,So I said that I was worried about going to him,0.42857142857142855
"Drop it, Fugo. How many times-",しつこくもなりますよ 僕があれほど…,It will be persistent.,0.18181818181818182
I-I'm sorry...,す…すみません,... sorry,0.5
"Takes a little while for the ability to take effect, though.",能力が効き始めるまで時間はちょっとかかるがよぉ,Time is a little while the ability starts to work,0.35294117647058826
Your bandanna and the clothes you're wearing are gonna keep shrinking with you.,てめえが身に着けてる服やバンダナは今も一緒に縮んでいる,The clothes and Bandana are now shrinking together,0.2777777777777778
Your knife and shoe stopped shrinking\N since they were separated from your body.,体から離れた靴やナイフはその時点で縮むのをやめている,Shoes and knife away from the body have stopped shrinking at that time,0.23809523809523808
"So basically, the more you shrink,\N the less things you'll be able to use!",つまり 縮み続けるてめえに持てる物はどんどんなくなっていくのさ,"In other words, the thing that can be held for shrinks is more and more",0.14814814814814814
Am I still shrinking?,縮み続けている,I keep shrinking,0.3333333333333333
This door...,このドアも,This door,0.6666666666666666
"Got that right, dumbass.",その通りさ マヌケ,That street manke,0.125
Still...,でも,but,0.0
I have to reach that phone\N as soon as possible so I can call for help!,助けてもらうためにも 早くあの電話にたどり着かなくてはよぉー,I have to get along with that phone as soon as I get help,0.3684210526315789
"That's right, it opened, dammit!",開いたぞ ちくしょう,It's open,0.2222222222222222
"Guess you haven't realized it yet, \Nbut your clothes and wallet are shrinking with you!",それにお前は気づいていねえようだが 一緒に服や財布も小さくなっていってるんだぜ,"Besides, you can not notice, but together, clothes and wallets are getting smaller",0.19230769230769232
You need a telephone card or coins to use the pay phone!,公衆電話にはテレホンカードかコインがいるんだぜー,There is a telephone card or coin on the public phone,0.3333333333333333
This is bad...,それは絶対まずい,It is absolutely bad,0.3333333333333333
His friends knowing my ability is bad news for me!,まずいな 奴の仲間に俺の能力を知られるのはまずい,It is bad to know my ability to a bad guy,0.25
"Plus, if Buccellati hears about this, \Nhe'll move the boss's daughter somewhere else!",それに このことを知ればブチャラティはボスの娘を別の場所に移しちまう,"Beside this, Burlati will move the boss's daughter to another place",0.30434782608695654
That's enough!,させるかよ,Let's do it,0.14285714285714285
This is perfect.,こっちか どこだ この野郎,This guy is here,0.3333333333333333
"In another two or three minutes, \Nhe'll have shrunken down to the size of a cockroach.",これでいい あと2 3分もすればこいつの身長はゴキブリほどまで縮む,"This is good after another 2 minutes, the height of the trigger shrinks to the cockroach",0.25925925925925924
"Where are you, you fucker?!",い いるな 野郎近くにいるのか,Are you in a nearby guy,0.18181818181818182
Narancia's Height: 58.0cm,そうなりゃ俺の勝ちだ,That's my win,0.125
...and then I'll get to torture the shit out of him!,わかったぞ ちくしょう 右ケツのポケットにいやがったのか,I know I'm out of the pocket of the right to the right,0.2777777777777778
Then I've won!,しょうがねえなぁ,I'm sorry,0.14285714285714285
"I finally figured it out, you bastard!",捕まえたぞ,I caught it,0.2
Hey! How did he figure out I was in his pocket?!,おい なんでポケットの中にいるってのがこいつにバレたんだ,"Hey, I'm in the pocket",0.25
T-Turn back!,も…戻れ,... Return,0.0
A-A ballpoint pen?!,ボ…ボールペン,Ballpoint pen,0.4
What the hell did you do?!,何をしやがった,What did you do?,0.625
That was close...,危なかったぜ,I was dangerous,0.16666666666666666
"If Little Feat shrinks anything other than me, \Nit takes a while because of how much energy it needs.",俺の「リトル・フィート」は自分以外のものを縮める時はエネルギーを食うせいで時間がかかるが,"My ""Little Feet"" takes time to eat energy when shrinking anything other than myself",0.1935483870967742
"But when it changes something back to normal size, it happens instantly, like with that ballpoint pen.",元の大きさに戻す時は 今のボールペンのように一瞬で戻せる,"When returning to the original size, it can be returned for a moment like a ballpoint pen",0.2962962962962963
The force it created in that moment was enough to send me flying over here.,その瞬間の反発力は俺を奴の手からここまで吹っ飛ばしてくれた,The repulsive force of the moment was blown away from the hand of the guy to this,0.20833333333333334
But how did he figure out I was in his pocket?,だが なぜポケットにいるのがバレた,But why I was in the pocket,0.35714285714285715
Did I move around too much and tickle his ass?,モゾモゾ動いて 奴のケツでもうっかりくすぐっちまったのか,Maosomozo moving and I was completely messed up with the butts of the guy,0.09090909090909091
I hid instantly! \NHow did it find me?!,そこにいるな 逃がさねぇぞ 尾行野郎,I'm there I miss it.,0.14285714285714285
That was way too close for comfort...,ど…どこへ行った あの野郎,How ... Where I went to that guy,0.14285714285714285
"If I hadn't been sent flying from the\N air pressure in the tire, I'd be dead meat!",タイヤの空気圧ですっ飛ばなかったら やられていた,It was an air pressure of the tire if I did not jump,0.2222222222222222
But I'm sure there's no way it's gonna...,けどよ さすがにここなら…,But if it is here ...,0.2
His Stand's ability isn't just to keep endlessly shooting!,このスタンド めちゃくちゃ撃ちまくるだけの能力じゃあねえ,This stand is just the ability to shoot,0.3333333333333333
And it's not like it can see me moving \Nor hear me making any noise...,しかも 俺の動きが見えたとか 動く音を探知しているとかとはわけが違うぞ,"Moreover, it is different from being able to see the movement of moving and moving sound",0.14814814814814814
It still wouldn't make sense how it figured out that I was in his pocket or where I landed after the tire sent me flying.,そんなんじゃ ポケットに隠れてたのや 空気圧ですっ飛んだのがバレてる説明がつかねぇ,"That's why I was hidden in the pocket or I'm eating it, but I'm going to explain it.",0.2571428571428571
Little Feat!,「リトル・フィート」,"""Little Feet""",0.16666666666666666
The Hitman Team is composed of nine members.,暗殺者チームのメンバーは九人,Members of the assassin team are nine,0.45454545454545453
Formaggio is one of them.,ホルマジオはそのうちの一人である,Hormaji is one of them,0.5714285714285714
I intend to address the waste issue\N at next week's assembly.,来週の議会でゴミ問題に触れるつもりだ,I'm going to touch the trash problem at the parliament next week,0.3157894736842105
Not at all. \NI just have to tell the Minister of Tourism what he wants to hear.,なに 環境大臣にどちらが正しいか教えてやるつもりだ,I'm going to tell me which is correct to the Minister of the Environment,0.2
Business as usual.,いつも通りさ,As always,0.2
I'm worried that you're pushing yourself too hard.,あなたのことだから 無理しないか心配だわ,I'm worried that you will not overdo it,0.3333333333333333
You drinking milk again?,あなた 今日はちょっと飲みすぎじゃない,You're not too much drinking today,0.2
"W-Well, my tummy hurts when I drink espresso...",け けどよ エスプレッソって なんか飲んだら胃がゲーッてなるんだよ,I'm sorry I'm going to go to the stomach if I drink espresso,0.16666666666666666
"Pesci, that's why you're such a complete mammone!",連れがミルク飲んでるってだけで カッコつかねぇんじゃねぇかって考えがよぎらねぇんだからな,It's just that you're drinking milk and it's not cool and thinking is good because it is good.,0.16666666666666666
"Pesci, I got a little something for you. A present.",ペッシ それおめぇにやるよ プレセントだ,I'll do it for Pessi It is a present,0.25
We just gotta sit back and watch.,とっとと帰ってサッカーでも見ようぜ,Let's go back and see soccer,0.14285714285714285
The food was delicious.,おいしかったよ,It was delicious,0.3333333333333333
Thank you very much.,ありがとうございます またのお越しをお待ちしております,Thank you I'm waiting for you again,0.2
I'm glad I ordered the white tod-,今日は白を頼んで…,Today I ask for white ...,0.18181818181818182
Hey! Why the hell are you parked here?!,どうしたの あなた どこか痛むの,What kind of hurts are you,0.14285714285714285
I-I-It's blood!,って おい し…下 車の下 ち…ちちち 血が,Hey ... lower car down ... Chichichi blood,0.1
"All right, let's go home.",んじゃ 帰るとするか,What to go home,0.2
How did it go?,どうした ペッシ 腰抜かしてんのか,What is it?,0.2857142857142857
The guy got blown to bits.,帰ったぜ,I got home,0.1111111111111111
I guess it was the perfect gig for your useless ability!,おめぇのくだらねぇスタンド能力にぴったりな仕事だったな,It was a job that was perfect for the stundness of Omei,0.2777777777777778
Whatever. Do shit yourself if you don't like my methods.,言ってろ 文句があるならてめぇでやれよ,"If you say, if you have a chance",0.125
"As much as I'd love to, the leader wants me to conserve my ability until we absolutely need to use it.",ついでに連れの女も死んじまったがな,A woman who tends to me also died,0.07407407407407407
That's fucking chump change!,二千万リラだな,"It's ¥ 200,000",0.1111111111111111
"Calm down, Ghiaccio. \NWe'll deal with the money later.",ギアッチョ 落ち着け 金の話は後だ,The story of Gear Chillo calms is later,0.1111111111111111
More importantly...,それよりもだ,It is more than that,0.14285714285714285
Where are Sorbet and Gelato?,ソルベとジェラートか,Sorbe and Gerat,0.125
They both playing hooky?,揃ってサボりかー,Serve together,0.0
"They're a couple, aren't they?",どこかにしけこんでんじゃあねぇか あいつら デキてんだろう,"It's somewhere, but it will be a guy dexter",0.125
Once an organization is established \Nand starts to mature as a group...,組織というものが出来上がり 集団として成熟してくると,When the organization is made up and mature as a group,0.3333333333333333
...there will always be those \Nwithin the group who choose to rebel.,必ず内部で指導者に反発する者が出てくる,Be sure to repel the leader inside,0.16666666666666666
By smuggling cheap drugs from Central Asia \Nto various countries in Europe and America...,中央アジアから安価で入ってくる麻薬をヨーロッパ各国やアメリカに流すと,Spring a cheap and cheap narcotics from Central Asia to Europe and China,0.3
"For this reason, it's not so strange...",いいや 足取り一つつかめねぇ,It's nice and feet,0.15384615384615385
"...that there are those within the organization attempting to\N take control of the boss's territory, even at the risk of their own lives.",たとえ命を失うことになっても ボスの縄張りを手に入れようと 賭けに出る者が現れても,"Even if you want to lose your life, you will see the boss's territory even if you get a bet",0.16666666666666666
No. No sign of them.,ありえるぜ あいつらイカれてやがるしな,There is no guy,0.125
Polpo controls all the gambling that goes on...,ポルポは賭博を仕切ってウハウハ,Porpo divides gambling Uhahha,0.08333333333333333
"...and those fucks selling drugs are making a fortune, too!",麻薬を扱う連中も大儲け,Big making of people who handle drugs,0.1111111111111111
"And all we, the Hitman Team, \Nget is lousy pay from the boss!",だが僕たち暗殺者チームにはボスからの報酬だけ,But our assassin team is only compensation from the boss,0.2631578947368421
"""Punishment""",罰,punishment,0.3333333333333333
"A few days later, dozens of packages\N with no sender were delivered to the team.",その数日後 差出人のないある郵便小包がチームの元へ配達された,A few days after a few days after the sender was delivered to the team,0.42105263157894735
Is this like modern art or some shit?,現代美術ってやつかよ,Modern art guy,0.2
They all got weird shit in them.,なんか妙なもんが入ってやがる,Something strange will enter,0.0
Hey!,おいおい またかよ,Hey again,0.3333333333333333
Th-That's the same color nail polish \Nthat Sorbet always wears!,こ…これ 色が同じだ,This ... This color is the same,0.2
He and Gelato use the same shade!,お…俺見たことあんだ ジェラートとお揃のやつだ,Oh ... I saw what I saw Gelato and the alien,0.21428571428571427
There were thirty-six of these pieces of art in total.,その美術品の数は三十六にもなった,The number of art products became 36,0.13333333333333333
I don't wanna see no more!,これ以上はもう見たくねえ,I already saw it anymore,0.07692307692307693
Shut up!,黙ってろ,Shut up,0.6666666666666666
His face was found distorted in fear when put together.,繋げた顔は恐怖に歪んでいた,The face that was connected was distorted by fear,0.26666666666666666
It was a rather intense form of murder.,それはホルマリン漬けにされた輪切りのソルベだった,It was a sorbe of a rounded rounded with formalin,0.3076923076923077
"The Hitman Team came to a \Nsecond realization at this time, as well.",そして 暗殺者チームは同時に別のことをも理解していた,And the assassin team was also understanding different things at the same time,0.17391304347826086
...was sliced up right in front of Gelato?,ソ…ソルベはよ ジェラートの目の前でぶった切れたんじゃねぇか,Sorbe Sorbe has a break in front of gelato eyes,0.26666666666666666
Yeah. He must have been so overcome with fear and despair...,ああ そしてやつは恐怖と絶望のあまり,Oh and the guy is too fear and despair,0.16666666666666666
This was a silent message from the boss.,それはボスからの無言のメッセージだった,It was a silent message from the boss,0.7
Forget about Sorbet and Gelato.,みな これっきりソルベとジェラートのことは忘れろ,Everybody forget about Sorbe and Gelato,0.5
"At least, not until...",その情報が飛び込んでくるまでは,Until that information goes into,0.1
...they discovered the boss had a daughter.,ボスの娘がいる,There is a boss daughter,0.2727272727272727
Shit! I'm not gonna die in a place like this!,く…くそ こんなところでやられてたまるか,Ku ... I wondered if it was done in such a place,0.19047619047619047
We're gonna kill the boss and\N take control of his drug routes!,ボスを殺し 俺たちは麻薬ルートを手に入れる,Kill the boss We get a drug route,0.2777777777777778
I-Is it possible...,ひょ…ひょっとして,Hina ...,0.2
It's still looking for me...,向こうへ行った 俺を探し回っている,I'm looking for me I went there,0.2727272727272727
Apparently mosquitoes find animals to suck blood from\N by sensing the carbon dioxide they exhale.,血を吸う動物を見つけるという,To find animals that suck blood,0.29411764705882354
That's what's happening here!,それと同じだ,That's the same,0.25
Now I know how he found me in his pocket!,だからポケットにいるのがわかったのか,So I knew I was in the pocket,0.2
"Come to think of it, when all those randos \Nshowed up in the alleyway, he stopped looking for me.",やつは俺を探すのをやめた,A guy stopped looking for me,0.17391304347826086
He was worried he was gonna shoot one of them!,間違ってやじうまを撃つ可能性があったんだ,There was a possibility that I could shoot a mistake wrong,0.1111111111111111
There you are!,そこだ,There,0.25
Looks like it doesn't know \Nthe difference between me and a rat!,また撃ったぜ やはり俺とネズミの区別がついてねえな,"I shot again, still I have to distinguish between me and rat",0.18181818181818182
Th-These numbers... \NAnd this movement pattern...,こ この数 それにこの動きのパターンは,This number of this motion pattern is,0.18181818181818182
There must be a ton of rats breathing!,脅威 それは謎があるからだぜ,Threat it is because there is a mystery,0.14285714285714285
They're going the same speed!,同じスピードだ 全部同じ動きだ,The same speed is the same movement,0.3333333333333333
So just how did you find me?,なぜ探知できるのか その謎さえわかりゃ,Why can you find it?,0.2727272727272727
...Narancia!,な…なぜ,... Why,0.25
I'm getting the hell outta here \Nand waiting for you to shrink into nothing!,このまま逃げ切って てめぇが縮みきるのを待ってやっからな,I will wait for the shrine to run away as it is,0.16666666666666666
The same movement pattern...,同じ動き 全部同じ動きだ,The same movement is the same movement,0.5
...but one of them is breathing way harder than the rest.,でも一個だけ でっけえ息をしているネズミがいるぞ,But there is a murine who is breathing only one piece,0.21052631578947367
You tired? \NFeeling out of breath?,疲れてんのか ハァーハァー言ってよ,I'm tired of tired,0.2222222222222222
You got something heavy on top of you \Nthat's making it hard to breathe?,重いもんでも乗っけて息を荒くしてんのかよ,It's heavy money and I'm irritating my breath,0.13636363636363635
Dammit!,しまった,Oops,0.0
Th-That was close...,あ 危なかったぜ,It was dangerous,0.16666666666666666
He would have gotten me if I \Nhadn't just returned to normal size!,元のサイズに戻らなかったらやられていた,It was done if I did not return to the original size,0.17391304347826086
If enough time hadn't passed to the point that your Stand power became nearly useless...,お前がスタンドパワーも無力なほど小さくなっていなかったら,If you are not as small as the stand power is too small,0.16666666666666666
Narancia's Height: 13.2cm,小さくなりすぎて,It's too small,0.125
My attacks won't do shit anymore!,や やれてねえ,And do it,0.1
