en_text,jp_text,google_translated,score,semantic_score
The poor brat is shaking.,"岸辺露伴への攻撃が
始まってしまう","Attacks to the shore area
Be started",0.08333333333333333,0.00034464346
His eyes look like cesspools full of drowning rats.,"肥だめで溺れかけてる
ネズミみたいに絶望しているぞ","I'm drowning with my fertile
I'm despairing like a rat",0.1111111111111111,0.276133
I must have imagined seeing that determination.,"（吉影）
おびえてるぞ あの小僧",I'm looking forward to that,0.16666666666666666,0.23313627
"I came here to bring you your hat, Hayato.","忘れていた帽子を
届けに来たよ 早人","Forgotten hat
I came to deliver early",0.2857142857142857,0.52221096
"If there is a God, I thank you!","（早人）
神様がいるなら
感謝する","If there is a god
appreciate",0.4545454545454545,0.63076806
And I thank fate for making this serial killer \Nmove out from behind the tree!,"この殺人鬼を木の陰から
出してくれた運命に―","This murderer is from the shade of the tree
To the destiny that came out-",0.16,0.55291486
I... I did it!,や… やった！,Yes ... I did it!,0.8333333333333334,0.7969201
Kawajiri Hayato isn't coming...,川尻早人は来ないな,Kawabiri's early is not coming,0.2,0.653031
He must have taken a different route to school.,"別の道を通って
学校へ行っちまったか","Through another way
Did you go to school",0.125,0.5900147
Recently...,なっ な… な…,Become ...,0.3333333333333333,0.29470795
Impossible!,バカなあ！,Stupid!,0.3333333333333333,0.44513047
...I had something in my pocket.,ポケットの中,In the pocket,0.2222222222222222,0.5595507
"That I need to, I want to","今朝 ママの大切にしてるカップを
割ってしまったろう","Cups that are cherished by Mom this morning
I will break it",0.125,0.12764138
"The coffee spilled and burned my hand and wrist, \Nso I took off my watch and put it inside my chest pocket.","腕時計 外して
胸ポケットにしまっといたんだ","Remove the watch
I was in the chest pocket",0.21739130434782608,0.5942578
If that coffee hadn't spilled this morning...,"もし朝 コーヒーを
こぼしていなかったら…","Morning coffee
If you have not spilled ...",0.4166666666666667,0.7976498
I... I failed!,し… 失敗した,... Failed,0.5,0.7065968
I-It's... It's almost time!,じ… 時間が来る！,... time will come!,0.3333333333333333,0.45895246
