en_text,jp_text,google_translated,score
The Teiko Middle School basketball club.,帝光中学校 バスケットボール部,Teiji Junior High School Basketball Club,0.3
An incredibly strong team with over one hundred members and three consecutive championship wins.,部員数は100を超え 全中三連覇を誇る 超強豪校,The number of members is over 100 super strong schools that boast more than 100,0.11538461538461539
"Even within that brilliant history,",その輝かしい歴史の中でも 特に“最強”と呼ばれ—,"Also in the bright history, it is called ""strongest"" especially-",0.11764705882352941
"a group of five prodigies known as the ""Generation of Miracles"" stood above the rest.",無敗を誇った10年に１人の天才が ５人同時にいた世代は—,The generation of five people at the same time in 10 years boasting,0.16666666666666666
"However, there was a strange rumor concerning the Generation of Miracles.",が “キセキの世代”には 奇妙なウワサがあった,"There was a strange wasa in ""Kiseki generation""",0.2777777777777778
Despite being relatively unknown,誰も知らない 試合記録もない,There is no match record that no one knows,0.0
A phantom sixth man.,幻のシックスマンがいた と,I had a phantom Sixman,0.25
I won't let you do that!,させねえっスよ！！,Let's do it!!,0.3
I don't need you to return the favor!,テメーのお返しは もう いんねーよ！ なぜなら…,Teme's return is no longer!because…,0.125
This ends now!,これで 終わりだからな！！,This is the end!!,0.2857142857142857
How dare you sleep so shamelessly in my class?,なに堂々と寝とるんだ キサマ！,Anyway I'm going to sleep.,0.0625
Come to the faculty office later.,あとで職員室に来い！,I will come to the staff room later!,0.3333333333333333
What?,かあーっ,How,0.0
Why didn't he get in trouble?,なんで こいつは スルーなんだよ！,Why is this one!,0.08333333333333333
"Now that I think of it, today's the day.",あ そういえばアレ 今日ね,"Oh, I'm going to be",0.11764705882352941
What do you want?,何スか 用って,Something,0.0
Go buy some bread.,ちょっとパン 買ってきて,I bought a little bread,0.1111111111111111
"On the 27th of every month, the Seirin High cafeteria sells a limited quantity of very special bread.",実は誠凛高校の売店で 毎月27日だけ—,Actually only 27 days a month at Seikei High School Store-,0.11538461538461539
"Supposedly, eating this fantastic bread will bring you great success in love, clubs, or anything else.",それを食べれば恋愛でも 部活でも必勝を約束される！,"If you eat it, you will be promised to win even in love and club activities!",0.16666666666666666
"It's so expensive. and there's so much on there, it must be trash.",たっけぇ… し やり過ぎて逆に品がねえ！,It's too ... and it's too much and the item is not good!,0.19047619047619047
"We beat Kaijo, and practice is going well.",海常にも勝ったし 練習も順調,I also won the sea and practice well,0.2
We're asking you to get this fantastic bread so you can continue building momentum.,ついでに幻のパンもゲットして 弾みをつけるぞ！ ってワケだ,"At the same time, get a phantom bread and put a bullet!It is a wake",0.06896551724137931
But we're not the only ones eyeing it.,けど狙ってるのは 私たちだけじゃないわ,But it is not only us who is aiming,0.2857142857142857
It always gets a little busier than usual.,うん いつもより ちょっとだけ混むのよ,Yeah I'm a little crowded than usual,0.3076923076923077
"We just have to go buy some bread, right?",ふっ… パン買ってくるだけだろ？,Fu ... I just buy bread?,0.2857142857142857
That's easy as pie... ma'am.,チョロいじゃん ですよ,I'm Choro,0.0
"Naturally, the second years will pay for this.",金はもちろん オレら２年が出す,Of course there will be 2 years,0.13333333333333333
Buy lunch for everyone else while you're there too.,ついでにみんなの昼メシも 買ってきて,"At the same time, everyone's lunch is also bought",0.1
I don't need any change.,釣りはいらねーよ,There is no fishing,0.0
"Instead, you'll be doing three times as much strength training and footwork.",今後 筋トレとフットワークが ３倍になるだけだ,"From now on, muscle training and footwork are only three times",0.2857142857142857
"If you don't hurry, they'll sell out.",ホラ 早く行かないと なくなっちゃうぞ,You will be lost if you don't go ahead,0.25
"We managed to buy some last year,",大丈夫 去年オレらも買えたし パン買うだけ…,Okay I just bought Ore last year and I just buy bread ...,0.1875
and it's just buying bread.,ん パン…？,Pan ...?,0.0
"What did you mean, ""a little busier""?",ったく 何が“ちょっとだけ”だよ,"What is ""a little bit""",0.38461538461538464
I'm making this an annual event for first years.,これから毎年 １年生の恒例行事にするわよ,I will be an annual event of first grader every year,0.29411764705882354
Seriously?,マジか…,Seriously ...,0.3333333333333333
"Lady, gimme an Iberian pork sandwich!",おばさん！ イベリコ豚カツサ…,Aunt!Iberko pork cutlet ...,0.15384615384615385
T-This is chaos.,カ… カオスだ…,Kao ... chaos ...,0.16666666666666666
Three times the strength training  and footwork will kill us.,筋トレ フットワーク３倍は… 死ぬ！,Muscle training 3 times ... die!,0.125
"Okay, I'll go first.",よし まずはオレが行く,Good morning I go,0.2222222222222222
but I'm pretty confident in my power.,火神ほどじゃねーが パワーには自信があるぜ,"It is not as fire god, and it is confident in the power",0.16666666666666666
"Now that I take a better look, this is going to take more than a little power.",ていうか よく見たらこれ… ハンパな力じゃ無理だぞ,"If you look closely, this is impossible in the hammer power",0.20833333333333334
The rugby team's forwards. the american football team's linemen.,ラグビー部のフォワード アメフト部のライン組,Rugby Department of forward American football club line set,0.2
Sumo and weight lifting.,相撲にウェイトリフティング,Weight lifting to sumo wrestling,0.42857142857142855
We're supposed to get past these guys?,ヤツらのブロックを かいくぐるのかよ,I wonder if the block of the guy,0.0
Sounds interesting.,面白え,Interesting,0.3333333333333333
Let's do this!,やってやろーじゃん,Don't do it,0.14285714285714285
This is Japanese lunch time rush!,ディス イズ ジャパニーズ ランチタイム ラッシュ！,Distive Japanese Lunch Time Rush!,0.625
The doors are closing. Please be careful.,ドアが 閉まります ご注意ください,Please be careful about the door closes,0.36363636363636365
You're acting American now?,こんなときだけ アメリカかぶれかよ！,Is it only in this case?,0.08333333333333333
We've got to go together.,やっぱ全員で行くしかねえ！,"After all, everyone can go!",0.07692307692307693
This isn't easy!,ハンパねえ〜！,Hampa!,0.16666666666666666
My basketball's not the only American thing about me!,アメリカ仕込みは バスケだけじゃねえぜ！,American preparation is not only Basketball!,0.38461538461538464
All right.,よ〜し！,Yo!,0.0
"Huh? What, what?",うっ 何 何 何 何？ おおっ うっ うおっ！？,What? What?Let's go!?,0.25
Please stop that!,もういいっつーんだよ それは！,It's already good!,0.125
You? How?,なっ オマエ… どうやって！？,Omae ... how!?,0.3333333333333333
"The flow of the crowd pushed me to the front,",人混みに流されてたら 先頭に出ちゃったんで,"When I was washed away, I came out at the top",0.1111111111111111
so I got the bread and left some money.,パン取って お金置いてきました,I got a bread and got up,0.3333333333333333
It's nothing.,いや… 何でもねーよ,No ... Neither,0.0
The phantom sixth man is in a league of his own.,さすが幻のシックスマンはちげーな,The phantom Sixman is a Chige,0.2857142857142857
"Here, we have some juice.",はい ジュースあるよ,Yes juice,0.125
I-Is this...,こ これ 例の…,This example ...,0.5
It's fine. You guys eat it.,あー いいよ オマエらで食べな,"Oh, I'm good at Omae et al.",0.0625
Of course. Don't hold back.,いいって 遠慮するなよ,I do not hesitate,0.1
I guess we'll take turns. Who's first?,じゃ順番に… 誰から行く？,Then ... Who go from?,0.13333333333333333
Thank you for the food.,じゃあ いただきます,Then I will,0.0
This is...,ん？ これは… え？,Yeah?This is ... eh?,0.5
It's incredibly delicious.,めっちゃおいしいです うお！？,It's delicious!?,0.42857142857142855
It's delicious! Is this what you call a harmony of flavors?,ウマっ！ 味のハーモニーってやつ！？,Uma!A flavor harmony!?,0.25
"I don't care what it is, as long as it's big.",オレはデカけりゃ なんでもいいや,I'm a big deal,0.125
Super Long BLT,何それ？,What that?,0.0
"Captain, I got copies of the preliminary tournament bracket!",キャプテーン 予選トーナメント表—,Captaine Qualifying Tournament Table-,0.07142857142857142
The Inter-High preliminaries start as a tournament.,インターハイ予選は まずトーナメント戦からだ,Inter-high qualifying is first from the tournament battle,0.23076923076923078
Tokyo has blocks A through D.,東京都はＡからＤまで ４ブロックある,Tokyo City has 4 blocks from A to D,0.45454545454545453
The winner of each block goes on to play in the championship league. championship league,各ブロックの頂点１校のみが 決勝リーグ進出,Only one of the vertices of each block goes out of the final league,0.3333333333333333
A Block Winner,さらにその決勝リーグで—,"Furthermore, in the final league-",0.0
B Block Winner,さらにその決勝リーグで—,"Furthermore, in the final league-",0.0
C Block Winner,さらにその決勝リーグで—,"Furthermore, in the final league-",0.0
D Block Winner,さらにその決勝リーグで—,"Furthermore, in the final league-",0.0
qualify for the Inter-High.,上位３チームに入って 初めて インターハイ出場,I entered the top three teams for the first time,0.16666666666666666
Only three schools are chosen out of 300 participating schools.,300校以上の出場校から 選ばれるのはたった３校,Three three schools selected from more than 300 participants,0.2
Only the chosen 1% will stand on the court of their dreams.,１％の選ばれた高校生しか 立てない夢の舞台,A dream stage that only 1% chosen high school student stands up,0.18181818181818182
That's the Inter-High.,それがインターハイだ！,That is inter high!,0.1111111111111111
"I sort of get the picture, but you're wrong about one thing.",何となくは分かったけど １つ間違えてるっスよ,"I understand somehow, but I'm different from one",0.2
They're not chosen. They win it... sir.,選ばれるんじゃなくて 勝ち取るんだろ です,"It is not chosen, but I will win",0.2857142857142857
We've got three weeks until the Inter-High preliminaries.,そのインターハイ予選まで あと３週間だ！,It is three more weeks to the inter high qualifying!,0.16666666666666666
"We fell one step short last year, but we'll definitely go this year.",去年はあと一歩及ばなかったが 今年は絶対行くぞ！,"Last year I had to go one more step, but I will definitely go this year!",0.45
"We'll be facing a lot of strong schools,",強豪がひしめき合ってるが—,Stronger is a great deal-,0.07142857142857142
"Last year, they were in the nation's top eight.",去年は全国ベスト８…,Last year Best Nationwide 8 ...,0.125
"On top of that, just like Kaijo, they had one of the Generation of Miracles join their team.",しかも今年は海常と同じように “キセキの世代”が１人入ってる,"Moreover, this year is in the same way as Someris ""Kiseki generation"" is one",0.13333333333333333
"If we can't beat them, we won't make it to the Nationals.",この超強豪に勝てなければ 全国への切符はない！,There is no ticket to the whole country if you can not win this ultra!,0.1111111111111111
"Seirin if we play against the generation of miracles,",その“キセキの世代”と やるには… 決勝か,"That ""Kiseki generation"" to do ... final",0.05555555555555555
"Kuroko, you know who he is, don't you?",黒子 オマエどんなヤツか 知ってんだろ？,Kuroko Omae What do you know?,0.4166666666666667
I doubt you would believe me even if I told you.,口で言ってもたぶん信じないですよ,"Even if you say in your mouth, I'm probably not surprised",0.21052631578947367
"However, as kise said, the other four are on another level.",ただ 黄瀬君が言ってたように 他の４人は格が違います,The other four people are different as Jinzo says,0.29411764705882354
"If they've gotten even better,",それがさらに進化してたら…,If it evolved further ...,0.09090909090909091
I cannot imagine how good they are.,想像もつかないです,I can not imagine,0.4444444444444444
"Before we can play Shutoku, we have to play our first game!",秀徳に挑むためにも まずは初戦！,"First of all, first to challenge Hidetoku!",0.25
"She was skipping after the Kaijo game,",海常のときはスキップしてたけど 今日はしてねーな,"I was skipping at the time of marine, but I do not",0.25
"but she's not skipping today. coach, are you gonna skip today?",カントク！ 今日はスキップとか したりしないんですか？,Kantoku!Do you not skip today?,0.2777777777777778
Like hell I will!,するか！ ヒッ,Or!Him,0.14285714285714285
Morons. she wouldn't act like an idiot over an official game.,ダアホ 公式戦でも ヘラヘラしてるわけねーだろ,Even Daaho Official Battle is also Herahera,0.05555555555555555
But you do seem unhappy. Are they good?,にしても機嫌ワリィな 強いのか 相手？,"Even if it is a good friend, it's a strong opponent?",0.1
We shouldn't be worrying about Shutoku,秀徳に挑むどころか…,Do not challenge Hidetoku ...,0.0
when our first match isn't looking good.,今のウチじゃ １回戦すら危ういわ,It is dangerous if it is the first round,0.14285714285714285
One of their players might give us some trouble.,ちょっと厄介な選手がいるのよ,There is a bit nasty player,0.0
You can watch the video later.,とりあえずビデオは 後で見るとして まず写メ見て,"First of all, when I look at the video later, I first watched",0.1875
Take a look at this picture. t-this is...,こっ これは…,This is ...,0.3
"I-It's cute, but...",かっ… かわいいが…,Cute ...,0.3333333333333333
"Sorry, it's the next one. the next one?",あ〜 ゴメン 次 次？,Oh ~ Gomen Next Next?,0.16666666666666666
He's two meters tall and weighs 87 kilograms.,身長２メートル 体重87キロ,Height 2 meter weight 87 km,0.06666666666666667
He's an exchange student from Senegal.,セネガル人の留学生,Senegalian International Student,0.1
Senegal? He's huge. Two meters?,セネガ… でかぁ！ ２メートル!?,Senega ...2 meters!?,0.16666666666666666
Can they do this?,アリなの？ 留学って…—,Is it an ant?Study abroad ...-,0.07692307692307693
This Papa Mbaye... What was it?,このパパ･ンバイ… 何だっけ？,This dad bite ... what?,0.4
We're not getting anywhere.,ああ 話が進まん！ 黒子君 なんか あだ名,"Oh, the story is progressing!Kuroko-kun Something",0.0
"How about ""Dad,"" then? where's your naming sense?",何そのセンス！？,What sense!?,0.13333333333333333
Dad's company is a dud.,お父さん！ お父さんの会社が お倒産,Father!Dad's company goes down,0.2727272727272727
He's not just tall. His arms and legs are long too.,特徴は背だけじゃなくて手足も長い,Characters are not only back but the limbs are long,0.15789473684210525
Everything about him is big.,とにか“高い”のひと言に 尽きるわ！,"Anyway, I will do my best to ""high""!",0.0
More and more schools are recruiting exchange students to increase their strength.,戦力アップに外国人選手を 留学生として入れる学校は増えてる,A school that puts foreign players as a foreign student to strength up,0.09523809523809523
"Our next opponent, Shinkyo High,",次の相手の新協学園も 去年までは 中堅校って感じだったけど…,The next opponent's newthroscopic school also felt mid-sized school until last year ...,0.11764705882352941
"but with the addition of a single foreign player,",たった１人の外国人選手の加入で 完全に別物のチームになってるわ,It is completely different teams with joining one foreign player,0.17647058823529413
"They can't reach high enough. because of this one simple reason, no one can stop him.",届かない… ただそれだけで 誰も彼を止められないのよ,I can not reach ... just because no one can stop him,0.3181818181818182
But we can't just do nothing.,だからって何もしないわけには…,So don't do anything ...,0.18181818181818182
"starting tomorrow, the two of you will have your own training regimen.",２人は明日から別メニューよ,Two men will be another menu from tomorrow,0.15789473684210525
The preliminaries start on May 16th.,予選本番は５月16日！,Qualifying production is May 16th!,0.18181818181818182
"Until then, you won't even have time to complain!",それまで弱音なんて はいてるヒマはないわ！,There is no Hima who has a loud noise until then!,0.14285714285714285
"Everyone's here, right?",全員そろったわね！,Everyone was all right!,0.2222222222222222
Everything is so short in Japan.,日本低イ ナンデモ,Nippon Low Nan Demo,0.0
What are you doing? Hurry up.,ったく 何やってんだ,I'm sorry,0.0
Sorry I'm late.,すみません 遅れましたー,I'm sorry I was late,0.6666666666666666
Why is that the only thing you can say fluently?,なんで そこだけ流暢なんだよ！,Why is fluent there!,0.14285714285714285
"Oh, sorry.",あ〜 すいません,"Oh, I'm sorry",0.5
"By the way, did you guys really beat Kaijo?",そういえば おたくら 海常に勝ったってマジ？,"Speaking of which, it is serious that I won a maker",0.045454545454545456
It was just a practice game.,あっ いや… 練習試合っスけど,There is no ... but I practice,0.07692307692307693
Shinkyo Academy Captain i guess the generation of miracles aren't as strong as we thought.,なんだ 思ったよか 大したことないんだ—,I thought it was a big deal-,0.09523809523809523
The Generation of Miracles lost?,キセキノ世代 負け？,Kisekino generation lose?,0.25
They brought me here to beat them.,そいつらに勝つために呼ばれたのに こんなガッカリだよ 弱くて…,"Even though it was called to win, it's a bit like this ...",0.047619047619047616
"No, little boy. Children shouldn't be on the court.",ダーメですヨ ボク 子供がコートに入っちゃあ,It is Daume Yuko Kids entering the coat,0.05263157894736842
They lost to a child like him?,あんな子供いる チームに負け？ キセキの世代って みんな子供？,Lose to such a child team?He is a child of Kiseki all children?,0.23529411764705882
"Honestly, I'm starting to get annoyed.",正直 いろいろイラッときました,I was able to do something honest,0.14285714285714285
I guess we'd better show Dad why he shouldn't piss off kids!,んじゃ まあ　子供を怒らせると 結構怖いってこと—,"Well, I'm quite scared if you get a child angry-",0.038461538461538464
Let the game between Seirin High School,それでは これより誠凛高校 対—,So this is Seikei High School--,0.16666666666666666
and Shinkyo Academy begin.,新協学園高校の試合を始めます！,I will start a match for Shinshokyo Gakuen High School!,0.0
Let's play a good game! shinkyo,しゃす！！,Shake!!,0.1111111111111111
Seriously? I don't believe it!,マジかよ！？ 信じらんねー,Are you serious!?Believe,0.2727272727272727
Bastard.,っのヤロ…！,Yaro ...!,0.0
Shinkyo's got the ball first!,おお まずは新協ボールだ！,Oteen First is an armial-kyo ball!,0.2727272727272727
There it is! He's so tall!,来たぁ！ 高ぇ！,I came!High!,0.09090909090909091
Shinkyo scores first!,先制は新協学園だ！,The first strike is the newthlow school!,0.2222222222222222
Don't worry about it. Let's get it back.,ドンマイ！ 取り返すぞ！,Don Mai!I'll get back!,0.13333333333333333
It's free.,フリー！ もらった！,free! received!,0.16666666666666666
He can reach that? what can't he defend?,あそこから届くんかい！？ んな守備範囲どんだけ！？,It is notification from over there!?Just defensive scope!?,0.05263157894736842
Are you guys one of those hard-working teams?,誠凛さんってアレ？ スポ根系？,Seikei Ao?Soup with a spoach?,0.06666666666666667
We see a lot of those.,いるんだよね よくさ〜,I'm there,0.0
We're not breaking any rules.,別にルール違反とかしてねえし,Apart from the rule violation,0.0
"Well, you can have up to two of them on your team.",ま ２人までならベンチ入り オッケーだからな,It is because it is a bench with a bench up to two people,0.14285714285714285
Right? what's wrong with getting strong players?,でしょ？ 強いヤツ呼んで 何が悪いの？,right?What's wrong with a strong guy?,0.6363636363636364
It's real easy. all we have to do is pass the ball to him and we can't help but score.,楽だぜー あいつにボール回しゃ 勝手に点入ってくし,It is easy-to-do the ball turns to the ball,0.21739130434782608
"I don't know how easy it is,",楽かどうかは知んねえけど そのポリシーなら逆に文句言うなよ,It is not good if it is easy to complain if it is a policy,0.1875
"Besides, we've got our own ridiculous players.",とんでもねえヤツなら ウチにもいるし,"Even if it is a guy, there is also a guy",0.05555555555555555
We didn't have to recruit them though.,呼んだわけじゃねえんだけどな,I'm not calling you,0.0
He missed! Get the rebound!,落ちた！ リバン！,fell!Riban!,0.125
His accuracy has suddenly declined.,急に精度が ガクッと落ちてる これは…,Suddenly the accuracy falls and this is ...,0.16666666666666666
"What's going on? it won't be so easy to score, because...",そう簡単には入らないわよ なんたって—,So it's not easy to enter-,0.2777777777777778
Kagami won't let Dad execute his own plays.,火神君がお父さんに自分のプレーを させてないからね！,It is because Father does not play your own father!,0.05263157894736842
What plays?,自分のプレーを？,What's your own play?,0.2857142857142857
"Even if he can't reach, there's still a way.",届かなくてもやり方はある 水戸部君 直伝のね！,"Even if you do not arrive, there is a Mito club Yuden!",0.22727272727272727
Mitobe-sensei's a veteran when it comes to defense.,ディフェンスもいぶし銀 水戸部先生よ！,Defense also Sometoby Silver Mito Mido-san!,0.0625
"From now on, you'll practice with Mitobe every day.",これから毎日 水戸部君と練習して—,Practice with Mito-ku every day from now on-,0.42857142857142855
You'll learn firsthand how to stop someone bigger than yourself.,自分より大きい相手を封じる方法を 体で覚えるの！,Remember how to seal the other party greater than you!,0.21052631578947367
Blocking's not the only way to stop a shot.,いい？ シュートを防ぐのは ブロックだけじゃない,good?He is not only block to prevent shoots,0.16666666666666666
You can make them miss.,落とさせるのよ！,I'll drop it!,0.0
"A normal one-on-one wouldn't be so bad,",普通のワンオンワンなら ともかく—,Another usual one-on-one-,0.0
"but when he won't let me inside, I can't make any shots.",インサイド限定だと 全然うまくいかねぇ！,"If it is in-side only, it is good at all!",0.041666666666666664
This is freaking hard.,なんかスゲーやりづれぇ…,Somehow Sgee and do it ...,0.0
Don't let him do what he wants to do.,やりたいことをさせない,I can not do what I want to do,0.23076923076923078
Don't let him go where he wants to go.,行きたいとこへ行かせない,I can not go to the place where I want to go,0.1875
Pressure him so he can't shoot easily.,プレッシャーをかけて 楽にシュートをさせない！,Put a pressure and do not shoot easily!,0.2
He missed again. He's been missing a lot.,あ またダメだ！ さっきから全然だぞ！？,"Oh, it's no good!It's not at all from the beginning!?",0.045454545454545456
Shut your mouths.,テキトー 言ってんじゃねーよ！,Don't say Tekito!,0.0
There's tons of pressure on the court.,コートの中だと すげー圧力なんだよ！,It is a great pressure if it is in the court!,0.1875
He can almost block him with those jumps.,２メートルを今にも ブロックしそうなジャンプ力！,Jump force that seems to block 2 meters still now!,0.05263157894736842
The intensity of his focus could kill.,殺気とも言えるような集中力！,Concentrated power that can be said to be cold!,0.0
What's your problem?,ナンナンダヨ コイツ…！？,Nannando Yokoitsu ...!?,0.1111111111111111
This is some serious pressure.,生半可なプレッシャーじゃねえ！,It is not a popular pressure!,0.18181818181818182
