en_text,jp_text,google_translated,score
The Teiko Middle School basketball club.,帝光中学校 バスケットボール部,Teiji Junior High School Basketball Club,0.3
An incredibly strong team with over one hundred members and three consecutive championship wins.,部員数は100を超え 全中三連覇を誇る 超強豪校,The number of members is over 100 super strong schools that boast more than 100,0.11538461538461539
"Even within that brilliant history,",その輝かしい歴史の中でも 特に“最強”と呼ばれ—,"Also in the bright history, it is called ""strongest"" especially-",0.11764705882352941
"a group of five prodigies known as the ""Generation of Miracles"" stood above the rest.",無敗を誇った10年に１人の天才が ５人同時にいた世代は—,The generation of five people at the same time in 10 years boasting,0.16666666666666666
"However, there was a strange rumor concerning the Generation of Miracles.",が “キセキの世代”には 奇妙なうわさがあった,"There was a strange rumor in ""Kiseki generation""",0.35294117647058826
Despite being relatively unknown,誰も知らない 試合記録もない,There is no match record that no one knows,0.0
A phantom sixth man.,幻のシックスマンがいた と,I had a phantom Sixman,0.25
"That's it, show some spirit",そうそう 張り切ってくれよ,Oh yeah,0.0
No! Those unconventional tricky movements...,違う！ 型にはまらない トリッキーな動き…,different!Trikly moving not to type ...,0.15384615384615385
He's going away from the hoop!,うわっ！ ゴールと全然違うほうへ跳んだ！？,Wow!I jumped to the difference at all with the goal!?,0.1111111111111111
What is he thinking?,抜けてねえぞ！！,You're missing!!,0.0
What was that shot?,なんだ 今のシュート！？,What is this shooting!?,0.2222222222222222
"Not a jump shot, but a hook?",ジャンプシュート じゃなくて フック…！？,It's not a jump shoot but hook ...!?,0.46153846153846156
"In all sports, including basketball,",バスケットに限らず どんなスポーツでも—,Not limited to baskets but also any sports-,0.0
fundamental movements and the ideal form have been polished throughout the sport's history.,その歴史の中で洗練されてきた 基本の動きがあり—,There is a basic movement that has been sophisticated in the history-,0.08333333333333333
"Because they have been refined to perfection, their options are limited and can be predicted.",洗練され ムダがなくなったからこそ—,Because sophisticated and uneven,0.10526315789473684
This sets the stage for the strategic battle between the offense and defense.,そこにオフェンス ディフェンスの—,There is an offense defense-,0.0625
That is the game.,それがゲームだ,That's a game,0.2857142857142857
But he...,だが あいつは…,But that guy ...,0.4
He's been handling a basketball since before I can remember.,物心つく前から バスケットボールに触れ—,Touch the basketball beforehand,0.06666666666666667
He was always playing on the street with adults.,大人に混じり ストリートで ずっとプレーしてきた,I've been playing with an adult and played for a street,0.15789473684210525
His ball handling plus his natural speed...,ボールハンドリング プラス 天性のスピード,Ball handling plus natural speed,0.7142857142857143
A free-spirited style.,自由奔放なバスケットスタイル,Boho Basket Style,0.16666666666666666
There is no form to Aomine's dribbling or shooting.,ドリブルもシュートも 青峰の動きに型はない,There is no type in the movement of Aomine and the movement of Aomine,0.23529411764705882
"He is limitless, impossible to defend against.",無限！！ ゆえに ディフェンス不可能,"infinite!!Therefore, it is possible to defend",0.2857142857142857
He is the unstoppable scorer.,アンストッパブル･スコアラー,Ansteropable scorer,0.14285714285714285
The ace of the Generation of Miracles:,それが “キセキの世代”のエース—,"That is the ace of ""Kiseki generation ""-",0.36363636363636365
What's with this guy? his play is full of gaps.,なんだこいつ スキだらけじゃ…！？,What is this guy ...!?,0.3333333333333333
You bastard...,っのやろぉ！,Yaro!,0.0
higher!,今までより一段と… )高い！,More than ever ...) High!,0.125
But I'm tired of this.,けど もう飽きたわ,But I already got tired,0.3333333333333333
but he's all over the place.,けど あいつはてんでバラバラだ,But it's a guy,0.18181818181818182
I'll just have to score more than him!,だったら 取られる以上に 点 取ってやる！！,"If so, I will take a point more than I can!!",0.2222222222222222
"If I can't beat him with speed,",平面の速さで 勝てねえんだったら—,If you won at the speed of the plane-,0.13333333333333333
I'll beat him with height!,高さで勝負だ！,It is a match at height!,0.16666666666666666
Sorry. you're so slow i took the ball.,わりいな ノロすぎて つい とっちまったわ,It was too good to get it,0.0
And even against Midorima...,緑間とやったときも—,Even when it comes between green-,0.1
"He stopped his opponents, no matter how strong they were.",どんな強敵にも 食らいついて止めてみせた,I tried to stop any strong enemy,0.05555555555555555
"So we thought he could do it again,",だから今度も…,So this time ...,0.08333333333333333
but we were naive.,けど 甘かった,But it was sweet,0.125
Basket counts! And one!,バスケットカウント ワンスロー！,Basket Count Wasw!,0.2857142857142857
"This isn't your basketball, is it?",そうじゃねえだろ テメエらのバスケは,That's right Basketball of Temee et al.,0.0625
The only one who can beat me is me.,オレに勝てるのはオレだけだ,Only me can beat me,0.4444444444444444
You can't fight me on your own.,テメエだけじゃ あらがえねえよ,Only Temee,0.0
"Come on out, Tetsu.",出て来いよ… テツ,It will come out ... Tetsu,0.3333333333333333
Let's settle this.,決着をつけようぜ,Let's settle,0.6
We're 20 points behind. we have to prepare ourselves.,20点差… 覚悟を決めるしかないわね,20 points difference ... I have no choice but to decide,0.23529411764705882
I've had plenty of time to rest.,大丈夫です もう十分 休めました,"It's okay, I rested enough",0.06666666666666667
Show me the strength of the new light and shadow.,見せてみろよ 新しい光と影の底力をよ,Show me to see the bottom of the new light and the shadow,0.6153846153846154
"We always intended to fight him together, didn't we?",最初から一緒に 戦うつもりだったじゃないですか,I'm going to fight together from the beginning,0.17647058823529413
"If winning were so simple, it would be too easy.",そんなに簡単に勝てたら 苦労はないです,There is no hardship if you win so easily,0.10526315789473684
Shut up. I know!,うっせえな わあってるよ,I'm sorry,0.125
"Yeah, bring it on.",ああ 来いよ,"Oh, come ah",0.1111111111111111
Please.,お願い…,please…,0.0
Amazing! What was that pass?,すげえ なんだ あのパス！！,That's the pass!!,0.3333333333333333
But Aomine's fast too!,けど 青峰も速い！！,But Aomine is also fast!!,0.5
I knew you'd catch up.,知ってるよ 追いついてくるんだろ？,I know I'll catch up with it?,0.25
That was a pretty nice pass.,どうした 火神？ ずいぶんとナイスパスじゃねえか！,What is the fire god?It's a lot and nice pass!,0.16666666666666666
"Quit praying, first years.",つか 祈ってんじゃねえぞ １年,I'm praying alone,0.1111111111111111
"When I'm shooting, get ready to celebrate!",オレが打つときは たたえる準備だけしとけや,"When I hit it, it is only preparation",0.2
He's already in clutch time!,クラッチタイム 入ってた！！,Clutch time included!!,0.375
He's amazing.,すごいや あの人,Amazing person,0.2
It really is different with Kuroko!,黒子いると違うぜ！！,It is different from Kuroko!!,0.625
It really is completely different when you're playing.,やっぱ全然違えな オマエが入るとよ,"After a lot, I will enter Omae",0.0
"You're still the same, Tetsu.",相変わらずだな テツ,Tetsu still,0.25
You really haven't changed since middle school.,中学のときと ホント変わってねえわ,"When I was in junior high school, it's really changing",0.10526315789473684
Really. Not at all.,ホント 全然…,Honto at all ...,0.2857142857142857
You still think you can beat me?,まだそれで勝つつもりかよ？ オレに,Is it still won by that?In,0.15384615384615385
This is my basketball.,これが ボクのバスケです,This is Basketball,0.6
Let's take back the game!,よし！ 一気に流れをとるぞ,OK!I will flow in a stretch,0.07142857142857142
Ignite Pass!,イグナイトパス,Ignitipass,0.0
Who do you think has caught your passes the most?,オマエのパスを 一番取ってきたのは—,What has the most of Omae's path?,0.25
Not even Takao could catch our trump card.,高尾君でも取れなかった 切り札が…,Trump cards that could not be taken by Takao ...,0.26666666666666666
He beat five guys.,５人抜き！？,5 people!?,0.0
You haven't changed at all since middle school.,最後の全中から オマエは何も変わってない,Omae has not changed from the last all,0.125
You haven't improved.,同じってことは 成長してねえってことじゃねえか,It's not a thing to grow in the same way,0.0
Akashi was right after all.,やっぱ結局 赤司が言ったとおりかよ…,"After all, if Akashi says ...",0.3
Your basketball will never win.,オマエのバスケじゃ 勝てねえよ,Omae's Basketball Wins,0.1111111111111111
He shot while rolling! that's crazy!,ロール中に打った！？ メチャクチャだ,I hit it during the roll!?It is a messy,0.05555555555555555
His legs? Why?,足！？ なんで！？,legs!?why!?,0.6
"They should be mostly healed, and I taped them up well.",ほとんど完治してる上に テーピングもキッチリやった,Taping was also kitchari,0.0
They shouldn't get so bad this quickly.,そう簡単に悪化なんて…！,So it's easy to get worse ...!,0.125
"No, this is...",違う これは…,Different this is ...,0.5
It's fine with the taping!,なんでまた！？ テーピングなら問題ねえっスよ,"Why!?If it is taping, there is no problem",0.2
Just get on the bench!,いいから戻りなさい！！,Return!!,0.14285714285714285
and has been overcompensating with his other leg.,そのせいで 今度は逆の足に極端な負荷が…,"Because of that, it is extreme load on the opposite legs ...",0.0
"I can't let him play anymore in this game,",この試合 もう出すわけにはいかない,This match can not come out anymore,0.125
or during the remaining two days of the championship league.,それどころか 決勝リーグ残り２日も…,"On the other hand, the final league remaining 2 days ...",0.23529411764705882
"Do you suppose the game will be over soon, Momoi?",いよいよ 決まりですかね,Finally the decision,0.07142857142857142
Don't you have a strategy we can use against him?,桃井さん 彼の対策もあったんでしょう？,Mr. Momoi also had his countermeasure?,0.05555555555555555
What shall we do?,どうします？,What do you do?,0.5
"No, it shouldn't be necessary anymore.",いえ もう必要ない… と思います,I do not need it anymore ...,0.14285714285714285
"Hey, he's crazy.",おいおい すんげえな あいつ,Hey himself,0.14285714285714285
Is he going to kill someone?,人でも殺すんか？,Do you kill people?,0.2
Everyone who has played against Aomine so far,今まで 青峰とやったヤツはみんな—,Everyone who has ever done with Aomine all-,0.3333333333333333
has given up or stood there stunned once they see how much better he is.,才能の差に諦めるか ぼう然とするか—,Do you want to give up with the difference in talent-,0.038461538461538464
"Either way, they lost their will.",どっちにしろ意気消沈って 感じだったんだけど—,I felt that I was disappointed anyway-,0.0
"But even after losing this badly, and even more than before,",あいつはあんだけやられてなお つか 今まで以上に—,He is an anchoring or something more than ever-,0.1111111111111111
he's radiating rage.,ほとばしってんぞ 怒りが,I'm getting angry,0.0
and they already know what we're going to do on offense because of Momoi!,オフェンスは桃井のせいで 全部読まれてる！,The offense is read everything because of Momoi!,0.25
"No matter what they do now, they can't win.",もう どうあがいても 無理だ…,It is impossible to go anymore ...,0.0
We're 40 points behind. there's nothing we can do.,くっ！ マジで手も足も出ねえ,"Come!Seriously, hands are also out",0.0
Wouldn't it be better to sub him out for Koganei?,なら むしろコガに代えたほうが いいんじゃねえのか？,If it is better to replace the coga?,0.23529411764705882
This was quicker than I expected.,思ったより早かったな もう決まりだろ,It was more faster than I thought,0.2727272727272727
"Your special pass didn't work,",自慢のパスも通じず 体力も尽き—,Pursuiting paths are also exhausted to,0.0
"you're out of stamina, and your light is gone.",オマエの光だった火神もいない,There is no fire god that was the light of Omae,0.15
Your misdirection stopped working a while ago.,ミスディレクションも とっくに切れた,Missing drawings too,0.0
Now you're worse than the average player.,もはや 並みのプレーヤー以下だ,It is less than or equal to the player,0.2
There's no such thing as a quick comeback in basketball.,バスケに一発逆転はねえよ,Return in the basketball,0.14285714285714285
"I win, Tetsu.",オレの勝ちだ テツ,Tetsu who wins,0.14285714285714285
It's not over yet.,まだ 終わってません,It is not over yet,0.5714285714285714
The possibility of victory is only 0% when all the players give up.,可能性がゼロになるとすれば それは諦めたときです,"If the possibility is zero, it is when it gives up",0.2631578947368421
"No matter how impossible it may seem, I refuse to make it 0% myself.",どんなに無意味と思われても—,No matter how meaningless-,0.17647058823529413
That is why I will never give up!,だから 諦めるのは絶対 嫌だ！,So I'm absolutely disliked to give up!,0.2857142857142857
"Sheesh, we can't sub him out now.",ったく そりゃ代えらんねえわ,It's a long time ago,0.0
We can't let a first year kid have more determination than us.,１年坊主のやる気に—,I will motivate the one of the first year-,0.047619047619047616
"Hey, bench!",こら ベンチ お通夜か もっと…,Much of the bench and more ...,0.1
Keep your voices up until the end!,声出せ！ 最後まで！,Voice!To the last!,0.18181818181818182
You can't sit here quietly!,黙ってて どうする？,What do you shut up?,0.08333333333333333
Keep running until the very end.,走れよ 最後まで,Run to the end,0.2222222222222222
I'll acknowledge one thing.,１つだけ認めてやるわ,Only one,0.14285714285714285
You don't give up easily.,その 諦めの悪さだけは,Only bad badness,0.0
But the difference in our scores only widened.,それでも点差は開き続けた,Stay still continued to open,0.0
No one shed a single tear.,涙は出なかった,There was no tears,0.1
"That day, we were...",その日 私たちは…,That day we are ...,0.5714285714285714
completely and totally...,それほど圧倒的に—,I'm very overwhelming-,0.0
Next Episode,降旗です 今日から練習メニュー３倍,It is a fountain flame from today's practice menu 3 times,0.0
Kawahara here! We won't lose!,河原です オレたちも負けてらんないぞ,It is Kawara I can not lose me too,0.06666666666666667
