en_text,jp_text,google_translated,score,semantic_score
You're going to help us?,"（グラハム）
協力してくれると？",Can you cooperate?,0.2222222222222222,0.36691573
I want to know the truth about myself.,"私は
私の真実を知りたい","I am
I want to know my truth",0.4545454545454545,0.66787153
Welcome aboard.,よろしく頼む,Irregularly ask,0.0,-0.027204517
Major! The pivot stone is ascending!,"（ベス）枢(くるる)が…
枢が上昇しています！","pivot  ...
The pivot is rising!",0.4444444444444444,0.58439904
What?,願望とは？,What is your desire?,0.4,0.1283772
There's no time for that.,"（ソフィー）絶望なんて
している暇はありません","Despair
There is no spare time",0.3,0.34879938
"I want to thank you. You have helped lift
a weight off of my chest.","君のおかげで
胸のつかえが取れた","Thanks to you
Her chest was caught",0.15789473684210525,0.53199595
"I was finally able to fulfill my promise
to Takehito.","やっと 岳人(たけひと)との約束を
果たすことができた","Finally the promise with Takei
I could fulfill it",0.26666666666666666,0.679484
What will you do now?,"これから
どうなされるのですか？","from now on
What is it?",0.3,0.3593981
The time for hiding has ended.,"もはや 隠れ潜む時は
終わりを告げた","When hidden hiding
I told the end",0.16666666666666666,0.6684428
"Let us fight together until we rid this
world of Efi Dorgs.","この星からエフィドルグを
駆逐するまで共に戦おう","Effidence from this star
Let's fight together until you break up",0.25,0.47233787
"That was the pact I made
with my fallen brethren.","それが 散っていった
仲間たちとの盟約","It was scattered
Meeting with friends",0.13333333333333333,0.33675644
You are a samurai.,侍なのですね,It is a jealousy,0.125,0.14619748
What will you do?,（ゼル）君は どうするのだ,What do you do?,0.8,0.690163
I...,私は…,I am…,0.3333333333333333,0.3277476
I will follow my beliefs.,私の信念に侍(さぶら)う,My beliefs,0.3333333333333333,0.57318866
Major Graham.,（ソフィー）グラハム少佐,Graham Major,0.6666666666666666,0.94946516
But don't feel pressured to say yes.,"今から言うことは
私の個人的なお願いだ","What to say from now
My personal request",0.13333333333333333,0.32284814
"I will fight as well. In a Dwarf or as a
foot soldier, I will do whatever I can.","ドワーフでも歩兵でも
私のやれることをやります","Even with dwarves
I will do what I can do",0.2,0.6250608
I've completely lost face.,私も戦います,I also fight,0.125,0.25585863
I apologize for my rudeness.,無礼な言葉 お詫びします,I apologize for no good words,0.3333333333333333,0.65603507
But I wanted to stand up for myself.,でも 少しは言い返したくて,But I want to say a little bit,0.21428571428571427,0.2377643
Sophie Noel. Will you pilot GAUS 1?,ソフィー･ノエル,Sophie Noel,0.2222222222222222,0.5927995
I'm sorry. Adults are selfish creatures.,"すまんな 大人ってやつは
身勝手なもんでね","Some adults are
Selfishness",0.2,0.8322014
"""The essence of Bushido is to die.""","“武士道と云(い)ふは
死ぬ事と見付けたり”","""Masturbation and""
Death and finding it",0.13333333333333333,0.26692614
I do not plan to choose death.,"死を選ぶつもりは
ありません","I intend to choose death
is not",0.5,0.82410985
Are you scared?,（剣之介）怖いか？,scary?,0.2,0.6388237
"If we don't fight here,
it will all end.","でも ここで勝たないと
終わっちゃうんだよね","But if you won't win here
It's over",0.2222222222222222,0.50783736
Yukina.,由希奈,Lady,0.0,0.39520615
Give me your life.,お前の命を俺にくれ,Give me your life,0.8,0.92119575
"-No.
-No?!",イヤ!?,Ear!,0.2,0.25373578
"Right, of course.",そうか… そうだな,Oh yeah ...,0.0,0.33581793
My life is my own.,私の命は私のだけど,My life is me,0.5,0.6921085
But I guess I can entrust you with it.,あんたになら預けてもいいかな,Maybe I can leave it,0.2727272727272727,0.43274042
Understood.,心得た,Gender,0.0,0.18063337
"You asked me what I would
do after the ogres are all killed.","以前 鬼を全て斬ったら
どうするのかと言っておったろう","If you cut all the demons before
I wonder what he will do",0.2857142857142857,0.2920959
There is one thing I have decided.,俺は １つ決めたことがある,I have decided one,0.5,0.65182835
Yukina. I will make you my wife!,由希奈 お前を嫁にしてやる,Yuuki Yurana I will give you a bride,0.21428571428571427,0.53049654
But I thought you liked...,"で… でも あんた
雪(ゆき)姫のことが…","So ... but
Snow  princess is ...",0.2,0.22451913
I never thought that before!,"そのような不埒(ふらち)なこと
思ったこともない！","Such a bad thing 
I have never thought!",0.3636363636363637,0.6002202
You're a better fit for me.,俺には お前くらいが頃合いなのだ,I'm at a time to me,0.15384615384615385,0.3272808
"That's the lousiest proposal
I've ever heard!",（洋海(ひろみ)）絶対に許しませんよ！,) I absolutely not forgive!,0.14285714285714285,0.17744368
"-Why aren't you happy?!
-Die, you stupid samurai!",どうして喜ばない？,Why don't you please?,0.21428571428571427,0.26066613
"-Uh oh...
-But why, mother?!",何ゆえでありますか 母上殿！,Somehow or Mother Mother!,0.18181818181818185,0.57646555
"Because I'm way too young
to be a grandmother!","（洋海）私 まだ
おばあちゃんなんて呼ばれたくないし","I still
I do not want to be called Grandma",0.17647058823529413,0.5452749
"<i>Yukina, do not accept his proposal.","（ソフィー）由希奈さん
そのプロポーズ 受けてはいけません","Yukina
Do not receive that proposal",0.3076923076923077,0.88163793
"-You're listening too, Sophie?
<i>-It's a red flag.",（ソフィー）それはフラグです,It is a flag,0.1111111111111111,0.2830384
<i>Rise in heart rate confirmed.,（ベス）心拍数の上昇を確認,Check the rise in heart rate,0.3636363636363637,0.74829394
What's this? A lovers' quarrel?,"（美夏(みか)）え？ なになに？
痴話ゲンカ？",")?What what?
Moliative Genca?",0.18181818181818185,0.14581387
"-No!
-You know, you've got some guts.",違うし！,Different!,0.08333333333333333,0.22605854
But you can die.,お前は死んでもいい,You may die,0.3333333333333333,0.58624965
"We're not done with the movie
so you better come back!","（赤城(あかぎ)）絶対 由希奈を
死なせるんじゃねえぞ",") Absolutely Yuuki
You're not dead",0.17647058823529413,0.21673691
"Victory comes to those who dare
to challenge!",勝利は 敢えて挑む者に！,The victory is dare to challenge!,0.5,0.8953736
"Inertia canceller,
graviton convergence, check.","イナーシャキャンセラー
重力子収束 よし","Inertia Canceller
Gravity child convergence",0.3333333333333333,0.82627267
They're here. But only one Grongol.,"（ヨルバ）来たぞ
だが グロングル１機だな","I came
But he is one of the gross",0.13333333333333333,0.1580226
Above us!,上！,Up!,0.25,0.46363014
"-Isn't this bad?
-We cannot back down now!",まずくない？,Isn't it bad?,0.21428571428571427,0.38629836
It's all over if we lose anyway.,"どうせ これで負けちゃったら
終わりでしょ","Anyway if you lose it
It is the end",0.3076923076923077,0.5758649
I like putting everything on the line.,私は好きですよ 乾坤一擲(けんこんいってき)！,I like Ichigo Anything !,0.18181818181818185,0.1811062
Report from patrol.,"（ベス）偵察隊から報告
クロムクロ 敵と接触","Reconnaissance Corps Report
Crome-black enemies and contact",0.1,0.37978172
"Kuromukuro is surrounded by a
large scale geoframe enemy.","敵大型ジオフレームに
囲まれているもようです","In the enemy large geoframe
It seems to be surrounded by",0.3125,0.6938892
Are we really going to trust her?,彼女を信じるんですか？,Do you believe her?,0.18181818181818185,0.5580826
We cannot win without her help.,"アレを戦力に
組み入れなければ勝てない","Alle to strength
I can not win without incorporation",0.3076923076923077,0.38503084
"-Hey, it's open!
-That works in our favor.",野郎ども 勝手に死ぬなよ！,Don't die in the man with a bastard!,0.1,0.14262559
We'll get there sooner.,"（グラハム）むしろ好都合だ
予定より早く着ける","rather good convenience
Wear earlier than planned",0.0,0.16190661
<i>You're late!,（トム）遅えぞ！,late!,0.2857142857142857,0.6602724
I'm 15 seconds earlier than planned.,予定より15秒 早いはずです,It should be 15 seconds earlier than planned,0.4545454545454545,0.8562553
"Just as I thought. Mirasa, behind us!","ん… やはりな
ミラーサ 後ろだ！","... still
Mirasa behind me!",0.2307692307692308,0.8193872
What?!,何!?,what!?,1.0,0.8981638
Worthless idiots!,ヘヘッ！,Hehehe!,0.25,0.23576611
"I'll share the truth
if you're willing to listen.",聞かせてやってもよいぞ,I can tell you,0.14285714285714285,0.31524315
"All right, they've split their forces.",よし 戦力が分散したな,Good work is distributed,0.0,0.17292568
Storm the control room!,司令室を押さえるぞ！,I will press the command room!,0.3333333333333333,0.5613305
Rita!,リタ！,Rita!,1.0,1.0
Prioritize restoring chain of command!,指揮系統の回復を最優先,Top priority with recovery of command system,0.18181818181818185,0.6787497
"Tie up anyone sitting there
and throw them in a corner!","座り込んでるヤツは縛り上げて
その辺に転がしておけ！","The guy who is sitting is tied up
Roll to that side!",0.14285714285714285,0.4460724
"We are good to go.
Nothing has been changed.","いけます
何も変更されていません","Will
Nothing has been changed",0.3636363636363637,0.58948386
Great.,お願いします,please,0.0,0.29413477
It completely matches the data.,データと完全に一致,Completely match with data,0.25,0.6714198
"The tip of the Efi Dorgs mother ship has
reached the deepest level.","エフィドルグ母艦の先端が
最深部まで到達しています","The tip of Effide Lugs
It has reached the deepest",0.4,0.6369758
How is the facility?,（グラハム）施設はどうです？,What is your facility?,0.42857142857142855,0.76205605
Crap!,しまった！,Oops!,0.3333333333333333,0.5255677
<i>You evade the first blow with a sway.,一太刀目をスウェイでよける,I can not wear a thick sword with sway,0.2352941176470588,0.40547866
"<i>I see you haven't fixed
<i>that habit of yours.","その癖は直っておりませんな
お嬢様","That habit is not correct
Lady",0.1176470588235294,0.50827515
"Looks like GAUS is better suited
to be co-piloted.","（セバスチャン）やはり ガウスは
複座のほうがよろしいようで","After all Gauss
It seems to be better",0.2,0.39693657
Sebastian!,セバスチャン！,Sebastian!,1.0,1.0000001
"Sebastian, you're...",セバスチャン あなた…,Sebastian You ...,0.6,0.8922245
"First, we must take back our home
from these thieves.","まずは 目の前の盗っ人どもから
我が家を取り返さねば","First of all, from the thief of the eyes
If you beat my home",0.19047619047619047,0.52561474
Yes.,ええ,Yes,0.5,0.83685577
Are you certain?,よいのか？,Is it good?,0.14285714285714285,0.24934913
"Devoting yourself to a Grongol means
you'll become something else.",頼むぜ 鬼のおっさん,Request a demon man,0.06666666666666668,0.09043834
You want me to desert my comrades?,"自分かわいさに
戦友を見捨てるだあ？","In my own
Will it abandon the comrade?",0.13333333333333333,0.54569405
No way! I'm not that heartless.,"冗談じゃねえ
それこそ人でなしだ","It is not a joke
That is not a person",0.14285714285714285,0.16174497
You won't believe anything I say.,何を言っても信じまい,I believe anything,0.375,0.5923496
This way. Keep stepping back!,"（セバスチャン）こっちだ！
そのまま下がれ！","This is here!
It is lowered as it is!",0.16666666666666666,0.24440466
I'm here to repay you.,己の手柄に固執するのであろうな,I will stick to my hand,0.18181818181818185,0.28141296
"Why are we so fixated
with our own achievements?",なぜ 我らは,Why we,0.2,0.3292851
Mirasa?! Curse you!,ミラーサ！,Mirasa!,0.4,0.8621367
"Control, I have a proposal.",司令室 １つ提案があります,There is a proposal one of the command rooms,0.14285714285714285,0.41833487
"<i>-Please come down now.
-Come down?!","（ソフィー）今すぐ
降りてきてください","right now
Please come down",0.2307692307692308,0.7236038
"<i>Please head directly
<i>to the research facility entrance.","研究棟のエントランスを
目指してください","Entrance of research building
Please aim at",0.1875,0.76443833
"-Can you do it?
-I'll try.",やれるか？,Can you do it?,0.4,0.6054
Is it possible?,可能ですか？,Is it possible?,1.0,0.99999964
"I suppose if she concentrates the gravity
compensation at once.","重力制御を一点に集中すれば
とは思いますが","If you concentrate gravity control at one point
I think",0.2352941176470588,0.67082345
<i>I can! I can do it.,やれます やってみせます！,I will try to do it!,0.3636363636363637,0.47252923
Okay. I'll leave the timing to you.,"分かりました
タイミングはあなたに任せます","understand
Timing will be left to you",0.2307692307692308,0.5870097
Yorba!,ヨルバ！,Yolva!,0.3333333333333333,0.59748316
"-Imusa, I will take your body.
-Yes, sir!",イムサ 主(ぬし)の体 もらうぞ,I will get my body of Imsa Main,0.1875,0.42520437
Something's coming down.,何か落ちてきたよ,Something has fallen,0.14285714285714285,0.589494
"-What?
-That's way too big.",ちょっと大きすぎじゃない？,Isn't it too big?,0.2727272727272727,0.57690096
"We are being outmatched.
What do we do?","純粋に力負けしている
どうする？","Purely loading
what will you do?",0.25,0.034838114
"First, we must kill that traitor.","（レフィル）まずは
裏切り者の処刑である","First of all
It is the execution of the traitor",0.14285714285714285,0.72182566
You don't have my permission to die!,"俺様の許可なく
死ぬことは許されん！","Without my permission
It is permitted to die!",0.38461538461538464,0.85680056
"-Naiyon?
-Sorry to keep you waiting.",待たせたな,I kept you waiting,0.2,0.4179222
"-We each take one.
-If we can.",１人１本か…,One person alone ...,0.09090909090909093,0.37120202
"Could everyone slow down each sword
that's attacking them?","みんな 自分に向かってくる刀
少しだけ止められるかな？","A sword that comes to you
Can you stop a little bit?",0.15789473684210525,0.5918871
"-What?
-Slow them down for what?",何？,what?,0.2857142857142857,0.14353235
"No one will be able
to reach the main part.","そんでどうする？
本体には誰も届かねえぞ","So what do you do?
No one has received it in the body",0.14285714285714285,0.09517846
Let's attack at the same time.,同時にかかるぞ！,It takes at the same time!,0.3636363636363637,0.36685568
"-Copy that.
-Understood.",了解,Roger that,0.2,0.25470084
"All right, fine.",しょうがねえな,Ginger,0.0,0.105007656
A little more...,もう少し…,A little more ...,1.0,1.0000005
I made it!,任せろ！,Leave it!,0.4,0.39400995
Sophie!,ソフィー！,Sophie!,1.0,1.0000001
It's not over yet!,まだ終わってねえぞ！,It's still over!,0.5714285714285714,0.8288851
"I can fight, too!",戦えるんだから！,Because I can fight!,0.5714285714285714,0.74235004
Captain Lefil!,レ… レフィル隊長！,Les ... Lelilager captain!,0.3333333333333333,0.69806415
I got you!,取った！,I took!,0.4,0.49395198
"Kennosuke, don't let him escape!",剣之介 ヤツを逃がすな！,Don't miss the Kenyuke guy!,0.25,0.6026653
I must protect the pivot stone!,"（レフィル）
何としても枢だけは！",Only the pivot!,0.375,0.5883437
What's wrong?,どうした？,What happened?,0.4,0.38352174
"I'm sorry, Yukina. But you did well.",だが よくやった,But I did it well,0.3636363636363637,0.4344722
You should rest here.,そなたは ここで休んでおれ,You are resting here,0.2857142857142857,0.63929456
"It ends after this, doesn't it?",これで終わりなんだよね,This is the end of it,0.16666666666666666,0.5625
"Disregard all safety procedures.
I must activate the emergency--","全ての安全手順を省略
緊急展開を…","Omit all safety steps
Emergency development ...",0.2,0.5650109
Just as I thought.,やはりな,Again,0.0,0.11524359
"Nothing has changed, not the
ship's structure or the security.","船の構造も
セキュリティーもな","The structure of the ship
Security",0.3076923076923077,0.67361015
"Cognitive camouflage has no effect
on non Efi Dorgs.","認知迷彩は
エフィドルグ以外の者には効果がない","Cognitive camouflage
There is no effect for people other than Effed Log",0.2222222222222222,0.5410087
Did you not know?,知らなかったのか？,Did not you know?,1.0,0.9577604
"Good. Now stop the pivot stone
immediately.","（ゼル）よし
今すぐ 枢を停止しろ","Yoshi
Stop the pivot right now",0.4,0.5044086
"Yes, sir.",（レフィル）りょ… 了解,り ...,0.0,0.18978927
We avoided a crisis.,"（ゼル）
ひとまずの危機は去ったな",Hitless crisis left,0.14285714285714285,0.44364437
Their commander was from your planet?,"指揮官は
あなたの星の人だったんですか？","Commander
Were you a man of your star?",0.2307692307692308,0.70987415
"This commander seems to be from
the previous generation's Border Reform.","指揮官は 一世代前の
辺境矯正官を使うようだな","The commander is before the generation
It seems to use the side eldirection officer",0.25,0.64476043
Lord Zell!,ん… ゼル殿！,... Zelle!,0.2,0.6936645
"First, who are you?",まず お前は何者だ,First of all you are,0.375,0.4872446
I am Border Reform Officer number 8192.,"（レフィル）わ… 私は
辺境管理官 第8192号","... I
Visitial Manager No. 8192",0.25,0.35686088
"to eliminate any potential threats
against the Efi Dorgs.","エフィドルグに対する
潜在的脅威を事前に排除する","For Effide Lug
Exclude potential threats in advance",0.125,0.4781163
"-Where is the Efi Dorgs' home planet?
-I do not have that information.",（レフィル）その情報はない,There is no information,0.1111111111111111,0.3141725
Then who made you?,では お前は誰に造られた,So who was built by anyone,0.1,0.46622545
"I was made under the directive
of Officer Number 4096.","管理官4096号の
製造指示により造られた","Administrative institute 4096
Made by manufacturing instruction",0.125,0.43492374
"I have not been inputted
with any further information.","それより上流の情報は
入力されていない","More information upstream
Not entered",0.15384615384615385,0.2737535
"What happens if the pivot stone
remains unopened?","このまま 枢が開かなかったとして
どうなるの？","As if this is not opened as it is
What happens?",0.26666666666666666,0.35835207
"Should the pivot stone not open,",枢が開かなかった場合,If the pivot does not open,0.4444444444444444,0.76584065
"an even larger correctional fleet will
be sent through.","より大規模な矯正艦隊が
通常航行にて出立する","Larger orthodontic fleet
Normal navigation",0.15384615384615385,0.3139248
"They will arrive after 224 rotational
periods.","（レフィル）到着は
224公転周期の のち…","arrival
224 After the revolving cycle ...",0.15384615384615385,0.7015937
"This one is Orga
that the enemy boss was on.","敵のボスが
乗ってたのが","Enemy boss
I was riding",0.2307692307692308,0.54256535
It's so awesome when giant robots combine!,"おっきいのが
出てきちゃったね","Opportunity
It came out",0.08333333333333333,0.13315031
