en_text,jp_text,google_translated,score
He missed again! what the hell is this? i'm pissed!,また外した！ ナンダヨ モウムカツク,I removed again!Nanda Yomememo Kutsu,0.17647058823529413
Don't let it get to you. He's not blocking you.,クサるなよ ブロックされてる わけじゃねーんだ,I'm not crazy I'm blocked,0.0625
I've gotta take him down more directly than this.,やっぱ もっとスカッと 倒さねーと気がすまねえ—,After all I feel like I'm going to kill more,0.1
"Hey, let me tell you two things.",ヘイ！ ２つ言っとくぜ ううっ,Hey!Two things to say,0.25
"First, I'll block one of your shots in this game.",１つは この試合中に—,One is during this game-,0.125
There's no way you can do that.,ソンナノ… ナイジャン デキルワケ,Son nano ... Nyjan Dekiruwake,0.0
I will not lose to a team with a child on it.,子供ガイル チームナンカニ 負ケナイ！,Children's Gille Team Nankani Pull Kenai!,0.05263157894736842
This kid might give you some trouble.,子供も結構ヤバイかもよ？,Children are also quite good?,0.0
Could you please stop calling me a child?,ていうか 子供で 話進めるの やめてください,"In other words, please stop talking with a child",0.26666666666666666
Next Episode looks like kagami's practice is paying off.,火神のヤツ 練習の成果出てるみたいだな,It seems that the results of the fire god's guy practicing,0.047619047619047616
But this game will get tougher because we have to rest Kuroko.,でも黒子を温存してからが勝負だ,"But since I preserve Kuroko, it is a match",0.09523809523809523
"Damn it, Papa! Get outta the way!",チッ パパ 邪魔するな！,Don't disturb the chippapa!,0.15384615384615385
"Coach, member change! you'll see something amazing",お父さんね カントク！ メンバーチェンジ！,Dad Neko Cantoku!Member Change!,0.23076923076923078
