en_text,jp_text,google_translated,score
The Teiko Middle School basketball club.,帝光中学校 バスケットボール部,Teiji Junior High School Basketball Club,0.3
An incredibly strong team with over one hundred members and three consecutive championship wins.,部員数は100を超え 全中三連覇を誇る 超強豪校,The number of members is over 100 super strong schools that boast more than 100,0.11538461538461539
"Even within that brilliant history,",その輝かしい歴史の中でも 特に“最強”と呼ばれ—,"Also in the bright history, it is called ""strongest"" especially-",0.11764705882352941
"a group of five prodigies known as the ""Generation of Miracles"" stood above the rest.",無敗を誇った10年に１人の天才が ５人同時にいた世代は—,The generation of five people at the same time in 10 years boasting,0.16666666666666666
"However, there was a strange rumor concerning the Generation of Miracles.",が “キセキの世代”には 奇妙なうわさがあった,"There was a strange rumor in ""Kiseki generation""",0.35294117647058826
Despite being relatively unknown,誰も知らない 試合記録もない,There is no match record that no one knows,0.0
A phantom sixth man.,幻のシックスマンがいた と,I had a phantom Sixman,0.25
My shooting range is the entire court.,オレのシュートレンジは コートすべてだ,My shot range is all about the coat,0.3333333333333333
"At this rate, I'm more worried about my heart than the score.",このままじゃ 点差以上に 心が—,The heart is more than the point difference-,0.2222222222222222
My heart's gonna break!,心が折られる,Be broken,0.0
The first half finished with them slowly pulling away.,結局 ズルズル離されて 前半終了かよ,"After all, it is the end of the first half",0.17647058823529413
This game's over.,てか 終わりだろ もう帰ろーぜ,It's over and it's already over.,0.375
"If they lose this badly, people will think we're weak.",つか こんな差つけられたら—,If you get this such as,0.11764705882352941
How can the addition of a single member change this team so much?,たった１人の加入が ここまでチームを変えるのか…,How many joining goes to here ...,0.05
"Geez, show some spirit, Seirin.",う… もー 根性見せろよ 誠凛,Uh ... I will show you,0.08333333333333333
"They are, you idiot.",見せてるよ バカ,I'm showing it stupid,0.0
"After being shown such a difference in their strength,",あんだけ 力の差 見せつけられて—,I'm looking forward to the difference between,0.058823529411764705
they're still barely hanging in there.,まだ ギリギリでも テンションつないでんだ,Even if it is still in the last minute tension,0.125
I'd praise them.,むしろ 褒めるぜ んん…,"Rather, I'll give up ...",0.09090909090909091
Aquariuses should play it quiet today.,みずがめ座のアナタは 今日は おとなしく過ごしましょう,Anata of Mizugyeza will spend yourself today,0.07692307692307693
Cancers will have a great day.,１位のかに座のアナタは絶好調！,Anata of the seat is in the first place!,0.0
"As long as you have your lucky item, Shigaraki raccoon,",ラッキーアイテム タヌキの信楽焼を持てば—,If you have Lucky Item Raku Shigaraki-,0.3076923076923077
you have nothing to fear.,向かうところ敵なし！,"If there is an enemy, there is no enemy!",0.0
This is simply the result of our abilities. it's not bad.,実力通りの展開だ 悪くはない が よくもない,It is not bad but not bad,0.2857142857142857
The other side hasn't given up yet.,とりあえず 向こうは まだ諦めてない,"For the time being, I have not given up yet",0.25
Let's smash them through Otusbo in the second half.,後半は 大坪も積極的に攻めろ,"In the second half, Otsubo is actively attacking",0.25
Finish them.,とどめを刺す 以上！,More than stab!,0.0
"Hey, what are you doing?",オーイ 何してんの？ 監督の話も聞かないで,Oo What are you doing?Don't ask for the story of the supervision,0.3125
"As you can see, I'm fixing my nails.",見たままなのだよ 爪を整えている,I'm looking at it I'm ready,0.13333333333333333
My shots depend on my nails.,オレのシュートタッチは 爪のかかり具合がキモなのだよ,My shoot touch is a kimono,0.09090909090909091
That's why he always tapes his fingers.,そのために 普段は 常にテーピングで保護…,"For that purpose, usually protect with taping ...",0.058823529411764705
This is more than fastidiousness. It's obsessive.,こだわり通り越して 執念すら感じるね,I feel even more obsessive passing through,0.14285714285714285
It is my lucky item.,ラッキーアイテムです,Lucky item,0.3333333333333333
This thing was on the bench during the entire first half!,てか 前半 フツーにベンチにあるし,It is on the bench in the first half Fuhu,0.3333333333333333
What should I do? i have to say something to raise their spirits.,どうしよう 何か言って みんなを鼓舞しないと…,If you say something to say something and inspire everyone ...,0.15789473684210525
What should I say?,何を言えば…,What to say ...,0.2857142857142857
"I can't do the same thing again, can I?",どうしよう もう同じパターンはないよね？,How do you do the same pattern?,0.2857142857142857
"Hey, everyone...",み… みんな… あのね…,... everyone ... that ...,0.4
"Coach, it's okay.",カントク いーよ え？,"Cantok, right?",0.1111111111111111
Read the situation.,空気読め,Ready,0.0
but I can't honestly imagine us winning.,正直 勝てるイメージがねーよ,You can not win the image right,0.0
"Kuroko, what are you doing?",黒子 何してんの？,What is Kuroko?,0.375
but I have never wondered if I can win or not.,“勝てるかどうか”とは 考えたことないです,"I have never thought of ""whether I can win""",0.3125
"Even if we lose by 100 points, there's a chance a meteor will strike the other team's bench in the last second.",ていうか もし100点差で 負けてたとしても 残り１秒で—,"If you lose with 100 points difference, it will be 1 second without being lost-",0.21875
That's a crazy thought.,てか すごいな その発想！,It's a great idea!,0.2
Don't get carried away. That won't happen either.,つられるな！ それもない,Don't get caught up!It is not,0.1875
"Well, compared to that,",まーねー それに比べたら—,If it is compared to it-,0.2222222222222222
a second half comeback is way more realistic.,後半 逆転するなんて 全然 現実的じゃん,It is realistic that it will reverse,0.15384615384615385
Let's just keep running and think after the game's over.,ハッ とにかく 最後まで走って—,Run to the end anyway-,0.0625
"All right, let's go!",よし 行くぞ！,I will go!,0.2222222222222222
The third quarter will now begin.,第３クオーター 始めます！,Start the third quarter!,0.3333333333333333
"Well, he can't do anything as long as Takao's there,",ま 高尾がいる限り しょーがねーだろ,"As long as there is Takao,",0.38461538461538464
but that isn't a strategy.,にしても 無策っつーか…,No matter how to do it ...,0.0
"Well, they can't help it.",まーねー しょうがないよねー,I can not help you,0.08333333333333333
"Conventional strategies won't work,",正攻法では敵わない かと言って—,In terms of honest law-,0.0
"but to use an unconventional strategy, they'll need something to make it happen.",奇策で勝負するには ここぞという 展開に持ち込む必要がある だが…,It is necessary to bring it to the development of here to compete with a wife ...,0.07407407407407407
However... something... we just need some kind of opening.,何か… 何か１つ 突破口があれば…,Something ... If there is a breakthrough with a break ...,0.1111111111111111
"Unfortunately, no such opening exists.",残念ながら その突破口はない！,Unfortunately there is no breakthrough!,0.18181818181818182
"There's still life in their eyes, but what is this?",全員 目は死んでいない… が なんだ？,Everyone is not dead ... What is it?,0.16666666666666666
This is more than just not giving up.,こいつは ただ 諦めていないのとは何か違う,This guy is just something different from not giving up,0.46153846153846156
I will simply crush him.,まあいい 全力でたたき潰すだけだ,It's just the best crushing,0.0
There goes Midorima!,うわぁ！ いきなり緑間！,Wow!Suddenly green!,0.14285714285714285
"This bastard! When did he... no, more importantly...",こいつ いつの間に… いや それより…,This always ... No longer ...,0.23076923076923078
I won't lose!,負けるか 絶対！ もっと… もっとだ,Never lose!More ...,0.25
Good! They didn't expect...,うっ うまい！ 意表をついて…,It's delicious!Looking up ...,0.16666666666666666
"Koganei-senpai, who can shoot from anywhere!",さすが どっからでも打てる 小金井先輩！,Koh Kanai senior who can hit me anyway!,0.21428571428571427
You don't give up until the very end.,オマエは 最後まで 決して諦めない,Omae never gives up to the end,0.21428571428571427
"But that means if you give everything you have and still can't do it, you accept the loss.",けど 全力を尽くして それでもダメなら—,But if you don't do our best-,0.23809523809523808
"Playing against an opponent who's impossible to beat excites me,",勝ち目がないような強敵とやるのは ワクワクする,It is exciting to be a strong enemy that won't win,0.043478260869565216
but ultimately...,それでも 最後は—,Still last-,0.0
There's no point if I don't win!,勝たなきゃ 何の意味も ねぇんだよ！,"If you have to win, you're all the meaning!",0.16666666666666666
He's been getting higher and higher all game.,試合中に どんどん 高くなっている！,It's getting more and more expensive during the game!,0.26666666666666666
There's our opening!,あった… 突破口！,There was a breakthrough!,0.25
Hey.,おい,Oi,0.0
"However, your compatibility with Leo is very poor.",ただし しし座の方とだけは 相性最悪,"However, only the person in the seat is compatible",0.1875
Be careful if you run into one.,出会ったら 要注意,If you encounter it carefully,0.18181818181818182
That horoscope really is always right.,まったく 本当に よく当たる占いなのだよ,It is a fortune telling that hit at all,0.14285714285714285
Don't lose focus.,集中力 切らすな 切らしたら終わりだ,It is the end when I cut a lot of focusing,0.0
"He might not be as good as Midorima, but he does hit a lot of shots.",緑間ほどじゃねーが ホントよく入るな あいつ,It is not enough to get in the middle of the green.,0.12
He's the one who finished us off.,オレらにトドメくれたヤツだしね,It's a guy who has been toded in Ore,0.11764705882352941
"The other four are playing zone,",他の４人はゾーンで 10番が緑間にマンツーマン,The other four people in the zone 10th is a man-to-one,0.3076923076923077
It's a box and one.,ボックスワンか,Box one,0.2857142857142857
He's guarding him from that far away?,そんなとこから ガード付くのかよ,Do you have a guard from such a cousin,0.0625
They haven't given up yet!,根性あるぜ あいつ！ まだ 諦めてねえ！,Caseyaries!I still give up!,0.18181818181818182
"This is the only way to stop Midorima, since he can shoot from anywhere.",確かに どっからでも打てる緑間を 封じるには これしかないが！,Certainly there is nothing to seal the green space where you can hit anyway!,0.14814814814814814
I won my game against Kise.,黄瀬との闘い…,Fight with Kise ...,0.1
But that was because Kuroko was there.,けど それは 黒子がいたからだ,But because it was Kuroko,0.5
"If that's what it takes to win, that's fine.",それでも 試合に勝てるならいい けど もし黒子がいなかったら？,"Still it is good if you can win the game, but if there is no Kuroko?",0.17391304347826086
"If Kuroko's basketball doesn't work in the future,",もしこの先 黒子のバスケが 通用しないときが来たら—,If the basketball of this last Kuroko does not pass--,0.29411764705882354
will I lose?,負けるのか？,Do you lose?,0.3333333333333333
It's two on one now!,ぐっ 今は ２対１だぜ,It is two to one now,0.4444444444444444
I've finally found your weakness!,テメーの弱点！,Teme's weakness!,0.2222222222222222
"The longer the shot,",距離が長いほど タメも長くなるってことだよ！,"The longer the distance, the longer the tame!",0.42857142857142855
He touched it again?,また触れただと？ バカな！,Are you touching again?stupid!,0.2
It takes an unusually long time to set up for the shot.,通常より はるかに長いタメが 必要になる,It is necessary to be much longer than normal,0.1
"But wait, I even got him off with a screen!",けど オイオイ 一度スクリーンで マーク外したのに！,But I removed the Mark on the screen once!,0.23529411764705882
This trajectory... could it be?,この軌道 これは… まさか！,This track This is ...,0.2222222222222222
He finally stopped Midorima!,うわあ！ ついに止めた 緑間を！,Wow!Finally stop green!,0.25
That's right. Shutoku still has that guy.,そうだ 秀徳には まだ こいつがいた！,"That's right, there was still this guy!",0.38461538461538464
"One of Tokyo's best centers, Otsubo Taisuke.",東京屈指の大型センター 大坪泰介！,Tokyo's leading large center Otegubo Tai!,0.125
but at this rate...,けど これならむしろ…,But rather ...,0.3333333333333333
They're double teaming Otsubo?,大坪さんに ダブルチーム！？,Double team to O Oyubo!?,0.18181818181818182
Maybe this way...,こりゃあ こっちかな,It's like this,0.14285714285714285
He's closer this time. He won't need as much time.,さっきより近い分 タメも短い 今度はイケる！,"Next time, the minute tame is also short next time!",0.05
"The strength to stand against the Generation of Miracles,",“キセキの世代”と 渡り合える力,"Power to cross the ""Kiseki generation""",0.21428571428571427
and one of the greatest weapons in basketball.,そして バスケにおいて 最も大きな武器の１つ,And one of the biggest weapons in basketball,0.7
His hidden ability is,あいつの秘められた才能 それはつまり…,That's hidden talent it is that ...,0.2222222222222222
What an amazing block!,うわぁ！ すげえブロック！,Wow!Somewhat block!,0.2857142857142857
There's always a drawback.  It doesn't matter how strong the ability is.,やっぱ どんな凶悪な技にも 欠点はあるか,After all there is a disadvantage for any violent technique,0.13636363636363635
They have another weakness too!,もう１つあったな 弱点！,There was one more weakness!,0.2
"if they manage to block the shot, their own basket is right there.",逆に ブロックされたら 自陣のゴールはすぐそこ…,"On the contrary, if it is blocked, the own goal is soon so ...",0.21739130434782608
It's the perfect opportunity for a counter!,絶好のカウンターチャンスになる！,Become a great counter opportunity!,0.36363636363636365
There it is!,うおぉ 来た来たー！,I came to come!,0.125
I can't just rely on Kuroko and the upperclassmen.,黒子や先輩たちに 頼ってるだけじゃダメだ！,It is not good to rely on Kuroko and seniors!,0.2222222222222222
It doesn't matter!,かまわん！,I do not care!,0.1111111111111111
I'll become stronger.,強くなってやる！,It will be strong!,0.0
Strong enough to win by myself!,オレ１人でも勝てるぐらいに！,Even if you win alone!,0.18181818181818182
S-So high!,なっ… 高い！,... high!,0.5
Who is he?,何なんだ あいつは,What is it?,0.3333333333333333
Foul! Black #10!,ファウル 黒10番！,Foul black 10th!,0.5
I'll win! even if i have to do it myself!,勝つんだ オレ１人でも！,Even if I'm Katsu I'm alone!,0.2857142857142857
"If he continues like this, i have a bad feeling about what will happen.",このままだと… まずい気がします,If it is this ... I feel bad,0.2
What's this guy's deal?,一体 何なんだよ こいつは！？,What is it? This guy is!?,0.4444444444444444
Are you telling me a guy who just graduated from middle school is pressuring our team?,ついこの前まで 中坊だったヤツに—,Just a guy who was a vain until this before-,0.18181818181818182
I've never seen anyone like this in the whole country.,全国でも 見たことがない,I have never seen it all over the country,0.3125
What is this extraordinary jumping power?,何だこの… 常軌を逸した跳躍は？,What is this ... Jumping out of everyday?,0.45454545454545453
That was unbelievable! he's pressuring shutoku all by himself!,信じらんねー １人で 秀徳を圧倒してるぞ！,I believe I'm overwhelming Hidetoku alone!,0.058823529411764705
Could you give me the ball more?,もっと ガンガン ボールくんねーですか？,More Gangan Balls?,0.2
I can't believe he can stop Midorima.,信じらんねーぜ まさか緑間を止めるなんて,I believe I'm sorry to stop green,0.23076923076923078
"Even if the time it takes for him to shoot is a weakness,",いくら モーションに時間が かかるって弱点があっても—,"Even if it takes time to motion, even if there is a weakness-",0.5294117647058824
I can't believe he can block such a high shot.,あの高い打点を はたくとか ありえねー！,There is a high hit point!,0.11764705882352941
Don't get ahead of yourselves just because you blocked one of Midorima's shots.,緑間を一度シメたぐらいで 調子のんなよ,I'm going to do my best while I'm doing it,0.041666666666666664
"Miyaji, wait! That position...",宮地さん タンマ！ その位置は…,Miyaji-san Tamma!The position is ...,0.2727272727272727
He stopped them again!,うおお また止めた！ カウンターだ,I stopped it!It is a counter,0.2
Don't be ridiculous! how much longer are you going to stay in the air for?,ふざけんな いつまで跳んでんだ テメー？,I'm jumping up to me.,0.041666666666666664
Are you sure you're not hanging from a wire?,ワイヤーで上から つってんじゃねーのか！,Don't get caught from the top with wire!,0.1111111111111111
And he's got the body balance,しかも 流れて跳んだのに 空中でたて直す ボディバランス,Body Balance to fix in the air although it flows and jumped,0.26666666666666666
"Even though it's just a normal jump shot,",基本のジャンプシュート １つとっても こいつが打つと…,When this guy strikes one basic jump shoot ...,0.05555555555555555
He scored. seriously?,入った マジかよ… てことは…,It's a really serious ... ...,0.0
That means...,うおっ １ケタ差！？,Uo 1 game difference!?,0.0
"With this little of a gap, it's anyone's game!",この差なら 分かんねーぞ,If this difference is different,0.0625
Stopping him won't be easy.,これを くい止めるのは 容易ではないな,It is not easy to stop this,0.07692307692307693
"Coach, we have to do something.",監督 何か手を 打たないと このままだと…,"If you don't hit any hand, it's like this ...",0.10526315789473684
At this rate... don't worry.,まあ 慌てるな,I'm sorry,0.0
I acknowledge your strength. However...,オマエの力は 認めるのだよ だが—,Omae's power is recognized-,0.0
You won't be able to close the gap any further.,これ以上 差が詰まることはない,No more difference is clogged,0.0
"Sorry, but it's the truth.",悪いが これが現実だ,Bad but this is a reality,0.07692307692307693
He must have overexerted himself jumping all over the place.,それを乱発して 孤軍奮闘してたからな しかも…,It's because I struggled with it and I was struggling to work ...,0.0
"On top of that... he was subbed in part way through,",途中交代とはいえ これで 今日２試合目,"Even if it is replacement, this is the second game today",0.043478260869565216
He must've lost a lot of stamina playing against Tsugawa too.,さらに 津川のマークで スタミナ削られてたからな,"Furthermore, because it was cracked by the Mark of Tsugawa",0.09090909090909091
Why is that idiot letting it get to him now?,今 ひびいてどーすんだよ あのヤロー！,It's so much so I'm sorry that Yarrow!,0.10526315789473684
And he's not the only one about to run out of gas.,いよいよ まずいな しかも ガス欠間近は—,"Finally, it's pretty bad and near gas missing-",0.14285714285714285
"You're pushing yourself too hard! and it's not time yet, you idiot!",強引すぎる！ ってか まだ早えよ バカ！,Get too strong!It is still early stupid!,0.14285714285714285
A counter!,うわぁ カウンター,Wow Counter,0.25
The third quarter is over!,第３クオーター 終了です,It is the end of the third quarter,0.4444444444444444
Pay more attention to your surroundings.,そうだ それにさっきのは 行くとこじゃねーだろ,"Yes, it's just like you're going",0.0
That's right.,そうだ それにさっきのは 行くとこじゃねーだろ,"Yes, it's just like you're going",0.08333333333333333
"And that wasn't the right time to go,",そうだ それにさっきのは 行くとこじゃねーだろ,"Yes, it's just like you're going",0.05555555555555555
I'm the only one who stands a chance against Shutoku.,現状 秀徳と 渡り合えるのはオレだけだろ,It is only me who can cross the current situation,0.15789473684210525
We don't need to play as a team right now.,今 必要なのは チームプレーじゃねえ,It is not a team play now,0.26666666666666666
You can't play basketball by yourself.,バスケは １人で やるものじゃないでしょう,Basketball will not be one person,0.07692307692307693
"As long as we play nice together, you don't care if we lose?",みんな仲良く頑張りゃ 負けてもいいのかよ？,"Everyone is good to get along well, can you lose?",0.18181818181818182
There's no point if we don't win!,勝たなきゃ 何の意味もねえよ！,"If you have to win, you're hesitate!",0.1875
There's no point if you win by yourself.,１人で勝っても 意味なんかないだろ,"Even if you win alone, there will be no meaning",0.3125
"You said you wanted to beat the Generation of Miracles,",“キセキの世代”倒すって 言ってたのに—,"""I told you to defeat"" Kiseki generation """,0.1875
but you're thinking just like them.,彼らと同じ考えで どうすんだ,I'm wondering with the same idea as they,0.0
"Even if we beat Shutoku as a team that can't trust each other,",今の お互いを 信頼できない状態で—,With the unreliable state of each other-,0.047619047619047616
Don't be so naive!,甘っちょろいこと 言ってんなよ！,I'm talking about sweet potatoes!,0.08333333333333333
Then what is victory?,じゃあ“勝利”ってなんですか,"Well, what is the ""victory""",0.3
"No matter how many more points you have at the end of the game,",試合終了したとき—,When the game ends-,0.125
It's not as though we want to lose!,そうそう 別に 負けたいわけじゃないって,Oh yeah I do not want to lose another,0.26666666666666666
We're just saying there's no reason for you to do it all by yourself.,ただ １人で気張ることは ねーってことだよ,It's just one person to feel nervous,0.19047619047619047
Do you have any objections?,つーか なんか異論 あるか？,Is there something wrong?,0.1
"No, but...",異論とか 別に… いや…,Other than or different ... No ...,0.25
The situation hasn't changed though.,ピンチは変わってねーけど どうする？,"Pinch changes, but what do you do?",0.0
What should we do?,すみません,excuse me,0.0
"The only thing I can do is pass the ball,",ボクにできるのは ボールを回すだけです,You can only turn the ball that you can do,0.38461538461538464
but I can take it up another level.,けど もう一段階 上があります,But there is one more stage,0.07142857142857142
Next Episode i did not think kagami was a leo.,火神がしし座だったとはな 相性は 最悪みたいですね,It is likely to be the worst that the fire god was Shishi Shishi,0.045454545454545456
My luck is number one today.,オレのかに座は 今日の運勢 第１位,Located in Ore Today's Fortion No. 1,0.14285714285714285
I Believed In You,黒子ォ！,Kuroko!,0.0
