en_text,jp_text,google_translated,score
We're almost done with this area.,（直継(なおつぐ)）この区域は ほぼ終了,This area is almost ended,0.3
We missed two platoons or so.,"２小隊くらい討ち漏らした
警戒してくれ","Two platous leaks
Warming",0.1
Message from Naotsugu.,直継さんから連絡,Contact from direct joint,0.14285714285714285
The enemy might be approaching.,敵 接近の可能性あり,Possibility of enemy approach,0.1111111111111111
I'll report once I have visual.,目視できしだい報告します,We report visual and report,0.2222222222222222
But how far can Miss Minori \Nsee in this darkness?,"ミス･ミノリは
どこまで見えているんだ？","Miss Minori
How far are you seeing?",0.35714285714285715
She's using magic eye drops \Nthat Naotsugu lent her.,"（セララ）直継さんから借りた
魔法の目薬 使ってますから―","I borrowed from direct joint
Because we use magic eye drops-",0.1
She should be able to see \Nlike a cat for a full day.,"猫みたく見えているはずです
丸１日は","You should see the cat
Maru 1 day",0.23529411764705882
It has to go well.,順調じゃなきゃ困る,I have to go well,0.375
A night attack?,"（マリエール）夜襲をかける？
何言うとんのや！","Night attack?
What to say!",0.375
Those kids can't protect the city alone...,あの子らだけで守れるはずが,You should be able to protect with that child alone,0.11764705882352941
That's why they're attacking.,だからこそ夜襲をかけるんだ,That's why I can't get a night attack,0.21428571428571427
What?,（マリエール）え？,?,0.5
But...,（マリエール）せやけど…,Spring ...,0.3333333333333333
And their attacks will be more sporadic \Nand more easily defended.,"ならば仕掛ける
そういうこと","Will be
That kind of thing",0.13333333333333333
"Honestly, it isn't a bad strategy.","それほど統率のとれた
連中じゃないから","That's why
Because it is not a good",0.2
It's going to be a long night.,長い夜になりそうだ,It seems to be a long night,0.6
Yeah.,（トウヤ）うん,Yeah,0.5
What? We haven't even finished \Ndiscussing things here.,（ミチタカ）おいおい―,Hoki-,0.0
"If you were actually there, seeing it,","（クラスティ）
現場を目の当たりにすれば",If you look at the field,0.16666666666666666
We must quickly come to a consensus \Nbefore the next full conference.,"次の全体会議に向けて
こちらも決断を急ぐ必要があります","Toward the next overall meeting
This also needs to get rushed",0.14285714285714285
A plot?,（セルジアッド）謀略？,?,0.3333333333333333
You're saying the goblin attack \Nis an adventurer plot?,"このゴブリンの襲撃が冒険者たちの
謀略によるものだと言うのか？","This goblin attack is an adventurer
Do you say that it is a strategy?",0.3157894736842105
Though I think calling it a plot \Nis a rather drastic leap...,"謀略というのは
いささか 飛躍が過ぎるような…","It is
It seems that there is too much leap ...",0.16666666666666666
"Baron Krendit,","（カシワザキ）
クレンディット男爵",Crenditit Baron,0.25
"right now, it's important that no \None withhold their thoughts.","忌憚(きたん)ない意見を交わすのが
今は大事","I will exchange opinions that do not
Now",0.10526315789473684
"To be honest, I don't expect \NChoushu to last for long.","チョウシの街は
長くはもたぬだろう","The city of Chokushi is
It will be long for a long time",0.13636363636363635
Or possibly...,（キリヴァ）んん…,...,0.3333333333333333
Maihama?,何だよ？,What?,0.3333333333333333
Are they still having their little secret meeting?,"向こうはまだ
コソコソやってるってのか？","The other side is still
Are you doing kosokoso?",0.1875
It's probably about something they \Nreally don't want us to hear.,"よほど こちらに
聞かれたくない話でも―","Well, here
Even if you don't want to be heard-",0.18181818181818182
and they have to consider their pride.,そして プライドもある,And there is also pride,0.18181818181818182
The first group they're likely to turn to is...,まず 彼らが,First of all they,0.16666666666666666
The Izumo Knights.,"理由は皆目分からぬが
イズモ騎士団は","The reason is that everyone is
Izumo Knights",0.375
"Then, as we thought...","期待を寄せる相手といえば…
（シロエ）ええ","Speaking of expectations ...
 yeah",0.1
And they found no corpses or signs of combat.,"死体 あるいは戦闘の痕跡なども
一切 発見されていないという","Traces of corpses or combat
It is said that nothing has been discovered",0.21052631578947367
It's as if they've been spirited away.,"彼らが居城として使っていた
いくつかの城塞は―","They used as a castle
Some Citadel -",0.125
Th-Then our only hope is for all the lords \Nto unite and attack the goblins...,"（キリヴァ）こ… こうなれば
すべての領主が一致協力して―","...
All lords co-operate-",0.1875
surrounding them is the most feasible plan.,"一番 実現可能な策は
包囲作戦でしょう","The most feasible measures
It will be a siege operation",0.2
"We force them to lay siege to \Na well-defended stronghold city,","防御を固めた
城塞都市が抵抗し","I fixed defense
Citaining city resists",0.0625
You aren't...,き… 貴公ら,... ら,0.2
"No, no one's saying that.",と言っているように聞こえますな,I hear it like saying,0.09090909090909091
I won't let Tsukuba be sacrificed!,"我がツクバが
犠牲となってたまるものか！","My Tsukuba
Is it sacrificed?",0.16666666666666666
"Calm down, Lord Kiliva.","（セルジアッド）
落ち着きなさい キリヴァ侯",Rettome Kiriva Dae,0.0
Let's take a break.,しばし休憩をしよう,Let's take a break,0.8333333333333334
They're approaching!,（ミノリ）あっ！,!,0.25
Two platoons.,"２小隊！
おそらく10匹程度","Two small corpses!
Perhaps about 10 animals",0.1
"Five,",（ミノリ）５ ４ ３―,5 4 3-,0.0
Zero!,（トウヤ）わっ とっとっ！,Wow!,0.3333333333333333
Willow Spirits!,ウィロースピリッツ,Willow Spirits,0.6666666666666666
I've rooted them!,足止めしました！,I stopped!,0.3333333333333333
Here I go.,（ルンデルハウス）分かった,I understood,0.2
Icicle Blade!,"いくぞ！
アイシクルブレイド！","let's go!
Issike Blade!",0.2857142857142857
I'll back you up for thirty seconds.,30秒だけ援護する,For 30 seconds,0.2
Second wave at two o'clock.,（ミノリ）第２波 前方右！,The second wave forward right!,0.2
Flare Arrow!,フレアアロー！,Flare arrow!,1.0
Maestro Echo!,マエストロエコー！,Maestro echo!,1.0
"Wonderful, Miss Isuzu.","ワンダフルだ ミス五十鈴
（五十鈴）いいから―","Wonderful Miss 5th bell
 because it is good-",0.18181818181818182
Seconds Left,（ルンデルハウス）任せたまえ,left behind,0.3333333333333333
"Once your cool down finishes, attack again!","リキャスト･タイムが終わったら
すぐに攻撃！","When the recast time is over
Attack soon!",0.125
If they aren't able to rely on the Izumo Knights...,"もし向こうが イズモ騎士団に
頼れない状況だとしたら…","Both is the Izumo Knights
If it is a situation that can not be relied ...",0.22727272727272727
"As long as we're here, in this world,","ボクたちが
この世界で生きているかぎり","Boku
As long as living in this world",0.45454545454545453
we won't be able to avoid fighting in its wars.,"いずれ戦いに巻き込まれるのは
避けられないでしょう","It is hard to get involved in the battle
It will not be avoided",0.13636363636363635
But it wouldn't be a good idea for either side,こっちしかないだろうな,It will only be here,0.14285714285714285
to hand over its soldiers easily.,"しかし だからといって
安易に兵力を提供するのは","But saying
It is easy to provide soldiers",0.15384615384615385
"Yes, and for that, I'd like us to \Nagree on something in advance.","あらかじめ
申し合わせておきたいのですが","in advance
I would like to ask",0.2777777777777778
Another of your plans?,おっ 得意の策略か？,Omnortic tricks?,0.14285714285714285
It's nothing that special.,"筋を通しておく必要がある
ということですね","Need to go through
It is that",0.18181818181818182
I think we three should decide \Nour roles in advance.,"事前に ボクたち３人の役割を
決めておく必要があると思うんです","The role of three people in advance
I think it is necessary to decide",0.3157894736842105
The goblin attack...,（レイネシア）ゴブリンの襲来,Goblin's attack,0.4
How intense will the fighting be?,"どれほどの激しい戦と
なるのでしょう","How intense war
Will be",0.5
It'll have to be Tsukuba.,村落や田畑の被害では済まぬぞ,It is not possible to damage villages and Tabata,0.14285714285714285
But who will tell Lord Kiliva?,"（カシワザキ）しかし
誰がキリヴァ侯に それを","But
Who is it on Kiriva",0.18181818181818182
"In the worst case, most of the population.",最悪 住人の大半も…,Most of the worst residents ...,0.36363636363636365
I'm sure everyone is thinking \Nin the back of their minds,皆 腹の中では考えているはずだ,Everyone should be thinking in the belly,0.1875
"Yes... If they die, they return to life.","ええ 死しても
また よみがえる者たちです","Even if you die
He is also a person who looks like",0.1
"And they cannot learn that the Izumo \NKnights are gone, no matter what.","だから
こちらの弱みを見せず―","that's why
Do not show this weakness-",0.09090909090909091
"Ultimately, we know nothing about them.",絶対に知られてはならぬ,Never know,0.1111111111111111
"We need them to be our shield, \Neven if it means lying to them.","だましてでも 我らの盾に
なってもらわねば","Even if it is
If you do",0.1111111111111111
They've finally called us?,"（ミチタカ）ようやく
お呼びがかかったか","finally
Was it called?",0.375
"I hear the West Wind Brigade has arrived, too.","（クラスティ）西風(にしかぜ)の旅団も
こちらに到着したそうですね","Nishi-style brigade
It seems that I arrived here",0.1875
"Yes, they just contacted me.","ええ
さっき連絡があったんですけど","Yes
There was a contact",0.09090909090909091
They'll have to wait until the conference ends...,"（シロエ）会議の間 ちょっと
待ってもらうしかないかなあ","a little while the meeting
I wonder if I have to wait",0.23529411764705882
"Well, if it isn't...","（シロエ）あっ
（クラスティ）これは…",This is ...,0.25
Is something wrong?,（レイネシア）え？,?,0.25
I'd imagined you'd be asleep in \Nyour soft bed at this hour.,"（クラスティ）柔らかなベッドが
恋しい時間だとばかり","Soft bed
It is only a time I miss",0.15
It's true that you may,それはご無礼を,That's not good,0.25
"see me as nothing but a lazy, cowardly girl.","私が 怠惰で臆病なだけの
小娘に見えているのかもしれません","I am lazy and cowardly
It may be visible to a small girl",0.2
But I am also a member of the duke's family.,"ですが私とて
公爵家の一員","But what
Part of the duke family",0.35714285714285715
Well?,で？,so?,0.3333333333333333
You seemed to have something you wanted to say.,"何か言いたいことでも
おありでしたかと","Even what you want to say
I wondered",0.23076923076923078
Yes.,ええ,Yes,0.5
That's all I wanted to say.,それを 言いたかっただけです,I just wanted to say that,0.5555555555555556
"Yes, we're all right.",（ミノリ）はい 大丈夫です,Yes is all right,0.375
I think we've wiped out all \Nthe enemies in this area.,"この辺りの敵は
せん滅できたと思いますので―","This enemy is
I think I was lost-",0.17647058823529413
We're resting now.,今は休憩を取っています,I'm taking a break now,0.1
You and Nyanta both be careful.,"直継さんもにゃん太(た)さんも
お気をつけて","Mr. Nya Nya 
be careful",0.2222222222222222
Mage's Gauntlets?,（ルンデルハウス）魔術師の籠手(こて)？,Magician's gossip ?,0.3333333333333333
Yes!,"はい ３キロ程度
了解です","Yes 3 kg
Confirmed",0.2
They're an item for magical attackers.,"魔法攻撃職専用の
マジックアイテムだそうです","Magical attack job dedicated
It seems to be a magic item",0.11764705882352941
But they're the first item we \Nacquired by working together.,"でも 力を合わせて手に入れた
初めてのアイテムですよ","But I got my power and got it
It is the first item",0.21052631578947367
Doesn't that make them an amazing treasure?,すっごい宝物だと思わない？,Don't you think it's a great treasure?,0.1875
"Yes, that's right.",ああ そのとおりさ,"Oh, that's right",0.5714285714285714
But what do we do with them?,あっ だけど どうする？,What do you do?,0.375
Um...,（一同）うん…,Yeah ...,0.3333333333333333
"You said it's an item for \Nmagical attackers, right?","（五十鈴）魔法攻撃職用の
アイテムだって言ったよね？","Magical attack
You said it was an item, right?",0.5333333333333333
Rudy's the only mage in our group.,"この中で魔術師は
ルディさんだけですし","In this, the magician
Ludi's only",0.3076923076923077
"Um, but something that important...","あっ いや
だがそんな大事なもの…","There
But that important thing ...",0.4444444444444444
"That isn't like you, Rudy!",そうですね,is that so,0.2222222222222222
B-But...,わあ…,Wow ...,0.3333333333333333
"Well, are you sure?",ん？ アハハッ,Yeah?Hahaha,0.125
"They look good on you, Rudy.",似合ってるよ ルディ,It looks good,0.1
Let's get going.,（ミノリ）そろそろ出発しましょう,Let's leave soon,0.2857142857142857
I swear by these gauntlets that \NI'll defeat even more next time.,次はもっと 倒してみせる,Next time you defeat more,0.26666666666666666
Don't get too fired up.,（五十鈴）あまり張り切りすぎても,Even if too much tight,0.09090909090909091
What? Is it bad to be fired up?,"何だ？
張り切ってはいけないか？","What?
Could you do it?",0.25
"No, let's do our best!",（五十鈴）ううん 頑張ろう,Let's do our best,0.625
that in this emergency situation...,"火急の事態として…
（ミチタカ）おい",As a cramped situation ...,0.2222222222222222
"Hey, we aren't getting anywhere.","目下 我らが自由都市同盟
イースタルにおきましては―","Capload We are free urban alliance
In Easterns-",0.14285714285714285
"We both want more information about what \Nthe other's thinking, to gain an advantage.","会議を有利に進めたいのは
どちらも同じ","I want to advance the meeting advantageously
Both are the same",0.125
So we'll go with the plan.,話が全然 進まないぞ,The story does not go at all,0.15384615384615385
"I'll talk about agreeing to send troops, \Nto try and gain information.","たぶん こちらから切り出すのを
待っているのでしょう","Maybe I'll cut out from here
I'm waiting",0.09090909090909091
"If this is how they want to play it, \Nthere's no need to hold back.","（シロエ）向こうもその気なら
遠慮する必要はない","if it is also
There is no need to do it",0.3
"If anyone knows the status of the \NIzumo Knights, please tell me.","イズモ騎士団の動静をご存じの方は
お教え願いたい","If you know the movement of the Izumo Knights
I want to teach me",0.23809523809523808
"Oh, that's even worse than I expected.","（シロエ）うわっ
予想以上だな この反応","Wow
This reaction is more than expected",0.13333333333333333
"It seems clear that, for some reason, \Nthe Izumo Knights won't be coming.","やはり イズモ騎士団が
何らかの理由で動けないのは","After all the Izumo Knights
I can not move for some reason",0.21739130434782608
I would rather ask the Akihabara Round Table.,"それよりも
アキバの円卓会議殿に尋ねる","It
Ask the Round Test of Akiba",0.23076923076923078
"With Akihabara in danger, why do you not rise?","何ゆえ ヤマトの危機に
立ち上がらないのですか","In the crisis of Yamato
Do you not stand up",0.23529411764705882
W-Well...,そ… それは,So ... it is,0.2
I'd thought the purpose of this \Nconference was to hear,"我ら アキバの意見を聞くための
会議だったのですか？","To hear the opinion of Akiba
Was it a meeting?",0.29411764705882354
I-I'd heard the Akihabara knights \Nwere unmatched in combat...,"ア… アキバの街の騎士団は
東西不敗と聞きます","A ... Knights in the city of Akiba
I heard that the east and west failure",0.23809523809523808
"If you're using ""knights"" to mean a \Nstanding force, ready for battle,","という意味で 騎士団と
仰せられたのであれば","With the Knights
If you were saying",0.15
Then what are you adventurers good for?,"それでは一体
何のための冒険者ですか？","Then it is one
What is an adventurer for what?",0.3076923076923077
What does that mean?,それはどういう意味ですか？,What does that mean?,1.0
You have a duty to save the land!,大地を救う義務があるはずだ！,There should be no obligation to save the earth!,0.26666666666666666
You should be ashamed!,恥を知れ！,shame on you!,0.2857142857142857
Shut up!,違うか！,Different!,0.25
"First off, we are not citizens \Nof the Freedom Cities!",（ミチタカ）まず第一に―,"First of all, first-",0.13333333333333333
That's why we weren't summoned \Nto the conference before.,"だから この集まりに先んじて
行われた会議にも 呼ばれなかった","So before this gathering
It was not called to the meeting",0.09523809523809523
"I don't know what plot you've devised,","いかなる謀議が
謀られていたかは知らんが―","No matter what
I do not know if it was trembled-",0.23529411764705882
but we have no obligation \Nto accede to your demands.,"そのような要請に
従う義務があるとでも？","Such a request
Even if there is a obligation to follow?",0.1
"Don't you agree, Baron Krendit?!","いかがお考えか
クレンディット男爵！","How is it?
Crenditit Baron!",0.23076923076923078
Th-That isn't...,一切ないわけであり…,There is no one ...,0.2857142857142857
"that Akihabara send troops, not the will \Nof the League of Freedom Cities?","アキバの街に 出兵を求める
などという事実は","Find troops in Akiba's city
The fact of",0.15
Are you saying that I'm acting \Nfor my own benefit here?!,"独断で ことを進めたと
おっしゃるおつもりか","When I proceeded with
Thank you",0.1111111111111111
It is not the will of the entire League.,"キリヴァ侯爵の独断であり
自由都市同盟の総意ではない","Kiriba 独 独
It is not the consensus of the free urban alliance",0.3333333333333333
But it's also true that many of us \Nwithin the League feel that way.,少なからず聞こえたことも事実,It is also a fact that I could hear little,0.13636363636363635
"Or will the proud, mighty warriors of Akihabara","それともアキバの街の
誉れ高き最高権力は","Or the city of Akiba
Presidential highest power",0.21428571428571427
"""You guys are immortal, so go \Nand kill the goblins for us""?","お前たちは死なぬのだから
ゴブリンを掃除してこいだ？","Because you don't die
Do you clean the goblin?",0.13636363636363635
"Anyone who believed that, and sent \Ntheir comrades to the battlefield","同胞を
戦場に駆り立てるような者が―","Sacrifice
Person who drives the battlefield-",0.125
could never gain the people of Akihabara's trust!,"アキバの民の信任なんて
得られるわけがねえだろうが！","Akiba's trust
It would be nice if you get!",0.16666666666666666
Was that too much?,やりすぎたか？,Was it too much?,0.6666666666666666
And it's your job to oppose sending troops.,"ミチタカさんじゃなくても
怒って当然だし―","Even if it is not Michitaka
It is natural to get angry-",0.1111111111111111
"Yeah, that may have been a bit much.","（シロエ）冒険者にも
記憶がなくなるというリスクがある","Adventurer
There is a risk that there is no memory",0.125
Lenessia...,だけど… 確かにちょっと,But ... surely a little,0.16666666666666666
What... What am I doing?,私は一体 何を…,What is one?,0.25
You're looking as beautiful as ever.,これは相変わらずお美しい,This is still beautiful,0.1
"Like a fairy on a lake, on a moonlit night.",まるで月夜の湖の妖精,It is full of lake lake fairy,0.15384615384615385
I want to put on my flannel \Npajamas and go to bed...,"ああ ネルのパジャマで
ベッドに入りたい","Oh in pajamas of Nell
I want to enter the bed",0.21052631578947367
I want to put my face down on \Na cold table and lie there.,"冷たいテーブルに顔をつけて
もたれていたい","Apply a face to a cold table
I want to lean",0.3333333333333333
Are you not slacking off today?,"（クラスティ）今日は
なまけの虫は いないのですか？","Today
Isn't it a bad insect?",0.15384615384615385
Did I imagine that?,（レイネシア）はっ そら耳？,Your ear ear?,0.14285714285714285
"Of course I want to slack off, but...","もちろん なまけていたいですとも
だけど…","Of course I would like to have something
However…",0.26666666666666666
Sir Crusty...,クラスティ様,Clasti,0.0
"Yes, Princess Lenessia?","あっ はい
レイネシア姫","Yes
Princess Reinesia",0.3333333333333333
To raise an army of volunteers.,"（レイネシア）これから
アキバの街へ向かいます","From now on
Go to the city of Akiba",0.14285714285714285
Impossible... What can a single woman do?,"（クラスティ）
アキバの街へ何のために？",What for the city of Akiba?,0.14285714285714285
Speaking to a foreign band of \Nknights without permission?,"（クレンディット）許可も受けず
よその騎士団に直接？","Not received permission
Directly to the Knights?",0.2
"No, the Round Table's representative \Nis going with her...","（カシワザキ）
いや 円卓会議の代表が―",There is a representative of a round table meeting-,0.17647058823529413
Then why?,"では なぜ
そのようなことを","So why
Such things",0.16666666666666666
"I'm just a stupid girl, so I don't \Nreally understand politics.","私は愚かな女に
すぎませんから","I am a stupid woman
Because",0.17647058823529413
"But I think that when you ask \Nsomeone for something,","ただ 人様に
何事かお願いする時は","Just
When asking if you ask",0.21428571428571427
you should show respect.,"隠し事もするべきではないと
考えます","If you should not hide
think",0.2222222222222222
"As a member of the duke's family,","公爵家の一員として
父からも祖父からも教わりました","As a member of the duke family
My father also taught from my grandfather",0.4666666666666667
That's why,だからこそ―,That's why,1.0
I don't think we should be \Nhiding things from you.,礼節を尽くすべきだと,I should do my best,0.21428571428571427
She's told them our secret!,"（タイハク）
機密を漏らすとは！",Leaking sensitive!,0.1111111111111111
"When I take responsibility, apologize with me.","責任を取る時は
一緒に謝ってください","When taking responsibility
Please apologize together",0.25
"And, exactly what are you planning?","それで？
何を考えているんです？","So?
What are you thinking about?",0.36363636363636365
I see there are things even you don't know.,"（レイネシア）クラスティ様にも
分からないことはあるのですね","Also like cluster
There is something I do not know",0.23529411764705882
Nothing.,ええ 何も,Yes nothing,0.3333333333333333
I don't have any plan at all.,"何にも考えてはいません
ただ―","I do not think anything
However-",0.15384615384615385
"As a member of the Cowen family, \NI do not wish to be insulting.","私はコーウェン家に連なる者として
礼は失したくないのです","I am a party to Kawen
I do not want to lose thanks",0.17391304347826086
Grandfather...,（レイネシア）んっ…,...,0.5
Continue.,続けなさい,Continue,0.5
Adventurers are free.,冒険者は自由です,Adventurer is free,0.16666666666666666
They are more free than we are.,"私たちよりも
自由な人間なのです","More than us
It is a free human",0.25
It's true that we may be weaker than they are.,"私たちは確かに 冒険者より
弱いかもしれませんが―","We certainly from the adventurer
It may be weak-",0.23529411764705882
"But that doesn't mean that, in our weakness, \Nwe can become aggressive.","だからといって その弱さに
居直ってよいわけがない","That's why the weakness
I can not wait",0.15
We don't have the right to take advantage,"かの方々を 道具のように使う
権利などありますまい","Use the people like a tool
There is a right to",0.1875
"I shall go to Akihabara, and ask \Nthe adventurers directly.",私はアキバの街へ行って,I went to Akiba city,0.13333333333333333
"So if any of them will agree to help us,","もし 応えてくれる
冒険者の方がいれば","I will respond
If there is an adventurer",0.11764705882352941
