en_text,jp_text,google_translated,score
I shall find even ten or fifteen \Nthat will agree to help us.,"力を貸してくれる方を
見つけに行きます","Those who lend power
I will go to find",0.21052631578947367
I learned from my grandfather \Nthat showing respect,私は祖父に教わりました,I taught my grandfather,0.3333333333333333
"I'll go there myself, to stand in the street,",直接出向き 街路に立って,Standing in the direct tour street,0.21428571428571427
and speak to each adventurer individually!,"冒険者の方々 一人一人に
懇願するつもりでいます！","Adventurers alone
I'm going to be aware!",0.14285714285714285
Princess Lenessia!,（シロエ）レイネシア姫,Reynesian princess,0.25
It's fine.,"最終決定は
クラスティさんの役割です","Final decision
It is a cluster's role",0.2
Can I leave the rest of this to you?,あとは任せてもいいかい？,Can I leave it later?,0.3333333333333333
I couldn't. That would be a waste.,"お断りします
そんな もったいない","I refuse
Such a waste",0.2727272727272727
So what will you do?,それで どうします？,So what do you do?,0.8333333333333334
"Will you accept her resolve, or not?","（シロエ）姫君の覚悟を
受け止めるか否か","Princess of Princess
Whether to accept or not",0.23076923076923078
A bird?,（トウヤ）鳥か…,Bird ...,0.25
It's scary out here at night.,"（トウヤ）
戦闘になったら もっと怖い","If you become a battle, it's more scary",0.2
We've only defeated a tiny \Npercentage of the goblins.,"（ミノリ）確かに 自分たちが
倒したゴブリンは 全体のごく一部","Certainly we
Gobrin defeated is one part of the whole",0.23529411764705882
You can trip on roots and soft ground.,"根っこや柔らかい土に
足が取られるし","Root and soft soil
Foot is taken",0.14285714285714285
I'm always anxious because I never know \Nwhen the enemy will appear.,"（セララ）いつ敵が現れるかって
ドキドキしっぱなしです","When and when the enemy appears
I'm sorry I'm sorry",0.23529411764705882
Like for the scent of the monsters.,モンスターのにおいもさ,The smell of monsters,0.375
I hate that scent.,助けたっていいんだ,I hope I helped,0.14285714285714285
"Yeah, it's just fine!",うん それでいいんだよね,"Yeah, it's fine",0.7142857142857143
"Yes, of course.",ああ もちろんだとも,"Oh, of course",0.5
"If you'd leave behind people in trouble, \Nhow can you be an adventurer?",何が冒険者か,What is an adventurer?,0.17647058823529413
That's right...,（ミノリ）そうなんだ,That's right,0.75
We'll all protect the people we care about.,みんな 守りたい人を守る,Protect people who want to protect,0.16666666666666666
That's all there is to it.,"余計なことなんて
考える必要ない","It is extra
There is no need to think",0.3333333333333333
"And as a shrine priestess,","そして カンナギである
私の仕事は―","And it is a candy
My job-",0.18181818181818182
I've never seen Crusty looking like that.,"クラスティさんのあんな顔
初めて見たよ","Cluster's like face
I saw for the first time",0.11764705882352941
He was totally overwhelmed.,あれ 完全に押されてた,It was completely pushed,0.125
That princess impresses me.,"あのお姫様も
大したタマだよ","That princess too
It is a big deal",0.18181818181818182
Respect?,（アカツキ）礼節？,Cooking?,0.3333333333333333
"Even if the Round Table promised to send troops,","（シロエ）うん もし円卓会議が
派兵を約束したとしても―","Yeah, a round table
Even if you promise a distributor-",0.3333333333333333
"Because, as she said, adventurers are free.","彼女の言うとおり
冒険者は自由だから","As you say
Because adventurer is freedom",0.14285714285714285
And she seemed to understand that perfectly.,"そして そのことを
百も承知というように―","And that
As a hundred understanding-",0.16666666666666666
"But in a way, isn't that obvious?","ある意味
当たり前のことではないのか？","In a sense
Isn't it natural?",0.38461538461538464
"Yes, you're right.","彼女は 自分たちが
礼を尽くすべきだと言い切った","Shethemselves
You shouldtryherbowshewastakento say",0.1111111111111111
But everyone there was about to ignore it.,"あの会議の場にいた みんなが
脇に置こうとしていた","Everyone who was in the place of that meeting
I was trying to put it aside",0.2
Including us.,ボクたちも含めて,Bokes including,0.25
What's that light?,あの明かりは？,What is the light?,0.42857142857142855
The city of Akihabara.,（クラスティ）アキバの街です,It is a city of Akiba,0.2222222222222222
It's night...,うっ…,Uey ...,0.2
She may be the one who saves the Freedom \NCities of Eastal from the dead end,"彼女が救うことに
なるかもしれない","As she saves
May be",0.26666666666666666
in which they've found themselves.,"（シロエ）今回の件で
行き止まりにはまり込んでいた―","In this case
I was in a retention time-",0.07142857142857142
"That lazy, cowardly princess...",怠惰で臆病な姫君が,Lazy and timid princess,0.25
She finds herself in a town she doesn't know,"（アカツキ）
たどり着いた知らない街",A city that I do not know,0.14285714285714285
"things she's never heard,","見たことのないもの
聞いたこともないもの―","I have never seen
I have never heard of",0.2
and people she's never met.,会ったこともない人々,People who have never met,0.3333333333333333
"She learns how big the world is, \Nand how tiny she is.","世界の広さを知り
自分の小ささを知る少女","Know the world's size
Girl who knows his smallness",0.10526315789473684
And her words drive the adventurers to action.,"そして その言葉が
冒険者たちを動かす","And that word
Move adventurers",0.16666666666666666
Next time: Expeditionary Force.,次回「遠征軍」,"Next time ""Expedition Forces""",0.2
Always look thirty seconds ahead.,"（シロエ）
見つめるのは 30秒先の未来",30 seconds ahead to be stamped,0.2
