en_text,jp_text,google_translated,score,semantic_score
Why do you always insist on doing this?,"入間様
（入間）ん？","Vibration
?",0.1,-0.0019741969
"The situation with \NKiriwo-senpai involves you,","いつもいつも
まったく お前というヤツは","Always, always
The guy who is totally",0.16666666666666666,0.11615176
so I won't prod for answers.,詳しくは お聞きしません,I will not ask for more details,0.15384615384615385,0.36842847
But please don't hesitate to tell us\N if there's anything we can do for you.,"ですが 我々にできることがあれば
何でもお申しつけください","But if we can do what we can do
Please give me anything",0.35,0.55080676
You guys...,ウフフ…,Uhufu ...,0.25,0.4016112
"I know that's what I wanted \Nat one point, but...","それは僕が
望んでたもののはずだけど…","That is me
It should be what I want ...",0.2222222222222222,0.4377898
"Okay, let's get back to class.",さあ　教室に戻ろうよ,Come back to the classroom,0.16666666666666666,0.57747895
Yay!,"（アスモデウス）はい
（クララ）わーい",Yes,0.0,0.391285
I'm going to make sure they \Ndon't find out I'm human.,"人間ってことを
絶対 バレないようにしよう","Human being
Don't bother",0.125,0.40254003
We are su-ki-ma!,♪ 我らはスキ魔,♪ We are ski,0.3333333333333333,0.4461823
You've got it all wrong!,違うんです,It is different,0.1111111111111111,0.1921525
I just wanted a lovely picture \Nof Iruma-san as he was eating!,"ご飯を食べる すてきな入間さんの
写真が欲しかっただけで…","Sunny Irumae eating rice
Just wanted a photo ...",0.2222222222222222,0.7311023
And he's just so kind!,偉大なほど お優しいのだ,Great and more kind,0.2222222222222222,0.44227648
It's rare to see Azz-kun \Ntalking to a girl...,"（入間）アズ君が
女の子としゃべってるの 珍しい","Azko
It is rare for girls and talking",0.125,0.65199393
"Congratulations on winning the Tricky Award \Nand ranking up, Iruma-sama!","（アスモデウス）
トリッキーで賞 受賞",Award winning with tricky,0.2307692307692308,0.5515588
"Next time on Welcome to Demon School! Iruma-kun,",次回「魔入りました！　入間くん」,"Next time ""I made a magical! Iruma-kun""",0.25,0.67058593
"""Dem-dol Kuromu-chan.""",“アクドルくろむちゃん！”,"""Akdle Kuromu-chan!""",0.42857142857142855,0.70236194
"A dem-dol concert? But of course I'll go \Nif you're going, Iruma-sama!","もちろん　入間様が
行かれるのであれば―","Of course I'm going to
If you go-",0.2380952380952381,0.46399698
"I, Asmodeus Alice, will follow you \Nto the ends of the netherworld!","このアスモデウス･アリス
魔界の果てまでお供いたします！","This As Modeus Alice
We offer to the end of the devil!",0.19047619047619047,0.57555944
