en_text,jp_text,google_translated,score
I'm shivering.,卑怯ですわね,I'm welcome,0.4
"Is that acceptable, Gruier?",グリューエル いいわね？,"Growel nice, right?",0.2222222222222222
It's cowardly.,かあっこいいー　ぞくぞくっ！,It's a good thing!,0.25
Leave it to me!,任せて！,Leave it to me!,1.0
C.M.S. C.M.A. O.P.R. Into the space,(C.M.S.C.M.A.O.P.R. Into the space),C. m.s.c. M.A.O.P.R. INTO THE SPACE),0.36363636363636365
"Welcome glory, let's breakthrough and fly out now, let's go!","ようこそ 栄光 突破口
いま飛びだすんだ Let's Go","Welcome glory breakthrough
I'm going to fly now Let's Go",0.5
"history that's to be known, regardless of time. Fly towards a destined future.","時こえ知るべき歴史
あるべき未来へ向かい Fly","History to know
Go to the future that should be fly",0.3
Just a fossil if you give up a miracle. Your decision is your best choice.,"奇跡あきらめたら化石
決断は自分の選んだベスト","A miracle giving up fossils
The decision is your choice",0.4117647058823529
"There's another, unknown, me hiding in my heart.",私の中に 知らない私が 隠れているんだ,I do not know in me I'm hiding,0.1875
How far?,何処まで,How much,0.25
"Go, go, go, go, ring a bell! Go, go, ring, ring a bell!",無限の次元へ疾走 さあ速攻で超えてこう,Go to infinite dimensions,0.1111111111111111
Until the end.,果てまで,To the end,0.4
You're lost and missing.,君が行方不明,You are missing,0.2857142857142857
We're lost without a hope of any shelter.,"AH まだ旅にも出ていないのに
私たち迷子なんて","AH yet I'm not on a journey
We get lost",0.16666666666666666
But why? What did we do? What did we do?,"どうしてなの どうしてなの
どうすればいい？","Why is it?
What should I do?",0.36363636363636365
"So no matter where we go, as far as it takes","でもこの世界 生まれた限り
イノチをつかうことが使命ならば","But as far as this world is born
If it is a mission to use innochi",0.13636363636363635
we'll always believe in ourselves.,"どうしても どうしても どこまでゆく
自分信じて","Why should I do everything
Believe in",0.16666666666666666
and impossible amounts of light \Nand shockwaves rock the ship.,"時空震が襲い ありえないほどの
輝きと衝撃が船を翻弄する","The space-time earthquake can not attack
Shine and shock will make the ship",0.15
A pirate's weapons are their own skills \Nand their captain's decisions.,海賊の武器は その腕と船長の決断,Pirate weapons make their arms and captain,0.26666666666666666
"As the ghost ship appears, two princesses face off.","宇宙を切り裂き出現した幽霊船を前に
２人の王女が対決する","Prior to the ghost ship that cut and appears the universe
Two princesses confront",0.3333333333333333
"Next time, on Bodacious Space Pirates:","次回 モーレツ宇宙海賊
「閃光の彷徨者（ワンダラー）」","Next Moret Space Pirate
""Flaxes of flash """,0.13333333333333333
Look forward to it.,お楽しみに,looking forward to,0.3333333333333333
