en_text,jp_text,google_translated,score
I'll simply be born again.,大丈夫　心配せずとも私はまた生まれる,"Even if you don't worry, I will be born again",0.26666666666666666
This'll be pointless if you die!,ふざけんな　お前が死んだら意味ねぇんだよ,It is meaningful if you die,0.2727272727272727
I wanna help you. And not 'cause my old man told me to!,親父に言われたからじゃねぇ,It's because I was told by my father,0.13636363636363635
It's not like that.,そういうわけじゃない　ただ私は代替りが利くから,"That's not that, I'm sorry",0.3
"What about you, personally?!",お前自身はどうなんだ,What is yourself,0.1111111111111111
Is that really what you want— what you yourself want?,本当にそれがお前の　今のお前の意志か,Really it is your current will,0.15384615384615385
Isn't there anyone you'll miss?,もう一度　会いたい奴はいねぇのか,What a guy who wants to meet again?,0.0625
Miss doing...,心残り…,regret…,0.0
suppose I'd like to eat another meal at the Olive Tavern.,私は…オリーブ軒の定食が食べたいかな,I want to eat the set meal of Olive,0.375
"Perfect! i, yato, have heard your wish and will grant it!",その願い　この夜ト神が聞き届けた,That wish I heard the night of the night,0.17647058823529413
You owe me five yen!,後で五円払えよ,You can pay five yen later,0.3333333333333333
Then don't give up just like that!,こんなところで諦めてんじゃねぇ,Don't give up in such a place,0.3076923076923077
"If there aren't any exits, make one!",出口がないなら造れ,If there is no exit,0.15384615384615385
Drill a hole out of the underworld!,黄泉に穴を穿て,Punch holes in yellow,0.0
That's insane.,バカなことを,An idiot,0.0
Don't blame me for whatever happens!,どうなっても知らんぞ,I know what happens,0.09090909090909091
As you wish!,風穴を開けろ,Open the wind hole,0.0
"Damn, he actually opened one!",マジで穴開けやがった,Seriously drilled,0.0
x,思ってたより晴れた空とあなたがそこにいた,Sunny sky and you were there,0.0
Practicing cat language. i'm gonna ask yato if i can have a cat someday!,俺いつか夜トに頼んで　猫飼おうと思ってるんだ,I'm thinking of going to a cat in some times,0.17391304347826086
"On the next Noragami Aragoto: ""Revival.""",次回　ノラガミ　ARAGOTO,Next time Noragami Aragoto,0.2727272727272727
