en_text,jp_text,google_translated,score
Then it's roman numerals!,やっぱり！　ローマ数字か！ ローマ数字？,on second thoughts!Roman numerals!Roman numbers?,0.2727272727272727
"In roman numerals,",ローマ数字では　Ｍは１，０００　Ｄは５００ Ｃが１００で　Ｌが５０。,"In Roman numerals, M is 1,000 D of 500 C and L is 100.",0.26666666666666666
You're all right!,あなたたち　無事だったのね。,You were safe.,0.125
Yeah. We solved the puzzle.,ああ　パズルは解いた。 金庫室の暗証番号は　１６５５だ。,"Oh, the puzzle was solved.The security code in the safe room is 1655.",0.17647058823529413
This is his treasure...,これが　あの人の宝…。,This is the treasure of that person ....,0.4
The very last painting of the late master.,んっ？！ 旦那様がお描きになった→,?!My husband was drawn →,0.0
My husband...,あの人。,that person.,0.0
"In a tiny bistro in Paris, I was a waitress, and he was a customer.",パリの小さなビストロで　私は店員。 あの人は　お客。,At the small bistro of Paris I have a clerk.He is a customer.,0.3
He was poor and always ordered from our bargain menu.,いつもお金がなくて 一番安いメニューを頼んでた。,I always asked for the cheapest menu without money.,0.16666666666666666
He came every day.,それも　毎日。,It is also daily.,0.1111111111111111
"But once, he did not show up for several days.",なのに　そんな彼が　何日も 来ないことがあって。,"However, he may not come for many days.",0.375
"I was worried he might be sick,",具合でも悪いんじゃないかって 心配して→,"I'm not bad, I'm worried →",0.25
so I brought his favorite meal to his studio. And then...,いつものメニューを持って アトリエを訪ねてみたの。,I visited Atelier with my usual menu.,0.1111111111111111
"He was laughing like a mischevious child,  saying, ""I knew you'd come.""",「きっと　君は来るだろう」って イタズラ好きの子供みたいに笑ってた。,"""Surely you will come"" laughing like a child who likes miso.",0.4090909090909091
I was so shocked I forgot to be angry and fell in love.,もう　あきれすぎて 怒るのも忘れて…　恋に落ちた。,I also forgot to get angry too much ... I fell in love.,0.4444444444444444
The place where we were bound together.,彼と私が結ばれた思い出の場所。,Location of memories that he was tied.,0.06666666666666667
The number of memories.,思い出のナンバー。,Number of memories.,0.8
My youthful days... The days that have long passed.,若い頃の話よ。　昔々のお話。,A story about young.A long time ago.,0.125
"Kaito, Ana, you have done well.",カイト様　アナ様　お見事でした。,Kite-like Ana was a statement.,0.16666666666666666
"Even though I may be a Giver, I apologize for my rudeness.",ギヴァーの使命とはいえ　ご無礼 心より　おわび申し上げます。,Thank you very much for your giver mission.,0.15789473684210525
"I am glad the puzzle was solved, but nevertheless, poison gas?",でも　パズルが解けたから いいようなものの　毒ガスだなんて。,"But because the puzzle was solved, it is a poisonous gas of something like that.",0.30434782608695654
Who said anything about poison gas?,誰が毒ガスなどと申しました。 えっ？！,Who applying to the poison gas etc.eh?!,0.3333333333333333
It was mere stage smoke.,舞台用のスモークでございますよ。,It is smoke for the stage.,0.4444444444444444
The late master truly loved mischief.,なにせ　旦那様は　イタズラが 大好きでいらっしゃいましたから。,Nice Husuna I love misola.,0.08333333333333333
Your puzzle was really warm.,うっふ。 あんたのパズルは温かかった。,.Annual puzzle was warm.,0.5714285714285714
I see there are many kinds of Givers in the POG.,ＰＯＧにも いろんなギヴァーがいるんだな。,There are many Givers in POG.,0.5833333333333334
I merely built the puzzle as specified.,依頼人の望みどおりのパズルを→,The puzzle as desired for the client →,0.25
What's with that satisfied look on his face?,何？　あの充実しきった顔。,what?That fulfilling face.,0.3333333333333333
What are you two doing here?,あっ　お前ら　何やってんだ？ こんなとこで。,"Oh, what do you do?In this way.",0.21428571428571427
It has nothing to do with you.,カ　カイトには関係ないでしょ。 まあ　何もなかったみてえだな。,"It does not matter to the kaikite.Well, I didn't have anything.",0.15789473684210525
"So Nonoha, should I take you home?",そうだ　ノノハ　よかったら 俺が家まで送って…。,That's right Nonoha I send to my house ....,0.1111111111111111
I think... it was really fun!,とっても楽しかった！ ふ～ん！　カイトは？,It was very fun!Hmm!What is a kite?,0.26666666666666666
"Yeah, it's been a while since I felt this good.",ああ　久々に　いい気分だぜ。 ふっ　ふ～ん！,Oh I feel good after a long time.Fuchu!,0.15789473684210525
What should we do?,いかが　いたしましょう？,Let's go out?,0.1111111111111111
There's nothing to worry about.,慌てることはない。,I'm not going to get rid of it.,0.13333333333333333
I think we should go and visit him.,お手並み拝見と いこうじゃないか。,Do you want to see you alone?,0.0
"The time has come, Kaito.",いよいよだね　カイト。,It is finally kit.,0.09090909090909091
A-Ana... You're a guy?,あっ　あっ！ アッ　アナって　男の子？,!A boy and a boy?,0.2
Yeah. And puzzles are so much fun!,そうだよ。　それより　パズルって 面白い！　前言撤回！,that's right.She is more interesting to puzzles! I take it back!,0.1
I take back what I said earlier! you're a guy? seriously?,なっ…。 男って　マジかよ？！,....Man is serious?!,0.11764705882352941
I met lots of great people!,すてきな人に　いっぱい会えたし。 中でも　カイト！,I met a lot of people.Even in the kite!,0.3076923076923077
He's a he...,おっ　男。,Omo man.,0.0
