en_text,jp_text,google_translated,score,semantic_score
I will not!,"（キヨシ）
見せません！",I can not show it!,0.42857142857142855,0.33232763
"Okay, fine.","（キヨシ）
あ… はい","Oh, yes",0.16666666666666666,0.31149033
Huh? You mean it?,え… いいんですか？,Well ... is it good?,0.2222222222222222,0.22808069
I'm going to give you a taste of\N the humiliation that you gave me.,"私が味わった屈辱を
あんたにも味わわせてやる","Humiliation I tasted
I will taste my taste",0.16666666666666666,0.7240615
the sheets will get soaked.,"（花）
順番を変えるわ　時間ないし",I will change the order,0.2222222222222222,0.10319696
I don't give a damn.,私が先に ぶっかけてやる,I will do my best,0.2,0.23566651
Is she seriously planning on going through with this?!,"（花）
絶対に こっち見るんじゃないわよ",Absolutely she looks like this,0.14285714285714285,0.39167714
If you do...,見たら… 殺すから,If you look at ... because you kill,0.375,0.2751625
Excuse me!,失礼しま～す,Excuse me,0.6666666666666666,0.8765359
Isn't Kiyoshi-kun in here?,あっ ベッドで休んでるのかな,I wonder if there is a rest in bed,0.15384615384615385,0.16520312
Not good!,"（花とキヨシ）
マズい！",Masu!,0.25,0.29326293
If she...,"（キヨシ）
千代ちゃんに見られたら…",If you are seen by Chiyo ...,0.25,0.3670531
Excuse me...,"（千代）
失礼します",Excuse me,0.6666666666666666,0.7801754
Excuse me.,"（万里）
失礼します",Excuse me,0.6666666666666666,0.8863534
Is something the matter?,どうかされましたか？,is there something wrong?,0.42857142857142855,0.41729555
"Earlier, Joe, one of the prisoners, committed a violent act,","先ほど 囚人のジョーが
暴力事件を起こしたので","The prisoner's joe
Because I got a violence case",0.16666666666666666,0.6178798
so I'm reporting it.,"（着信音）
副会長が突き飛ばされ 私も…",Vice-President and I'm also missing ...,0.18181818181818185,0.1519426
Are you sure you're not blowing it a little bit out of...,"お前は物事を少し
大げさに言い過ぎるんじゃないか…","You are a little bit
It's too much to say ...",0.3888888888888889,0.41478872
Huh? He's not here.,あれ？ いないなあ…,that?Not ...,0.2222222222222222,0.22007321
we're too close...,近すぎる,Be too close,0.3333333333333333,0.5735462
Also...,この距離はマズい…,This distance is maze ...,0.16666666666666666,0.2172492
"Chiyo-chan, hurry up and get out of here!",千代ちゃん 早く行ってくれ～！,Chiyo-chan goes early!,0.16666666666666666,0.79370373
What is that?,何？ これ,what?this,0.4,0.46276608
Sorry... I'm really sorry...,"（花）
何か 当たってんだけど…",I'm hitting something ...,0.42857142857142855,0.24683404
Really... Really...,"（キヨシ）
本当に… 本当に…",Really ... really ...,1.0,1.0000001
And...,"（花）
どんどん…",More and more ...,0.6666666666666666,0.5589455
it's getting bigger!,大きくなってるんだけど！,I'm getting bigger!,0.42857142857142855,0.76098424
Maybe they already finished treating him.,"（千代）
もう 治療 終わっちゃったのかな？",Have you already been to treat?,0.07692307692307693,0.40386155
"Well, that's a good thing.",それなら いいけど,That's fine,0.2222222222222222,0.30873632
I really am sorry!,"（キヨシ）
本当に すいません！",I'm really sorry!,0.6666666666666666,0.9513613
It wasn't on purpose!,わざとじゃないんです,It is not a purpose,0.2222222222222222,0.4535116
"Of course, when the phone rings, you answer...","（理事長）
もちろん 電話が鳴れば取る…",Of course if the phone rang ...,0.4166666666666667,0.6492263
What?,何だ？ うん…,What?Yes…,0.6666666666666666,0.7145442
that!,"（受話器を置く音）
な！",!,0.5,0.5643931
Ah!,あっ！,Ah!,1.0,0.99999976
Don't get the wrong idea.,誤解するな,Do not misunderstand,0.1111111111111111,0.4596376
That is just a mouse...,それは ただのマウスパッ…,It's just a mouse ...,0.5,0.9520423
"My wrist has been sore lately, \Nand this supports it just right.","（理事長）
最近 手首を痛めてな",Recently hurt my wrist,0.125,0.6517129
"DTO, the Dog Transferal Operation—","（万里）
ＤＴＯ… 男子退学オペレーション",Dto ... Men's Domestic Operation,0.09090909090909093,0.525435
It appears we'll need to intensify our plans.,"この計画を
より強化する必要がありそうね","This plan
It will be necessary to strengthen more",0.1176470588235294,0.64486855
What's going on?!,"（シンゴ）
どうなってるんですか！",What is it?,0.25,0.24208029
"I distracted Joe, just like you told me to,","（シンゴ）
あんたに頼まれて
ジョーを呼び出したけど","Requested to
I called a jaw",0.14285714285714285,0.1628253
"It's almost like I set Joe up, isn't it?!","あれじゃ 俺がジョーを
はめたみたいじゃないですか！","That's why me
It looks like it looks like!",0.2352941176470588,0.2506683
Is that all?,"（芽衣子）
フンッ そんなことか",What is it?,0.3333333333333333,0.16860877
"If that's the kind of work you're going to make me do, then I...","あんな仕事をさせられるなら
俺は もう…","If you can make such a job
I already ...",0.21739130434782608,0.57731175
You... what?,何だ？,What?,0.5,0.6392191
"You don't seem to realize your position, do you?","（芽衣子）
ヤツらは どう思うだろうな？",What do you think she think?,0.2307692307692308,0.121974826
I can inform the other prisoners about you.,"ほかの囚人どもに
教えてやってもいいんだぞ","For other prisoners
I can tell me",0.3333333333333333,0.70107436
"Well, that's...","（シンゴ）
それは…",that is…,0.16666666666666666,0.41298786
Not to mention...,しかも…,And ...,0.2,0.5124832
"As long as you do as I say, I won't wrong you.","言うとおりにしているかぎり
悪いようにはせん","As long as you say
It's bad",0.2857142857142857,0.42332247
"Get back to work, now!",さっさと作業に戻れ,Return to work quickly,0.2222222222222222,0.5006846
"If you try something like you did yesterday again,\N you'll be expelled immediately.","昨日のようなことをしたら
今度こそ 即 退学だぞ","If you do something like yesterday
This time I'm out of school",0.21739130434782608,0.45535916
Are you okay?,ジョー君 大丈夫？,Joe You Are OK?,0.5,0.5065487
I've been eating three square meals.,３食 きっちり食ってた,I ate 3 meals,0.2,0.77353626
"And all of my dessert, too.",デザートも残さず,Do not leave dessert,0.09090909090909093,0.5162148
Joe looks surprisingly good.,"（キヨシ）
ジョー 割と元気そうだな",Jauce is likely to be well,0.0,0.40859208
"Oh, sorry.",あ… すいません,Oh ... I'm sorry,0.2857142857142857,0.6572397
It really must be because of what happened in the nurse's office.,何 ボーッとしてんのよ,What's wrong,0.13333333333333333,0.111783706
I remember everything up until when we got under the bed...,"（花）
ベッドの下に入ったあたりまでは
覚えてるんだけど…","Until the vicinity of the bed
I remember but ...",0.4,0.60998505
"Okay, five-minute break!","（芽衣子）
よし ５分間の休憩！",Good for 5 minutes!,0.1111111111111111,0.57747453
"Kiyoshi, grab the kettle for me.","（シンゴ）
キヨシ やかん取ってくれよ",Kiyoshi Kinken takes me,0.2,0.634054
Get it now.,早く取れよ,Get quickly,0.2,0.39062744
"Eh, whatever.","（キヨシ）
まあいいや…",whatever…,0.0,0.8051998
Get it yourself.,"（ジョー）
自分で取れよ",Get yourself,0.5,0.65362734
"What's with you all of a sudden, Joe?",何だよ ジョー お前 急に…,What is Joe Suddenly ...,0.14285714285714285,0.80651695
Huh?!,"（シンゴ）
ああ？",Ah?,0.25,0.6141791
Break's over! Back to work!,"（芽衣子）
休憩終了！ 作業再開！",Close a break!Resume work!,0.3,0.64702636
"Hey, Shingo, come over here.","（芽衣子）
おい シンゴ こっちへ来い",Hey Shingo come here,0.5714285714285714,0.9086626
I'm giving you a different job.,"お前には
別の仕事を与える","You
Give another job",0.2,0.7035956
Yes...,"（シンゴ）
チッ…",Chip ...,0.3333333333333333,0.22448345
Want some?,"（ジョー）
飲むか？",Do you drink?,0.16666666666666666,0.2881441
You saved me...,ありがとう,Thank you,0.2,0.19726802
I'd have been on my way to a real prison.,"キヨシが止めてくれなかったら
本物の刑務所に行くとこだった","If Kiyoshi did not stop
I went to a genuine prison",0.21052631578947367,0.51117265
"Nah, my body just moved on its own,","“ヤバい 止めなきゃ”って
体が勝手に動いただけさ","""If you're not good enough
I just moved my body",0.2352941176470588,0.40925518
"Sorry, you're right.","（キヨシ）
ジョー
お前が突っ込んだんじゃねえか","Jaw
You're going to stick",0.2,0.11787655
I don't know about that...,"（キヨシ）
そうかな…",I do not think so…,0.2,0.42565995
There was something weird \Nabout that whole lunch break.,"あの日の昼休みは
ちょっと様子が変だったんだ","The lunch break of that day is
A little bit was strange",0.2222222222222222,0.8333678
"The entire Underground Student Council was in the yard,","いつもはいない裏生徒会の人たちが
みんな 中庭にいたり","People who are always a student council
Everyone is in the courtyard",0.2352941176470588,0.56353545
Moreover?,"（シンゴ）
え？",picture?,0.3333333333333333,0.18183137
"I couldn't make them out all that clearly,","俺も はっきり
分かってるわけじゃないんだけど","I also clearly
I do not know",0.14285714285714285,0.27062416
This is... my uniform...,"（シンゴ）
これ… 俺の制服",This ... my uniform,0.8,0.91738755
I'm giving you permission to leave campus for the next two hours.,今から２時間 外出許可を与える,Give out for two hours from now,0.16666666666666666,0.44251913
"I'm saying, put on that uniform, go outside, and relax.","その制服を着て 外で
気晴らししてこいと言ってるんだ","Wear the uniform outside
I'm saying that I'm wondering",0.375,0.70070535
