en_text,jp_text,google_translated,score
That weapon has the power to destroy the balance of the world,あの兵器は 世界のバランスを崩し➡,That weapon breaks the balance of the world,0.5454545454545454
and lead it down the path of its own destruction.,崩壊へと導く力です｡➡,It is a force that leads to collapse. ➡,0.10526315789473684
I would like to go to the land of the gods.,私は 神の国に行きたい｡,I want to go to God's country.,0.2857142857142857
"Yeah, the old lady back in my village would talk about it all the time.",うん｡ 確か 里のばあちゃんが 昔 よく行ってたって｡,Yeah. I'm sure that the grandma of the village was in a long time ago.,0.23076923076923078
Then let us go to your village.,行こう ニーナの里へ｡,Go to Nina's village.,0.4
Your Highness.,≪報告に参りました｡,«I have a report.,0.125
We have not yet ascertained the whereabouts,脱獄したジャンヌ･ダルク➡,Janne d'Arc that jailbreak,0.0
"of the fugitives Jeanne D'Arc, Favaro Leone and Nina Drango.",ファバロ･レオーネ ニーナ･ドランゴの行方は➡,Favalo Leone Nina Drango's whereabouts,0.2
"We are interrogating Kaisar Lidfard harshly,",カイザル･リドファルドを 拷問にかけておりますが➡,Kaisal Lidofard is tortured but,0.0
but he has maintained his silence.,何も吐きません｡,I will not spit anything.,0.08333333333333333
"-I will leave the fugitives to you. -Yes, My Lord.",脱獄犯は お前たちに任せる｡,Jailbreak Office leave it to you.,0.26666666666666666
I will be heading to Eibos.,余は エイボスに向かう｡,Thoroughly heads to Avos.,0.2
Get up! You have a visitor.,≫面会だ 起きろ｡,»Close up.,0.2
It seems that I'm a real jailbird now.,牢獄生活が すっかり 板に付いてしまった｡,The prison life has grown on the board.,0.058823529411764705
An iron sword would suit you more than these iron bars.,鉄格子を握るより あなたには剣が似合いますよ｡,The sword looks better than you grab the grating.,0.25
How are the knights?,騎士団はどうだ？,How is the Knights?,0.6666666666666666
I suppose not much can be expected when their captain is imprisoned.,団長が捕まっていては どうもこうもないか｡,How do you think that the leader is caught?,0.045454545454545456
You are the captain!,あっ… 団長は あなたです｡,Oh ... The leader is you.,0.2
She hadn't changed.,あの方は 何も変わってはいなかった｡,That person did not change anything.,0.09090909090909091
The Orleans Knights will rise again.,オルレアン騎士団は必ず復活する｡,The Orleans Knights always resurrit.,0.4444444444444444
Yes. The three of us will return the knights to glory.,分かりました｡ ジャンヌ様と私と➡,I understand. Jeanne and me and me,0.0625
I see it! My house is right over there!,あそこ あそこ！ 私の家は あそこだよ｡,Over there!My house is her out of her.,0.42857142857142855
Hey!,お～い！ はははっ はははっ｡,Oh!Hahahahahahaha.,0.2
"Ow! Hey, you mean Sis, not Nina!",｢ニーナ｣じゃないでしょ｡ ニーナ！,"It is not ""Nina"". Nina!",0.21428571428571427
-Nina! How have you been? -Nina's back!,ニーナ｡ ニーナ｡,Nina.,0.0
"I don't know. But it's cute, isn't it?",分かんない｡ けど かわいいでしょ？,I do not know. But is it cute?,0.6923076923076923
"Is that you, Nina!",おかえりなさい ニーナ｡,Welcome to Nina.,0.1111111111111111
-I'm home! -I'm so glad you're home.,ただいま～｡ いらっしゃい｡,I'm sorry.,0.18181818181818182
"This is my friend, Jeanne.",あっ 私は…｡ 私の友達のジャンヌさんだよ｡,I am .... It's Mr. Jeanne of my friend.,0.2857142857142857
So that's what they're wearing in the capital nowadays.,王都では そういう服が はやっているのね｡,"In the kingdom, that clothes are doing.",0.23529411764705882
"Welcome back, Nina!",おかえり ニーナ！ ただいま～！,Welcome Nina!It's now!,0.375
"Welcome home, Nina!",おかえり ニーナ｡ ただいま！,Welcome Nina.,0.3333333333333333
"-Welcome back, Nina! -Thanks!",≫おかえり ニーナ｡ ただいま～！,»Welcome Nina. I am now!,0.16666666666666666
"Nina, welcome back!",ニーナ おかえり｡ たっだいま～！,Nina Welcome. I'm sorry!,0.3333333333333333
"Jeanne, hurry up!",ジャンヌさん 早く～！,Mr. Jeanne is early!,0.25
I'm going to leave you behind!,置いていきますよ～！,I will put it!,0.18181818181818182
This is our village elder.,里のばあちゃんです｡,It is a village's grandma.,0.3
What's wrong?,どうしたの？,What's wrong?,1.0
I am Jeanne D'Arc.,ジャンヌ… ダルクです｡,Jeanne ... Dulk.,0.2857142857142857
She's not a statue.,置物じゃないよ｡ うっ…｡,It's not a figurine. Uh ....,0.4
Nina! You've gotten thin.,ニーナ おめ 細くなったな｡➡,Nina is fine.,0.2222222222222222
"What happened? you know, this and that.",なじょした？ なんだかんだっす｡,Did you do it?Somehow.,0.21428571428571427
"Now, I know you've been there before, Granny.",ばあちゃん 神の国さ行ったことあんべ？,Big A-chan God's country I went to me?,0.05
Could you tell us how you got there?,行き方 教えてくんりょ｡,Tell me how to tell.,0.18181818181818182
"Please, Granny!",お願い ばあちゃん｡,Request Bae-chan.,0.0
"-No, thank you. -No, thank you.",飲むか？ ん？ いや… どうぞ｡,Do you drink?Yeah?No ... please.,0.16666666666666666
"Two thousand years ago, the gods and demons worked together",2000年前 神と悪魔は 力合わして➡,2000 years ago God and devil,0.21428571428571427
And so I took the tired gods,そんとき 力尽きた神々を背中に乗っけて➡,"Then, take the rid of the drone exhaustive gods",0.14285714285714285
and carried them to their homeland on my back.,神の国まで連れて帰ってやったんは わしなんじゃ｡,I went back to the country of God and I did it.,0.2222222222222222
Yeah! I love this story!,でた！ また その話だぎゃ｡,!He is also the story.,0.18181818181818182
Look at that.,あれを見ろ｡ ん？,Look at that?,0.6
That's what I looked like back then.,あれは あんときの わしの雄姿だべ｡➡,That's the male figure of the morning.,0.21428571428571427
"Pretty cool, right? I was a looker!",どや？ かっこいいやろ｡ ほれぼれするど？,Did you do?Cool Yoro. How to remove?,0.1111111111111111
"Granny, are you all right?",ばあちゃん 大丈夫か？,Is it okay?,0.1
There' s no way you could fit everyone on your little back.,この背中に乗れるわけねぇべ｡,You can get on this back.,0.23529411764705882
"-Pshaw! -Oh, she's mad!",もう知らね｡ あっ 怒った｡,I'm already knowing that I was angry.,0.0
I must go to the land of the gods.,どうしても 神の国へ行きたいのです｡➡,I really want to go to God's country.,0.2857142857142857
I implore your help.,何とぞ ご協力を｡,Somehow cooperation.,0.14285714285714285
-Granny! -I implore you!,ばあちゃん｡ 何とぞ｡,My grandma.,0.0
She fell asleep.,寝ちゃった｡ あっ…｡,I went to bed ....,0.1111111111111111
You can't wake her up once she falls asleep.,ばあちゃん 寝たら起きないから➡,"If you go to bed, you won't get up",0.16666666666666666
Let's just come back tomorrow.,明日 また来よ？,See you tomorrow?,0.1
This is wonderful.,これは すばらしいな｡,This is wonderful.,1.0
The water's amazing.,このお湯 すごいんだよ｡ ケガも治るし 疲れも取れるの｡,This hot water is amazing. The injury is also cured and tired.,0.3076923076923077
"I mean, he has to be. You've got it down, Jeanne.",いいよね そりゃあ｡ やるなぁ ジャンヌさん｡,That's right. I don't do it. Jeanne.,0.21052631578947367
I did not view that gentleman in such a way.,あの方は そういうものではないんだ｡,That person is not that.,0.23076923076923078
That gentleman? You're so dirty!,｢あの方｣だって｡ うふふっ｡ エッチ！,"""That person"" is it. Ufufu. Etch!",0.125
What was between us was not romantic.,恋とか 愛とか そういったものとは違う｡,It is different from love or something like love.,0.06666666666666667
What? But they say that children are the fruit of love.,ええ～？ でも 子供は 愛の結晶でしょ？,Yeah ~?But the child is a crystal of love?,0.2631578947368421
I know he is still watching over El and me.,あの方は 今も エルと私を 見守ってくださっている｡,That person is still watching El and me.,0.5384615384615384
That is everything.,それが全てだ｡ ん？,That's all.?,0.2857142857142857
What about you?,そなたは どうなのだ？ えっ 私？,"What is it?Eh, I?",0.2222222222222222
Has a man captured your heart?,慕っている男性は いないのか？,Are there any men who are in love?,0.07142857142857142
"Since I transform into a dragon when I get near a handsome man,",私 かっこいい男の人に近づくと 竜になって暴れちゃうから➡,Because I'm going to be a dragon when I get close to my good man,0.3
I've never really been able to get close to anyone like that.,ずっと そういう人と 仲よくできなかったんだ｡,I couldn't get along well with such people.,0.15
But he's the only one I've been able to dance with.,でも その人だけは 一緒に踊ることができたの｡,But only that person was able to dance together.,0.3333333333333333
I felt safe when I was with him. i was really happy.,一緒にいて すごく安心できて 幸せな気持ちだった｡,I was very relieved and happy.,0.3076923076923077
It almost felt like I was born to dance with him.,私が生まれてきたのは➡,What I was born,0.23076923076923078
Is this your first love?,初恋なのか？,Is it first love?,0.5714285714285714
That is wonderful.,それは すてきだな｡,That's nice.,0.3333333333333333
What was your first love like?,ジャンヌさんの初恋は どんなだったの？,What was Jeanne's first love?,0.5555555555555556
I don't know.,私は… 分からないんだ｡➡,I do not know ...,0.42857142857142855
I received my divine revelation before I knew romance,恋を知る前に啓示を受け 神のしもべとして戦場にいた｡,I was revealed before knowing the love and was on the battlefield as a god of God.,0.09523809523809523
Are the gods' servants not allowed to love?,神のしもべって 恋できないの？,Can God I can not fall in love?,0.2
I hope you will find happiness with that person.,ニーナは その者と幸せになれるといいな｡,Nina should be happy with that person.,0.2857142857142857
"Well, the thing is, the person I fell for",でもね 私の好きな人➡,But my favorite person ➡,0.07692307692307693
turned out to be someone I hated.,私の大嫌いな人だったの｡,I was a man who hated.,0.25
So I have no idea what I should do.,だから どうしていいか分からなくて｡,So I do not know what to do.,0.4166666666666667
I still can't bring myself to hate him.,それでも嫌いになれない｡,But I can not dislike it.,0.13333333333333333
I too have many different faces.,私の中にも いろいろな顔の自分がいる｡,"Among them, there are various faces of my face.",0.125
Really?,そうなの？ もし ニーナが➡,Is that so?Nina is ➡,0.14285714285714285
then your love may be real.,その恋は 本物かもしれない｡,That love may be genuine.,0.4444444444444444
"Jeanne, that looks so good on you!",ジャンヌさん 似合う～！ そうか？,Mr. Jeanne looks good!Really?,0.3333333333333333
Looking real good!,イケてる イケてる！➡,I'm cool!➡,0.125
Time to eat!,いっただきま～す！,I'm sorry!,0.14285714285714285
We'll be taking a trip to the land of the gods tomorrow.,明日 ちょっと 神の国に行ってくる｡,I will go to God's country tomorrow.,0.15789473684210525
-Land of the gods? I'll go too! -Me too!,神の国？ 俺も行く！ 俺も！,God's country?I will go!me too!,0.3125
You can't come! It's not that simple.,俺も！ ダメ｡ 簡単には行けないんだから｡,me too!No use. I can not go easily.,0.15789473684210525
Why are you going to the land of the gods?,神の国に何しに行くの？,What do you go to God's country?,0.1875
"Mugaro is Jeanne's holy child, and he's been separated from her.",ムガロちゃんは ジャンヌさんの子供で➡,Mugaro is a kid of Jeanne,0.17647058823529413
Holy child?,聖なる子？ 分かんない｡ うん 俺は分かる｡,Holy child?I do not know. Yeah I understand.,0.3
-I get it though. -Liar.,うそつけ！ 分かるもん！,you lied!I understand!,0.0
Thank you.,水なら そこに｡ すみません｡,"If it is water, there is no trouble.",0.09090909090909091
"It's a strange village, isn't it?",不思議な里でしょう ここは｡ ええ｡,It is a strange village here. Yeah.,0.4166666666666667
I was really overwhelmed at first too.,私も最初は 衝撃的だったわ｡,I was also shocking at first.,0.5
"I'm from a nearby village, and I married in.",麓の村の出身で 嫁いできたのよ｡,I was able to marry and married from the village of the foot.,0.3333333333333333
Nina is a wonderful child.,ニーナは とてもいい子ですね｡,Nina is a very good girl.,0.4444444444444444
Those are pictures of the parents of the children we take care of.,あれね うちで預かってる子たちの➡,Children who are deposited in that case,0.125
"The village is poor, so they are all out earning money for everyone.",この里も景気が悪くってねぇ…➡,This village is also bad in the economy ... ➡,0.13636363636363635
Even Nina's father?,ニーナのお父さんも？,Nina's father?,0.8
Her father died.,あの子の父親は 死んだわ｡,That girl's father died.,0.42857142857142855
He wanted to protect the village from the fireball 10 years ago.,１０年前 あの火の玉から 里を守ろうとして 逃げ遅れて…｡,Ten years ago I was late for trying to protect the village from the ball of that fire ....,0.34782608695652173
Did Nina cause any trouble for you turning into a dragon or anything?,あの子 突然 竜になって 迷惑かけなかった？,Did that child suddenly became a dragon?,0.2222222222222222
"No, she saved my life.",いえ 命を助けてもらいました｡,I also helped lives.,0.09090909090909091
"Really? She's growing up, isn't she?",へえ～｡ あの子も成長したのかしら｡,Hey ~. I also grown that child.,0.0
"Ever since her father died, whenever she gets near a man like him,",あの子 お父さんが死んだ日から➡,From the day when that girl dad is dead,0.0
she'll turn into a dragon and go on a bit of a rampage.,竜になって 暴れるようになっちゃったの｡➡,It became a dragon and became going wild.,0.23529411764705882
Almost as if to avoid painful memories.,つらい記憶を思い出すのを 拒否するようにね｡,Let's refuse to remember hard memory.,0.14285714285714285
"Thank you, Jeanne.",ありがと ジャンヌさん｡➡,Thank you Jeanne.,0.8
Thank you for being her friend.,あの子と友達になってくれて ありがと｡,Thank you for being a friend with that child.,0.5454545454545454
I am... I am the one who...,私は…｡,I….,0.0
It must have been hard.,はっ｡ 大変だったね｡,It was hard.,0.42857142857142855
I can tell from how attached she is.,あの子の懐き具合で分かるわ➡,I can see it by the blessing of that child,0.11764705882352941
I can tell how kind you've been to her.,あなたが ニーナに優しくしてくれたこと｡,You have been kind to Nina.,0.38461538461538464
So thank you.,だから ありがと｡,So thank you.,1.0
"Cerby, I need you to say it again for me.",ケル子 こ… こんなときは あれを言ってくれ｡,Keruko ... Tell me that time.,0.11764705882352941
-What? -Do it!,ええ～？ 早く言え！,Yeah ~?Say early!,0.2222222222222222
You're the captain now.,あんたが団長…｡ もっと大きく！,Anti is a leader .... More greater!,0.07142857142857142
-Louder! -You're the captain now!,あんたが団長！ よ～し➡,Annota's leader!Yo ~,0.08333333333333333
I'll make you the captain's wife!,お前を 団長の嫁にしてやるぞ！ ええ～？,I will do your wife's daughter-in-law!Yeah ~?,0.25
"Get it together, Captain.",しっかりしろよ 団長｡ ごほっ…｡,I'm firm.,0.1111111111111111
I thought you'd be here.,≫やはり ここだったか｡ ん？,»After all it was here?,0.07692307692307693
You are an Orleans Knight!,お前は オルレアン騎士団の騎士だ！,You are the knight of the Orleans Knights!,0.5555555555555556
What are you getting mad for? -cerby! -please come back soon!,ちょっと ケ… ケル子～！ まいど｡ ｢バイバ～イ｣｡,"A little bit ... Kerko ~!Mido. ""Bava-A"".",0.041666666666666664
Are you two serious about going?,お前たち 本気で行く気だべか？,Are you really going to go?,0.4
I told you! I'll carry you on my back.,だから わしの背中に 乗せてやると言ったべさ｡,That's why I said that I will carry it on my back.,0.375
What? But your back won't-,ええ～？ だって その背中…｡,Yeah ~?Because he is back ....,0.15384615384615385
"Mom, I'm off, then!",お母さん 行ってくるね！,Mother will come!,0.1
Have a safe trip!,ああ 行ってらっしゃい｡ ≪ニーナ➡,"Oh, I'm going. «Nina ➡",0.0
Bring back souvenirs.,おみやべ 待ってる｡ 天使 連れて 帰って来る｡,I'm waiting for you. Let's come back with an angel.,0.13333333333333333
Take good care of Nina for me.,ニーナをよろしく｡,Thank you for Nina.,0.3
"I'm off, then!",行ってくるね～！,I will go!,0.25
Bye! Have a safe trip!,は～い！,Yes!,0.14285714285714285
We exceeded the limits long ago.,限界は とうに過ぎています｡,The limit is over.,0.2
